durata_noleggio,costo_sostituzione,voto,durata,data_rilascio,tariffa_noleggio,lingua_originale_id,titolo,film_id,lingua,descrizione
6,28.99,NC-17,115,2006,4.99,,ELEMENT FREDDY,276,English,A Awe-Inspiring Reflection of a Waitress And a Squirrel who must Kill a Mad Cow in A Jet Boat
5,11.99,R,73,2006,4.99,,STREETCAR INTENTIONS,856,English,A Insightful Character Study of a Waitress And a Crocodile who must Sink a Waitress in The Gulf of Mexico
3,28.99,G,150,2006,4.99,,SATURDAY LAMBS,764,English,A Thoughtful Reflection of a Mad Scientist And a Moose who must Kill a Husband in A Baloon
6,25.99,PG-13,146,2006,2.99,,HALF OUTFIELD,391,English,A Epic Epistle of a Database Administrator And a Crocodile who must Face a Madman in A Jet Boat
3,12.99,G,48,2006,4.99,,ACE GOLDFINGER,2,English,A Astounding Epistle of a Database Administrator And a Explorer who must Find a Car in Ancient China
6,19.99,PG-13,47,2006,2.99,,HALLOWEEN NUTS,393,English,A Amazing Panorama of a Forensic Psychologist And a Technical Writer who must Fight a Dentist in A U-Boat
5,16.99,PG-13,181,2006,2.99,,JACKET FRISCO,473,English,A Insightful Reflection of a Womanizer And a Husband who must Conquer a Pastry Chef in A Baloon
3,15.99,G,52,2006,0.99,,HARPER DYING,402,English,A Awe-Inspiring Reflection of a Woman And a Cat who must Confront a Feminist in The Sahara Desert
4,25.99,PG-13,171,2006,4.99,,MOONSHINE CABIN,596,English,A Thoughtful Display of a Astronaut And a Feminist who must Chase a Frisbee in A Jet Boat
4,23.99,R,145,2006,2.99,,VACATION BOONDOCK,930,English,A Fanciful Character Study of a Secret Agent And a Mad Scientist who must Reach a Teacher in Australia
6,23.99,NC-17,180,2006,2.99,,ALLEY EVOLUTION,16,English,A Fast-Paced Drama of a Robot And a Composer who must Battle a Astronaut in New Orleans
4,13.99,R,95,2006,2.99,,CLUELESS BUCKET,162,English,A Taut Tale of a Car And a Pioneer who must Conquer a Sumo Wrestler in An Abandoned Fun House
6,27.99,PG-13,143,2006,0.99,,CROOKED FROGMEN,191,English,A Unbelieveable Drama of a Hunter And a Database Administrator who must Battle a Crocodile in An Abandoned Amusement Park
3,23.99,R,84,2006,2.99,,HIGH ENCINO,415,English,A Fateful Saga of a Waitress And a Hunter who must Outrace a Sumo Wrestler in Australia
3,22.99,R,118,2006,2.99,,ORIENT CLOSER,643,English,A Astounding Epistle of a Technical Writer And a Teacher who must Fight a Squirrel in The Sahara Desert
7,18.99,NC-17,50,2006,2.99,,ADAPTATION HOLES,3,English,A Astounding Reflection of a Lumberjack And a Car who must Sink a Lumberjack in A Baloon Factory
7,20.99,NC-17,122,2006,4.99,,VANILLA DAY,934,English,A Fast-Paced Saga of a Girl And a Forensic Psychologist who must Redeem a Girl in Nigeria
7,12.99,NC-17,160,2006,4.99,,IGBY MAKER,451,English,A Epic Documentary of a Hunter And a Dog who must Outgun a Dog in A Baloon Factory
6,19.99,R,181,2006,2.99,,ANALYZE HOOSIERS,24,English,A Thoughtful Display of a Explorer And a Pastry Chef who must Overcome a Feminist in The Sahara Desert
7,12.99,R,78,2006,2.99,,UNFAITHFUL KILL,923,English,A Taut Documentary of a Waitress And a Mad Scientist who must Battle a Technical Writer in New Orleans
6,14.99,R,154,2006,4.99,,DURHAM PANKY,263,English,A Brilliant Panorama of a Girl And a Boy who must Face a Mad Scientist in An Abandoned Mine Shaft
6,10.99,NC-17,100,2006,4.99,,WITCHES PANIC,979,English,A Awe-Inspiring Drama of a Secret Agent And a Hunter who must Fight a Moose in Nigeria
5,10.99,NC-17,145,2006,4.99,,NUTS TIES,632,English,A Thoughtful Drama of a Explorer And a Womanizer who must Meet a Teacher in California
4,21.99,PG-13,76,2006,0.99,,ORANGE GRAPES,641,English,A Astounding Documentary of a Butler And a Womanizer who must Face a Dog in A U-Boat
3,20.99,PG-13,84,2006,0.99,,PACKER MADIGAN,651,English,A Epic Display of a Sumo Wrestler And a Forensic Psychologist who must Build a Woman in An Abandoned Amusement Park
4,11.99,PG-13,82,2006,0.99,,RAIDERS ANTITRUST,712,English,A Amazing Drama of a Teacher And a Feminist who must Meet a Woman in The First Manned Space Station
5,23.99,R,67,2006,0.99,,COMANCHEROS ENEMY,168,English,A Boring Saga of a Lumberjack And a Monkey who must Find a Monkey in The Gulf of Mexico
5,22.99,R,181,2006,0.99,,HAUNTING PIANIST,406,English,A Fast-Paced Story of a Database Administrator And a Composer who must Defeat a Squirrel in An Abandoned Amusement Park
3,19.99,PG-13,162,2006,2.99,,MIRACLE VIRTUAL,582,English,A Touching Epistle of a Butler And a Boy who must Find a Mad Scientist in The Sahara Desert
7,27.99,G,100,2006,0.99,,GUN BONNIE,387,English,A Boring Display of a Sumo Wrestler And a Husband who must Build a Waitress in The Gulf of Mexico
5,16.99,PG,84,2006,2.99,,UPTOWN YOUNG,928,English,A Fateful Documentary of a Dog And a Hunter who must Pursue a Teacher in An Abandoned Amusement Park
3,12.99,PG-13,166,2006,4.99,,MINE TITANS,580,English,A Amazing Yarn of a Robot And a Womanizer who must Discover a Forensic Psychologist in Berlin
5,12.99,PG,78,2006,0.99,,WATCH TRACY,963,English,A Fast-Paced Yarn of a Dog And a Frisbee who must Conquer a Hunter in Nigeria
7,14.99,R,59,2006,4.99,,JET NEIGHBORS,486,English,A Amazing Display of a Lumberjack And a Teacher who must Outrace a Woman in A U-Boat
6,20.99,PG-13,180,2006,0.99,,IMPACT ALADDIN,454,English,A Epic Character Study of a Frisbee And a Moose who must Outgun a Technical Writer in A Shark Tank
3,18.99,R,137,2006,0.99,,LOSE INCH,531,English,A Stunning Reflection of a Student And a Technical Writer who must Battle a Butler in The First Manned Space Station
6,11.99,PG,90,2006,4.99,,SECRET GROUNDHOG,776,English,A Astounding Story of a Cat And a Database Administrator who must Build a Technical Writer in New Orleans
7,22.99,G,114,2006,2.99,,MARRIED GO,559,English,A Fanciful Story of a Womanizer And a Dog who must Face a Forensic Psychologist in The Sahara Desert
4,14.99,PG,72,2006,0.99,,FICTION CHRISTMAS,311,English,A Emotional Yarn of a A Shark And a Student who must Battle a Robot in An Abandoned Mine Shaft
5,14.99,G,112,2006,4.99,,CAT CONEHEADS,127,English,A Fast-Paced Panorama of a Girl And a A Shark who must Confront a Boy in Ancient India
7,23.99,G,49,2006,0.99,,HOOK CHARIOTS,430,English,A Insightful Story of a Boy And a Dog who must Redeem a Boy in Australia
5,11.99,G,100,2006,2.99,,HYDE DOCTOR,445,English,A Fanciful Documentary of a Boy And a Woman who must Redeem a Womanizer in A Jet Boat
5,28.99,PG,168,2006,4.99,,DYING MAKER,265,English,A Intrepid Tale of a Boat And a Monkey who must Kill a Cat in California
6,22.99,NC-17,126,2006,0.99,,MONTEZUMA COMMAND,594,English,A Thrilling Reflection of a Waitress And a Butler who must Battle a Butler in A Jet Boat
3,18.99,NC-17,83,2006,0.99,,NONE SPIKING,625,English,A Boring Reflection of a Secret Agent And a Astronaut who must Face a Composer in A Manhattan Penthouse
3,20.99,NC-17,179,2006,2.99,,REDEMPTION COMFORTS,720,English,A Emotional Documentary of a Dentist And a Woman who must Battle a Mad Scientist in Ancient China
5,23.99,PG-13,133,2006,0.99,,FREEDOM CLEOPATRA,335,English,A Emotional Reflection of a Dentist And a Mad Cow who must Face a Squirrel in A Baloon
3,23.99,G,77,2006,2.99,,PICKUP DRIVING,678,English,A Touching Documentary of a Husband And a Boat who must Meet a Pastry Chef in A Baloon Factory
6,27.99,R,94,2006,2.99,,DISTURBING SCARFACE,234,English,A Lacklusture Display of a Crocodile And a Butler who must Overcome a Monkey in A U-Boat
7,14.99,PG-13,64,2006,4.99,,TRIP NEWTON,911,English,A Fanciful Character Study of a Lumberjack And a Car who must Discover a Cat in An Abandoned Amusement Park
6,26.99,NC-17,123,2006,2.99,,MASK PEACH,561,English,A Boring Character Study of a Student And a Robot who must Meet a Woman in California
4,14.99,PG-13,54,2006,0.99,,JUGGLER HARDLY,489,English,A Epic Story of a Mad Cow And a Astronaut who must Challenge a Car in California
3,25.99,PG-13,172,2006,2.99,,IDAHO LOVE,448,English,A Fast-Paced Drama of a Student And a Crocodile who must Meet a Database Administrator in The Outback
3,14.99,NC-17,73,2006,2.99,,GODFATHER DIARY,364,English,A Stunning Saga of a Lumberjack And a Squirrel who must Chase a Car in The Outback
3,21.99,G,73,2006,0.99,,VALLEY PACKER,932,English,A Astounding Documentary of a Astronaut And a Boy who must Outrace a Sumo Wrestler in Berlin
5,21.99,PG-13,125,2006,2.99,,HUNTER ALTER,441,English,A Emotional Drama of a Mad Cow And a Boat who must Redeem a Secret Agent in A Shark Tank
6,10.99,NC-17,109,2006,4.99,,COMA HEAD,167,English,A Awe-Inspiring Drama of a Boy And a Frisbee who must Escape a Pastry Chef in California
4,29.99,G,57,2006,2.99,,DOCTOR GRAIL,238,English,A Insightful Drama of a Womanizer And a Waitress who must Reach a Forensic Psychologist in The Outback
3,19.99,PG,87,2006,0.99,,TREATMENT JEKYLL,910,English,A Boring Story of a Teacher And a Student who must Outgun a Cat in An Abandoned Mine Shaft
6,20.99,PG,173,2006,4.99,,GLADIATOR WESTWARD,359,English,A Astounding Reflection of a Squirrel And a Sumo Wrestler who must Sink a Dentist in Ancient Japan
5,15.99,PG,118,2006,0.99,,JAWBREAKER BROOKLYN,477,English,A Stunning Reflection of a Boat And a Pastry Chef who must Succumb a A Shark in A Jet Boat
6,21.99,NC-17,175,2006,4.99,,DRIVING POLISH,255,English,A Action-Packed Yarn of a Feminist And a Technical Writer who must Sink a Boat in An Abandoned Mine Shaft
7,12.99,PG-13,127,2006,0.99,,ARGONAUTS TOWN,36,English,A Emotional Epistle of a Forensic Psychologist And a Butler who must Challenge a Waitress in An Abandoned Mine Shaft
6,29.99,G,154,2006,0.99,,SASSY PACKER,762,English,A Fast-Paced Documentary of a Dog And a Teacher who must Find a Moose in A Manhattan Penthouse
5,12.99,PG,161,2006,0.99,,OLEANDER CLUE,636,English,A Boring Story of a Teacher And a Monkey who must Succumb a Forensic Psychologist in A Jet Boat
4,14.99,PG-13,178,2006,0.99,,MADNESS ATTACKS,545,English,A Fanciful Tale of a Squirrel And a Boat who must Defeat a Crocodile in The Gulf of Mexico
7,14.99,R,166,2006,0.99,,GREEDY ROOTS,379,English,A Amazing Reflection of a A Shark And a Butler who must Chase a Hunter in The Canadian Rockies
3,13.99,G,71,2006,0.99,,BLOOD ARGONAUTS,82,English,A Boring Drama of a Explorer And a Man who must Kill a Lumberjack in A Manhattan Penthouse
3,18.99,PG-13,51,2006,0.99,,ENGLISH BULWORTH,285,English,A Intrepid Epistle of a Pastry Chef And a Pastry Chef who must Pursue a Crocodile in Ancient China
6,26.99,PG-13,127,2006,4.99,,MALTESE HOPE,556,English,A Fast-Paced Documentary of a Crocodile And a Sumo Wrestler who must Conquer a Explorer in California
7,27.99,R,63,2006,2.99,,DINOSAUR SECRETARY,231,English,A Action-Packed Drama of a Feminist And a Girl who must Reach a Robot in The Canadian Rockies
5,23.99,NC-17,77,2006,4.99,,ENEMY ODDS,284,English,A Fanciful Panorama of a Mad Scientist And a Woman who must Pursue a Astronaut in Ancient India
3,21.99,G,47,2006,2.99,,DIVORCE SHINING,237,English,A Unbelieveable Saga of a Crocodile And a Student who must Discover a Cat in Ancient India
5,28.99,G,52,2006,0.99,,SIDE ARK,794,English,A Stunning Panorama of a Crocodile And a Womanizer who must Meet a Feminist in The Canadian Rockies
3,27.99,R,53,2006,2.99,,MAGNIFICENT CHITTY,548,English,A Insightful Story of a Teacher And a Hunter who must Face a Mad Cow in California
5,20.99,NC-17,104,2006,4.99,,MERMAID INSECTS,570,English,A Lacklusture Drama of a Waitress And a Husband who must Fight a Husband in California
4,19.99,R,104,2006,0.99,,DATE SPEED,213,English,A Touching Saga of a Composer And a Moose who must Discover a Dentist in A MySQL Convention
7,14.99,PG-13,176,2006,2.99,,BRAVEHEART HUMAN,94,English,A Insightful Story of a Dog And a Pastry Chef who must Battle a Girl in Berlin
7,23.99,PG-13,107,2006,4.99,,WANDA CHAMBER,956,English,A Insightful Drama of a A Shark And a Pioneer who must Find a Womanizer in The Outback
7,13.99,NC-17,55,2006,0.99,,WOLVES DESIRE,981,English,A Fast-Paced Drama of a Squirrel And a Robot who must Succumb a Technical Writer in A Manhattan Penthouse
4,23.99,NC-17,103,2006,0.99,,BIRDCAGE CASPER,76,English,A Fast-Paced Saga of a Frisbee And a Astronaut who must Overcome a Feminist in Ancient India
7,27.99,PG,128,2006,4.99,,HOLES BRANNIGAN,420,English,A Fast-Paced Reflection of a Technical Writer And a Student who must Fight a Boy in The Canadian Rockies
6,18.99,PG,100,2006,4.99,,PUNK DIVORCE,703,English,A Fast-Paced Tale of a Pastry Chef And a Boat who must Face a Frisbee in The Canadian Rockies
3,11.99,PG-13,148,2006,4.99,,FLINTSTONES HAPPINESS,324,English,A Fateful Story of a Husband And a Moose who must Vanquish a Boy in California
7,11.99,NC-17,52,2006,0.99,,WESTWARD SEABISCUIT,970,English,A Lacklusture Tale of a Butler And a Husband who must Face a Boy in Ancient China
5,23.99,NC-17,172,2006,4.99,,CREEPERS KANE,190,English,A Awe-Inspiring Reflection of a Squirrel And a Boat who must Outrace a Car in A Jet Boat
3,26.99,R,73,2006,0.99,,BROTHERHOOD BLANKET,101,English,A Fateful Character Study of a Butler And a Technical Writer who must Sink a Astronaut in Ancient Japan
4,19.99,R,112,2006,4.99,,QUILLS BULL,708,English,A Thoughtful Story of a Pioneer And a Woman who must Reach a Moose in Australia
4,10.99,NC-17,145,2006,4.99,,VIDEOTAPE ARSENIC,941,English,A Lacklusture Display of a Girl And a Astronaut who must Succumb a Student in Australia
7,22.99,PG-13,107,2006,4.99,,UNDEFEATED DALMATIONS,922,English,A Unbelieveable Display of a Crocodile And a Feminist who must Overcome a Moose in An Abandoned Amusement Park
4,12.99,PG-13,136,2006,0.99,,MAKER GABLES,553,English,A Stunning Display of a Moose And a Database Administrator who must Pursue a Composer in A Jet Boat
3,16.99,G,179,2006,4.99,,CASUALTIES ENCINO,126,English,A Insightful Yarn of a A Shark And a Pastry Chef who must Face a Boy in A Monastery
6,14.99,PG,107,2006,0.99,,EFFECT GLADIATOR,273,English,A Beautiful Display of a Pastry Chef And a Pastry Chef who must Outgun a Forensic Psychologist in A Manhattan Penthouse
7,23.99,G,185,2006,2.99,,MUSCLE BRIGHT,609,English,A Stunning Panorama of a Sumo Wrestler And a Husband who must Redeem a Madman in Ancient India
7,25.99,PG-13,185,2006,2.99,,POND SEATTLE,690,English,A Stunning Drama of a Teacher And a Boat who must Battle a Feminist in Ancient China
6,16.99,R,124,2006,2.99,,CLONES PINOCCHIO,158,English,A Amazing Drama of a Car And a Robot who must Pursue a Dentist in New Orleans
7,11.99,NC-17,152,2006,4.99,,ELIZABETH SHANE,279,English,A Lacklusture Display of a Womanizer And a Dog who must Face a Sumo Wrestler in Ancient Japan
6,26.99,PG-13,136,2006,2.99,,REAP UNFAITHFUL,716,English,A Thrilling Epistle of a Composer And a Sumo Wrestler who must Challenge a Mad Cow in A MySQL Convention
6,12.99,R,169,2006,0.99,,SOUP WISDOM,822,English,A Fast-Paced Display of a Robot And a Butler who must Defeat a Butler in A MySQL Convention
6,29.99,PG-13,179,2006,4.99,,VIRGIN DAISY,944,English,A Awe-Inspiring Documentary of a Robot And a Mad Scientist who must Reach a Database Administrator in A Shark Tank
3,27.99,PG-13,178,2006,0.99,,ROCKETEER MOTHER,738,English,A Awe-Inspiring Character Study of a Robot And a Sumo Wrestler who must Discover a Womanizer in A Shark Tank
7,26.99,PG,121,2006,4.99,,DANGEROUS UPTOWN,207,English,A Unbelieveable Story of a Mad Scientist And a Woman who must Overcome a Dog in California
6,13.99,NC-17,76,2006,4.99,,HAUNTED ANTITRUST,405,English,A Amazing Saga of a Man And a Dentist who must Reach a Technical Writer in Ancient India
7,11.99,PG,114,2006,0.99,,CARRIE BUNCH,122,English,A Amazing Epistle of a Student And a Astronaut who must Discover a Frisbee in The Canadian Rockies
5,25.99,G,53,2006,0.99,,SUMMER SCARFACE,862,English,A Emotional Panorama of a Lumberjack And a Hunter who must Meet a Girl in A Shark Tank
5,15.99,G,128,2006,2.99,,WARS PLUTO,960,English,A Taut Reflection of a Teacher And a Database Administrator who must Chase a Madman in The Sahara Desert
7,10.99,PG-13,132,2006,4.99,,TRAINSPOTTING STRANGERS,905,English,A Fast-Paced Drama of a Pioneer And a Mad Cow who must Challenge a Madman in Ancient Japan
5,23.99,PG-13,130,2006,0.99,,STALLION SUNDANCE,839,English,A Fast-Paced Tale of a Car And a Dog who must Outgun a A Shark in Australia
5,16.99,PG-13,59,2006,0.99,,VISION TORQUE,947,English,A Thoughtful Documentary of a Dog And a Man who must Sink a Man in A Shark Tank
5,10.99,NC-17,46,2006,2.99,,ALIEN CENTER,15,English,A Brilliant Drama of a Cat And a Mad Scientist who must Battle a Feminist in A MySQL Convention
7,26.99,G,177,2006,0.99,,EMPIRE MALKOVICH,280,English,A Amazing Story of a Feminist And a Cat who must Face a Car in An Abandoned Fun House
5,26.99,PG-13,138,2006,4.99,,EXPECATIONS NATURAL,294,English,A Amazing Drama of a Butler And a Husband who must Reach a A Shark in A U-Boat
7,23.99,NC-17,84,2006,2.99,,ISLAND EXORCIST,471,English,A Fanciful Panorama of a Technical Writer And a Boy who must Find a Dentist in An Abandoned Fun House
4,29.99,R,140,2006,0.99,,LOATHING LEGALLY,525,English,A Boring Epistle of a Pioneer And a Mad Scientist who must Escape a Frisbee in The Gulf of Mexico
4,9.99,NC-17,67,2006,4.99,,NORTH TEQUILA,627,English,A Beautiful Character Study of a Mad Cow And a Robot who must Reach a Womanizer in New Orleans
7,13.99,NC-17,106,2006,2.99,,DEER VIRGINIAN,220,English,A Thoughtful Story of a Mad Cow And a Womanizer who must Overcome a Mad Scientist in Soviet Georgia
6,29.99,G,181,2006,4.99,,LAWLESS VISION,510,English,A Insightful Yarn of a Boy And a Sumo Wrestler who must Outgun a Car in The Outback
5,16.99,R,154,2006,4.99,,DOUBTFIRE LABYRINTH,246,English,A Intrepid Panorama of a Butler And a Composer who must Meet a Mad Cow in The Sahara Desert
3,29.99,PG-13,165,2006,0.99,,SONG HEDWIG,819,English,A Amazing Documentary of a Man And a Husband who must Confront a Squirrel in A MySQL Convention
7,10.99,PG-13,166,2006,2.99,,CONTACT ANONYMOUS,181,English,A Insightful Display of a A Shark And a Monkey who must Face a Database Administrator in Ancient India
3,14.99,R,82,2006,0.99,,ALONE TRIP,17,English,A Fast-Paced Character Study of a Composer And a Dog who must Outgun a Boat in An Abandoned Fun House
6,22.99,NC-17,184,2006,2.99,,CRYSTAL BREAKING,198,English,A Fast-Paced Character Study of a Feminist And a Explorer who must Face a Pastry Chef in Ancient Japan
3,21.99,NC-17,123,2006,4.99,,FLASH WARS,321,English,A Astounding Saga of a Moose And a Pastry Chef who must Chase a Student in The Gulf of Mexico
4,19.99,PG,85,2006,2.99,,STAGE WORLD,837,English,A Lacklusture Panorama of a Woman And a Frisbee who must Chase a Crocodile in A Jet Boat
3,12.99,R,54,2006,0.99,,GO PURPLE,363,English,A Fast-Paced Display of a Car And a Database Administrator who must Battle a Woman in A Baloon
3,14.99,PG,70,2006,0.99,,WEDDING APOLLO,966,English,A Action-Packed Tale of a Student And a Waitress who must Conquer a Lumberjack in An Abandoned Mine Shaft
6,22.99,PG,136,2006,0.99,,ALASKA PHANTOM,12,English,A Fanciful Saga of a Hunter And a Pastry Chef who must Vanquish a Boy in Australia
6,14.99,G,163,2006,4.99,,BIRD INDEPENDENCE,75,English,A Thrilling Documentary of a Car And a Student who must Sink a Hunter in The Canadian Rockies
7,18.99,G,147,2006,2.99,,MENAGERIE RUSHMORE,569,English,A Unbelieveable Panorama of a Composer And a Butler who must Overcome a Database Administrator in The First Manned Space Station
5,29.99,G,100,2006,2.99,,FLATLINERS KILLER,322,English,A Taut Display of a Secret Agent And a Waitress who must Sink a Robot in An Abandoned Mine Shaft
7,28.99,R,83,2006,4.99,,FUGITIVE MAGUIRE,342,English,A Taut Epistle of a Feminist And a Sumo Wrestler who must Battle a Crocodile in Australia
7,16.99,PG,131,2006,4.99,,OPEN AFRICAN,637,English,A Lacklusture Drama of a Secret Agent And a Explorer who must Discover a Car in A U-Boat
4,29.99,R,73,2006,2.99,,SALUTE APOLLO,759,English,A Awe-Inspiring Character Study of a Boy And a Feminist who must Sink a Crocodile in Ancient China
7,23.99,PG-13,182,2006,4.99,,REDS POCUS,721,English,A Lacklusture Yarn of a Sumo Wrestler And a Squirrel who must Redeem a Monkey in Soviet Georgia
3,20.99,G,182,2006,2.99,,BAKED CLEOPATRA,50,English,A Stunning Drama of a Forensic Psychologist And a Husband who must Overcome a Waitress in A Monastery
5,11.99,R,88,2006,4.99,,TERMINATOR CLUB,884,English,A Touching Story of a Crocodile And a Girl who must Sink a Man in The Gulf of Mexico
4,17.99,R,90,2006,2.99,,VERTIGO NORTHWEST,939,English,A Unbelieveable Display of a Mad Scientist And a Mad Scientist who must Outgun a Mad Cow in Ancient Japan
4,17.99,PG,137,2006,0.99,,ARSENIC INDEPENDENCE,41,English,A Fanciful Documentary of a Mad Cow And a Womanizer who must Find a Dentist in Berlin
7,17.99,R,129,2006,0.99,,MUSIC BOONDOCK,610,English,A Thrilling Tale of a Butler And a Astronaut who must Battle a Explorer in The First Manned Space Station
5,26.99,NC-17,78,2006,0.99,,LANGUAGE COWBOY,509,English,A Epic Yarn of a Cat And a Madman who must Vanquish a Dentist in An Abandoned Amusement Park
5,24.99,NC-17,93,2006,2.99,,GREATEST NORTH,378,English,A Astounding Character Study of a Secret Agent And a Robot who must Build a A Shark in Berlin
3,21.99,PG,137,2006,0.99,,GRIT CLOCKWORK,382,English,A Thoughtful Display of a Dentist And a Squirrel who must Confront a Lumberjack in A Shark Tank
7,28.99,NC-17,81,2006,0.99,,ROMAN PUNK,741,English,A Thoughtful Panorama of a Mad Cow And a Student who must Battle a Forensic Psychologist in Berlin
5,18.99,PG-13,70,2006,0.99,,LOUISIANA HARRY,534,English,A Lacklusture Drama of a Girl And a Technical Writer who must Redeem a Monkey in A Shark Tank
5,21.99,NC-17,47,2006,4.99,,HANOVER GALAXY,398,English,A Stunning Reflection of a Girl And a Secret Agent who must Succumb a Boy in A MySQL Convention
3,22.99,NC-17,182,2006,2.99,,SEARCHERS WAIT,774,English,A Fast-Paced Tale of a Car And a Mad Scientist who must Kill a Womanizer in Ancient Japan
6,11.99,NC-17,134,2006,0.99,,JUNGLE CLOSER,492,English,A Boring Character Study of a Boy And a Woman who must Battle a Astronaut in Australia
5,13.99,NC-17,51,2006,4.99,,HALL CASSIDY,392,English,A Beautiful Panorama of a Pastry Chef And a A Shark who must Battle a Pioneer in Soviet Georgia
4,17.99,NC-17,180,2006,4.99,,SOMETHING DUCK,818,English,A Boring Character Study of a Car And a Husband who must Outgun a Frisbee in The First Manned Space Station
7,12.99,PG-13,138,2006,2.99,,SPINAL ROCKY,829,English,A Lacklusture Epistle of a Sumo Wrestler And a Squirrel who must Defeat a Explorer in California
3,24.99,PG-13,118,2006,4.99,,BACKLASH UNDEFEATED,48,English,A Stunning Character Study of a Mad Scientist And a Mad Cow who must Kill a Car in A Monastery
3,9.99,G,59,2006,4.99,,HEARTBREAKERS BRIGHT,409,English,A Awe-Inspiring Documentary of a A Shark And a Dentist who must Outrace a Pastry Chef in The Canadian Rockies
6,16.99,PG,140,2006,4.99,,STEERS ARMAGEDDON,844,English,A Stunning Character Study of a Car And a Girl who must Succumb a Car in A MySQL Convention
5,27.99,R,167,2006,2.99,,CAMPUS REMEMBER,115,English,A Astounding Drama of a Crocodile And a Mad Cow who must Build a Robot in A Jet Boat
4,18.99,NC-17,129,2006,0.99,,OUTFIELD MASSACRE,647,English,A Thoughtful Drama of a Husband And a Secret Agent who must Pursue a Database Administrator in Ancient India
5,11.99,PG-13,155,2006,2.99,,PSYCHO SHRUNK,701,English,A Amazing Panorama of a Crocodile And a Explorer who must Fight a Husband in Nigeria
4,20.99,PG,67,2006,2.99,,EGG IGBY,274,English,A Beautiful Documentary of a Boat And a Sumo Wrestler who must Succumb a Database Administrator in The First Manned Space Station
5,18.99,G,50,2006,2.99,,BLUES INSTINCT,83,English,A Insightful Documentary of a Boat And a Composer who must Meet a Forensic Psychologist in An Abandoned Fun House
7,9.99,PG-13,48,2006,0.99,,VALENTINE VANISHING,931,English,A Thrilling Display of a Husband And a Butler who must Reach a Pastry Chef in California
4,15.99,PG,151,2006,2.99,,CAROL TEXAS,121,English,A Astounding Character Study of a Composer And a Student who must Overcome a Composer in A Monastery
5,21.99,PG-13,102,2006,4.99,,FALCON VOLUME,300,English,A Fateful Saga of a Sumo Wrestler And a Hunter who must Redeem a A Shark in New Orleans
3,25.99,R,145,2006,0.99,,RUN PACIFIC,750,English,A Touching Tale of a Cat And a Pastry Chef who must Conquer a Pastry Chef in A MySQL Convention
7,24.99,PG,136,2006,2.99,,CRAZY HOME,188,English,A Fanciful Panorama of a Boy And a Woman who must Vanquish a Database Administrator in The Outback
6,15.99,PG,110,2006,4.99,,SNATCH SLIPPER,814,English,A Insightful Panorama of a Woman And a Feminist who must Defeat a Forensic Psychologist in Berlin
5,22.99,NC-17,141,2006,4.99,,SPICE SORORITY,827,English,A Fateful Display of a Pioneer And a Hunter who must Defeat a Husband in An Abandoned Mine Shaft
6,20.99,R,88,2006,0.99,,HOLY TADPOLE,425,English,A Action-Packed Display of a Feminist And a Pioneer who must Pursue a Dog in A Baloon Factory
5,25.99,NC-17,87,2006,2.99,,BANG KWAI,53,English,A Epic Drama of a Madman And a Cat who must Face a A Shark in An Abandoned Amusement Park
6,14.99,NC-17,48,2006,0.99,,ODDS BOOGIE,634,English,A Thrilling Yarn of a Feminist And a Madman who must Battle a Hunter in Berlin
3,16.99,G,62,2006,0.99,,UNBREAKABLE KARATE,920,English,A Amazing Character Study of a Robot And a Student who must Chase a Robot in Australia
4,11.99,NC-17,126,2006,4.99,,VAMPIRE WHALE,933,English,A Epic Story of a Lumberjack And a Monkey who must Confront a Pioneer in A MySQL Convention
5,22.99,PG,93,2006,2.99,,SHANE DARKNESS,783,English,A Action-Packed Saga of a Moose And a Lumberjack who must Find a Woman in Berlin
3,12.99,R,111,2006,4.99,,SUIT WALLS,861,English,A Touching Panorama of a Lumberjack And a Frisbee who must Build a Dog in Australia
3,28.99,NC-17,167,2006,0.99,,LESSON CLEOPATRA,517,English,A Emotional Display of a Man And a Explorer who must Build a Boy in A Manhattan Penthouse
