durata_noleggio,costo_sostituzione,voto,durata,data_rilascio,tariffa_noleggio,lingua_originale_id,titolo,film_id,lingua,descrizione
5,10.99,R,84,2006,0.99,,SLING LUKE,808,English,A Intrepid Character Study of a Robot And a Monkey who must Reach a Secret Agent in An Abandoned Amusement Park
7,28.99,PG-13,132,2006,0.99,,STREAK RIDGEMONT,855,English,A Astounding Character Study of a Hunter And a Waitress who must Sink a Man in New Orleans
5,9.99,R,84,2006,4.99,,PLUTO OLEANDER,686,English,A Action-Packed Reflection of a Car And a Moose who must Outgun a Car in A Shark Tank
4,20.99,G,155,2006,0.99,,GRAPES FURY,376,English,A Boring Yarn of a Mad Cow And a Sumo Wrestler who must Meet a Robot in Australia
5,11.99,G,118,2006,4.99,,FIDELITY DEVIL,313,English,A Awe-Inspiring Drama of a Technical Writer And a Composer who must Reach a Pastry Chef in A U-Boat
3,11.99,PG,85,2006,0.99,,EGYPT TENENBAUMS,275,English,A Intrepid Story of a Madman And a Secret Agent who must Outrace a Astronaut in An Abandoned Amusement Park
7,19.99,PG-13,48,2006,0.99,,NOTTING SPEAKEASY,630,English,A Thoughtful Display of a Butler And a Womanizer who must Find a Waitress in The Canadian Rockies
7,10.99,PG-13,80,2006,2.99,,SADDLE ANTITRUST,756,English,A Stunning Epistle of a Feminist And a A Shark who must Battle a Woman in An Abandoned Fun House
4,10.99,PG-13,168,2006,0.99,,TRANSLATION SUMMER,907,English,A Touching Reflection of a Man And a Monkey who must Pursue a Womanizer in A MySQL Convention
7,16.99,PG-13,137,2006,4.99,,PHILADELPHIA WIFE,676,English,A Taut Yarn of a Hunter And a Astronaut who must Conquer a Database Administrator in The Sahara Desert
6,19.99,PG-13,64,2006,0.99,,VICTORY ACADEMY,940,English,A Insightful Epistle of a Mad Scientist And a Explorer who must Challenge a Cat in The Sahara Desert
4,22.99,PG,56,2006,4.99,,GOODFELLAS SALUTE,369,English,A Unbelieveable Tale of a Dog And a Explorer who must Sink a Mad Cow in A Baloon Factory
6,27.99,NC-17,157,2006,0.99,,VOLCANO TEXAS,949,English,A Awe-Inspiring Yarn of a Hunter And a Feminist who must Challenge a Dentist in The Outback
3,25.99,R,85,2006,2.99,,WINDOW SIDE,977,English,A Astounding Character Study of a Womanizer And a Hunter who must Escape a Robot in A Monastery
6,20.99,R,178,2006,4.99,,DROP WATERFRONT,256,English,A Fanciful Documentary of a Husband And a Explorer who must Reach a Madman in Ancient China
7,21.99,NC-17,152,2006,2.99,,LUCK OPUS,539,English,A Boring Display of a Moose And a Squirrel who must Outrace a Teacher in A Shark Tank
3,13.99,G,69,2006,0.99,,TIMBERLAND SKY,891,English,A Boring Display of a Man And a Dog who must Redeem a Girl in A U-Boat
7,19.99,PG,135,2006,4.99,,WALLS ARTIST,955,English,A Insightful Panorama of a Teacher And a Teacher who must Overcome a Mad Cow in An Abandoned Fun House
5,13.99,G,171,2006,0.99,,DUFFEL APOCALYPSE,261,English,A Emotional Display of a Boat And a Explorer who must Challenge a Madman in A MySQL Convention
5,17.99,NC-17,78,2006,2.99,,INSIDER ARIZONA,462,English,A Astounding Saga of a Mad Scientist And a Hunter who must Pursue a Robot in A Baloon Factory
4,14.99,G,61,2006,2.99,,BULWORTH COMMANDMENTS,106,English,A Amazing Display of a Mad Cow And a Pioneer who must Redeem a Sumo Wrestler in The Outback
7,22.99,R,161,2006,4.99,,WASH HEAVENLY,961,English,A Awe-Inspiring Reflection of a Cat And a Pioneer who must Escape a Hunter in Ancient China
5,28.99,PG-13,120,2006,4.99,,COMMAND DARLING,170,English,A Awe-Inspiring Tale of a Forensic Psychologist And a Woman who must Challenge a Database Administrator in Ancient Japan
3,26.99,NC-17,61,2006,0.99,,CAMELOT VACATION,114,English,A Touching Character Study of a Woman And a Waitress who must Battle a Pastry Chef in A MySQL Convention
3,25.99,PG,147,2006,4.99,,RANGE MOONWALKER,715,English,A Insightful Documentary of a Hunter And a Dentist who must Confront a Crocodile in A Baloon
7,15.99,PG,58,2006,0.99,,OKLAHOMA JUMANJI,635,English,A Thoughtful Drama of a Dentist And a Womanizer who must Meet a Husband in The Sahara Desert
5,13.99,PG,71,2006,4.99,,TEMPLE ATTRACTION,881,English,A Action-Packed Saga of a Forensic Psychologist And a Woman who must Battle a Womanizer in Soviet Georgia
6,13.99,PG,50,2006,0.99,,LION UNCUT,524,English,A Intrepid Display of a Pastry Chef And a Cat who must Kill a A Shark in Ancient China
7,9.99,PG,101,2006,2.99,,CIDER DESIRE,150,English,A Stunning Character Study of a Composer And a Mad Cow who must Succumb a Cat in Soviet Georgia
7,29.99,G,81,2006,4.99,,DESPERATE TRAINSPOTTING,224,English,A Epic Yarn of a Forensic Psychologist And a Teacher who must Face a Lumberjack in California
7,10.99,PG-13,78,2006,4.99,,HOLIDAY GAMES,421,English,A Insightful Reflection of a Waitress And a Madman who must Pursue a Boy in Ancient Japan
3,20.99,R,161,2006,0.99,,NEIGHBORS CHARADE,619,English,A Fanciful Reflection of a Crocodile And a Astronaut who must Outrace a Feminist in An Abandoned Amusement Park
6,21.99,PG-13,180,2006,2.99,,NASH CHOCOLAT,615,English,A Epic Reflection of a Monkey And a Mad Cow who must Kill a Forensic Psychologist in An Abandoned Mine Shaft
5,26.99,NC-17,123,2006,0.99,,REEF SALUTE,722,English,A Action-Packed Saga of a Teacher And a Lumberjack who must Battle a Dentist in A Baloon
4,29.99,PG-13,149,2006,0.99,,RIVER OUTLAW,733,English,A Thrilling Character Study of a Squirrel And a Lumberjack who must Face a Hunter in A MySQL Convention
7,12.99,PG,85,2006,2.99,,BLACKOUT PRIVATE,78,English,A Intrepid Yarn of a Pastry Chef And a Mad Scientist who must Challenge a Secret Agent in Ancient Japan
4,16.99,PG-13,142,2006,4.99,,MILLION ACE,578,English,A Brilliant Documentary of a Womanizer And a Squirrel who must Find a Technical Writer in The Sahara Desert
3,28.99,PG-13,102,2006,0.99,,TREASURE COMMAND,909,English,A Emotional Saga of a Car And a Madman who must Discover a Pioneer in California
3,9.99,PG-13,112,2006,0.99,,WAIT CIDER,953,English,A Intrepid Epistle of a Woman And a Forensic Psychologist who must Succumb a Astronaut in A Manhattan Penthouse
7,27.99,PG-13,98,2006,2.99,,MADRE GABLES,546,English,A Intrepid Panorama of a Sumo Wrestler And a Forensic Psychologist who must Discover a Moose in The First Manned Space Station
5,21.99,NC-17,74,2006,2.99,,LUKE MUMMY,541,English,A Taut Character Study of a Boy And a Robot who must Redeem a Mad Scientist in Ancient India
3,22.99,NC-17,68,2006,2.99,,HUMAN GRAFFITI,438,English,A Beautiful Reflection of a Womanizer And a Sumo Wrestler who must Chase a Database Administrator in The Gulf of Mexico
6,29.99,PG-13,145,2006,2.99,,FLOATS GARDEN,325,English,A Action-Packed Epistle of a Robot And a Car who must Chase a Boat in Ancient Japan
6,28.99,NC-17,112,2006,2.99,,SEABISCUIT PUNK,773,English,A Insightful Saga of a Man And a Forensic Psychologist who must Discover a Mad Cow in A MySQL Convention
4,27.99,R,82,2006,2.99,,ANYTHING SAVANNAH,30,English,A Epic Story of a Pastry Chef And a Woman who must Chase a Feminist in An Abandoned Fun House
7,25.99,R,101,2006,0.99,,ROOF CHAMPION,742,English,A Lacklusture Reflection of a Car And a Explorer who must Find a Monkey in A Baloon
6,17.99,NC-17,181,2006,0.99,,RUNAWAY TENENBAUMS,751,English,A Thoughtful Documentary of a Boat And a Man who must Meet a Boat in An Abandoned Fun House
5,16.99,NC-17,101,2006,0.99,,CHOCOLAT HARRY,147,English,A Action-Packed Epistle of a Dentist And a Moose who must Meet a Mad Cow in Ancient Japan
6,27.99,PG-13,57,2006,0.99,,ALTER VICTORY,18,English,A Thoughtful Drama of a Composer And a Feminist who must Meet a Secret Agent in The Canadian Rockies
4,24.99,R,181,2006,0.99,,WILD APOLLO,974,English,A Beautiful Story of a Monkey And a Sumo Wrestler who must Conquer a A Shark in A MySQL Convention
3,11.99,PG-13,102,2006,4.99,,SCARFACE BANG,768,English,A Emotional Yarn of a Teacher And a Girl who must Find a Teacher in A Baloon Factory
5,21.99,PG,147,2006,0.99,,SLUMS DUCK,810,English,A Amazing Character Study of a Teacher And a Database Administrator who must Defeat a Waitress in A Jet Boat
4,22.99,R,148,2006,0.99,,ARMY FLINTSTONES,40,English,A Boring Saga of a Database Administrator And a Womanizer who must Battle a Waitress in Nigeria
3,12.99,PG-13,104,2006,0.99,,FEATHERS METAL,306,English,A Thoughtful Yarn of a Monkey And a Teacher who must Find a Dog in Australia
3,9.99,PG,138,2006,4.99,,MAIDEN HOME,551,English,A Lacklusture Saga of a Moose And a Teacher who must Kill a Forensic Psychologist in A MySQL Convention
6,11.99,PG,166,2006,2.99,,MURDER ANTITRUST,608,English,A Brilliant Yarn of a Car And a Database Administrator who must Escape a Boy in A MySQL Convention
6,14.99,PG-13,183,2006,4.99,,FRONTIER CABIN,340,English,A Emotional Story of a Madman And a Waitress who must Battle a Teacher in An Abandoned Fun House
6,20.99,PG,80,2006,4.99,,SHAWSHANK BUBBLE,785,English,A Lacklusture Story of a Moose And a Monkey who must Confront a Butler in An Abandoned Amusement Park
6,26.99,PG-13,139,2006,4.99,,GROUNDHOG UNCUT,385,English,A Brilliant Panorama of a Astronaut And a Technical Writer who must Discover a Butler in A Manhattan Penthouse
7,13.99,PG,102,2006,4.99,,BOILED DARES,84,English,A Awe-Inspiring Story of a Waitress And a Dog who must Discover a Dentist in Ancient Japan
5,18.99,PG,50,2006,4.99,,MUPPET MILE,607,English,A Lacklusture Story of a Madman And a Teacher who must Kill a Frisbee in The Gulf of Mexico
6,20.99,R,72,2006,0.99,,MAUDE MOD,566,English,A Beautiful Documentary of a Forensic Psychologist And a Cat who must Reach a Astronaut in Nigeria
7,23.99,PG,154,2006,2.99,,SANTA PARIS,761,English,A Emotional Documentary of a Moose And a Car who must Redeem a Mad Cow in A Baloon Factory
4,19.99,NC-17,155,2006,4.99,,ELF MURDER,278,English,A Action-Packed Story of a Frisbee And a Woman who must Reach a Girl in An Abandoned Mine Shaft
3,9.99,R,141,2006,4.99,,KISSING DOLLS,501,English,A Insightful Reflection of a Pioneer And a Teacher who must Build a Composer in The First Manned Space Station
3,21.99,PG,66,2006,2.99,,CHARADE DUFFEL,137,English,A Action-Packed Display of a Man And a Waitress who must Build a Dog in A MySQL Convention
5,29.99,NC-17,84,2006,2.99,,IDOLS SNATCHERS,450,English,A Insightful Drama of a Car And a Composer who must Fight a Man in A Monastery
3,29.99,NC-17,71,2006,2.99,,PRINCESS GIANT,698,English,A Thrilling Yarn of a Pastry Chef And a Monkey who must Battle a Monkey in A Shark Tank
6,21.99,PG-13,141,2006,2.99,,HOMICIDE PEACH,428,English,A Astounding Documentary of a Hunter And a Boy who must Confront a Boy in A MySQL Convention
4,21.99,PG-13,169,2006,2.99,,BREAKING HOME,96,English,A Beautiful Display of a Secret Agent And a Monkey who must Battle a Sumo Wrestler in An Abandoned Mine Shaft
4,13.99,NC-17,113,2006,0.99,,LADYBUGS ARMAGEDDON,507,English,A Fateful Reflection of a Dog And a Mad Scientist who must Meet a Mad Scientist in New Orleans
7,9.99,NC-17,48,2006,4.99,,STEPMOM DREAM,845,English,A Touching Epistle of a Crocodile And a Teacher who must Build a Forensic Psychologist in A MySQL Convention
7,12.99,PG,128,2006,0.99,,JEDI BENEATH,479,English,A Astounding Reflection of a Explorer And a Dentist who must Pursue a Student in Nigeria
5,16.99,PG,175,2006,0.99,,SPLASH GUMP,832,English,A Taut Saga of a Crocodile And a Boat who must Conquer a Hunter in A Shark Tank
4,14.99,R,85,2006,2.99,,OZ LIAISONS,649,English,A Epic Yarn of a Mad Scientist And a Cat who must Confront a Womanizer in A Baloon Factory
4,17.99,R,59,2006,4.99,,INTERVIEW LIAISONS,465,English,A Action-Packed Reflection of a Student And a Butler who must Discover a Database Administrator in A Manhattan Penthouse
4,28.99,PG-13,151,2006,4.99,,HUNCHBACK IMPOSSIBLE,439,English,A Touching Yarn of a Frisbee And a Dentist who must Fight a Composer in Ancient Japan
4,17.99,R,88,2006,4.99,,DETAILS PACKER,227,English,A Epic Saga of a Waitress And a Composer who must Face a Boat in A U-Boat
4,23.99,PG,152,2006,4.99,,TWISTED PIRATES,918,English,A Touching Display of a Frisbee And a Boat who must Kill a Girl in A MySQL Convention
4,19.99,NC-17,92,2006,2.99,,NATIONAL STORY,616,English,A Taut Epistle of a Mad Scientist And a Girl who must Escape a Monkey in California
5,19.99,NC-17,61,2006,2.99,,CASSIDY WYOMING,125,English,A Intrepid Drama of a Frisbee And a Hunter who must Kill a Secret Agent in New Orleans
3,27.99,G,138,2006,2.99,,LIBERTY MAGNIFICENT,519,English,A Boring Drama of a Student And a Cat who must Sink a Technical Writer in A Baloon
7,16.99,R,126,2006,2.99,,FREAKY POCUS,333,English,A Fast-Paced Documentary of a Pastry Chef And a Crocodile who must Chase a Squirrel in The Gulf of Mexico
4,24.99,PG-13,126,2006,4.99,,ELEPHANT TROJAN,277,English,A Beautiful Panorama of a Lumberjack And a Forensic Psychologist who must Overcome a Frisbee in A Baloon
7,21.99,PG,114,2006,4.99,,CHASING FIGHT,139,English,A Astounding Saga of a Technical Writer And a Butler who must Battle a Butler in A Shark Tank
6,22.99,G,57,2006,0.99,,MOSQUITO ARMAGEDDON,598,English,A Thoughtful Character Study of a Waitress And a Feminist who must Build a Teacher in Ancient Japan
5,19.99,NC-17,60,2006,4.99,,PITY BOUND,683,English,A Boring Panorama of a Feminist And a Moose who must Defeat a Database Administrator in Nigeria
3,27.99,G,179,2006,4.99,,TORQUE BOUND,897,English,A Emotional Display of a Crocodile And a Husband who must Reach a Man in Ancient Japan
5,20.99,R,134,2006,0.99,,SPLENDOR PATTON,833,English,A Taut Story of a Dog And a Explorer who must Find a Astronaut in Berlin
3,27.99,G,62,2006,0.99,,SNOWMAN ROLLERCOASTER,816,English,A Fateful Display of a Lumberjack And a Girl who must Succumb a Mad Cow in A Manhattan Penthouse
3,24.99,PG-13,144,2006,2.99,,STRICTLY SCARFACE,857,English,A Touching Reflection of a Crocodile And a Dog who must Chase a Hunter in An Abandoned Fun House
6,16.99,NC-17,174,2006,2.99,,UPRISING UPTOWN,927,English,A Fanciful Reflection of a Boy And a Butler who must Pursue a Woman in Berlin
3,22.99,NC-17,83,2006,4.99,,HUSTLER PARTY,444,English,A Emotional Reflection of a Sumo Wrestler And a Monkey who must Conquer a Robot in The Sahara Desert
7,13.99,R,109,2006,2.99,,HOUSE DYNAMITE,437,English,A Taut Story of a Pioneer And a Squirrel who must Battle a Student in Soviet Georgia
4,25.99,NC-17,155,2006,2.99,,LOLITA WORLD,528,English,A Thrilling Drama of a Girl And a Robot who must Redeem a Waitress in An Abandoned Mine Shaft
5,14.99,PG-13,83,2006,4.99,,ATTRACTION NEWTON,45,English,A Astounding Panorama of a Composer And a Frisbee who must Reach a Husband in Ancient Japan
7,28.99,NC-17,147,2006,4.99,,LIES TREATMENT,521,English,A Fast-Paced Character Study of a Dentist And a Moose who must Defeat a Composer in The First Manned Space Station
5,21.99,R,127,2006,4.99,,SUBMARINE BED,858,English,A Amazing Display of a Car And a Monkey who must Fight a Teacher in Soviet Georgia
5,14.99,PG,146,2006,0.99,,MOURNING PURPLE,602,English,A Lacklusture Display of a Waitress And a Lumberjack who must Chase a Pioneer in New Orleans
7,18.99,PG,59,2006,0.99,,LEGEND JEDI,516,English,A Awe-Inspiring Epistle of a Pioneer And a Student who must Outgun a Crocodile in The Outback
4,17.99,PG-13,145,2006,4.99,,ROCKY WAR,739,English,A Fast-Paced Display of a Squirrel And a Explorer who must Outgun a Mad Scientist in Nigeria
4,11.99,PG,74,2006,4.99,,SILVERADO GOLDFINGER,798,English,A Stunning Epistle of a Sumo Wrestler And a Man who must Challenge a Waitress in Ancient India
6,16.99,G,122,2006,2.99,,BEACH HEARTBREAKERS,58,English,A Fateful Display of a Womanizer And a Mad Scientist who must Outgun a A Shark in Soviet Georgia
3,11.99,PG-13,91,2006,2.99,,TARZAN VIDEOTAPE,876,English,A Fast-Paced Display of a Lumberjack And a Mad Scientist who must Succumb a Sumo Wrestler in The Sahara Desert
4,11.99,NC-17,173,2006,2.99,,PIZZA JUMANJI,684,English,A Epic Saga of a Cat And a Squirrel who must Outgun a Robot in A U-Boat
6,20.99,PG-13,63,2006,4.99,,INTOLERABLE INTENTIONS,466,English,A Awe-Inspiring Story of a Monkey And a Pastry Chef who must Succumb a Womanizer in A MySQL Convention
4,11.99,R,147,2006,2.99,,MADISON TRAP,544,English,A Awe-Inspiring Reflection of a Monkey And a Dentist who must Overcome a Pioneer in A U-Boat
5,10.99,R,102,2006,2.99,,GIANT TROOPERS,356,English,A Fateful Display of a Feminist And a Monkey who must Vanquish a Monkey in The Canadian Rockies
5,17.99,R,142,2006,0.99,,VANISHED GARDEN,935,English,A Intrepid Character Study of a Squirrel And a A Shark who must Kill a Lumberjack in California
6,22.99,PG,104,2006,0.99,,CROW GREASE,194,English,A Awe-Inspiring Documentary of a Woman And a Husband who must Sink a Database Administrator in The First Manned Space Station
4,11.99,PG-13,159,2006,2.99,,DRIVER ANNIE,254,English,A Lacklusture Character Study of a Butler And a Car who must Redeem a Boat in An Abandoned Fun House
3,16.99,PG-13,163,2006,4.99,,CASPER DRAGONFLY,124,English,A Intrepid Documentary of a Boat And a Crocodile who must Chase a Robot in The Sahara Desert
4,15.99,R,127,2006,4.99,,SEVEN SWARM,781,English,A Unbelieveable Character Study of a Dog And a Mad Cow who must Kill a Monkey in Berlin
4,10.99,G,160,2006,0.99,,MULAN MOON,604,English,A Emotional Saga of a Womanizer And a Pioneer who must Overcome a Dentist in A Baloon
6,17.99,NC-17,60,2006,2.99,,PHANTOM GLORY,675,English,A Beautiful Documentary of a Astronaut And a Crocodile who must Discover a Madman in A Monastery
4,12.99,PG-13,119,2006,2.99,,IDENTITY LOVER,449,English,A Boring Tale of a Composer And a Mad Cow who must Defeat a Car in The Outback
7,14.99,G,156,2006,2.99,,GRADUATE LORD,373,English,A Lacklusture Epistle of a Girl And a A Shark who must Meet a Mad Scientist in Ancient China
4,22.99,NC-17,120,2006,4.99,,CALENDAR GUNFIGHT,112,English,A Thrilling Drama of a Frisbee And a Lumberjack who must Sink a Man in Nigeria
6,23.99,NC-17,94,2006,0.99,,ALICE FANTASIA,14,English,A Emotional Drama of a A Shark And a Database Administrator who must Vanquish a Pioneer in Soviet Georgia
3,29.99,PG,117,2006,0.99,,GRAFFITI LOVE,374,English,A Unbelieveable Epistle of a Sumo Wrestler And a Hunter who must Build a Composer in Berlin
4,13.99,G,63,2006,2.99,,BUNCH MINDS,107,English,A Emotional Story of a Feminist And a Feminist who must Escape a Pastry Chef in A MySQL Convention
3,20.99,PG,48,2006,0.99,,RUSH GOODFELLAS,753,English,A Emotional Display of a Man And a Dentist who must Challenge a Squirrel in Australia
7,9.99,PG,92,2006,4.99,,OPPOSITE NECKLACE,639,English,A Fateful Epistle of a Crocodile And a Moose who must Kill a Explorer in Nigeria
5,17.99,PG-13,157,2006,4.99,,PAST SUICIDES,661,English,A Intrepid Tale of a Madman And a Astronaut who must Challenge a Hunter in A Monastery
7,14.99,R,113,2006,0.99,,SHEPHERD MIDSUMMER,786,English,A Thoughtful Drama of a Robot And a Womanizer who must Kill a Lumberjack in A Baloon
5,15.99,R,110,2006,2.99,,REMEMBER DIARY,724,English,A Insightful Tale of a Technical Writer And a Waitress who must Conquer a Monkey in Ancient India
7,16.99,G,53,2006,0.99,,PRIMARY GLASS,697,English,A Fateful Documentary of a Pastry Chef And a Butler who must Build a Dog in The Canadian Rockies
5,9.99,PG,181,2006,2.99,,STAR OPERATION,841,English,A Insightful Character Study of a Girl And a Car who must Pursue a Mad Cow in A Shark Tank
6,22.99,PG-13,139,2006,0.99,,VOICE PEACH,948,English,A Amazing Panorama of a Pioneer And a Student who must Overcome a Mad Scientist in A Manhattan Penthouse
6,28.99,PG-13,78,2006,0.99,,VOYAGE LEGALLY,951,English,A Epic Tale of a Squirrel And a Hunter who must Conquer a Boy in An Abandoned Mine Shaft
3,27.99,PG-13,122,2006,2.99,,CONFUSED CANDLES,175,English,A Stunning Epistle of a Cat And a Forensic Psychologist who must Confront a Pioneer in A Baloon
4,28.99,G,102,2006,0.99,,ROCK INSTINCT,737,English,A Astounding Character Study of a Robot And a Moose who must Overcome a Astronaut in Ancient India
5,19.99,PG-13,152,2006,4.99,,SISTER FREDDY,801,English,A Stunning Saga of a Butler And a Woman who must Pursue a Explorer in Australia
4,18.99,PG,162,2006,4.99,,BIRCH ANTITRUST,74,English,A Fanciful Panorama of a Husband And a Pioneer who must Outgun a Dog in A Baloon
6,20.99,NC-17,177,2006,4.99,,DOZEN LION,248,English,A Taut Drama of a Cat And a Girl who must Defeat a Frisbee in The Canadian Rockies
5,9.99,NC-17,130,2006,2.99,,JASON TRAP,476,English,A Thoughtful Tale of a Woman And a A Shark who must Conquer a Dog in A Monastery
3,20.99,R,103,2006,0.99,,MOTHER OLEANDER,599,English,A Boring Tale of a Husband And a Boy who must Fight a Squirrel in Ancient China
3,19.99,G,86,2006,0.99,,MIDNIGHT WESTWARD,574,English,A Taut Reflection of a Husband And a A Shark who must Redeem a Pastry Chef in A Monastery
6,28.99,NC-17,57,2006,0.99,,STORM HAPPINESS,849,English,A Insightful Drama of a Feminist And a A Shark who must Vanquish a Boat in A Shark Tank
3,13.99,PG,116,2006,2.99,,WORDS HUNTER,987,English,A Action-Packed Reflection of a Composer And a Mad Scientist who must Face a Pioneer in A MySQL Convention
7,20.99,R,84,2006,2.99,,GONE TROUBLE,368,English,A Insightful Character Study of a Mad Cow And a Forensic Psychologist who must Conquer a A Shark in A Manhattan Penthouse
3,22.99,R,98,2006,0.99,,EARRING INSTINCT,269,English,A Stunning Character Study of a Dentist And a Mad Cow who must Find a Teacher in Nigeria
3,26.99,G,75,2006,4.99,,SATISFACTION CONFIDENTIAL,763,English,A Lacklusture Yarn of a Dentist And a Butler who must Meet a Secret Agent in Ancient China
6,11.99,PG,49,2006,2.99,,HURRICANE AFFAIR,443,English,A Lacklusture Epistle of a Database Administrator And a Woman who must Meet a Hunter in An Abandoned Mine Shaft
3,21.99,NC-17,123,2006,2.99,,VANISHING ROCKY,936,English,A Brilliant Reflection of a Man And a Woman who must Conquer a Pioneer in A MySQL Convention
4,18.99,PG-13,152,2006,4.99,,TOURIST PELICAN,898,English,A Boring Story of a Butler And a Astronaut who must Outrace a Pioneer in Australia
7,26.99,PG,106,2006,4.99,,PRIVATE DROP,699,English,A Stunning Story of a Technical Writer And a Hunter who must Succumb a Secret Agent in A Baloon
7,27.99,G,70,2006,4.99,,COLDBLOODED DARLING,165,English,A Brilliant Panorama of a Dentist And a Moose who must Find a Student in The Gulf of Mexico
7,21.99,R,146,2006,2.99,,HAMLET WISDOM,394,English,A Touching Reflection of a Man And a Man who must Sink a Robot in The Outback
3,17.99,PG-13,178,2006,2.99,,IMAGE PRINCESS,453,English,A Lacklusture Panorama of a Secret Agent And a Crocodile who must Discover a Madman in The Canadian Rockies
4,27.99,PG,60,2006,0.99,,MOCKINGBIRD HOLLYWOOD,586,English,A Thoughtful Panorama of a Man And a Car who must Sink a Composer in Berlin
4,23.99,PG-13,64,2006,0.99,,TAXI KICK,877,English,A Amazing Epistle of a Girl And a Woman who must Outrace a Waitress in Soviet Georgia
5,20.99,R,116,2006,4.99,,MADIGAN DORADO,543,English,A Astounding Character Study of a A Shark And a A Shark who must Discover a Crocodile in The Outback
4,9.99,NC-17,137,2006,2.99,,LIFE TWISTED,522,English,A Thrilling Reflection of a Teacher And a Composer who must Find a Man in The First Manned Space Station
4,27.99,R,64,2006,4.99,,DESERT POSEIDON,222,English,A Brilliant Documentary of a Butler And a Frisbee who must Build a Astronaut in New Orleans
4,27.99,PG,121,2006,4.99,,BRANNIGAN SUNRISE,93,English,A Amazing Epistle of a Moose And a Crocodile who must Outrace a Dog in Berlin
7,28.99,NC-17,131,2006,2.99,,FOREVER CANDIDATE,328,English,A Unbelieveable Panorama of a Technical Writer And a Man who must Pursue a Frisbee in A U-Boat
5,25.99,G,66,2006,4.99,,EVE RESURRECTION,289,English,A Awe-Inspiring Yarn of a Pastry Chef And a Database Administrator who must Challenge a Teacher in A Baloon
4,24.99,PG-13,99,2006,0.99,,TENENBAUMS COMMAND,882,English,A Taut Display of a Pioneer And a Man who must Reach a Girl in The Gulf of Mexico
3,25.99,PG-13,100,2006,4.99,,BILKO ANONYMOUS,71,English,A Emotional Reflection of a Teacher And a Man who must Meet a Cat in The First Manned Space Station
6,9.99,NC-17,77,2006,4.99,,FELLOWSHIP AUTUMN,307,English,A Lacklusture Reflection of a Dentist And a Hunter who must Meet a Teacher in A Baloon
5,13.99,NC-17,49,2006,4.99,,HEAVENLY GUN,411,English,A Beautiful Yarn of a Forensic Psychologist And a Frisbee who must Battle a Moose in A Jet Boat
5,20.99,NC-17,92,2006,0.99,,ENCOUNTERS CURTAIN,282,English,A Insightful Epistle of a Pastry Chef And a Womanizer who must Build a Boat in New Orleans
4,21.99,PG,150,2006,4.99,,ALI FOREVER,13,English,A Action-Packed Drama of a Dentist And a Crocodile who must Battle a Feminist in The Canadian Rockies
3,24.99,G,174,2006,4.99,,ITALIAN AFRICAN,472,English,A Astounding Character Study of a Monkey And a Moose who must Outgun a Cat in A U-Boat
5,12.99,PG,97,2006,2.99,,INVASION CYCLONE,468,English,A Lacklusture Character Study of a Mad Scientist And a Womanizer who must Outrace a Explorer in A Monastery
3,13.99,R,132,2006,2.99,,CHOCOLATE DUCK,148,English,A Unbelieveable Story of a Mad Scientist And a Technical Writer who must Discover a Composer in Ancient China
3,19.99,G,94,2006,0.99,,STONE FIRE,848,English,A Intrepid Drama of a Astronaut And a Crocodile who must Find a Boat in Soviet Georgia
7,24.99,PG-13,110,2006,0.99,,CELEBRITY HORN,130,English,A Amazing Documentary of a Secret Agent And a Astronaut who must Vanquish a Hunter in A Shark Tank
3,24.99,PG,158,2006,4.99,,FOOL MOCKINGBIRD,327,English,A Lacklusture Tale of a Crocodile And a Composer who must Defeat a Madman in A U-Boat
4,29.99,PG,163,2006,0.99,,EVERYONE CRAFT,290,English,A Fateful Display of a Waitress And a Dentist who must Reach a Butler in Nigeria
4,11.99,PG,91,2006,4.99,,TITANS JERK,893,English,A Unbelieveable Panorama of a Feminist And a Sumo Wrestler who must Challenge a Technical Writer in Ancient China
7,24.99,PG,61,2006,4.99,,CHINATOWN GLADIATOR,144,English,A Brilliant Panorama of a Technical Writer And a Lumberjack who must Escape a Butler in Ancient India
7,15.99,R,72,2006,2.99,,HARDLY ROBBERS,400,English,A Emotional Character Study of a Hunter And a Car who must Kill a Woman in Berlin
