durata_noleggio,costo_sostituzione,voto,durata,data_rilascio,tariffa_noleggio,lingua_originale_id,titolo,film_id,lingua,descrizione
5,28.99,PG,177,2006,2.99,,RIDER CADDYSHACK,729,English,A Taut Reflection of a Monkey And a Womanizer who must Chase a Moose in Nigeria
6,16.99,G,126,2006,0.99,,ALAMO VIDEOTAPE,11,English,A Boring Epistle of a Butler And a Cat who must Fight a Pastry Chef in A MySQL Convention
3,28.99,R,111,2006,4.99,,TIES HUNGER,889,English,A Insightful Saga of a Astronaut And a Explorer who must Pursue a Mad Scientist in A U-Boat
6,25.99,G,102,2006,4.99,,HEAVYWEIGHTS BEAST,412,English,A Unbelieveable Story of a Composer And a Dog who must Overcome a Womanizer in An Abandoned Amusement Park
3,13.99,PG,142,2006,2.99,,FERRIS MOTHER,308,English,A Touching Display of a Frisbee And a Frisbee who must Kill a Girl in The Gulf of Mexico
3,29.99,NC-17,171,2006,2.99,,JERICHO MULAN,483,English,A Amazing Yarn of a Hunter And a Butler who must Defeat a Boy in A Jet Boat
7,28.99,NC-17,91,2006,2.99,,LICENSE WEEKEND,520,English,A Insightful Story of a Man And a Husband who must Overcome a Madman in A Monastery
5,28.99,PG,80,2006,4.99,,LOSER HUSTLER,532,English,A Stunning Drama of a Robot And a Feminist who must Outgun a Butler in Nigeria
6,10.99,G,83,2006,2.99,,WARLOCK WEREWOLF,959,English,A Astounding Yarn of a Pioneer And a Crocodile who must Defeat a A Shark in The Outback
6,10.99,G,180,2006,2.99,,MUSSOLINI SPOILERS,612,English,A Thrilling Display of a Boat And a Monkey who must Meet a Composer in Ancient China
7,29.99,NC-17,85,2006,0.99,,EARTH VISION,270,English,A Stunning Drama of a Butler And a Madman who must Outrace a Womanizer in Ancient India
3,16.99,NC-17,92,2006,4.99,,CARIBBEAN LIBERTY,120,English,A Fanciful Tale of a Pioneer And a Technical Writer who must Outgun a Pioneer in A Shark Tank
3,20.99,PG-13,160,2006,2.99,,PEACH INNOCENT,667,English,A Action-Packed Drama of a Monkey And a Dentist who must Chase a Butler in Berlin
6,13.99,PG-13,68,2006,2.99,,DIVIDE MONSTER,235,English,A Intrepid Saga of a Man And a Forensic Psychologist who must Reach a Squirrel in A Monastery
7,29.99,PG,69,2006,0.99,,HOLLYWOOD ANONYMOUS,423,English,A Fast-Paced Epistle of a Boy And a Explorer who must Escape a Dog in A U-Boat
3,29.99,G,142,2006,0.99,,TRACY CIDER,901,English,A Touching Reflection of a Database Administrator And a Madman who must Build a Lumberjack in Nigeria
7,19.99,NC-17,147,2006,2.99,,RACER EGG,709,English,A Emotional Display of a Monkey And a Waitress who must Reach a Secret Agent in California
7,9.99,PG-13,86,2006,0.99,,GANDHI KWAI,348,English,A Thoughtful Display of a Mad Scientist And a Secret Agent who must Chase a Boat in Berlin
3,18.99,PG,65,2006,2.99,,LOVELY JINGLE,536,English,A Fanciful Yarn of a Crocodile And a Forensic Psychologist who must Discover a Crocodile in The Outback
6,9.99,PG,173,2006,0.99,,TALENTED HOMICIDE,875,English,A Lacklusture Panorama of a Dentist And a Forensic Psychologist who must Outrace a Pioneer in A U-Boat
7,16.99,PG-13,89,2006,2.99,,DARES PLUTO,208,English,A Fateful Story of a Robot And a Dentist who must Defeat a Astronaut in New Orleans
4,29.99,G,159,2006,4.99,,WEST LION,969,English,A Intrepid Drama of a Butler And a Lumberjack who must Challenge a Database Administrator in A Manhattan Penthouse
4,21.99,PG-13,120,2006,0.99,,KARATE MOON,494,English,A Astounding Yarn of a Womanizer And a Dog who must Reach a Waitress in A MySQL Convention
5,25.99,PG-13,84,2006,0.99,,SAVANNAH TOWN,766,English,A Awe-Inspiring Tale of a Astronaut And a Database Administrator who must Chase a Secret Agent in The Gulf of Mexico
5,17.99,PG,98,2006,0.99,,BOUND CHEAPER,91,English,A Thrilling Panorama of a Database Administrator And a Astronaut who must Challenge a Lumberjack in A Baloon
7,16.99,NC-17,169,2006,2.99,,HEDWIG ALTER,413,English,A Action-Packed Yarn of a Womanizer And a Lumberjack who must Chase a Sumo Wrestler in A Monastery
3,29.99,G,75,2006,2.99,,LOVER TRUMAN,537,English,A Emotional Yarn of a Robot And a Boy who must Outgun a Technical Writer in A U-Boat
3,21.99,R,142,2006,2.99,,TOMORROW HUSTLER,895,English,A Thoughtful Story of a Moose And a Husband who must Face a Secret Agent in The Sahara Desert
6,9.99,PG-13,56,2006,4.99,,MATRIX SNOWMAN,565,English,A Action-Packed Saga of a Womanizer And a Woman who must Overcome a Student in California
6,29.99,R,98,2006,0.99,,FEUD FROGMEN,309,English,A Brilliant Reflection of a Database Administrator And a Mad Cow who must Chase a Woman in The Canadian Rockies
3,13.99,NC-17,172,2006,2.99,,JERK PAYCHECK,484,English,A Touching Character Study of a Pastry Chef And a Database Administrator who must Reach a A Shark in Ancient Japan
5,15.99,PG,130,2006,0.99,,MAJESTIC FLOATS,552,English,A Thrilling Character Study of a Moose And a Student who must Escape a Butler in The First Manned Space Station
6,15.99,NC-17,138,2006,0.99,,POCUS PULP,687,English,A Intrepid Yarn of a Frisbee And a Dog who must Build a Astronaut in A Baloon Factory
7,23.99,R,149,2006,0.99,,SPIRIT FLINTSTONES,830,English,A Brilliant Yarn of a Cat And a Car who must Confront a Explorer in Ancient Japan
7,14.99,G,103,2006,0.99,,FIREHOUSE VIETNAM,318,English,A Awe-Inspiring Character Study of a Boat And a Boy who must Kill a Pastry Chef in The Sahara Desert
5,22.99,PG-13,150,2006,2.99,,BINGO TALENTED,73,English,A Touching Tale of a Girl And a Crocodile who must Discover a Waitress in Nigeria
7,14.99,NC-17,76,2006,0.99,,BOONDOCK BALLROOM,87,English,A Fateful Panorama of a Crocodile And a Boy who must Defeat a Monkey in The Gulf of Mexico
5,16.99,PG-13,91,2006,4.99,,ANTHEM LUKE,28,English,A Touching Panorama of a Waitress And a Woman who must Outrace a Dog in An Abandoned Amusement Park
6,17.99,PG,50,2006,2.99,,PILOT HOOSIERS,679,English,A Awe-Inspiring Reflection of a Crocodile And a Sumo Wrestler who must Meet a Forensic Psychologist in An Abandoned Mine Shaft
6,16.99,R,165,2006,4.99,,MASSACRE USUAL,563,English,A Fateful Reflection of a Waitress And a Crocodile who must Challenge a Forensic Psychologist in California
5,13.99,G,139,2006,4.99,,TRAFFIC HOBBIT,903,English,A Amazing Epistle of a Squirrel And a Lumberjack who must Succumb a Database Administrator in A U-Boat
3,23.99,NC-17,137,2006,4.99,,SCORPION APOLLO,771,English,A Awe-Inspiring Documentary of a Technical Writer And a Husband who must Meet a Monkey in An Abandoned Fun House
4,27.99,NC-17,103,2006,0.99,,STRANGELOVE DESIRE,852,English,A Awe-Inspiring Panorama of a Lumberjack And a Waitress who must Defeat a Crocodile in An Abandoned Amusement Park
3,9.99,PG,128,2006,0.99,,PAPI NECKLACE,656,English,A Fanciful Display of a Car And a Monkey who must Escape a Squirrel in Ancient Japan
6,21.99,NC-17,65,2006,4.99,,FREDDY STORM,334,English,A Intrepid Saga of a Man And a Lumberjack who must Vanquish a Husband in The Outback
5,16.99,NC-17,70,2006,0.99,,GUNFIGHT MOON,388,English,A Epic Reflection of a Pastry Chef And a Explorer who must Reach a Dentist in The Sahara Desert
4,25.99,NC-17,53,2006,0.99,,CABIN FLASH,110,English,A Stunning Epistle of a Boat And a Man who must Challenge a A Shark in A Baloon Factory
7,24.99,NC-17,76,2006,2.99,,DESIRE ALIEN,223,English,A Fast-Paced Tale of a Dog And a Forensic Psychologist who must Meet a Astronaut in The First Manned Space Station
5,15.99,R,104,2006,2.99,,SHIP WONDERLAND,788,English,A Thrilling Saga of a Monkey And a Frisbee who must Escape a Explorer in The Outback
3,9.99,PG-13,127,2006,2.99,,GUNFIGHTER MUSSOLINI,389,English,A Touching Saga of a Robot And a Boy who must Kill a Man in Ancient Japan
3,10.99,G,80,2006,2.99,,TURN STAR,916,English,A Stunning Tale of a Man And a Monkey who must Chase a Student in New Orleans
6,12.99,PG,117,2006,0.99,,RESURRECTION SILVERADO,727,English,A Epic Yarn of a Robot And a Explorer who must Challenge a Girl in A MySQL Convention
6,22.99,NC-17,74,2006,2.99,,MAGUIRE APACHE,550,English,A Fast-Paced Reflection of a Waitress And a Hunter who must Defeat a Forensic Psychologist in A Baloon
4,27.99,PG-13,145,2006,4.99,,PAYCHECK WAIT,666,English,A Awe-Inspiring Reflection of a Boy And a Man who must Discover a Moose in The Sahara Desert
7,14.99,NC-17,117,2006,4.99,,CHAMBER ITALIAN,133,English,A Fateful Reflection of a Moose And a Husband who must Overcome a Monkey in Nigeria
5,23.99,NC-17,131,2006,2.99,,NEMO CAMPUS,620,English,A Lacklusture Reflection of a Monkey And a Squirrel who must Outrace a Womanizer in A Manhattan Penthouse
7,21.99,NC-17,150,2006,0.99,,CHRISTMAS MOONSHINE,149,English,A Action-Packed Epistle of a Feminist And a Astronaut who must Conquer a Boat in A Manhattan Penthouse
5,26.99,G,161,2006,4.99,,DADDY PITTSBURGH,202,English,A Epic Story of a A Shark And a Student who must Confront a Explorer in The Gulf of Mexico
6,13.99,PG-13,112,2006,2.99,,SPY MILE,835,English,A Thrilling Documentary of a Feminist And a Feminist who must Confront a Feminist in A Baloon
6,20.99,G,120,2006,4.99,,DAZED PUNK,217,English,A Action-Packed Story of a Pioneer And a Technical Writer who must Discover a Forensic Psychologist in An Abandoned Amusement Park
4,13.99,G,93,2006,4.99,,SUICIDES SILENCE,860,English,A Emotional Character Study of a Car And a Girl who must Face a Composer in A U-Boat
7,19.99,PG-13,162,2006,0.99,,LOVERBOY ATTACKS,538,English,A Boring Story of a Car And a Butler who must Build a Girl in Soviet Georgia
6,15.99,NC-17,135,2006,4.99,,CANDLES GRAPES,117,English,A Fanciful Character Study of a Monkey And a Explorer who must Build a Astronaut in An Abandoned Fun House
5,21.99,R,102,2006,4.99,,OPUS ICE,640,English,A Fast-Paced Drama of a Hunter And a Boy who must Discover a Feminist in The Sahara Desert
3,10.99,PG-13,179,2006,0.99,,KICK SAVANNAH,496,English,A Emotional Drama of a Monkey And a Robot who must Defeat a Monkey in New Orleans
6,22.99,PG-13,67,2006,0.99,,SHOOTIST SUPERFLY,790,English,A Fast-Paced Story of a Crocodile And a A Shark who must Sink a Pioneer in Berlin
3,16.99,R,179,2006,2.99,,CAUSE DATE,129,English,A Taut Tale of a Explorer And a Pastry Chef who must Conquer a Hunter in A MySQL Convention
4,24.99,PG-13,59,2006,4.99,,WHISPERER GIANT,972,English,A Intrepid Story of a Dentist And a Hunter who must Confront a Monkey in Ancient Japan
6,15.99,G,129,2006,2.99,,BAREFOOT MANCHURIAN,56,English,A Intrepid Story of a Cat And a Student who must Vanquish a Girl in An Abandoned Amusement Park
5,9.99,PG-13,184,2006,0.99,,THEORY MERMAID,886,English,A Fateful Yarn of a Composer And a Monkey who must Vanquish a Womanizer in The First Manned Space Station
7,26.99,PG-13,102,2006,2.99,,ROBBERS JOON,735,English,A Thoughtful Story of a Mad Scientist And a Waitress who must Confront a Forensic Psychologist in Soviet Georgia
4,17.99,G,119,2006,2.99,,BUGSY SONG,104,English,A Awe-Inspiring Character Study of a Secret Agent And a Boat who must Find a Squirrel in The First Manned Space Station
3,20.99,PG,148,2006,4.99,,TELEGRAPH VOYAGE,879,English,A Fateful Yarn of a Husband And a Dog who must Battle a Waitress in A Jet Boat
5,13.99,PG-13,153,2006,2.99,,ROLLERCOASTER BRINGING,740,English,A Beautiful Drama of a Robot And a Lumberjack who must Discover a Technical Writer in A Shark Tank
5,14.99,PG,137,2006,2.99,,POLLOCK DELIVERANCE,689,English,A Intrepid Story of a Madman And a Frisbee who must Outgun a Boat in The Sahara Desert
4,24.99,PG,85,2006,4.99,,LOLA AGENT,527,English,A Astounding Tale of a Mad Scientist And a Husband who must Redeem a Database Administrator in Ancient Japan
7,21.99,G,148,2006,2.99,,BLANKET BEVERLY,80,English,A Emotional Documentary of a Student And a Girl who must Build a Boat in Nigeria
3,23.99,NC-17,105,2006,0.99,,JOON NORTHWEST,488,English,A Thrilling Panorama of a Technical Writer And a Car who must Discover a Forensic Psychologist in A Shark Tank
3,22.99,NC-17,58,2006,0.99,,DANCES NONE,205,English,A Insightful Reflection of a A Shark And a Dog who must Kill a Butler in An Abandoned Amusement Park
3,12.99,G,176,2006,2.99,,HOOSIERS BIRDCAGE,431,English,A Astounding Display of a Explorer And a Boat who must Vanquish a Car in The First Manned Space Station
6,18.99,G,85,2006,4.99,,GHOST GROUNDHOG,354,English,A Brilliant Panorama of a Madman And a Composer who must Succumb a Car in Ancient India
4,11.99,PG-13,109,2006,4.99,,WHALE BIKINI,971,English,A Intrepid Story of a Pastry Chef And a Database Administrator who must Kill a Feminist in A MySQL Convention
7,20.99,G,107,2006,2.99,,DIARY PANIC,230,English,A Thoughtful Character Study of a Frisbee And a Mad Cow who must Outgun a Man in Ancient India
3,18.99,PG-13,71,2006,2.99,,MANNEQUIN WORST,558,English,A Astounding Saga of a Mad Cow And a Pastry Chef who must Discover a Husband in Ancient India
3,25.99,PG,149,2006,4.99,,NIGHTMARE CHILL,624,English,A Brilliant Display of a Robot And a Butler who must Fight a Waitress in An Abandoned Mine Shaft
6,22.99,NC-17,125,2006,2.99,,GENTLEMEN STAGE,353,English,A Awe-Inspiring Reflection of a Monkey And a Student who must Overcome a Dentist in The First Manned Space Station
3,27.99,NC-17,183,2006,4.99,,WIFE TURN,973,English,A Awe-Inspiring Epistle of a Teacher And a Feminist who must Confront a Pioneer in Ancient Japan
7,19.99,NC-17,72,2006,4.99,,BOWFINGER GABLES,92,English,A Fast-Paced Yarn of a Waitress And a Composer who must Outgun a Dentist in California
6,10.99,NC-17,168,2006,0.99,,HAROLD FRENCH,401,English,A Stunning Saga of a Sumo Wrestler And a Student who must Outrace a Moose in The Sahara Desert
7,21.99,R,161,2006,4.99,,BROOKLYN DESERT,100,English,A Beautiful Drama of a Dentist And a Composer who must Battle a Sumo Wrestler in The First Manned Space Station
4,15.99,R,122,2006,0.99,,ILLUSION AMELIE,452,English,A Emotional Epistle of a Boat And a Mad Scientist who must Outrace a Robot in An Abandoned Mine Shaft
6,19.99,PG,176,2006,4.99,,SWEDEN SHINING,871,English,A Taut Documentary of a Car And a Robot who must Conquer a Boy in The Canadian Rockies
3,23.99,PG,75,2006,2.99,,HELLFIGHTERS SIERRA,414,English,A Taut Reflection of a A Shark And a Dentist who must Battle a Boat in Soviet Georgia
6,22.99,G,159,2006,2.99,,MALKOVICH PET,554,English,A Intrepid Reflection of a Waitress And a A Shark who must Kill a Squirrel in The Outback
7,9.99,NC-17,128,2006,0.99,,NOTORIOUS REUNION,629,English,A Amazing Epistle of a Woman And a Squirrel who must Fight a Hunter in A Baloon
6,20.99,NC-17,114,2006,0.99,,PRIDE ALAMO,696,English,A Thoughtful Drama of a A Shark And a Forensic Psychologist who must Vanquish a Student in Ancient India
6,17.99,G,167,2006,2.99,,EXORCIST STING,293,English,A Touching Drama of a Dog And a Sumo Wrestler who must Conquer a Mad Scientist in Berlin
3,24.99,PG-13,92,2006,2.99,,CORE SUIT,184,English,A Unbelieveable Tale of a Car And a Explorer who must Confront a Boat in A Manhattan Penthouse
6,17.99,R,136,2006,2.99,,TOWN ARK,900,English,A Awe-Inspiring Documentary of a Moose And a Madman who must Meet a Dog in An Abandoned Mine Shaft
5,24.99,PG,172,2006,2.99,,NORTHWEST POLISH,628,English,A Boring Character Study of a Boy And a A Shark who must Outrace a Womanizer in The Outback
7,17.99,PG,73,2006,4.99,,MUSKETEERS WAIT,611,English,A Touching Yarn of a Student And a Moose who must Fight a Mad Cow in Australia
6,16.99,PG,60,2006,4.99,,JERSEY SASSY,485,English,A Lacklusture Documentary of a Madman And a Mad Cow who must Find a Feminist in Ancient Japan
6,14.99,R,139,2006,2.99,,SHRUNK DIVINE,793,English,A Fateful Character Study of a Waitress And a Technical Writer who must Battle a Hunter in A Baloon
3,11.99,PG,99,2006,0.99,,PET HAUNTING,674,English,A Unbelieveable Reflection of a Explorer And a Boat who must Conquer a Woman in California
5,20.99,R,158,2006,4.99,,FEVER EMPIRE,310,English,A Insightful Panorama of a Cat And a Boat who must Defeat a Boat in The Gulf of Mexico
6,27.99,NC-17,70,2006,4.99,,CLUE GRAIL,161,English,A Taut Tale of a Butler And a Mad Scientist who must Build a Crocodile in Ancient China
4,10.99,G,112,2006,2.99,,JAWS HARRY,478,English,A Thrilling Display of a Database Administrator And a Monkey who must Overcome a Dog in An Abandoned Fun House
5,18.99,R,92,2006,0.99,,KANE EXORCIST,493,English,A Epic Documentary of a Composer And a Robot who must Overcome a Car in Berlin
4,20.99,R,84,2006,4.99,,GUYS FALCON,390,English,A Boring Story of a Woman And a Feminist who must Redeem a Squirrel in A U-Boat
6,28.99,PG-13,181,2006,4.99,,HOTEL HAPPINESS,435,English,A Thrilling Yarn of a Pastry Chef And a A Shark who must Challenge a Mad Scientist in The Outback
6,19.99,R,153,2006,4.99,,RULES HUMAN,749,English,A Beautiful Epistle of a Astronaut And a Student who must Confront a Monkey in An Abandoned Fun House
5,16.99,NC-17,92,2006,4.99,,APACHE DIVINE,31,English,A Awe-Inspiring Reflection of a Pastry Chef And a Teacher who must Overcome a Sumo Wrestler in A U-Boat
6,17.99,PG,53,2006,4.99,,TEQUILA PAST,883,English,A Action-Packed Panorama of a Mad Scientist And a Robot who must Challenge a Student in Nigeria
7,18.99,R,101,2006,0.99,,GHOSTBUSTERS ELF,355,English,A Thoughtful Epistle of a Dog And a Feminist who must Chase a Composer in Berlin
4,14.99,NC-17,140,2006,4.99,,EAGLES PANKY,267,English,A Thoughtful Story of a Car And a Boy who must Find a A Shark in The Sahara Desert
5,17.99,G,129,2006,4.99,,GOSFORD DONNIE,371,English,A Epic Panorama of a Mad Scientist And a Monkey who must Redeem a Secret Agent in Berlin
7,22.99,NC-17,179,2006,0.99,,TEXAS WATCH,885,English,A Awe-Inspiring Yarn of a Student And a Teacher who must Fight a Teacher in An Abandoned Amusement Park
6,13.99,G,101,2006,2.99,,DWARFS ALTER,264,English,A Emotional Yarn of a Girl And a Dog who must Challenge a Composer in Ancient Japan
5,21.99,PG-13,128,2006,4.99,,USUAL UNTOUCHABLES,929,English,A Touching Display of a Explorer And a Lumberjack who must Fight a Forensic Psychologist in A Shark Tank
5,13.99,G,147,2006,2.99,,SCISSORHANDS SLUMS,770,English,A Awe-Inspiring Drama of a Girl And a Technical Writer who must Meet a Feminist in The Canadian Rockies
4,27.99,PG,171,2006,0.99,,TRAMP OTHERS,906,English,A Brilliant Display of a Composer And a Cat who must Succumb a A Shark in Ancient India
5,18.99,G,123,2006,4.99,,BREAKFAST GOLDFINGER,95,English,A Beautiful Reflection of a Student And a Student who must Fight a Moose in Berlin
6,24.99,NC-17,65,2006,2.99,,HUNTING MUSKETEERS,442,English,A Thrilling Reflection of a Pioneer And a Dentist who must Outrace a Womanizer in An Abandoned Mine Shaft
4,16.99,G,59,2006,0.99,,MINORITY KISS,581,English,A Insightful Display of a Lumberjack And a Sumo Wrestler who must Meet a Man in The Outback
4,23.99,R,54,2006,4.99,,SENSE GREEK,779,English,A Taut Saga of a Lumberjack And a Pastry Chef who must Escape a Sumo Wrestler in An Abandoned Fun House
4,12.99,PG,75,2006,4.99,,WIZARD COLDBLOODED,980,English,A Lacklusture Display of a Robot And a Girl who must Defeat a Sumo Wrestler in A MySQL Convention
6,23.99,PG,51,2006,4.99,,FRISCO FORREST,338,English,A Beautiful Documentary of a Woman And a Pioneer who must Pursue a Mad Scientist in A Shark Tank
3,9.99,G,132,2006,4.99,,DUDE BLINDNESS,260,English,A Stunning Reflection of a Husband And a Lumberjack who must Face a Frisbee in An Abandoned Fun House
4,9.99,PG-13,64,2006,2.99,,METROPOLIS COMA,572,English,A Emotional Saga of a Database Administrator And a Pastry Chef who must Confront a Teacher in A Baloon Factory
5,29.99,G,131,2006,2.99,,FANTASIA PARK,302,English,A Thoughtful Documentary of a Mad Scientist And a A Shark who must Outrace a Feminist in Australia
5,17.99,R,111,2006,0.99,,FROGMEN BREAKING,339,English,A Unbelieveable Yarn of a Mad Scientist And a Cat who must Chase a Lumberjack in Australia
3,14.99,PG-13,109,2006,4.99,,PARK CITIZEN,659,English,A Taut Epistle of a Sumo Wrestler And a Girl who must Face a Husband in Ancient Japan
4,15.99,NC-17,116,2006,2.99,,DUCK RACER,259,English,A Lacklusture Yarn of a Teacher And a Squirrel who must Overcome a Dog in A Shark Tank
5,27.99,PG,114,2006,0.99,,SUPERFLY TRIP,868,English,A Beautiful Saga of a Lumberjack And a Teacher who must Build a Technical Writer in An Abandoned Fun House
7,17.99,PG-13,119,2006,4.99,,GAMES BOWFINGER,347,English,A Astounding Documentary of a Butler And a Explorer who must Challenge a Butler in A Monastery
7,22.99,G,63,2006,0.99,,BORROWERS BEDAZZLED,89,English,A Brilliant Epistle of a Teacher And a Sumo Wrestler who must Defeat a Man in An Abandoned Fun House
4,22.99,PG,58,2006,2.99,,JEKYLL FROGMEN,481,English,A Fanciful Epistle of a Student And a Astronaut who must Kill a Waitress in A Shark Tank
7,13.99,G,114,2006,0.99,,GILBERT PELICAN,357,English,A Fateful Tale of a Man And a Feminist who must Conquer a Crocodile in A Manhattan Penthouse
5,12.99,G,148,2006,4.99,,EASY GLADIATOR,271,English,A Fateful Story of a Monkey And a Girl who must Overcome a Pastry Chef in Ancient India
6,28.99,PG,107,2006,2.99,,MONSTER SPARTACUS,592,English,A Fast-Paced Story of a Waitress And a Cat who must Fight a Girl in Australia
6,10.99,PG-13,54,2006,4.99,,OCTOBER SUBMARINE,633,English,A Taut Epistle of a Monkey And a Boy who must Confront a Husband in A Jet Boat
6,10.99,NC-17,105,2006,0.99,,ZHIVAGO CORE,998,English,A Fateful Yarn of a Composer And a Man who must Face a Boy in The Canadian Rockies
7,29.99,PG-13,143,2006,0.99,,CLOCKWORK PARADISE,157,English,A Insightful Documentary of a Technical Writer And a Feminist who must Challenge a Cat in A Baloon
7,15.99,PG,132,2006,2.99,,SKY MIRACLE,802,English,A Epic Drama of a Mad Scientist And a Explorer who must Succumb a Waitress in An Abandoned Fun House
3,28.99,PG-13,46,2006,0.99,,RIDGEMONT SUBMARINE,730,English,A Unbelieveable Drama of a Waitress And a Composer who must Sink a Mad Cow in Ancient Japan
6,27.99,G,65,2006,2.99,,BARBARELLA STREETCAR,55,English,A Awe-Inspiring Story of a Feminist And a Cat who must Conquer a Dog in A Monastery
6,20.99,R,153,2006,0.99,,GOLDMINE TYCOON,367,English,A Brilliant Epistle of a Composer And a Frisbee who must Conquer a Husband in The Outback
4,25.99,PG,133,2006,0.99,,MALLRATS UNITED,555,English,A Thrilling Yarn of a Waitress And a Dentist who must Find a Hunter in A Monastery
7,10.99,PG,160,2006,2.99,,STOCK GLASS,847,English,A Boring Epistle of a Crocodile And a Lumberjack who must Outgun a Moose in Ancient China
5,16.99,PG,115,2006,2.99,,POTTER CONNECTICUT,693,English,A Thrilling Epistle of a Frisbee And a Cat who must Fight a Technical Writer in Berlin
6,15.99,G,170,2006,2.99,,ATLANTIS CAUSE,43,English,A Thrilling Yarn of a Feminist And a Hunter who must Fight a Technical Writer in A Shark Tank
5,22.99,NC-17,109,2006,4.99,,PANTHER REDS,655,English,A Brilliant Panorama of a Moose And a Man who must Reach a Teacher in The Gulf of Mexico
7,19.99,PG-13,126,2006,2.99,,SINNERS ATLANTIS,800,English,A Epic Display of a Dog And a Boat who must Succumb a Mad Scientist in An Abandoned Mine Shaft
7,12.99,NC-17,112,2006,4.99,,CONEHEADS SMOOCHY,172,English,A Touching Story of a Womanizer And a Composer who must Pursue a Husband in Nigeria
6,11.99,R,73,2006,2.99,,FRIDA SLIPPER,337,English,A Fateful Story of a Lumberjack And a Car who must Escape a Boat in An Abandoned Mine Shaft
3,26.99,G,80,2006,2.99,,MEET CHOCOLATE,567,English,A Boring Documentary of a Dentist And a Butler who must Confront a Monkey in A MySQL Convention
7,27.99,PG,133,2006,4.99,,BUCKET BROTHERHOOD,103,English,A Amazing Display of a Girl And a Womanizer who must Succumb a Lumberjack in A Baloon Factory
7,26.99,NC-17,146,2006,2.99,,CHAPLIN LICENSE,136,English,A Boring Drama of a Dog And a Forensic Psychologist who must Outrace a Explorer in Ancient India
7,23.99,G,156,2006,2.99,,OPERATION OPERATION,638,English,A Intrepid Character Study of a Man And a Frisbee who must Overcome a Madman in Ancient China
5,14.99,PG-13,156,2006,0.99,,SLIPPER FIDELITY,809,English,A Taut Reflection of a Secret Agent And a Man who must Redeem a Explorer in A MySQL Convention
7,22.99,NC-17,122,2006,0.99,,DECEIVER BETRAYED,218,English,A Taut Story of a Moose And a Squirrel who must Build a Husband in Ancient India
4,17.99,G,61,2006,4.99,,WATERFRONT DELIVERANCE,964,English,A Unbelieveable Documentary of a Dentist And a Technical Writer who must Build a Womanizer in Nigeria
3,17.99,PG,169,2006,2.99,,AGENT TRUMAN,6,English,A Intrepid Panorama of a Robot And a Boy who must Escape a Sumo Wrestler in Ancient China
7,22.99,NC-17,112,2006,4.99,,FORRESTER COMANCHEROS,330,English,A Fateful Tale of a Squirrel And a Forensic Psychologist who must Redeem a Man in Nigeria
5,19.99,PG,150,2006,4.99,,HYSTERICAL GRAIL,446,English,A Amazing Saga of a Madman And a Dentist who must Build a Car in A Manhattan Penthouse
4,27.99,PG,57,2006,4.99,,DAWN POND,215,English,A Thoughtful Documentary of a Dentist And a Forensic Psychologist who must Defeat a Waitress in Berlin
5,26.99,NC-17,139,2006,4.99,,DORADO NOTTING,244,English,A Action-Packed Tale of a Sumo Wrestler And a A Shark who must Meet a Frisbee in California
7,13.99,PG-13,129,2006,4.99,,SLEEPING SUSPECTS,804,English,A Stunning Reflection of a Sumo Wrestler And a Explorer who must Sink a Frisbee in A MySQL Convention
5,21.99,PG-13,151,2006,4.99,,SCHOOL JACKET,769,English,A Intrepid Yarn of a Monkey And a Boy who must Fight a Composer in A Manhattan Penthouse
3,12.99,G,67,2006,2.99,,LONELY ELEPHANT,529,English,A Intrepid Story of a Student And a Dog who must Challenge a Explorer in Soviet Georgia
7,27.99,NC-17,99,2006,4.99,,PERDITION FARGO,671,English,A Fast-Paced Story of a Car And a Cat who must Outgun a Hunter in Berlin
7,18.99,G,73,2006,4.99,,WAKE JAWS,954,English,A Beautiful Saga of a Feminist And a Composer who must Challenge a Moose in Berlin
7,11.99,PG,182,2006,4.99,,RECORDS ZORRO,719,English,A Amazing Drama of a Mad Scientist And a Composer who must Build a Husband in The Outback
4,22.99,NC-17,139,2006,2.99,,HOPE TOOTSIE,432,English,A Amazing Documentary of a Student And a Sumo Wrestler who must Outgun a A Shark in A Shark Tank
