durata_noleggio,costo_sostituzione,voto,durata,data_rilascio,tariffa_noleggio,lingua_originale_id,titolo,film_id,lingua,descrizione
3,11.99,R,63,2006,0.99,,BOULEVARD MOB,90,English,A Fateful Epistle of a Moose And a Monkey who must Confront a Lumberjack in Ancient China
6,28.99,PG-13,62,2006,4.99,,AIRPLANE SIERRA,7,English,A Touching Saga of a Hunter And a Butler who must Discover a Butler in A Jet Boat
7,15.99,PG-13,154,2006,2.99,,SHREK LICENSE,792,English,A Fateful Yarn of a Secret Agent And a Feminist who must Find a Feminist in A Jet Boat
4,17.99,PG-13,134,2006,4.99,,PITTSBURGH HUNCHBACK,682,English,A Thrilling Epistle of a Boy And a Boat who must Find a Student in Soviet Georgia
3,13.99,PG-13,59,2006,4.99,,DAUGHTER MADIGAN,214,English,A Beautiful Tale of a Hunter And a Mad Scientist who must Confront a Squirrel in The First Manned Space Station
6,24.99,NC-17,85,2006,2.99,,WONKA SEA,986,English,A Brilliant Saga of a Boat And a Mad Scientist who must Meet a Moose in Ancient India
3,20.99,PG,100,2006,4.99,,BEHAVIOR RUNAWAY,65,English,A Unbelieveable Drama of a Student And a Husband who must Outrace a Sumo Wrestler in Berlin
6,22.99,G,130,2006,2.99,,AFRICAN EGG,5,English,A Fast-Paced Documentary of a Pastry Chef And a Dentist who must Pursue a Forensic Psychologist in The Gulf of Mexico
6,22.99,PG-13,165,2006,2.99,,SPEAKEASY DATE,825,English,A Lacklusture Drama of a Forensic Psychologist And a Car who must Redeem a Man in A Manhattan Penthouse
4,24.99,PG-13,50,2006,0.99,,NATURAL STOCK,617,English,A Fast-Paced Story of a Sumo Wrestler And a Girl who must Defeat a Car in A Baloon Factory
7,10.99,R,120,2006,2.99,,LOCK REAR,526,English,A Thoughtful Character Study of a Squirrel And a Technical Writer who must Outrace a Student in Ancient Japan
3,16.99,R,112,2006,4.99,,CROWDS TELEMARK,195,English,A Intrepid Documentary of a Astronaut And a Forensic Psychologist who must Find a Frisbee in An Abandoned Fun House
4,26.99,PG,185,2006,2.99,,WORST BANGER,991,English,A Thrilling Drama of a Madman And a Dentist who must Conquer a Boy in The Outback
7,26.99,NC-17,142,2006,4.99,,BIKINI BORROWERS,70,English,A Astounding Drama of a Astronaut And a Cat who must Discover a Woman in The First Manned Space Station
6,18.99,PG,135,2006,2.99,,DREAM PICKUP,252,English,A Epic Display of a Car And a Composer who must Overcome a Forensic Psychologist in The Gulf of Mexico
6,21.99,R,181,2006,0.99,,LOVE SUICIDES,535,English,A Brilliant Panorama of a Hunter And a Explorer who must Pursue a Dentist in An Abandoned Fun House
5,15.99,G,61,2006,4.99,,BIRDS PERDITION,77,English,A Boring Story of a Womanizer And a Pioneer who must Face a Dog in California
7,13.99,PG-13,120,2006,2.99,,ORDER BETRAYED,642,English,A Amazing Saga of a Dog And a A Shark who must Challenge a Cat in The Sahara Desert
6,21.99,PG-13,153,2006,2.99,,LEATHERNECKS DWARFS,513,English,A Fateful Reflection of a Dog And a Mad Cow who must Outrace a Teacher in An Abandoned Mine Shaft
4,19.99,PG,111,2006,4.99,,WONDERLAND CHRISTMAS,985,English,A Awe-Inspiring Character Study of a Waitress And a Car who must Pursue a Mad Scientist in The First Manned Space Station
5,29.99,G,93,2006,0.99,,HILLS NEIGHBORS,417,English,A Epic Display of a Hunter And a Feminist who must Sink a Car in A U-Boat
4,21.99,R,134,2006,0.99,,ROBBERY BRIGHT,736,English,A Taut Reflection of a Robot And a Squirrel who must Fight a Boat in Ancient Japan
3,16.99,G,113,2006,4.99,,DAY UNFAITHFUL,216,English,A Stunning Documentary of a Composer And a Mad Scientist who must Find a Technical Writer in A U-Boat
4,12.99,PG-13,65,2006,0.99,,CLUB GRAFFITI,160,English,A Epic Tale of a Pioneer And a Hunter who must Escape a Girl in A U-Boat
4,29.99,G,60,2006,2.99,,SMILE EARRING,811,English,A Intrepid Drama of a Teacher And a Butler who must Build a Pastry Chef in Berlin
3,10.99,NC-17,74,2006,2.99,,PEARL DESTINY,669,English,A Lacklusture Yarn of a Astronaut And a Pastry Chef who must Sink a Dog in A U-Boat
3,15.99,G,86,2006,0.99,,ANNIE IDENTITY,26,English,A Amazing Panorama of a Pastry Chef And a Boat who must Escape a Woman in An Abandoned Amusement Park
3,21.99,R,85,2006,2.99,,BEVERLY OUTLAW,69,English,A Fanciful Documentary of a Womanizer And a Boat who must Defeat a Madman in The First Manned Space Station
4,21.99,PG-13,71,2006,2.99,,KNOCK WARLOCK,502,English,A Unbelieveable Story of a Teacher And a Boat who must Confront a Moose in A Baloon
5,22.99,PG,163,2006,4.99,,QUEEN LUKE,706,English,A Astounding Story of a Girl And a Boy who must Challenge a Composer in New Orleans
7,29.99,R,179,2006,4.99,,SLACKER LIAISONS,803,English,A Fast-Paced Tale of a A Shark And a Student who must Meet a Crocodile in Ancient China
7,20.99,PG,83,2006,0.99,,MOON BUNCH,595,English,A Beautiful Tale of a Astronaut And a Mad Cow who must Challenge a Cat in A Baloon Factory
3,26.99,R,71,2006,4.99,,TRAIN BUNCH,904,English,A Thrilling Character Study of a Robot And a Squirrel who must Face a Dog in Ancient India
5,29.99,R,177,2006,2.99,,QUEST MUSSOLINI,707,English,A Fateful Drama of a Husband And a Sumo Wrestler who must Battle a Pastry Chef in A Baloon Factory
4,29.99,G,63,2006,0.99,,BONNIE HOLOCAUST,85,English,A Fast-Paced Story of a Crocodile And a Robot who must Find a Moose in Ancient Japan
6,17.99,PG-13,150,2006,2.99,,RUSHMORE MERMAID,754,English,A Boring Story of a Woman And a Moose who must Reach a Husband in A Shark Tank
4,14.99,NC-17,122,2006,0.99,,HOURS RAGE,436,English,A Fateful Story of a Explorer And a Feminist who must Meet a Technical Writer in Soviet Georgia
4,20.99,PG,100,2006,0.99,,PIRATES ROXANNE,681,English,A Stunning Drama of a Woman And a Lumberjack who must Overcome a A Shark in The Canadian Rockies
4,22.99,R,74,2006,4.99,,WORKING MICROCOSMOS,989,English,A Stunning Epistle of a Dentist And a Dog who must Kill a Madman in Ancient China
6,21.99,NC-17,62,2006,0.99,,MARS ROMAN,560,English,A Boring Drama of a Car And a Dog who must Succumb a Madman in Soviet Georgia
6,12.99,PG,144,2006,4.99,,PRESIDENT BANG,695,English,A Fateful Panorama of a Technical Writer And a Moose who must Battle a Robot in Soviet Georgia
4,26.99,NC-17,135,2006,0.99,,INDIAN LOVE,458,English,A Insightful Saga of a Mad Scientist And a Mad Scientist who must Kill a Astronaut in An Abandoned Fun House
5,10.99,NC-17,170,2006,2.99,,ARTIST COLDBLOODED,42,English,A Stunning Reflection of a Robot And a Moose who must Challenge a Woman in California
4,20.99,R,160,2006,2.99,,BEAR GRACELAND,59,English,A Astounding Saga of a Dog And a Boy who must Kill a Teacher in The First Manned Space Station
3,26.99,PG-13,178,2006,4.99,,INNOCENT USUAL,460,English,A Beautiful Drama of a Pioneer And a Crocodile who must Challenge a Student in The Outback
6,29.99,G,135,2006,0.99,,JAPANESE RUN,475,English,A Awe-Inspiring Epistle of a Feminist And a Girl who must Sink a Girl in The Outback
5,26.99,R,140,2006,4.99,,GRACELAND DYNAMITE,372,English,A Taut Display of a Cat And a Girl who must Overcome a Database Administrator in New Orleans
6,26.99,PG-13,180,2006,2.99,,MIXED DOORS,584,English,A Taut Drama of a Womanizer And a Lumberjack who must Succumb a Pioneer in Ancient India
7,25.99,NC-17,136,2006,4.99,,HOLLOW JEOPARDY,422,English,A Beautiful Character Study of a Robot And a Astronaut who must Overcome a Boat in A Monastery
3,19.99,PG-13,118,2006,0.99,,PERSONAL LADYBUGS,673,English,A Epic Saga of a Hunter And a Technical Writer who must Conquer a Cat in Ancient Japan
6,22.99,G,85,2006,4.99,,CASABLANCA SUPER,123,English,A Amazing Panorama of a Crocodile And a Forensic Psychologist who must Pursue a Secret Agent in The First Manned Space Station
5,12.99,G,57,2006,2.99,,NOON PAPI,626,English,A Unbelieveable Character Study of a Mad Scientist And a Astronaut who must Find a Pioneer in A Manhattan Penthouse
3,19.99,R,151,2006,0.99,,STRAIGHT HOURS,851,English,A Boring Panorama of a Secret Agent And a Girl who must Sink a Waitress in The Outback
6,25.99,G,144,2006,0.99,,DANCING FEVER,206,English,A Stunning Story of a Explorer And a Forensic Psychologist who must Face a Crocodile in A Shark Tank
4,11.99,NC-17,175,2006,4.99,,MODEL FISH,588,English,A Beautiful Panorama of a Boat And a Crocodile who must Outrace a Dog in Australia
4,13.99,NC-17,113,2006,2.99,,STATE WASTELAND,842,English,A Beautiful Display of a Cat And a Pastry Chef who must Outrace a Mad Cow in A Jet Boat
3,15.99,G,164,2006,4.99,,CLERKS ANGELS,156,English,A Thrilling Display of a Sumo Wrestler And a Girl who must Confront a Man in A Baloon
7,29.99,PG,115,2006,2.99,,OSCAR GOLD,644,English,A Insightful Tale of a Database Administrator And a Dog who must Face a Madman in Soviet Georgia
4,22.99,PG,175,2006,2.99,,PATTON INTERVIEW,665,English,A Thrilling Documentary of a Composer And a Secret Agent who must Succumb a Cat in Berlin
6,25.99,NC-17,68,2006,0.99,,ARK RIDGEMONT,38,English,A Beautiful Yarn of a Pioneer And a Monkey who must Pursue a Explorer in The Sahara Desert
6,20.99,PG,113,2006,0.99,,AMADEUS HOLY,19,English,A Emotional Display of a Pioneer And a Technical Writer who must Battle a Man in A Baloon
5,9.99,R,171,2006,0.99,,ROXANNE REBEL,747,English,A Astounding Story of a Pastry Chef And a Database Administrator who must Fight a Man in The Outback
4,15.99,NC-17,143,2006,4.99,,STEEL SANTA,843,English,A Fast-Paced Yarn of a Composer And a Frisbee who must Face a Moose in Nigeria
6,28.99,NC-17,48,2006,0.99,,SUNSET RACER,866,English,A Awe-Inspiring Reflection of a Astronaut And a A Shark who must Defeat a Forensic Psychologist in California
6,11.99,PG-13,185,2006,4.99,,CHICAGO NORTH,141,English,A Fateful Yarn of a Mad Cow And a Waitress who must Battle a Student in California
4,27.99,PG-13,185,2006,2.99,,GANGS PRIDE,349,English,A Taut Character Study of a Woman And a A Shark who must Confront a Frisbee in Berlin
7,14.99,NC-17,85,2006,2.99,,VARSITY TRIP,937,English,A Action-Packed Character Study of a Astronaut And a Explorer who must Reach a Monkey in A MySQL Convention
7,26.99,G,176,2006,0.99,,DRACULA CRYSTAL,249,English,A Thrilling Reflection of a Feminist And a Cat who must Find a Frisbee in An Abandoned Fun House
3,14.99,R,173,2006,4.99,,VELVET TERMINATOR,938,English,A Lacklusture Tale of a Pastry Chef And a Technical Writer who must Confront a Crocodile in An Abandoned Amusement Park
6,25.99,PG,114,2006,0.99,,CHAINSAW UPTOWN,132,English,A Beautiful Documentary of a Boy And a Robot who must Discover a Squirrel in Australia
5,10.99,PG-13,174,2006,0.99,,EVOLUTION ALTER,291,English,A Fanciful Character Study of a Feminist And a Madman who must Find a Explorer in A Baloon Factory
3,21.99,PG-13,114,2006,2.99,,ALABAMA DEVIL,9,English,A Thoughtful Panorama of a Database Administrator And a Mad Scientist who must Outgun a Mad Scientist in A Jet Boat
3,22.99,R,89,2006,4.99,,BEAST HUNCHBACK,60,English,A Awe-Inspiring Epistle of a Student And a Squirrel who must Defeat a Boy in Ancient China
7,10.99,PG-13,97,2006,2.99,,LUCKY FLYING,540,English,A Lacklusture Character Study of a A Shark And a Man who must Find a Forensic Psychologist in A U-Boat
6,13.99,G,158,2006,0.99,,MONTEREY LABYRINTH,593,English,A Awe-Inspiring Drama of a Monkey And a Composer who must Escape a Feminist in A U-Boat
6,25.99,R,167,2006,4.99,,REQUIEM TYCOON,725,English,A Unbelieveable Character Study of a Cat And a Database Administrator who must Pursue a Teacher in A Monastery
5,29.99,R,163,2006,0.99,,GILMORE BOILED,358,English,A Unbelieveable Documentary of a Boat And a Husband who must Succumb a Student in A U-Boat
3,13.99,G,108,2006,4.99,,AUTUMN CROW,46,English,A Beautiful Tale of a Dentist And a Mad Cow who must Battle a Moose in The Sahara Desert
5,26.99,G,117,2006,2.99,,AFFAIR PREJUDICE,4,English,A Fanciful Documentary of a Frisbee And a Lumberjack who must Chase a Monkey in A Shark Tank
7,16.99,NC-17,159,2006,0.99,,FRANKENSTEIN STRANGER,332,English,A Insightful Character Study of a Feminist And a Pioneer who must Pursue a Pastry Chef in Nigeria
3,17.99,R,129,2006,4.99,,AMERICAN CIRCUS,21,English,A Insightful Drama of a Girl And a Astronaut who must Face a Database Administrator in A Shark Tank
5,12.99,PG-13,48,2006,2.99,,PARADISE SABRINA,657,English,A Intrepid Yarn of a Car And a Moose who must Outrace a Crocodile in A Manhattan Penthouse
3,9.99,R,92,2006,0.99,,ANACONDA CONFESSIONS,23,English,A Lacklusture Display of a Dentist And a Dentist who must Fight a Girl in Australia
6,21.99,NC-17,174,2006,2.99,,JADE BUNCH,474,English,A Insightful Panorama of a Squirrel And a Mad Cow who must Confront a Student in The First Manned Space Station
4,24.99,G,103,2006,0.99,,GLASS DYING,360,English,A Astounding Drama of a Frisbee And a Astronaut who must Fight a Dog in Ancient Japan
5,16.99,G,122,2006,4.99,,DOGMA FAMILY,239,English,A Brilliant Character Study of a Database Administrator And a Monkey who must Succumb a Astronaut in New Orleans
3,15.99,G,102,2006,4.99,,PANIC CLUB,653,English,A Fanciful Display of a Teacher And a Crocodile who must Succumb a Girl in A Baloon
4,26.99,NC-17,170,2006,0.99,,DRAGON SQUAD,250,English,A Taut Reflection of a Boy And a Waitress who must Outgun a Teacher in Ancient China
5,15.99,PG,140,2006,4.99,,LIAISONS SWEET,518,English,A Boring Drama of a A Shark And a Explorer who must Redeem a Waitress in The Canadian Rockies
5,18.99,R,173,2006,4.99,,FIRE WOLVES,316,English,A Intrepid Documentary of a Frisbee And a Dog who must Outrace a Lumberjack in Nigeria
7,18.99,G,165,2006,0.99,,CITIZEN SHREK,153,English,A Fanciful Character Study of a Technical Writer And a Husband who must Redeem a Robot in The Outback
6,27.99,NC-17,53,2006,0.99,,BENEATH RUSH,66,English,A Astounding Panorama of a Man And a Monkey who must Discover a Man in The First Manned Space Station
4,25.99,PG,137,2006,2.99,,SLEEPY JAPANESE,806,English,A Emotional Epistle of a Moose And a Composer who must Fight a Technical Writer in The Outback
3,17.99,G,89,2006,0.99,,BUTTERFLY CHOCOLAT,109,English,A Fateful Story of a Girl And a Composer who must Conquer a Husband in A Shark Tank
4,18.99,PG-13,110,2006,4.99,,SEATTLE EXPECATIONS,775,English,A Insightful Reflection of a Crocodile And a Sumo Wrestler who must Meet a Technical Writer in The Sahara Desert
3,9.99,PG,52,2006,2.99,,TROJAN TOMORROW,912,English,A Astounding Panorama of a Husband And a Sumo Wrestler who must Pursue a Boat in Ancient India
3,24.99,PG-13,167,2006,4.99,,SHOW LORD,791,English,A Fanciful Saga of a Student And a Girl who must Find a Butler in Ancient Japan
6,12.99,R,111,2006,0.99,,WIND PHANTOM,976,English,A Touching Saga of a Madman And a Forensic Psychologist who must Build a Sumo Wrestler in An Abandoned Mine Shaft
5,25.99,R,112,2006,4.99,,STAGECOACH ARMAGEDDON,838,English,A Touching Display of a Pioneer And a Butler who must Chase a Car in California
5,16.99,PG,166,2006,0.99,,MOTIONS DETAILS,600,English,A Awe-Inspiring Reflection of a Dog And a Student who must Kill a Car in An Abandoned Fun House
4,18.99,NC-17,74,2006,0.99,,JUMPING WRATH,491,English,A Touching Epistle of a Monkey And a Feminist who must Discover a Boat in Berlin
7,20.99,R,167,2006,2.99,,ESCAPE METROPOLIS,288,English,A Taut Yarn of a Astronaut And a Technical Writer who must Outgun a Boat in New Orleans
7,9.99,G,92,2006,4.99,,TRUMAN CRAZY,915,English,A Thrilling Epistle of a Moose And a Boy who must Meet a Database Administrator in A Monastery
4,22.99,PG-13,176,2006,0.99,,GATHERING CALENDAR,352,English,A Intrepid Tale of a Pioneer And a Moose who must Conquer a Frisbee in A MySQL Convention
4,20.99,G,56,2006,4.99,,DESTINY SATURDAY,226,English,A Touching Drama of a Crocodile And a Crocodile who must Conquer a Explorer in Soviet Georgia
3,25.99,NC-17,121,2006,2.99,,PURE RUNNER,704,English,A Thoughtful Documentary of a Student And a Madman who must Challenge a Squirrel in A Manhattan Penthouse
3,9.99,NC-17,93,2006,4.99,,STING PERSONAL,846,English,A Fanciful Drama of a Frisbee And a Dog who must Fight a Madman in A Jet Boat
4,12.99,G,89,2006,2.99,,PULP BEVERLY,702,English,A Unbelieveable Display of a Dog And a Crocodile who must Outrace a Man in Nigeria
6,24.99,NC-17,99,2006,2.99,,DARKNESS WAR,209,English,A Touching Documentary of a Husband And a Hunter who must Escape a Boy in The Sahara Desert
5,24.99,PG-13,77,2006,2.99,,BERETS AGENT,67,English,A Taut Saga of a Crocodile And a Boy who must Overcome a Technical Writer in Ancient China
4,28.99,R,177,2006,0.99,,DOUBLE WRATH,245,English,A Thoughtful Yarn of a Womanizer And a Dog who must Challenge a Madman in The Gulf of Mexico
4,23.99,R,126,2006,0.99,,WOMEN DORADO,982,English,A Insightful Documentary of a Waitress And a Butler who must Vanquish a Composer in Australia
6,27.99,PG-13,58,2006,0.99,,FANTASY TROOPERS,303,English,A Touching Saga of a Teacher And a Monkey who must Overcome a Secret Agent in A MySQL Convention
3,29.99,G,93,2006,0.99,,GOLDFINGER SENSIBILITY,366,English,A Insightful Drama of a Mad Scientist And a Hunter who must Defeat a Pastry Chef in New Orleans
4,12.99,G,125,2006,0.99,,SHINING ROSES,787,English,A Awe-Inspiring Character Study of a Astronaut And a Forensic Psychologist who must Challenge a Madman in Ancient India
6,17.99,NC-17,184,2006,0.99,,SORORITY QUEEN,821,English,A Fast-Paced Display of a Squirrel And a Composer who must Fight a Forensic Psychologist in A Jet Boat
5,19.99,NC-17,92,2006,0.99,,MYSTIC TRUMAN,613,English,A Epic Yarn of a Teacher And a Hunter who must Outgun a Explorer in Soviet Georgia
3,24.99,R,171,2006,2.99,,KRAMER CHOCOLATE,503,English,A Amazing Yarn of a Robot And a Pastry Chef who must Redeem a Mad Scientist in The Outback
3,12.99,NC-17,135,2006,0.99,,SIERRA DIVIDE,796,English,A Emotional Character Study of a Frisbee And a Mad Scientist who must Build a Madman in California
3,28.99,G,52,2006,2.99,,LUST LOCK,542,English,A Fanciful Panorama of a Hunter And a Dentist who must Meet a Secret Agent in The Sahara Desert
6,13.99,NC-17,111,2006,0.99,,GROOVE FICTION,383,English,A Unbelieveable Reflection of a Moose And a A Shark who must Defeat a Lumberjack in An Abandoned Mine Shaft
4,15.99,G,54,2006,0.99,,KILL BROTHERHOOD,497,English,A Touching Display of a Hunter And a Secret Agent who must Redeem a Husband in The Outback
4,13.99,G,121,2006,2.99,,JUMANJI BLADE,490,English,A Intrepid Yarn of a Husband And a Womanizer who must Pursue a Mad Scientist in New Orleans
3,26.99,NC-17,51,2006,0.99,,SIMON NORTH,799,English,A Thrilling Documentary of a Technical Writer And a A Shark who must Face a Pioneer in A Shark Tank
5,25.99,G,124,2006,4.99,,CHISUM BEHAVIOR,145,English,A Epic Documentary of a Sumo Wrestler And a Butler who must Kill a Car in Ancient India
4,29.99,R,56,2006,2.99,,CUPBOARD SINNERS,199,English,A Emotional Reflection of a Frisbee And a Boat who must Reach a Pastry Chef in An Abandoned Amusement Park
6,18.99,NC-17,69,2006,2.99,,FLYING HOOK,326,English,A Thrilling Display of a Mad Cow And a Dog who must Challenge a Frisbee in Nigeria
5,9.99,PG-13,53,2006,4.99,,THIN SAGEBRUSH,888,English,A Emotional Drama of a Husband And a Lumberjack who must Build a Cat in Ancient India
7,27.99,PG,46,2006,4.99,,IRON MOON,469,English,A Fast-Paced Documentary of a Mad Cow And a Boy who must Pursue a Dentist in A Baloon
5,29.99,R,71,2006,2.99,,CHARIOTS CONSPIRACY,138,English,A Unbelieveable Epistle of a Robot And a Husband who must Chase a Robot in The First Manned Space Station
5,12.99,R,58,2006,4.99,,CLOSER BANG,159,English,A Unbelieveable Panorama of a Frisbee And a Hunter who must Vanquish a Monkey in Ancient India
7,12.99,G,79,2006,2.99,,SPIKING ELEMENT,828,English,A Lacklusture Epistle of a Dentist And a Technical Writer who must Find a Dog in A Monastery
4,18.99,R,120,2006,4.99,,RAGE GAMES,710,English,A Fast-Paced Saga of a Astronaut And a Secret Agent who must Escape a Hunter in An Abandoned Amusement Park
6,20.99,PG,86,2006,0.99,,ACADEMY DINOSAUR,1,English,A Epic Drama of a Feminist And a Mad Scientist who must Battle a Teacher in The Canadian Rockies
7,14.99,G,185,2006,4.99,,DARN FORRESTER,212,English,A Fateful Story of a A Shark And a Explorer who must Succumb a Technical Writer in A Jet Boat
5,28.99,R,101,2006,2.99,,ZOOLANDER FICTION,999,English,A Fateful Reflection of a Waitress And a Boat who must Discover a Sumo Wrestler in Ancient China
6,10.99,G,85,2006,2.99,,AMISTAD MIDSUMMER,22,English,A Emotional Character Study of a Dentist And a Crocodile who must Meet a Sumo Wrestler in California
7,11.99,R,161,2006,2.99,,KILLER INNOCENT,498,English,A Fanciful Character Study of a Student And a Explorer who must Succumb a Composer in An Abandoned Mine Shaft
7,24.99,G,73,2006,0.99,,REBEL AIRPORT,718,English,A Intrepid Yarn of a Database Administrator And a Boat who must Outrace a Husband in Ancient India
3,19.99,PG,117,2006,0.99,,MAGIC MALLRATS,547,English,A Touching Documentary of a Pastry Chef And a Pastry Chef who must Build a Mad Scientist in California
7,23.99,R,111,2006,0.99,,SIEGE MADRE,795,English,A Boring Tale of a Frisbee And a Crocodile who must Vanquish a Moose in An Abandoned Mine Shaft
6,24.99,PG-13,46,2006,2.99,,LABYRINTH LEAGUE,505,English,A Awe-Inspiring Saga of a Composer And a Frisbee who must Succumb a Pioneer in The Sahara Desert
3,25.99,G,74,2006,4.99,,TEEN APOLLO,878,English,A Awe-Inspiring Drama of a Dog And a Man who must Escape a Robot in A Shark Tank
7,14.99,NC-17,144,2006,0.99,,TOWERS HURRICANE,899,English,A Fateful Display of a Monkey And a Car who must Sink a Husband in A MySQL Convention
4,10.99,PG,64,2006,0.99,,MILE MULAN,577,English,A Lacklusture Epistle of a Cat And a Husband who must Confront a Boy in A MySQL Convention
4,19.99,NC-17,75,2006,4.99,,CALIFORNIA BIRDS,113,English,A Thrilling Yarn of a Database Administrator And a Robot who must Battle a Database Administrator in Ancient India
3,20.99,PG,74,2006,0.99,,MODERN DORADO,589,English,A Awe-Inspiring Story of a Butler And a Sumo Wrestler who must Redeem a Boy in New Orleans
5,27.99,PG-13,157,2006,0.99,,HOBBIT ALIEN,418,English,A Emotional Drama of a Husband And a Girl who must Outgun a Composer in The First Manned Space Station
7,15.99,R,185,2006,4.99,,HOME PITY,426,English,A Touching Panorama of a Man And a Secret Agent who must Challenge a Teacher in A MySQL Convention
5,11.99,G,125,2006,2.99,,SAINTS BRIDE,758,English,A Fateful Tale of a Technical Writer And a Composer who must Pursue a Explorer in The Gulf of Mexico
4,27.99,PG-13,184,2006,2.99,,CONSPIRACY SPIRIT,180,English,A Awe-Inspiring Story of a Student And a Frisbee who must Conquer a Crocodile in An Abandoned Mine Shaft
6,23.99,PG,68,2006,0.99,,TOMATOES HELLFIGHTERS,894,English,A Thoughtful Epistle of a Madman And a Astronaut who must Overcome a Monkey in A Shark Tank
4,24.99,PG-13,147,2006,2.99,,ARACHNOPHOBIA ROLLERCOASTER,35,English,A Action-Packed Reflection of a Pastry Chef And a Composer who must Discover a Mad Scientist in The First Manned Space Station
7,18.99,R,182,2006,4.99,,SATURN NAME,765,English,A Fateful Epistle of a Butler And a Boy who must Redeem a Teacher in Berlin
7,16.99,NC-17,158,2006,2.99,,ENOUGH RAGING,286,English,A Astounding Character Study of a Boat And a Secret Agent who must Find a Mad Cow in The Sahara Desert
6,22.99,PG,170,2006,4.99,,TRADING PINOCCHIO,902,English,A Emotional Character Study of a Student And a Explorer who must Discover a Frisbee in The First Manned Space Station
7,13.99,PG-13,50,2006,0.99,,SMOKING BARBARELLA,812,English,A Lacklusture Saga of a Mad Cow And a Mad Scientist who must Sink a Cat in A MySQL Convention
3,22.99,R,70,2006,2.99,,CHANCE RESURRECTION,135,English,A Astounding Story of a Forensic Psychologist And a Forensic Psychologist who must Overcome a Moose in Ancient China
5,10.99,PG,169,2006,2.99,,KENTUCKIAN GIANT,495,English,A Stunning Yarn of a Woman And a Frisbee who must Escape a Waitress in A U-Boat
4,22.99,R,119,2006,4.99,,STRANGERS GRAFFITI,854,English,A Brilliant Character Study of a Secret Agent And a Man who must Find a Cat in The Gulf of Mexico
6,15.99,PG-13,98,2006,4.99,,PREJUDICE OLEANDER,694,English,A Epic Saga of a Boy And a Dentist who must Outrace a Madman in A U-Boat
5,17.99,G,58,2006,0.99,,RINGS HEARTBREAKERS,732,English,A Amazing Yarn of a Sumo Wrestler And a Boat who must Conquer a Waitress in New Orleans
7,12.99,NC-17,179,2006,0.99,,ANONYMOUS HUMAN,27,English,A Amazing Reflection of a Database Administrator And a Astronaut who must Outrace a Database Administrator in A Shark Tank
6,12.99,G,81,2006,2.99,,CLASH FREDDY,154,English,A Amazing Yarn of a Composer And a Squirrel who must Escape a Astronaut in Australia
6,11.99,PG,96,2006,0.99,,DRUMS DYNAMITE,258,English,A Epic Display of a Crocodile And a Crocodile who must Confront a Dog in An Abandoned Amusement Park
3,13.99,R,91,2006,0.99,,FIGHT JAWBREAKER,314,English,A Intrepid Panorama of a Womanizer And a Girl who must Escape a Girl in A Manhattan Penthouse
4,21.99,R,143,2006,2.99,,SOUTH WAIT,823,English,A Amazing Documentary of a Car And a Robot who must Escape a Lumberjack in An Abandoned Amusement Park
6,29.99,NC-17,73,2006,2.99,,RANDOM GO,714,English,A Fateful Drama of a Frisbee And a Student who must Confront a Cat in A Shark Tank
6,11.99,R,121,2006,4.99,,BOOGIE AMELIE,86,English,A Lacklusture Character Study of a Husband And a Sumo Wrestler who must Succumb a Technical Writer in The Gulf of Mexico
3,11.99,NC-17,184,2006,2.99,,SONS INTERVIEW,820,English,A Taut Character Study of a Explorer And a Mad Cow who must Battle a Hunter in Ancient China
6,11.99,R,119,2006,4.99,,APOCALYPSE FLAMINGOS,32,English,A Astounding Story of a Dog And a Squirrel who must Defeat a Woman in An Abandoned Amusement Park
7,15.99,PG-13,79,2006,2.99,,SHOCK CABIN,789,English,A Fateful Tale of a Mad Cow And a Crocodile who must Meet a Husband in New Orleans
5,13.99,PG,82,2006,0.99,,FROST HEAD,341,English,A Amazing Reflection of a Lumberjack And a Cat who must Discover a Husband in A MySQL Convention
4,19.99,NC-17,52,2006,4.99,,SPARTACUS CHEAPER,824,English,A Thrilling Panorama of a Pastry Chef And a Secret Agent who must Overcome a Student in A Manhattan Penthouse
