lingua_originale_id,costo_sostituzione,descrizione,durata,voto,titolo,film_id,durata_noleggio,data_rilascio,tariffa_noleggio,lingua
,13.99,A Stunning Reflection of a Frisbee And a Husband who must Redeem a Dog in New Orleans,130,NC-17,DARKO DORADO,210,3,2006,4.99,English
,27.99,A Awe-Inspiring Yarn of a Hunter And a Feminist who must Challenge a Dentist in The Outback,157,NC-17,VOLCANO TEXAS,949,6,2006,0.99,English
,14.99,A Fast-Paced Panorama of a Girl And a A Shark who must Confront a Boy in Ancient India,112,G,CAT CONEHEADS,127,5,2006,4.99,English
,16.99,A Thoughtful Documentary of a Dog And a Man who must Sink a Man in A Shark Tank,59,PG-13,VISION TORQUE,947,5,2006,0.99,English
,16.99,A Fateful Documentary of a Dog And a Hunter who must Pursue a Teacher in An Abandoned Amusement Park,84,PG,UPTOWN YOUNG,928,5,2006,2.99,English
,17.99,A Boring Character Study of a Car And a Husband who must Outgun a Frisbee in The First Manned Space Station,180,NC-17,SOMETHING DUCK,818,4,2006,4.99,English
,10.99,A Awe-Inspiring Drama of a Astronaut And a Frisbee who must Conquer a Mad Scientist in Australia,118,NC-17,ROUGE SQUAD,746,3,2006,0.99,English
,21.99,A Taut Reflection of a Robot And a Squirrel who must Fight a Boat in Ancient Japan,134,R,ROBBERY BRIGHT,736,4,2006,0.99,English
,12.99,A Boring Story of a Teacher And a Monkey who must Succumb a Forensic Psychologist in A Jet Boat,161,PG,OLEANDER CLUE,636,5,2006,0.99,English
,27.99,A Boring Yarn of a Pioneer And a Feminist who must Redeem a Cat in An Abandoned Amusement Park,76,PG-13,VILLAIN DESPERATE,943,4,2006,4.99,English
,19.99,A Epic Display of a Dog And a Boat who must Succumb a Mad Scientist in An Abandoned Mine Shaft,126,PG-13,SINNERS ATLANTIS,800,7,2006,2.99,English
,22.99,A Fast-Paced Character Study of a Feminist And a Explorer who must Face a Pastry Chef in Ancient Japan,184,NC-17,CRYSTAL BREAKING,198,6,2006,2.99,English
,26.99,A Fanciful Documentary of a Crocodile And a Technical Writer who must Fight a A Shark in A Baloon,150,PG-13,CLEOPATRA DEVIL,155,6,2006,0.99,English
,13.99,A Beautiful Tale of a Frisbee And a Moose who must Vanquish a Dog in An Abandoned Amusement Park,155,PG,TADPOLE PARK,874,6,2006,2.99,English
,15.99,A Touching Panorama of a Man And a Secret Agent who must Challenge a Teacher in A MySQL Convention,185,R,HOME PITY,426,7,2006,4.99,English
,9.99,A Astounding Drama of a Feminist And a Teacher who must Confront a Husband in A Baloon,143,G,ENCINO ELF,281,6,2006,0.99,English
,26.99,A Beautiful Drama of a Pioneer And a Crocodile who must Challenge a Student in The Outback,178,PG-13,INNOCENT USUAL,460,3,2006,4.99,English
,18.99,A Touching Epistle of a Monkey And a Feminist who must Discover a Boat in Berlin,74,NC-17,JUMPING WRATH,491,4,2006,0.99,English
,12.99,A Fanciful Documentary of a Teacher And a Dog who must Outgun a Forensic Psychologist in A Baloon Factory,57,NC-17,CRANES RESERVOIR,187,5,2006,2.99,English
,20.99,A Insightful Character Study of a Mad Cow And a Forensic Psychologist who must Conquer a A Shark in A Manhattan Penthouse,84,R,GONE TROUBLE,368,7,2006,2.99,English
,24.99,A Fanciful Panorama of a Boy And a Woman who must Vanquish a Database Administrator in The Outback,136,PG,CRAZY HOME,188,7,2006,2.99,English
,19.99,A Lacklusture Panorama of a Woman And a Frisbee who must Chase a Crocodile in A Jet Boat,85,PG,STAGE WORLD,837,4,2006,2.99,English
,10.99,A Thoughtful Character Study of a Frisbee And a Pastry Chef who must Fight a Dentist in The First Manned Space Station,114,PG-13,BLADE POLISH,79,5,2006,0.99,English
,23.99,A Emotional Reflection of a Dentist And a Mad Cow who must Face a Squirrel in A Baloon,133,PG-13,FREEDOM CLEOPATRA,335,5,2006,0.99,English
,16.99,A Fateful Reflection of a Waitress And a Crocodile who must Challenge a Forensic Psychologist in California,165,R,MASSACRE USUAL,563,6,2006,4.99,English
,24.99,A Emotional Drama of a Dog And a Explorer who must Outrace a Technical Writer in Australia,122,PG,CHICKEN HELLFIGHTERS,142,3,2006,0.99,English
,20.99,A Emotional Display of a Pioneer And a Technical Writer who must Battle a Man in A Baloon,113,PG,AMADEUS HOLY,19,6,2006,0.99,English
,27.99,A Awe-Inspiring Character Study of a Robot And a Sumo Wrestler who must Discover a Womanizer in A Shark Tank,178,PG-13,ROCKETEER MOTHER,738,3,2006,0.99,English
,28.99,A Fast-Paced Character Study of a Dentist And a Moose who must Defeat a Composer in The First Manned Space Station,147,NC-17,LIES TREATMENT,521,7,2006,4.99,English
,21.99,A Astounding Saga of a Moose And a Pastry Chef who must Chase a Student in The Gulf of Mexico,123,NC-17,FLASH WARS,321,3,2006,4.99,English
,20.99,A Fast-Paced Character Study of a Crocodile And a Lumberjack who must Build a Husband in An Abandoned Fun House,47,PG,SHANGHAI TYCOON,784,7,2006,2.99,English
,24.99,A Fast-Paced Documentary of a Technical Writer And a Pastry Chef who must Escape a Moose in A U-Boat,80,PG,SEA VIRGIN,772,4,2006,2.99,English
,10.99,A Taut Epistle of a Monkey And a Boy who must Confront a Husband in A Jet Boat,54,PG-13,OCTOBER SUBMARINE,633,6,2006,4.99,English
,11.99,A Touching Story of a Crocodile And a Girl who must Sink a Man in The Gulf of Mexico,88,R,TERMINATOR CLUB,884,5,2006,4.99,English
,10.99,A Amazing Epistle of a Boy And a Astronaut who must Redeem a Man in The Gulf of Mexico,106,PG,GASLIGHT CRUSADE,351,4,2006,2.99,English
,11.99,A Awe-Inspiring Yarn of a Monkey And a Hunter who must Chase a Teacher in Ancient China,103,NC-17,IMPOSSIBLE PREJUDICE,455,7,2006,4.99,English
,27.99,A Fateful Display of a Lumberjack And a Girl who must Succumb a Mad Cow in A Manhattan Penthouse,62,G,SNOWMAN ROLLERCOASTER,816,3,2006,0.99,English
,29.99,A Thrilling Yarn of a Pastry Chef And a Monkey who must Battle a Monkey in A Shark Tank,71,NC-17,PRINCESS GIANT,698,3,2006,2.99,English
,29.99,A Emotional Yarn of a Robot And a Boy who must Outgun a Technical Writer in A U-Boat,75,G,LOVER TRUMAN,537,3,2006,2.99,English
,15.99,A Astounding Character Study of a Composer And a Student who must Overcome a Composer in A Monastery,151,PG,CAROL TEXAS,121,4,2006,2.99,English
,13.99,A Thoughtful Story of a Mad Cow And a Womanizer who must Overcome a Mad Scientist in Soviet Georgia,106,NC-17,DEER VIRGINIAN,220,7,2006,2.99,English
,25.99,A Stunning Drama of a Teacher And a Boat who must Battle a Feminist in Ancient China,185,PG-13,POND SEATTLE,690,7,2006,2.99,English
,25.99,A Lacklusture Reflection of a Car And a Explorer who must Find a Monkey in A Baloon,101,R,ROOF CHAMPION,742,7,2006,0.99,English
,17.99,A Intrepid Panorama of a Robot And a Boy who must Escape a Sumo Wrestler in Ancient China,169,PG,AGENT TRUMAN,6,3,2006,2.99,English
,21.99,A Amazing Documentary of a Car And a Robot who must Escape a Lumberjack in An Abandoned Amusement Park,143,R,SOUTH WAIT,823,4,2006,2.99,English
,29.99,A Fast-Paced Story of a Crocodile And a Robot who must Find a Moose in Ancient Japan,63,G,BONNIE HOLOCAUST,85,4,2006,0.99,English
,29.99,A Amazing Documentary of a Man And a Husband who must Confront a Squirrel in A MySQL Convention,165,PG-13,SONG HEDWIG,819,3,2006,0.99,English
,27.99,A Awe-Inspiring Panorama of a Lumberjack And a Waitress who must Defeat a Crocodile in An Abandoned Amusement Park,103,NC-17,STRANGELOVE DESIRE,852,4,2006,0.99,English
,12.99,A Taut Documentary of a Waitress And a Mad Scientist who must Battle a Technical Writer in New Orleans,78,R,UNFAITHFUL KILL,923,7,2006,2.99,English
,25.99,A Thrilling Drama of a Girl And a Robot who must Redeem a Waitress in An Abandoned Mine Shaft,155,NC-17,LOLITA WORLD,528,4,2006,2.99,English
,10.99,A Emotional Saga of a Womanizer And a Pioneer who must Overcome a Dentist in A Baloon,160,G,MULAN MOON,604,4,2006,0.99,English
,17.99,A Lacklusture Epistle of a Boat And a Technical Writer who must Fight a A Shark in The Canadian Rockies,142,PG,CHILL LUCK,143,6,2006,0.99,English
,16.99,A Fateful Documentary of a Pastry Chef And a Butler who must Build a Dog in The Canadian Rockies,53,G,PRIMARY GLASS,697,7,2006,0.99,English
,17.99,A Beautiful Documentary of a Astronaut And a Crocodile who must Discover a Madman in A Monastery,60,NC-17,PHANTOM GLORY,675,6,2006,2.99,English
,13.99,A Unbelieveable Story of a Mad Scientist And a Technical Writer who must Discover a Composer in Ancient China,132,R,CHOCOLATE DUCK,148,3,2006,2.99,English
,12.99,A Astounding Epistle of a Database Administrator And a Explorer who must Find a Car in Ancient China,48,G,ACE GOLDFINGER,2,3,2006,4.99,English
,21.99,A Unbelieveable Yarn of a Student And a Database Administrator who must Outgun a Husband in An Abandoned Mine Shaft,105,G,HUNGER ROOF,440,6,2006,0.99,English
,23.99,A Fateful Saga of a Waitress And a Hunter who must Outrace a Sumo Wrestler in Australia,84,R,HIGH ENCINO,415,3,2006,2.99,English
,19.99,A Beautiful Epistle of a Madman And a Butler who must Face a Crocodile in A Manhattan Penthouse,135,PG-13,SUNRISE LEAGUE,865,3,2006,4.99,English
,25.99,A Unbelieveable Character Study of a Cat And a Database Administrator who must Pursue a Teacher in A Monastery,167,R,REQUIEM TYCOON,725,6,2006,4.99,English
,14.99,A Taut Epistle of a Sumo Wrestler And a Girl who must Face a Husband in Ancient Japan,109,PG-13,PARK CITIZEN,659,3,2006,4.99,English
,18.99,A Insightful Story of a Man And a Feminist who must Fight a Composer in Australia,144,PG-13,LAMBS CINCINATTI,508,6,2006,4.99,English
,21.99,A Epic Reflection of a Monkey And a Mad Cow who must Kill a Forensic Psychologist in An Abandoned Mine Shaft,180,PG-13,NASH CHOCOLAT,615,6,2006,2.99,English
,12.99,A Unbelieveable Display of a Dog And a Crocodile who must Outrace a Man in Nigeria,89,G,PULP BEVERLY,702,4,2006,2.99,English
,13.99,A Emotional Story of a Feminist And a Feminist who must Escape a Pastry Chef in A MySQL Convention,63,G,BUNCH MINDS,107,4,2006,2.99,English
,27.99,A Awe-Inspiring Panorama of a Composer And a Secret Agent who must Sink a Composer in A Shark Tank,60,PG,ROOM ROMAN,743,7,2006,0.99,English
,16.99,A Astounding Character Study of a Boat And a Secret Agent who must Find a Mad Cow in The Sahara Desert,158,NC-17,ENOUGH RAGING,286,7,2006,2.99,English
,17.99,A Thrilling Yarn of a Dog And a Dog who must Build a Husband in A Baloon,82,PG-13,PERFECT GROOVE,672,7,2006,2.99,English
,9.99,A Thrilling Reflection of a Teacher And a Composer who must Find a Man in The First Manned Space Station,137,NC-17,LIFE TWISTED,522,4,2006,2.99,English
,28.99,A Stunning Drama of a Robot And a Feminist who must Outgun a Butler in Nigeria,80,PG,LOSER HUSTLER,532,5,2006,4.99,English
,21.99,A Insightful Panorama of a Squirrel And a Mad Cow who must Confront a Student in The First Manned Space Station,174,NC-17,JADE BUNCH,474,6,2006,2.99,English
,29.99,A Awe-Inspiring Character Study of a Boy And a Feminist who must Sink a Crocodile in Ancient China,73,R,SALUTE APOLLO,759,4,2006,2.99,English
,27.99,A Action-Packed Display of a Frisbee And a Pastry Chef who must Pursue a Crocodile in A Jet Boat,108,PG-13,LORD ARIZONA,530,5,2006,2.99,English
,28.99,A Astounding Character Study of a Robot And a Moose who must Overcome a Astronaut in Ancient India,102,G,ROCK INSTINCT,737,4,2006,0.99,English
,17.99,A Thrilling Panorama of a Database Administrator And a Astronaut who must Challenge a Lumberjack in A Baloon,98,PG,BOUND CHEAPER,91,5,2006,0.99,English
,20.99,A Astounding Tale of a Crocodile And a Car who must Outrace a Squirrel in A U-Boat,182,PG,MONSOON CAUSE,591,6,2006,4.99,English
,16.99,A Stunning Documentary of a Composer And a Mad Scientist who must Find a Technical Writer in A U-Boat,113,G,DAY UNFAITHFUL,216,3,2006,4.99,English
,28.99,A Brilliant Panorama of a Mad Scientist And a Mad Cow who must Meet a Pioneer in A Monastery,121,PG,ARIZONA BANG,37,3,2006,2.99,English
,12.99,A Amazing Yarn of a Composer And a Squirrel who must Escape a Astronaut in Australia,81,G,CLASH FREDDY,154,6,2006,2.99,English
,21.99,A Thoughtful Story of a Moose And a Husband who must Face a Secret Agent in The Sahara Desert,142,R,TOMORROW HUSTLER,895,3,2006,2.99,English
,14.99,A Fateful Tale of a Database Administrator And a Squirrel who must Discover a Student in Soviet Georgia,144,NC-17,VIRTUAL SPOILERS,946,3,2006,4.99,English
,15.99,A Emotional Character Study of a Hunter And a Car who must Kill a Woman in Berlin,72,R,HARDLY ROBBERS,400,7,2006,2.99,English
,17.99,A Awe-Inspiring Documentary of a Moose And a Madman who must Meet a Dog in An Abandoned Mine Shaft,136,R,TOWN ARK,900,6,2006,2.99,English
,28.99,A Touching Documentary of a Madman And a Mad Scientist who must Outrace a Feminist in An Abandoned Mine Shaft,135,PG-13,THIEF PELICAN,887,5,2006,4.99,English
,13.99,A Fast-Paced Drama of a Squirrel And a Robot who must Succumb a Technical Writer in A Manhattan Penthouse,55,NC-17,WOLVES DESIRE,981,7,2006,0.99,English
,29.99,A Brilliant Reflection of a Database Administrator And a Mad Cow who must Chase a Woman in The Canadian Rockies,98,R,FEUD FROGMEN,309,6,2006,0.99,English
,21.99,A Boring Drama of a Car And a Dog who must Succumb a Madman in Soviet Georgia,62,NC-17,MARS ROMAN,560,6,2006,0.99,English
,11.99,A Epic Saga of a Cat And a Squirrel who must Outgun a Robot in A U-Boat,173,NC-17,PIZZA JUMANJI,684,4,2006,2.99,English
,19.99,A Boring Story of a Teacher And a Student who must Outgun a Cat in An Abandoned Mine Shaft,87,PG,TREATMENT JEKYLL,910,3,2006,0.99,English
,29.99,A Stunning Drama of a Butler And a Madman who must Outrace a Womanizer in Ancient India,85,NC-17,EARTH VISION,270,7,2006,0.99,English
,9.99,A Insightful Reflection of a Pioneer And a Teacher who must Build a Composer in The First Manned Space Station,141,R,KISSING DOLLS,501,3,2006,4.99,English
,14.99,A Epic Display of a Butler And a Dog who must Vanquish a Crocodile in A Manhattan Penthouse,123,NC-17,INSECTS STONE,461,3,2006,0.99,English
,25.99,A Thoughtful Display of a Astronaut And a Feminist who must Chase a Frisbee in A Jet Boat,171,PG-13,MOONSHINE CABIN,596,4,2006,4.99,English
,13.99,A Intrepid Display of a Pastry Chef And a Cat who must Kill a A Shark in Ancient China,50,PG,LION UNCUT,524,6,2006,0.99,English
,11.99,A Touching Epistle of a Squirrel And a Explorer who must Redeem a Pastry Chef in The Sahara Desert,77,NC-17,MEMENTO ZOOLANDER,568,4,2006,4.99,English
,25.99,A Unbelieveable Story of a Composer And a Dog who must Overcome a Womanizer in An Abandoned Amusement Park,102,G,HEAVYWEIGHTS BEAST,412,6,2006,4.99,English
,23.99,A Thrilling Panorama of a Technical Writer And a Car who must Discover a Forensic Psychologist in A Shark Tank,105,NC-17,JOON NORTHWEST,488,3,2006,0.99,English
,21.99,A Touching Documentary of a Mad Cow And a Explorer who must Confront a Butler in A Manhattan Penthouse,116,PG,INSTINCT AIRPORT,463,4,2006,2.99,English
,20.99,A Intrepid Documentary of a Sumo Wrestler And a Astronaut who must Battle a Composer in The Outback,153,G,CROSSROADS CASUALTIES,193,5,2006,2.99,English
,24.99,A Intrepid Story of a Dentist And a Hunter who must Confront a Monkey in Ancient Japan,59,PG-13,WHISPERER GIANT,972,4,2006,4.99,English
,14.99,A Lacklusture Tale of a Pastry Chef And a Technical Writer who must Confront a Crocodile in An Abandoned Amusement Park,173,R,VELVET TERMINATOR,938,3,2006,4.99,English
,27.99,A Fast-Paced Story of a Car And a Cat who must Outgun a Hunter in Berlin,99,NC-17,PERDITION FARGO,671,7,2006,4.99,English
,18.99,A Intrepid Epistle of a Pastry Chef And a Pastry Chef who must Pursue a Crocodile in Ancient China,51,PG-13,ENGLISH BULWORTH,285,3,2006,0.99,English
,26.99,A Fateful Character Study of a Butler And a Technical Writer who must Sink a Astronaut in Ancient Japan,73,R,BROTHERHOOD BLANKET,101,3,2006,0.99,English
,13.99,A Thrilling Story of a Cat And a Waitress who must Fight a Explorer in The Outback,172,PG-13,EYES DRIVING,298,4,2006,2.99,English
,14.99,A Fateful Saga of a A Shark And a Technical Writer who must Find a Woman in A Jet Boat,136,PG,BRINGING HYSTERICAL,99,7,2006,2.99,English
,23.99,A Boring Drama of a Woman And a Squirrel who must Conquer a Student in A Baloon,79,R,AMELIE HELLFIGHTERS,20,4,2006,4.99,English
,21.99,A Intrepid Saga of a Man And a Lumberjack who must Vanquish a Husband in The Outback,65,NC-17,FREDDY STORM,334,6,2006,4.99,English
,25.99,A Unbelieveable Documentary of a Frisbee And a Boat who must Meet a Boy in The Canadian Rockies,105,G,MOB DUFFEL,585,4,2006,0.99,English
,18.99,A Stunning Reflection of a Student And a Technical Writer who must Battle a Butler in The First Manned Space Station,137,R,LOSE INCH,531,3,2006,0.99,English
,20.99,A Unbelieveable Drama of a Student And a Husband who must Outrace a Sumo Wrestler in Berlin,100,PG,BEHAVIOR RUNAWAY,65,3,2006,4.99,English
,16.99,A Fanciful Tale of a Pioneer And a Technical Writer who must Outgun a Pioneer in A Shark Tank,92,NC-17,CARIBBEAN LIBERTY,120,3,2006,4.99,English
,11.99,A Amazing Documentary of a Woman And a Astronaut who must Outrace a Teacher in An Abandoned Fun House,120,NC-17,UNTOUCHABLES SUNRISE,926,5,2006,2.99,English
,25.99,A Epic Epistle of a Database Administrator And a Crocodile who must Face a Madman in A Jet Boat,146,PG-13,HALF OUTFIELD,391,6,2006,2.99,English
,13.99,A Taut Story of a Pioneer And a Squirrel who must Battle a Student in Soviet Georgia,109,R,HOUSE DYNAMITE,437,7,2006,2.99,English
,17.99,A Emotional Display of a Husband And a A Shark who must Succumb a Madman in A Manhattan Penthouse,82,G,TYCOON GATHERING,919,3,2006,4.99,English
,15.99,A Amazing Panorama of a Pastry Chef And a Boat who must Escape a Woman in An Abandoned Amusement Park,86,G,ANNIE IDENTITY,26,3,2006,0.99,English
,10.99,A Fanciful Character Study of a Explorer And a Mad Scientist who must Vanquish a Squirrel in A Jet Boat,181,G,INTRIGUE WORST,467,6,2006,0.99,English
,12.99,A Boring Character Study of a Database Administrator And a Lumberjack who must Reach a Madman in The Outback,61,PG,POLISH BROOKLYN,688,6,2006,0.99,English
,14.99,A Beautiful Display of a Pastry Chef And a Pastry Chef who must Outgun a Forensic Psychologist in A Manhattan Penthouse,107,PG,EFFECT GLADIATOR,273,6,2006,0.99,English
,16.99,A Insightful Reflection of a Womanizer And a Husband who must Conquer a Pastry Chef in A Baloon,181,PG-13,JACKET FRISCO,473,5,2006,2.99,English
,16.99,A Fanciful Reflection of a Boy And a Butler who must Pursue a Woman in Berlin,174,NC-17,UPRISING UPTOWN,927,6,2006,2.99,English
,15.99,A Fateful Tale of a Mad Cow And a Crocodile who must Meet a Husband in New Orleans,79,PG-13,SHOCK CABIN,789,7,2006,2.99,English
,25.99,A Intrepid Story of a Boy And a Technical Writer who must Pursue a Lumberjack in A Monastery,136,NC-17,PIANIST OUTFIELD,677,6,2006,0.99,English
,9.99,A Touching Epistle of a Crocodile And a Teacher who must Build a Forensic Psychologist in A MySQL Convention,48,NC-17,STEPMOM DREAM,845,7,2006,4.99,English
,17.99,A Lacklusture Panorama of a Secret Agent And a Crocodile who must Discover a Madman in The Canadian Rockies,178,PG-13,IMAGE PRINCESS,453,3,2006,2.99,English
,21.99,A Touching Documentary of a Cat And a Pastry Chef who must Find a Lumberjack in A Baloon,87,PG-13,CONGENIALITY QUEST,176,6,2006,0.99,English
,22.99,A Emotional Panorama of a Pioneer And a Composer who must Escape a Mad Scientist in A Jet Boat,162,R,BADMAN DAWN,49,6,2006,2.99,English
,18.99,A Lacklusture Documentary of a Mad Cow And a Madman who must Sink a Moose in The Gulf of Mexico,118,PG,OTHERS SOUP,645,7,2006,2.99,English
,29.99,A Awe-Inspiring Documentary of a Robot And a Mad Scientist who must Reach a Database Administrator in A Shark Tank,179,PG-13,VIRGIN DAISY,944,6,2006,4.99,English
,29.99,A Fast-Paced Epistle of a Boy And a Explorer who must Escape a Dog in A U-Boat,69,PG,HOLLYWOOD ANONYMOUS,423,7,2006,0.99,English
,21.99,A Fateful Saga of a Sumo Wrestler And a Hunter who must Redeem a A Shark in New Orleans,102,PG-13,FALCON VOLUME,300,5,2006,4.99,English
,17.99,A Astounding Saga of a Mad Scientist And a Hunter who must Pursue a Robot in A Baloon Factory,78,NC-17,INSIDER ARIZONA,462,5,2006,2.99,English
,12.99,A Awe-Inspiring Character Study of a Astronaut And a Forensic Psychologist who must Challenge a Madman in Ancient India,125,G,SHINING ROSES,787,4,2006,0.99,English
,24.99,A Thrilling Reflection of a Pioneer And a Dentist who must Outrace a Womanizer in An Abandoned Mine Shaft,65,NC-17,HUNTING MUSKETEERS,442,6,2006,2.99,English
,18.99,A Stunning Epistle of a Man And a Husband who must Reach a Mad Scientist in A Jet Boat,90,PG-13,BASIC EASY,57,4,2006,2.99,English
,21.99,A Action-Packed Reflection of a Mad Scientist And a A Shark who must Find a Feminist in California,103,PG,PINOCCHIO SIMON,680,4,2006,4.99,English
,14.99,A Intrepid Story of a Madman And a Frisbee who must Outgun a Boat in The Sahara Desert,137,PG,POLLOCK DELIVERANCE,689,5,2006,2.99,English
,14.99,A Brilliant Panorama of a Girl And a Boy who must Face a Mad Scientist in An Abandoned Mine Shaft,154,R,DURHAM PANKY,263,6,2006,4.99,English
,20.99,A Epic Character Study of a Frisbee And a Moose who must Outgun a Technical Writer in A Shark Tank,180,PG-13,IMPACT ALADDIN,454,6,2006,0.99,English
,14.99,A Amazing Character Study of a Mad Cow And a Squirrel who must Discover a Hunter in A U-Boat,97,PG,EXPENDABLE STALLION,295,3,2006,0.99,English
,25.99,A Thrilling Yarn of a Waitress And a Dentist who must Find a Hunter in A Monastery,133,PG,MALLRATS UNITED,555,4,2006,0.99,English
,15.99,A Thrilling Yarn of a Feminist And a Hunter who must Fight a Technical Writer in A Shark Tank,170,G,ATLANTIS CAUSE,43,6,2006,2.99,English
,16.99,A Brilliant Character Study of a Database Administrator And a Monkey who must Succumb a Astronaut in New Orleans,122,G,DOGMA FAMILY,239,5,2006,4.99,English
,10.99,A Lacklusture Epistle of a Cat And a Husband who must Confront a Boy in A MySQL Convention,64,PG,MILE MULAN,577,4,2006,0.99,English
,25.99,A Epic Drama of a Madman And a Cat who must Face a A Shark in An Abandoned Amusement Park,87,NC-17,BANG KWAI,53,5,2006,2.99,English
,21.99,A Fateful Reflection of a Dog And a Mad Cow who must Outrace a Teacher in An Abandoned Mine Shaft,153,PG-13,LEATHERNECKS DWARFS,513,6,2006,2.99,English
,20.99,A Taut Story of a Dog And a Explorer who must Find a Astronaut in Berlin,134,R,SPLENDOR PATTON,833,5,2006,0.99,English
,12.99,A Fateful Panorama of a Technical Writer And a Moose who must Battle a Robot in Soviet Georgia,144,PG,PRESIDENT BANG,695,6,2006,4.99,English
,23.99,A Intrepid Character Study of a Man And a Frisbee who must Overcome a Madman in Ancient China,156,G,OPERATION OPERATION,638,7,2006,2.99,English
,23.99,A Fanciful Character Study of a Secret Agent And a Mad Scientist who must Reach a Teacher in Australia,145,R,VACATION BOONDOCK,930,4,2006,2.99,English
,18.99,A Awe-Inspiring Epistle of a Pioneer And a Student who must Outgun a Crocodile in The Outback,59,PG,LEGEND JEDI,516,7,2006,0.99,English
,22.99,A Fast-Paced Documentary of a Pastry Chef And a Dentist who must Pursue a Forensic Psychologist in The Gulf of Mexico,130,G,AFRICAN EGG,5,6,2006,2.99,English
,29.99,A Taut Story of a Waitress And a Crocodile who must Outrace a Lumberjack in A Shark Tank,84,R,HONEY TIES,429,3,2006,0.99,English
,17.99,A Unbelieveable Display of a Mad Scientist And a Mad Scientist who must Outgun a Mad Cow in Ancient Japan,90,R,VERTIGO NORTHWEST,939,4,2006,2.99,English
,20.99,A Beautiful Documentary of a Forensic Psychologist And a Cat who must Reach a Astronaut in Nigeria,72,R,MAUDE MOD,566,6,2006,0.99,English
,15.99,A Taut Epistle of a Monkey And a Sumo Wrestler who must Vanquish a A Shark in A Baloon Factory,129,PG,UNFORGIVEN ZOOLANDER,924,7,2006,0.99,English
,17.99,A Fast-Paced Display of a Squirrel And a Composer who must Fight a Forensic Psychologist in A Jet Boat,184,NC-17,SORORITY QUEEN,821,6,2006,0.99,English
,13.99,A Brilliant Character Study of a Frisbee And a Sumo Wrestler who must Confront a Woman in The Gulf of Mexico,108,G,SWEETHEARTS SUSPECTS,873,3,2006,0.99,English
,21.99,A Astounding Saga of a Technical Writer And a Butler who must Battle a Butler in A Shark Tank,114,PG,CHASING FIGHT,139,7,2006,4.99,English
,24.99,A Fateful Saga of a Cat And a Frisbee who must Kill a Girl in A Manhattan Penthouse,109,G,SECRETS PARADISE,778,3,2006,4.99,English
,18.99,A Thrilling Display of a Mad Cow And a Dog who must Challenge a Frisbee in Nigeria,69,NC-17,FLYING HOOK,326,6,2006,2.99,English
,25.99,A Amazing Yarn of a Dentist And a A Shark who must Vanquish a Madman in An Abandoned Mine Shaft,148,PG,FIREBALL PHILADELPHIA,317,4,2006,0.99,English
,25.99,A Emotional Reflection of a Teacher And a Man who must Meet a Cat in The First Manned Space Station,100,PG-13,BILKO ANONYMOUS,71,3,2006,4.99,English
,13.99,A Beautiful Yarn of a Forensic Psychologist And a Frisbee who must Battle a Moose in A Jet Boat,49,NC-17,HEAVENLY GUN,411,5,2006,4.99,English
,13.99,A Intrepid Saga of a Man And a Forensic Psychologist who must Reach a Squirrel in A Monastery,68,PG-13,DIVIDE MONSTER,235,6,2006,2.99,English
,10.99,A Stunning Tale of a Man And a Monkey who must Chase a Student in New Orleans,80,G,TURN STAR,916,3,2006,2.99,English
,14.99,A Beautiful Character Study of a Woman And a Man who must Pursue a Explorer in A U-Boat,67,PG,LADY STAGE,506,4,2006,4.99,English
,24.99,A Touching Reflection of a Crocodile And a Dog who must Chase a Hunter in An Abandoned Fun House,144,PG-13,STRICTLY SCARFACE,857,3,2006,2.99,English
,22.99,A Taut Story of a Moose And a Squirrel who must Build a Husband in Ancient India,122,NC-17,DECEIVER BETRAYED,218,7,2006,0.99,English
,27.99,A Awe-Inspiring Story of a Student And a Frisbee who must Conquer a Crocodile in An Abandoned Mine Shaft,184,PG-13,CONSPIRACY SPIRIT,180,4,2006,2.99,English
,22.99,A Stunning Character Study of a Dentist And a Mad Cow who must Find a Teacher in Nigeria,98,R,EARRING INSTINCT,269,3,2006,0.99,English
,27.99,A Fast-Paced Reflection of a Technical Writer And a Student who must Fight a Boy in The Canadian Rockies,128,PG,HOLES BRANNIGAN,420,7,2006,4.99,English
