lingua_originale_id,costo_sostituzione,descrizione,durata,voto,titolo,film_id,durata_noleggio,data_rilascio,tariffa_noleggio,lingua
,12.99,A Stunning Saga of a Mad Scientist And a Forensic Psychologist who must Challenge a Squirrel in A MySQL Convention,93,PG,BILL OTHERS,72,6,2006,2.99,English
,9.99,A Fanciful Display of a Car And a Monkey who must Escape a Squirrel in Ancient Japan,128,PG,PAPI NECKLACE,656,3,2006,0.99,English
,22.99,A Awe-Inspiring Yarn of a Student And a Teacher who must Fight a Teacher in An Abandoned Amusement Park,179,NC-17,TEXAS WATCH,885,7,2006,0.99,English
,14.99,A Fanciful Character Study of a Lumberjack And a Car who must Discover a Cat in An Abandoned Amusement Park,64,PG-13,TRIP NEWTON,911,7,2006,4.99,English
,15.99,A Insightful Panorama of a Woman And a Feminist who must Defeat a Forensic Psychologist in Berlin,110,PG,SNATCH SLIPPER,814,6,2006,4.99,English
,19.99,A Action-Packed Display of a Mad Cow And a Astronaut who must Kill a Car in Ancient India,178,G,WARDROBE PHANTOM,958,6,2006,2.99,English
,26.99,A Amazing Drama of a Butler And a Husband who must Reach a A Shark in A U-Boat,138,PG-13,EXPECATIONS NATURAL,294,5,2006,4.99,English
,20.99,A Unbelieveable Drama of a Crocodile And a Mad Cow who must Reach a Dentist in A Shark Tank,172,R,CONNECTICUT TRAMP,177,4,2006,4.99,English
,19.99,A Thoughtful Panorama of a Hunter And a Teacher who must Reach a Mad Cow in A U-Boat,176,R,ENTRAPMENT SATISFACTION,287,5,2006,0.99,English
,23.99,A Taut Reflection of a A Shark And a Dentist who must Battle a Boat in Soviet Georgia,75,PG,HELLFIGHTERS SIERRA,414,3,2006,2.99,English
,14.99,A Boring Epistle of a Sumo Wrestler And a Woman who must Escape a Man in The Canadian Rockies,74,PG-13,SNATCHERS MONTEZUMA,815,4,2006,2.99,English
,21.99,A Emotional Character Study of a Robot And a A Shark who must Defeat a Technical Writer in A Manhattan Penthouse,98,PG-13,LOST BIRD,533,4,2006,2.99,English
,29.99,A Thrilling Documentary of a Composer And a Monkey who must Find a Feminist in California,173,G,BALLROOM MOCKINGBIRD,52,6,2006,0.99,English
,22.99,A Touching Character Study of a Boat And a Student who must Sink a A Shark in Nigeria,105,PG-13,MICROCOSMOS PARADISE,573,6,2006,2.99,English
,17.99,A Touching Display of a Feminist And a Dentist who must Conquer a Husband in The Gulf of Mexico,119,NC-17,DUMBO LUST,262,5,2006,0.99,English
,23.99,A Boring Tale of a Frisbee And a Crocodile who must Vanquish a Moose in An Abandoned Mine Shaft,111,R,SIEGE MADRE,795,7,2006,0.99,English
,19.99,A Epic Saga of a Hunter And a Technical Writer who must Conquer a Cat in Ancient Japan,118,PG-13,PERSONAL LADYBUGS,673,3,2006,0.99,English
,22.99,A Brilliant Epistle of a Teacher And a Sumo Wrestler who must Defeat a Man in An Abandoned Fun House,63,G,BORROWERS BEDAZZLED,89,7,2006,0.99,English
,19.99,A Fanciful Story of a Man And a Sumo Wrestler who must Outrace a Student in A Monastery,79,G,WEREWOLF LOLA,968,6,2006,4.99,English
,27.99,A Thoughtful Panorama of a Man And a Car who must Sink a Composer in Berlin,60,PG,MOCKINGBIRD HOLLYWOOD,586,4,2006,0.99,English
,29.99,A Insightful Tale of a Database Administrator And a Dog who must Face a Madman in Soviet Georgia,115,PG,OSCAR GOLD,644,7,2006,2.99,English
,9.99,A Stunning Character Study of a Composer And a Mad Cow who must Succumb a Cat in Soviet Georgia,101,PG,CIDER DESIRE,150,7,2006,2.99,English
,14.99,A Action-Packed Character Study of a Astronaut And a Explorer who must Reach a Monkey in A MySQL Convention,85,NC-17,VARSITY TRIP,937,7,2006,2.99,English
,13.99,A Thoughtful Drama of a Pastry Chef And a Dentist who must Pursue a Girl in A Baloon,90,PG-13,CIRCUS YOUTH,152,5,2006,2.99,English
,19.99,A Beautiful Epistle of a Astronaut And a Student who must Confront a Monkey in An Abandoned Fun House,153,R,RULES HUMAN,749,6,2006,4.99,English
,12.99,A Unbelieveable Character Study of a Mad Scientist And a Astronaut who must Find a Pioneer in A Manhattan Penthouse,57,G,NOON PAPI,626,5,2006,2.99,English
,27.99,A Emotional Display of a Crocodile And a Husband who must Reach a Man in Ancient Japan,179,G,TORQUE BOUND,897,3,2006,4.99,English
,25.99,A Emotional Epistle of a Moose And a Hunter who must Overcome a Robot in A Manhattan Penthouse,106,PG,DALMATIONS SWEDEN,204,4,2006,0.99,English
,27.99,A Boring Display of a Sumo Wrestler And a Husband who must Build a Waitress in The Gulf of Mexico,100,G,GUN BONNIE,387,7,2006,0.99,English
,14.99,A Taut Character Study of a Husband And a Waitress who must Sink a Squirrel in A MySQL Convention,112,R,CONVERSATION DOWNHILL,183,4,2006,4.99,English
,18.99,A Fanciful Character Study of a Technical Writer And a Husband who must Redeem a Robot in The Outback,165,G,CITIZEN SHREK,153,7,2006,0.99,English
,10.99,A Stunning Reflection of a Robot And a Moose who must Challenge a Woman in California,170,NC-17,ARTIST COLDBLOODED,42,5,2006,2.99,English
,12.99,A Thoughtful Yarn of a Monkey And a Teacher who must Find a Dog in Australia,104,PG-13,FEATHERS METAL,306,3,2006,0.99,English
,13.99,A Beautiful Drama of a Robot And a Lumberjack who must Discover a Technical Writer in A Shark Tank,153,PG-13,ROLLERCOASTER BRINGING,740,5,2006,2.99,English
,19.99,A Awe-Inspiring Character Study of a Waitress And a Car who must Pursue a Mad Scientist in The First Manned Space Station,111,PG,WONDERLAND CHRISTMAS,985,4,2006,4.99,English
,16.99,A Thrilling Epistle of a Frisbee And a Cat who must Fight a Technical Writer in Berlin,115,PG,POTTER CONNECTICUT,693,5,2006,2.99,English
,9.99,A Lacklusture Display of a Dentist And a Dentist who must Fight a Girl in Australia,92,R,ANACONDA CONFESSIONS,23,3,2006,0.99,English
,22.99,A Fateful Display of a Pioneer And a Hunter who must Defeat a Husband in An Abandoned Mine Shaft,141,NC-17,SPICE SORORITY,827,5,2006,4.99,English
,28.99,A Unbelieveable Panorama of a Technical Writer And a Man who must Pursue a Frisbee in A U-Boat,131,NC-17,FOREVER CANDIDATE,328,7,2006,2.99,English
,14.99,A Emotional Yarn of a A Shark And a Student who must Battle a Robot in An Abandoned Mine Shaft,72,PG,FICTION CHRISTMAS,311,4,2006,0.99,English
,17.99,A Thoughtful Documentary of a Boat And a Man who must Meet a Boat in An Abandoned Fun House,181,NC-17,RUNAWAY TENENBAUMS,751,6,2006,0.99,English
,15.99,A Thrilling Character Study of a Moose And a Student who must Escape a Butler in The First Manned Space Station,130,PG,MAJESTIC FLOATS,552,5,2006,0.99,English
,15.99,A Stunning Reflection of a Boat And a Pastry Chef who must Succumb a A Shark in A Jet Boat,118,PG,JAWBREAKER BROOKLYN,477,5,2006,0.99,English
,19.99,A Epic Yarn of a Teacher And a Hunter who must Outgun a Explorer in Soviet Georgia,92,NC-17,MYSTIC TRUMAN,613,5,2006,0.99,English
,19.99,A Taut Documentary of a Car And a Robot who must Conquer a Boy in The Canadian Rockies,176,PG,SWEDEN SHINING,871,6,2006,4.99,English
,21.99,A Thrilling Tale of a Technical Writer And a Boy who must Face a Pioneer in A Monastery,157,NC-17,INDEPENDENCE HOTEL,457,5,2006,0.99,English
,27.99,A Beautiful Saga of a Lumberjack And a Teacher who must Build a Technical Writer in An Abandoned Fun House,114,PG,SUPERFLY TRIP,868,5,2006,0.99,English
,9.99,A Astounding Panorama of a Husband And a Sumo Wrestler who must Pursue a Boat in Ancient India,52,PG,TROJAN TOMORROW,912,3,2006,2.99,English
,29.99,A Beautiful Yarn of a Astronaut And a Frisbee who must Overcome a Explorer in A Jet Boat,139,PG-13,CLYDE THEORY,163,4,2006,0.99,English
,27.99,A Boring Reflection of a Dentist And a Mad Cow who must Chase a Secret Agent in A Shark Tank,133,PG-13,CURTAIN VIDEOTAPE,200,7,2006,0.99,English
,12.99,A Lacklusture Epistle of a Sumo Wrestler And a Squirrel who must Defeat a Explorer in California,138,PG-13,SPINAL ROCKY,829,7,2006,2.99,English
,22.99,A Touching Display of a Feminist And a Girl who must Confront a Astronaut in Australia,125,R,FISH OPUS,319,4,2006,2.99,English
,10.99,A Brilliant Drama of a Cat And a Mad Scientist who must Battle a Feminist in A MySQL Convention,46,NC-17,ALIEN CENTER,15,5,2006,2.99,English
,22.99,A Stunning Epistle of a Dentist And a Dog who must Kill a Madman in Ancient China,74,R,WORKING MICROCOSMOS,989,4,2006,4.99,English
,29.99,A Fateful Drama of a Husband And a Sumo Wrestler who must Battle a Pastry Chef in A Baloon Factory,177,R,QUEST MUSSOLINI,707,5,2006,2.99,English
,21.99,A Unbelieveable Saga of a Crocodile And a Student who must Discover a Cat in Ancient India,47,G,DIVORCE SHINING,237,3,2006,2.99,English
,25.99,A Insightful Story of a Car And a Boy who must Battle a Technical Writer in A Baloon,65,PG-13,CONFESSIONS MAGUIRE,173,7,2006,4.99,English
,10.99,A Insightful Reflection of a Waitress And a Madman who must Pursue a Boy in Ancient Japan,78,PG-13,HOLIDAY GAMES,421,7,2006,4.99,English
,29.99,A Fast-Paced Documentary of a Dog And a Teacher who must Find a Moose in A Manhattan Penthouse,154,G,SASSY PACKER,762,6,2006,0.99,English
,25.99,A Beautiful Character Study of a Robot And a Astronaut who must Overcome a Boat in A Monastery,136,NC-17,HOLLOW JEOPARDY,422,7,2006,4.99,English
,24.99,A Boring Epistle of a Boat And a Database Administrator who must Kill a Sumo Wrestler in The First Manned Space Station,107,G,CHITTY LOCK,146,6,2006,2.99,English
,24.99,A Epic Documentary of a Teacher And a Boy who must Escape a Woman in Berlin,155,R,FAMILY SWEET,301,4,2006,0.99,English
,23.99,A Emotional Drama of a Womanizer And a Squirrel who must Vanquish a Crocodile in Ancient India,139,NC-17,CREATURES SHAKESPEARE,189,3,2006,0.99,English
,22.99,A Awe-Inspiring Display of a Squirrel And a Woman who must Overcome a Boy in The Gulf of Mexico,49,NC-17,DOORS PRESIDENT,243,3,2006,4.99,English
,29.99,A Touching Drama of a Robot And a Dentist who must Meet a Hunter in A Jet Boat,103,PG-13,BLINDNESS GUN,81,6,2006,4.99,English
,19.99,A Boring Panorama of a Secret Agent And a Girl who must Sink a Waitress in The Outback,151,R,STRAIGHT HOURS,851,3,2006,0.99,English
,28.99,A Emotional Display of a Man And a Explorer who must Build a Boy in A Manhattan Penthouse,167,NC-17,LESSON CLEOPATRA,517,3,2006,0.99,English
,17.99,A Touching Epistle of a Frisbee And a Husband who must Pursue a Student in Nigeria,179,PG,BORN SPINAL,88,7,2006,4.99,English
,20.99,A Awe-Inspiring Tale of a Butler And a Frisbee who must Vanquish a Teacher in Ancient Japan,125,NC-17,DONNIE ALLEY,241,4,2006,0.99,English
,23.99,A Lacklusture Reflection of a Monkey And a Squirrel who must Outrace a Womanizer in A Manhattan Penthouse,131,NC-17,NEMO CAMPUS,620,5,2006,2.99,English
,16.99,A Boring Epistle of a Butler And a Cat who must Fight a Pastry Chef in A MySQL Convention,126,G,ALAMO VIDEOTAPE,11,6,2006,0.99,English
,9.99,A Thoughtful Display of a Mad Scientist And a Secret Agent who must Chase a Boat in Berlin,86,PG-13,GANDHI KWAI,348,7,2006,0.99,English
,26.99,A Touching Character Study of a Woman And a Waitress who must Battle a Pastry Chef in A MySQL Convention,61,NC-17,CAMELOT VACATION,114,3,2006,0.99,English
,28.99,A Awe-Inspiring Tale of a Forensic Psychologist And a Woman who must Challenge a Database Administrator in Ancient Japan,120,PG-13,COMMAND DARLING,170,5,2006,4.99,English
,20.99,A Touching Story of a Dentist And a Database Administrator who must Conquer a Astronaut in An Abandoned Amusement Park,114,PG,SUGAR WONKA,859,3,2006,4.99,English
,10.99,A Fast-Paced Drama of a Pioneer And a Mad Cow who must Challenge a Madman in Ancient Japan,132,PG-13,TRAINSPOTTING STRANGERS,905,7,2006,4.99,English
,16.99,A Lacklusture Documentary of a Madman And a Mad Cow who must Find a Feminist in Ancient Japan,60,PG,JERSEY SASSY,485,6,2006,4.99,English
,26.99,A Stunning Story of a Technical Writer And a Hunter who must Succumb a Secret Agent in A Baloon,106,PG,PRIVATE DROP,699,7,2006,4.99,English
,24.99,A Taut Saga of a Crocodile And a Boy who must Overcome a Technical Writer in Ancient China,77,PG-13,BERETS AGENT,67,5,2006,2.99,English
,14.99,A Emotional Drama of a Boy And a Technical Writer who must Redeem a Sumo Wrestler in California,126,R,PAJAMA JAWBREAKER,652,3,2006,0.99,English
,18.99,A Fanciful Story of a Database Administrator And a Womanizer who must Fight a Database Administrator in Ancient China,85,PG,WASTELAND DIVINE,962,7,2006,2.99,English
,13.99,A Beautiful Display of a Cat And a Pastry Chef who must Outrace a Mad Cow in A Jet Boat,113,NC-17,STATE WASTELAND,842,4,2006,2.99,English
,12.99,A Awe-Inspiring Yarn of a Womanizer And a Explorer who must Fight a Woman in The First Manned Space Station,139,G,STRANGER STRANGERS,853,3,2006,4.99,English
,19.99,A Intrepid Drama of a Astronaut And a Crocodile who must Find a Boat in Soviet Georgia,94,G,STONE FIRE,848,3,2006,0.99,English
,20.99,A Action-Packed Drama of a Monkey And a Dentist who must Chase a Butler in Berlin,160,PG-13,PEACH INNOCENT,667,3,2006,2.99,English
,21.99,A Astounding Epistle of a Database Administrator And a Mad Scientist who must Pursue a Cat in California,132,PG,NECKLACE OUTBREAK,618,3,2006,0.99,English
,29.99,A Brilliant Tale of a Car And a Moose who must Battle a Dentist in Nigeria,69,G,CRUELTY UNFORGIVEN,196,7,2006,0.99,English
,20.99,A Boring Documentary of a Mad Cow And a Cat who must Build a Lumberjack in New Orleans,77,NC-17,MOD SECRETARY,587,6,2006,4.99,English
,13.99,A Fateful Reflection of a Car And a Teacher who must Confront a Waitress in A Monastery,183,NC-17,SCALAWAG DUCK,767,6,2006,4.99,English
,13.99,A Lacklusture Saga of a Mad Cow And a Mad Scientist who must Sink a Cat in A MySQL Convention,50,PG-13,SMOKING BARBARELLA,812,7,2006,0.99,English
,13.99,A Intrepid Yarn of a Husband And a Womanizer who must Pursue a Mad Scientist in New Orleans,121,G,JUMANJI BLADE,490,4,2006,2.99,English
,23.99,A Boring Saga of a Lumberjack And a Monkey who must Find a Monkey in The Gulf of Mexico,67,R,COMANCHEROS ENEMY,168,5,2006,0.99,English
,9.99,A Thrilling Epistle of a Moose And a Boy who must Meet a Database Administrator in A Monastery,92,G,TRUMAN CRAZY,915,7,2006,4.99,English
,23.99,A Emotional Character Study of a Pioneer And a Girl who must Discover a Dog in Ancient Japan,87,G,CHEAPER CLYDE,140,6,2006,0.99,English
,22.99,A Intrepid Reflection of a Waitress And a A Shark who must Kill a Squirrel in The Outback,159,G,MALKOVICH PET,554,6,2006,2.99,English
,22.99,A Fateful Saga of a Moose And a Car who must Pursue a Woman in A MySQL Convention,176,G,CAPER MOTIONS,119,6,2006,0.99,English
,18.99,A Fateful Epistle of a Butler And a Boy who must Redeem a Teacher in Berlin,182,R,SATURN NAME,765,7,2006,4.99,English
,13.99,A Lacklusture Panorama of a Forensic Psychologist And a Woman who must Kill a Explorer in Ancient Japan,61,PG,TROUBLE DATE,914,6,2006,2.99,English
,23.99,A Beautiful Documentary of a Woman And a Pioneer who must Pursue a Mad Scientist in A Shark Tank,51,PG,FRISCO FORREST,338,6,2006,4.99,English
,13.99,A Amazing Saga of a Dog And a A Shark who must Challenge a Cat in The Sahara Desert,120,PG-13,ORDER BETRAYED,642,7,2006,2.99,English
,26.99,A Emotional Character Study of a Boat And a Pioneer who must Find a Explorer in A Shark Tank,122,NC-17,BETRAYED REAR,68,5,2006,4.99,English
,28.99,A Taut Reflection of a Monkey And a Womanizer who must Chase a Moose in Nigeria,177,PG,RIDER CADDYSHACK,729,5,2006,2.99,English
,18.99,A Intrepid Documentary of a Frisbee And a Dog who must Outrace a Lumberjack in Nigeria,173,R,FIRE WOLVES,316,5,2006,4.99,English
,27.99,A Boring Drama of a Student And a Cat who must Sink a Technical Writer in A Baloon,138,G,LIBERTY MAGNIFICENT,519,3,2006,2.99,English
,10.99,A Stunning Yarn of a Woman And a Frisbee who must Escape a Waitress in A U-Boat,169,PG,KENTUCKIAN GIANT,495,5,2006,2.99,English
,10.99,A Stunning Epistle of a Feminist And a A Shark who must Battle a Woman in An Abandoned Fun House,80,PG-13,SADDLE ANTITRUST,756,7,2006,2.99,English
,22.99,A Amazing Documentary of a Student And a Sumo Wrestler who must Outgun a A Shark in A Shark Tank,139,NC-17,HOPE TOOTSIE,432,4,2006,2.99,English
,28.99,A Thoughtful Documentary of a Composer And a Explorer who must Conquer a Dentist in New Orleans,171,PG-13,MAGNOLIA FORRESTER,549,4,2006,0.99,English
,11.99,A Insightful Character Study of a Waitress And a Crocodile who must Sink a Waitress in The Gulf of Mexico,73,R,STREETCAR INTENTIONS,856,5,2006,4.99,English
,15.99,A Taut Reflection of a Teacher And a Database Administrator who must Chase a Madman in The Sahara Desert,128,G,WARS PLUTO,960,5,2006,2.99,English
,18.99,A Insightful Reflection of a Crocodile And a Sumo Wrestler who must Meet a Technical Writer in The Sahara Desert,110,PG-13,SEATTLE EXPECATIONS,775,4,2006,4.99,English
,27.99,A Lacklusture Saga of a Boy And a Cat who must Sink a Dentist in An Abandoned Mine Shaft,163,R,STORY SIDE,850,7,2006,0.99,English
,19.99,A Action-Packed Story of a Frisbee And a Woman who must Reach a Girl in An Abandoned Mine Shaft,155,NC-17,ELF MURDER,278,4,2006,4.99,English
,10.99,A Fateful Tale of a Database Administrator And a Girl who must Battle a Squirrel in New Orleans,156,R,FINDING ANACONDA,315,4,2006,0.99,English
,14.99,A Thrilling Epistle of a Boat And a Secret Agent who must Face a Boy in A Baloon,172,R,TIGHTS DAWN,890,5,2006,0.99,English
,10.99,A Thrilling Display of a Boat And a Monkey who must Meet a Composer in Ancient China,180,G,MUSSOLINI SPOILERS,612,6,2006,2.99,English
,11.99,A Fateful Story of a Husband And a Moose who must Vanquish a Boy in California,148,PG-13,FLINTSTONES HAPPINESS,324,3,2006,4.99,English
,25.99,A Insightful Documentary of a Hunter And a Dentist who must Confront a Crocodile in A Baloon,147,PG,RANGE MOONWALKER,715,3,2006,4.99,English
,26.99,A Thrilling Reflection of a Feminist And a Cat who must Find a Frisbee in An Abandoned Fun House,176,G,DRACULA CRYSTAL,249,7,2006,0.99,English
,28.99,A Astounding Character Study of a Hunter And a Waitress who must Sink a Man in New Orleans,132,PG-13,STREAK RIDGEMONT,855,7,2006,0.99,English
,20.99,A Taut Drama of a Cat And a Girl who must Defeat a Frisbee in The Canadian Rockies,177,NC-17,DOZEN LION,248,6,2006,4.99,English
,13.99,A Astounding Epistle of a Cat And a Cat who must Conquer a Mad Cow in A U-Boat,107,PG-13,INTENTIONS EMPIRE,464,3,2006,2.99,English
,23.99,A Astounding Panorama of a Monkey And a Secret Agent who must Defeat a Woman in The First Manned Space Station,162,PG-13,ROSES TREASURE,745,5,2006,4.99,English
,12.99,A Fast-Paced Display of a Robot And a Butler who must Defeat a Butler in A MySQL Convention,169,R,SOUP WISDOM,822,6,2006,0.99,English
,26.99,A Thoughtful Reflection of a Waitress And a Feminist who must Escape a Squirrel in A Manhattan Penthouse,85,R,CANYON STOCK,118,7,2006,0.99,English
,28.99,A Fast-Paced Tale of a Butler And a Moose who must Overcome a Pioneer in A Manhattan Penthouse,131,R,ICE CROSSING,447,5,2006,2.99,English
,9.99,A Beautiful Character Study of a Mad Cow And a Robot who must Reach a Womanizer in New Orleans,67,NC-17,NORTH TEQUILA,627,4,2006,4.99,English
,12.99,A Fast-Paced Display of a Car And a Database Administrator who must Battle a Woman in A Baloon,54,R,GO PURPLE,363,3,2006,0.99,English
,13.99,A Amazing Saga of a Woman And a Womanizer who must Discover a Cat in The First Manned Space Station,115,PG-13,GLORY TRACY,362,7,2006,2.99,English
,11.99,A Fast-Paced Display of a Lumberjack And a Mad Scientist who must Succumb a Sumo Wrestler in The Sahara Desert,91,PG-13,TARZAN VIDEOTAPE,876,3,2006,2.99,English
,20.99,A Amazing Tale of a Crocodile And a Squirrel who must Discover a Composer in Australia,51,PG-13,DEEP CRUSADE,219,6,2006,4.99,English
,18.99,A Boring Reflection of a Secret Agent And a Astronaut who must Face a Composer in A Manhattan Penthouse,83,NC-17,NONE SPIKING,625,3,2006,0.99,English
,27.99,A Intrepid Panorama of a Sumo Wrestler And a Forensic Psychologist who must Discover a Moose in The First Manned Space Station,98,PG-13,MADRE GABLES,546,7,2006,2.99,English
,22.99,A Emotional Character Study of a Student And a Explorer who must Discover a Frisbee in The First Manned Space Station,170,PG,TRADING PINOCCHIO,902,6,2006,4.99,English
,18.99,A Boring Story of a Butler And a Astronaut who must Outrace a Pioneer in Australia,152,PG-13,TOURIST PELICAN,898,4,2006,4.99,English
,26.99,A Boring Documentary of a Dentist And a Butler who must Confront a Monkey in A MySQL Convention,80,G,MEET CHOCOLATE,567,3,2006,2.99,English
,13.99,A Boring Display of a Man And a Dog who must Redeem a Girl in A U-Boat,69,G,TIMBERLAND SKY,891,3,2006,0.99,English
,24.99,A Touching Documentary of a Husband And a Hunter who must Escape a Boy in The Sahara Desert,99,NC-17,DARKNESS WAR,209,6,2006,2.99,English
,19.99,A Boring Story of a Car And a Butler who must Build a Girl in Soviet Georgia,162,PG-13,LOVERBOY ATTACKS,538,7,2006,0.99,English
,25.99,A Astounding Display of a Forensic Psychologist And a Mad Scientist who must Challenge a Girl in New Orleans,90,NC-17,FORWARD TEMPLE,331,6,2006,2.99,English
,29.99,A Insightful Drama of a Mad Scientist And a Hunter who must Defeat a Pastry Chef in New Orleans,93,G,GOLDFINGER SENSIBILITY,366,3,2006,0.99,English
,19.99,A Touching Documentary of a Pastry Chef And a Pastry Chef who must Build a Mad Scientist in California,117,PG,MAGIC MALLRATS,547,3,2006,0.99,English
,18.99,A Lacklusture Drama of a Student And a Monkey who must Sink a Womanizer in A MySQL Convention,176,PG,CYCLONE FAMILY,201,7,2006,2.99,English
,9.99,A Action-Packed Panorama of a Technical Writer And a Man who must Build a Forensic Psychologist in A Manhattan Penthouse,152,PG-13,TELEMARK HEARTBREAKERS,880,6,2006,2.99,English
,14.99,A Beautiful Documentary of a Astronaut And a Moose who must Pursue a Monkey in A Shark Tank,94,PG,FULL FLATLINERS,343,6,2006,2.99,English
,18.99,A Beautiful Saga of a Feminist And a Composer who must Challenge a Moose in Berlin,73,G,WAKE JAWS,954,7,2006,4.99,English
,11.99,A Amazing Drama of a Teacher And a Feminist who must Meet a Woman in The First Manned Space Station,82,PG-13,RAIDERS ANTITRUST,712,4,2006,0.99,English
,13.99,A Stunning Reflection of a Sumo Wrestler And a Explorer who must Sink a Frisbee in A MySQL Convention,129,PG-13,SLEEPING SUSPECTS,804,7,2006,4.99,English
,16.99,A Brilliant Documentary of a Womanizer And a Squirrel who must Find a Technical Writer in The Sahara Desert,142,PG-13,MILLION ACE,578,4,2006,4.99,English
,13.99,A Fanciful Saga of a Student And a Mad Scientist who must Battle a Hunter in An Abandoned Mine Shaft,59,R,COMMANDMENTS EXPRESS,171,6,2006,4.99,English
,13.99,A Thrilling Documentary of a Feminist And a Feminist who must Confront a Feminist in A Baloon,112,PG-13,SPY MILE,835,6,2006,2.99,English
,22.99,A Fateful Tale of a Squirrel And a Forensic Psychologist who must Redeem a Man in Nigeria,112,NC-17,FORRESTER COMANCHEROS,330,7,2006,4.99,English
,19.99,A Intrepid Story of a Squirrel And a Crocodile who must Defeat a Monkey in The Outback,121,PG-13,PARIS WEEKEND,658,7,2006,2.99,English
,19.99,A Thoughtful Story of a Pioneer And a Woman who must Reach a Moose in Australia,112,R,QUILLS BULL,708,4,2006,4.99,English
,13.99,A Stunning Reflection of a Cat And a Woman who must Find a Astronaut in Ancient Japan,180,NC-17,CONFIDENTIAL INTERVIEW,174,6,2006,4.99,English
,26.99,A Brilliant Saga of a Pastry Chef And a Hunter who must Confront a Butler in Berlin,143,NC-17,CINCINATTI WHISPERER,151,5,2006,4.99,English
,17.99,A Unbelieveable Yarn of a Mad Scientist And a Cat who must Chase a Lumberjack in Australia,111,R,FROGMEN BREAKING,339,5,2006,0.99,English
,29.99,A Emotional Reflection of a Frisbee And a Boat who must Reach a Pastry Chef in An Abandoned Amusement Park,56,R,CUPBOARD SINNERS,199,4,2006,2.99,English
,15.99,A Thoughtful Drama of a Dentist And a Womanizer who must Meet a Husband in The Sahara Desert,58,PG,OKLAHOMA JUMANJI,635,7,2006,0.99,English
,27.99,A Astounding Drama of a Crocodile And a Mad Cow who must Build a Robot in A Jet Boat,167,R,CAMPUS REMEMBER,115,5,2006,2.99,English
,20.99,A Astounding Documentary of a Mad Cow And a Pioneer who must Challenge a Butler in The Sahara Desert,55,PG,COAST RAINBOW,164,4,2006,0.99,English
,28.99,A Touching Yarn of a Frisbee And a Dentist who must Fight a Composer in Ancient Japan,151,PG-13,HUNCHBACK IMPOSSIBLE,439,4,2006,4.99,English
,28.99,A Thrilling Reflection of a Pastry Chef And a Crocodile who must Reach a Teacher in The Outback,130,G,FARGO GANDHI,304,3,2006,2.99,English
,27.99,A Taut Character Study of a Woman And a A Shark who must Confront a Frisbee in Berlin,185,PG-13,GANGS PRIDE,349,4,2006,2.99,English
,24.99,A Stunning Character Study of a Mad Scientist And a Mad Cow who must Kill a Car in A Monastery,118,PG-13,BACKLASH UNDEFEATED,48,3,2006,4.99,English
,16.99,A Touching Panorama of a Waitress And a Woman who must Outrace a Dog in An Abandoned Amusement Park,91,PG-13,ANTHEM LUKE,28,5,2006,4.99,English
,13.99,A Awe-Inspiring Story of a Waitress And a Dog who must Discover a Dentist in Ancient Japan,102,PG,BOILED DARES,84,7,2006,4.99,English
,14.99,A Amazing Display of a Lumberjack And a Teacher who must Outrace a Woman in A U-Boat,59,R,JET NEIGHBORS,486,7,2006,4.99,English
,23.99,A Stunning Panorama of a Sumo Wrestler And a Husband who must Redeem a Madman in Ancient India,185,G,MUSCLE BRIGHT,609,7,2006,2.99,English
,28.99,A Fanciful Panorama of a Hunter And a Dentist who must Meet a Secret Agent in The Sahara Desert,52,G,LUST LOCK,542,3,2006,2.99,English
,15.99,A Fast-Paced Yarn of a Composer And a Frisbee who must Face a Moose in Nigeria,143,NC-17,STEEL SANTA,843,4,2006,4.99,English
,26.99,A Epic Yarn of a Cat And a Madman who must Vanquish a Dentist in An Abandoned Amusement Park,78,NC-17,LANGUAGE COWBOY,509,5,2006,0.99,English
,10.99,A Lacklusture Character Study of a A Shark And a Man who must Find a Forensic Psychologist in A U-Boat,97,PG-13,LUCKY FLYING,540,7,2006,2.99,English
,18.99,A Lacklusture Drama of a Girl And a Technical Writer who must Redeem a Monkey in A Shark Tank,70,PG-13,LOUISIANA HARRY,534,5,2006,0.99,English
