lingua_originale_id,costo_sostituzione,descrizione,durata,voto,titolo,film_id,durata_noleggio,data_rilascio,tariffa_noleggio,lingua
,22.99,A Astounding Story of a Girl And a Boy who must Challenge a Composer in New Orleans,163,PG,QUEEN LUKE,706,5,2006,4.99,English
,29.99,A Awe-Inspiring Panorama of a Robot And a Boat who must Overcome a Feminist in A U-Boat,100,PG-13,WYOMING STORM,994,6,2006,4.99,English
,22.99,A Thoughtful Character Study of a Waitress And a Feminist who must Build a Teacher in Ancient Japan,57,G,MOSQUITO ARMAGEDDON,598,6,2006,0.99,English
,15.99,A Awe-Inspiring Reflection of a Woman And a Cat who must Confront a Feminist in The Sahara Desert,52,G,HARPER DYING,402,3,2006,0.99,English
,17.99,A Unbelieveable Saga of a Teacher And a Monkey who must Fight a Girl in An Abandoned Mine Shaft,85,NC-17,GRAIL FRANKENSTEIN,375,4,2006,2.99,English
,13.99,A Boring Drama of a Explorer And a Man who must Kill a Lumberjack in A Manhattan Penthouse,71,G,BLOOD ARGONAUTS,82,3,2006,0.99,English
,12.99,A Touching Story of a Womanizer And a Composer who must Pursue a Husband in Nigeria,112,NC-17,CONEHEADS SMOOCHY,172,7,2006,4.99,English
,29.99,A Touching Epistle of a Madman And a Mad Cow who must Defeat a Student in Nigeria,62,NC-17,ARABIA DOGMA,34,6,2006,0.99,English
,10.99,A Touching Reflection of a Man And a Monkey who must Pursue a Womanizer in A MySQL Convention,168,PG-13,TRANSLATION SUMMER,907,4,2006,0.99,English
,18.99,A Epic Display of a Car And a Composer who must Overcome a Forensic Psychologist in The Gulf of Mexico,135,PG,DREAM PICKUP,252,6,2006,2.99,English
,13.99,A Beautiful Tale of a Hunter And a Mad Scientist who must Confront a Squirrel in The First Manned Space Station,59,PG-13,DAUGHTER MADIGAN,214,3,2006,4.99,English
,26.99,A Fanciful Documentary of a Frisbee And a Lumberjack who must Chase a Monkey in A Shark Tank,117,G,AFFAIR PREJUDICE,4,5,2006,2.99,English
,26.99,A Brilliant Panorama of a Astronaut And a Technical Writer who must Discover a Butler in A Manhattan Penthouse,139,PG-13,GROUNDHOG UNCUT,385,6,2006,4.99,English
,11.99,A Epic Display of a Crocodile And a Crocodile who must Confront a Dog in An Abandoned Amusement Park,96,PG,DRUMS DYNAMITE,258,6,2006,0.99,English
,17.99,A Boring Story of a Woman And a Moose who must Reach a Husband in A Shark Tank,150,PG-13,RUSHMORE MERMAID,754,6,2006,2.99,English
,19.99,A Boring Documentary of a Pioneer And a Man who must Vanquish a Man in Nigeria,133,NC-17,DRAGONFLY STRANGERS,251,6,2006,4.99,English
,12.99,A Intrepid Yarn of a Explorer And a Student who must Kill a Husband in An Abandoned Mine Shaft,53,NC-17,GUMP DATE,386,3,2006,4.99,English
,9.99,A Emotional Drama of a Husband And a Lumberjack who must Build a Cat in Ancient India,53,PG-13,THIN SAGEBRUSH,888,5,2006,4.99,English
,19.99,A Intrepid Story of a Butler And a Car who must Vanquish a Man in New Orleans,48,PG,HEAVEN FREEDOM,410,7,2006,2.99,English
,21.99,A Boring Display of a Moose And a Squirrel who must Outrace a Teacher in A Shark Tank,152,NC-17,LUCK OPUS,539,7,2006,2.99,English
,11.99,A Lacklusture Character Study of a Butler And a Car who must Redeem a Boat in An Abandoned Fun House,159,PG-13,DRIVER ANNIE,254,4,2006,2.99,English
,12.99,A Amazing Reflection of a Database Administrator And a Astronaut who must Outrace a Database Administrator in A Shark Tank,179,NC-17,ANONYMOUS HUMAN,27,7,2006,0.99,English
,25.99,A Emotional Panorama of a Lumberjack And a Hunter who must Meet a Girl in A Shark Tank,53,G,SUMMER SCARFACE,862,5,2006,0.99,English
,10.99,A Lacklusture Yarn of a Astronaut And a Pastry Chef who must Sink a Dog in A U-Boat,74,NC-17,PEARL DESTINY,669,3,2006,2.99,English
,16.99,A Action-Packed Epistle of a Dentist And a Moose who must Meet a Mad Cow in Ancient Japan,101,NC-17,CHOCOLAT HARRY,147,5,2006,0.99,English
,24.99,A Lacklusture Tale of a Crocodile And a Composer who must Defeat a Madman in A U-Boat,158,PG,FOOL MOCKINGBIRD,327,3,2006,4.99,English
,29.99,A Fateful Display of a Waitress And a Dentist who must Reach a Butler in Nigeria,163,PG,EVERYONE CRAFT,290,4,2006,0.99,English
,15.99,A Epic Saga of a Boy And a Dentist who must Outrace a Madman in A U-Boat,98,PG-13,PREJUDICE OLEANDER,694,6,2006,4.99,English
,26.99,A Thrilling Drama of a Madman And a Dentist who must Conquer a Boy in The Outback,185,PG,WORST BANGER,991,4,2006,2.99,English
,19.99,A Brilliant Display of a Frisbee And a Mad Scientist who must Succumb a Robot in Ancient China,124,PG-13,SPEED SUIT,826,7,2006,4.99,English
,9.99,A Action-Packed Reflection of a Car And a Moose who must Outgun a Car in A Shark Tank,84,R,PLUTO OLEANDER,686,5,2006,4.99,English
,25.99,A Amazing Drama of a Car And a Squirrel who must Pursue a Car in Soviet Georgia,46,PG-13,KWAI HOMEWARD,504,5,2006,0.99,English
,26.99,A Boring Drama of a Dog And a Forensic Psychologist who must Outrace a Explorer in Ancient India,146,NC-17,CHAPLIN LICENSE,136,7,2006,2.99,English
,15.99,A Thrilling Display of a Sumo Wrestler And a Girl who must Confront a Man in A Baloon,164,G,CLERKS ANGELS,156,3,2006,4.99,English
,11.99,A Stunning Display of a Butler And a Teacher who must Confront a A Shark in The First Manned Space Station,176,PG,GREEK EVERYONE,380,7,2006,2.99,English
,11.99,A Lacklusture Display of a Womanizer And a Dog who must Face a Sumo Wrestler in Ancient Japan,152,NC-17,ELIZABETH SHANE,279,7,2006,4.99,English
,26.99,A Epic Story of a A Shark And a Student who must Confront a Explorer in The Gulf of Mexico,161,G,DADDY PITTSBURGH,202,5,2006,4.99,English
,19.99,A Stunning Saga of a Butler And a Woman who must Pursue a Explorer in Australia,152,PG-13,SISTER FREDDY,801,5,2006,4.99,English
,11.99,A Amazing Display of a Robot And a Astronaut who must Fight a Womanizer in Berlin,86,R,YENTL IDAHO,995,5,2006,4.99,English
,27.99,A Unbelieveable Epistle of a Sumo Wrestler And a Hunter who must Chase a Forensic Psychologist in A Baloon,185,R,SWEET BROTHERHOOD,872,3,2006,2.99,English
,24.99,A Boring Character Study of a Boy And a A Shark who must Outrace a Womanizer in The Outback,172,PG,NORTHWEST POLISH,628,5,2006,2.99,English
,11.99,A Boring Character Study of a Boy And a Woman who must Battle a Astronaut in Australia,134,NC-17,JUNGLE CLOSER,492,6,2006,0.99,English
,22.99,A Lacklusture Drama of a Forensic Psychologist And a Car who must Redeem a Man in A Manhattan Penthouse,165,PG-13,SPEAKEASY DATE,825,6,2006,2.99,English
,10.99,A Emotional Saga of a Crocodile And a Sumo Wrestler who must Discover a Mad Cow in New Orleans,178,PG-13,WRONG BEHAVIOR,993,6,2006,2.99,English
,29.99,A Insightful Drama of a Womanizer And a Waitress who must Reach a Forensic Psychologist in The Outback,57,G,DOCTOR GRAIL,238,4,2006,2.99,English
,12.99,A Taut Saga of a Robot And a Database Administrator who must Challenge a Astronaut in California,65,PG,PATRIOT ROMAN,664,6,2006,2.99,English
,29.99,A Fateful Drama of a Frisbee And a Student who must Confront a Cat in A Shark Tank,73,NC-17,RANDOM GO,714,6,2006,2.99,English
,17.99,A Amazing Yarn of a Sumo Wrestler And a Boat who must Conquer a Waitress in New Orleans,58,G,RINGS HEARTBREAKERS,732,5,2006,0.99,English
,21.99,A Emotional Drama of a Mad Cow And a Boat who must Redeem a Secret Agent in A Shark Tank,125,PG-13,HUNTER ALTER,441,5,2006,2.99,English
,16.99,A Taut Saga of a Crocodile And a Boat who must Conquer a Hunter in A Shark Tank,175,PG,SPLASH GUMP,832,5,2006,0.99,English
,24.99,A Fanciful Saga of a Student And a Girl who must Find a Butler in Ancient Japan,167,PG-13,SHOW LORD,791,3,2006,4.99,English
,15.99,A Lacklusture Yarn of a Teacher And a Squirrel who must Overcome a Dog in A Shark Tank,116,NC-17,DUCK RACER,259,4,2006,2.99,English
,26.99,A Boring Drama of a Teacher And a Sumo Wrestler who must Challenge a Secret Agent in The Canadian Rockies,80,G,WAR NOTTING,957,7,2006,4.99,English
,26.99,A Unbelieveable Story of a Mad Scientist And a Woman who must Overcome a Dog in California,121,PG,DANGEROUS UPTOWN,207,7,2006,4.99,English
,11.99,A Amazing Epistle of a Student And a Astronaut who must Discover a Frisbee in The Canadian Rockies,114,PG,CARRIE BUNCH,122,7,2006,0.99,English
,10.99,A Brilliant Epistle of a Composer And a Database Administrator who must Vanquish a Mad Scientist in The First Manned Space Station,70,R,CANDIDATE PERDITION,116,4,2006,2.99,English
,27.99,A Thoughtful Documentary of a Crocodile And a Robot who must Outrace a Womanizer in The Outback,101,NC-17,RUNNER MADIGAN,752,6,2006,0.99,English
,16.99,A Fateful Story of a Robot And a Dentist who must Defeat a Astronaut in New Orleans,89,PG-13,DARES PLUTO,208,7,2006,2.99,English
,18.99,A Beautiful Reflection of a Student And a Student who must Fight a Moose in Berlin,123,G,BREAKFAST GOLDFINGER,95,5,2006,4.99,English
,14.99,A Insightful Panorama of a Monkey And a Sumo Wrestler who must Outrace a Mad Scientist in The Canadian Rockies,110,G,DRUMLINE CYCLONE,257,3,2006,0.99,English
,17.99,A Thrilling Tale of a Butler And a Astronaut who must Battle a Explorer in The First Manned Space Station,129,R,MUSIC BOONDOCK,610,7,2006,0.99,English
,12.99,A Unbelieveable Panorama of a Frisbee And a Hunter who must Vanquish a Monkey in Ancient India,58,R,CLOSER BANG,159,5,2006,4.99,English
,22.99,A Astounding Story of a Forensic Psychologist And a Forensic Psychologist who must Overcome a Moose in Ancient China,70,R,CHANCE RESURRECTION,135,3,2006,2.99,English
,20.99,A Astounding Saga of a Dog And a Boy who must Kill a Teacher in The First Manned Space Station,160,R,BEAR GRACELAND,59,4,2006,2.99,English
,14.99,A Fateful Display of a Monkey And a Car who must Sink a Husband in A MySQL Convention,144,NC-17,TOWERS HURRICANE,899,7,2006,0.99,English
,19.99,A Taut Reflection of a Astronaut And a Squirrel who must Fight a Squirrel in A Manhattan Penthouse,103,R,HOMEWARD CIDER,427,5,2006,0.99,English
,9.99,A Action-Packed Saga of a Teacher And a Frisbee who must Escape a Lumberjack in The Sahara Desert,144,PG-13,FACTORY DRAGON,299,4,2006,0.99,English
,23.99,A Insightful Drama of a A Shark And a Pioneer who must Find a Womanizer in The Outback,107,PG-13,WANDA CHAMBER,956,7,2006,4.99,English
,21.99,A Unbelieveable Character Study of a Womanizer And a Madman who must Reach a Man in The Outback,80,G,GARDEN ISLAND,350,3,2006,4.99,English
,12.99,A Insightful Panorama of a Crocodile And a Boat who must Conquer a Sumo Wrestler in A MySQL Convention,123,PG-13,SWARM GOLD,870,4,2006,0.99,English
,28.99,A Insightful Story of a Lumberjack And a Hunter who must Kill a Boy in Ancient Japan,106,G,SAGEBRUSH CLUELESS,757,4,2006,2.99,English
,9.99,A Astounding Saga of a Monkey And a Moose who must Conquer a Butler in A Shark Tank,100,R,DELIVERANCE MULHOLLAND,221,4,2006,0.99,English
,11.99,A Fateful Display of a Technical Writer And a Butler who must Battle a Sumo Wrestler in An Abandoned Mine Shaft,107,PG,PARTY KNOCK,660,7,2006,2.99,English
,29.99,A Stunning Story of a Dog And a Feminist who must Face a Forensic Psychologist in Berlin,122,G,EXTRAORDINARY CONQUERER,297,6,2006,2.99,English
,21.99,A Taut Documentary of a Database Administrator And a Waitress who must Reach a Mad Scientist in A Baloon Factory,154,R,GOLD RIVER,365,4,2006,4.99,English
,10.99,A Thoughtful Character Study of a Squirrel And a Technical Writer who must Outrace a Student in Ancient Japan,120,R,LOCK REAR,526,7,2006,2.99,English
,24.99,A Action-Packed Tale of a Boy And a Lumberjack who must Chase a Madman in A Baloon,184,NC-17,KING EVOLUTION,499,3,2006,4.99,English
,11.99,A Astounding Story of a Cat And a Database Administrator who must Build a Technical Writer in New Orleans,90,PG,SECRET GROUNDHOG,776,6,2006,4.99,English
,27.99,A Action-Packed Drama of a Feminist And a Girl who must Reach a Robot in The Canadian Rockies,63,R,DINOSAUR SECRETARY,231,7,2006,2.99,English
,9.99,A Thoughtful Tale of a Woman And a A Shark who must Conquer a Dog in A Monastery,130,NC-17,JASON TRAP,476,5,2006,2.99,English
,28.99,A Stunning Panorama of a Crocodile And a Womanizer who must Meet a Feminist in The Canadian Rockies,52,G,SIDE ARK,794,5,2006,0.99,English
,15.99,A Fanciful Display of a Teacher And a Crocodile who must Succumb a Girl in A Baloon,102,G,PANIC CLUB,653,3,2006,4.99,English
,11.99,A Stunning Epistle of a Sumo Wrestler And a Man who must Challenge a Waitress in Ancient India,74,PG,SILVERADO GOLDFINGER,798,4,2006,4.99,English
,13.99,A Awe-Inspiring Display of a Husband And a Squirrel who must Battle a Sumo Wrestler in A Jet Boat,157,PG,MULHOLLAND BEAST,605,7,2006,2.99,English
,27.99,A Stunning Epistle of a Cat And a Forensic Psychologist who must Confront a Pioneer in A Baloon,122,PG-13,CONFUSED CANDLES,175,3,2006,2.99,English
,29.99,A Epic Character Study of a Feminist And a Student who must Meet a Woman in A Baloon,124,PG-13,JINGLE SAGEBRUSH,487,6,2006,4.99,English
,26.99,A Fast-Paced Documentary of a Car And a Butler who must Find a Frisbee in A Jet Boat,134,R,WEEKEND PERSONAL,967,5,2006,2.99,English
,20.99,A Fateful Yarn of a Husband And a Dog who must Battle a Waitress in A Jet Boat,148,PG,TELEGRAPH VOYAGE,879,3,2006,4.99,English
,28.99,A Unbelieveable Drama of a Waitress And a Composer who must Sink a Mad Cow in Ancient Japan,46,PG-13,RIDGEMONT SUBMARINE,730,3,2006,0.99,English
,28.99,A Beautiful Display of a Pioneer And a Squirrel who must Vanquish a Sumo Wrestler in Soviet Georgia,108,R,HANDICAP BOONDOCK,395,4,2006,0.99,English
,23.99,A Insightful Documentary of a Waitress And a Butler who must Vanquish a Composer in Australia,126,R,WOMEN DORADO,982,4,2006,0.99,English
,12.99,A Amazing Saga of a Moose And a Pastry Chef who must Escape a Butler in Australia,64,G,SLEEPLESS MONSOON,805,5,2006,4.99,English
,22.99,A Awe-Inspiring Reflection of a Monkey And a Student who must Overcome a Dentist in The First Manned Space Station,125,NC-17,GENTLEMEN STAGE,353,6,2006,2.99,English
,11.99,A Amazing Drama of a Mad Scientist And a Composer who must Build a Husband in The Outback,182,PG,RECORDS ZORRO,719,7,2006,4.99,English
,9.99,A Lacklusture Saga of a Moose And a Teacher who must Kill a Forensic Psychologist in A MySQL Convention,138,PG,MAIDEN HOME,551,3,2006,4.99,English
,16.99,A Stunning Character Study of a Car And a Girl who must Succumb a Car in A MySQL Convention,140,PG,STEERS ARMAGEDDON,844,6,2006,4.99,English
,25.99,A Touching Documentary of a A Shark And a Car who must Build a Husband in Nigeria,139,R,HORROR REIGN,434,3,2006,0.99,English
,19.99,A Emotional Display of a Monkey And a Waitress who must Reach a Secret Agent in California,147,NC-17,RACER EGG,709,7,2006,2.99,English
,22.99,A Brilliant Panorama of a Moose And a Man who must Reach a Teacher in The Gulf of Mexico,109,NC-17,PANTHER REDS,655,5,2006,4.99,English
,13.99,A Intrepid Panorama of a Womanizer And a Girl who must Escape a Girl in A Manhattan Penthouse,91,R,FIGHT JAWBREAKER,314,3,2006,0.99,English
,20.99,A Astounding Story of a Forensic Psychologist And a Cat who must Battle a Teacher in An Abandoned Mine Shaft,79,PG-13,MOULIN WAKE,601,4,2006,0.99,English
,19.99,A Touching Saga of a Composer And a Moose who must Discover a Dentist in A MySQL Convention,104,R,DATE SPEED,213,4,2006,0.99,English
,25.99,A Fateful Documentary of a Crocodile And a Husband who must Face a Husband in The First Manned Space Station,115,G,CONNECTION MICROCOSMOS,178,6,2006,0.99,English
,29.99,A Intrepid Drama of a Teacher And a Moose who must Kill a Car in California,61,PG-13,RESERVOIR ADAPTATION,726,7,2006,2.99,English
,21.99,A Stunning Reflection of a Girl And a Secret Agent who must Succumb a Boy in A MySQL Convention,47,NC-17,HANOVER GALAXY,398,5,2006,4.99,English
,19.99,A Thrilling Panorama of a Pastry Chef And a Secret Agent who must Overcome a Student in A Manhattan Penthouse,52,NC-17,SPARTACUS CHEAPER,824,4,2006,4.99,English
,19.99,A Emotional Tale of a Pastry Chef And a Forensic Psychologist who must Succumb a Monkey in The Sahara Desert,47,G,DOWNHILL ENOUGH,247,3,2006,0.99,English
,22.99,A Emotional Epistle of a Pioneer And a Crocodile who must Battle a Man in A Manhattan Penthouse,47,PG,SUSPECTS QUILLS,869,4,2006,2.99,English
,22.99,A Awe-Inspiring Documentary of a Woman And a Husband who must Sink a Database Administrator in The First Manned Space Station,104,PG,CROW GREASE,194,6,2006,0.99,English
,18.99,A Action-Packed Yarn of a Boat And a Crocodile who must Build a Monkey in Berlin,62,G,HANGING DEEP,396,5,2006,4.99,English
,20.99,A Boring Panorama of a Woman And a Madman who must Overcome a Butler in A U-Boat,126,NC-17,WONDERFUL DROP,984,3,2006,2.99,English
,26.99,A Intrepid Reflection of a Mad Scientist And a Pioneer who must Overcome a Hunter in The First Manned Space Station,107,PG,HATE HANDICAP,404,4,2006,0.99,English
,27.99,A Awe-Inspiring Story of a Feminist And a Cat who must Conquer a Dog in A Monastery,65,G,BARBARELLA STREETCAR,55,6,2006,2.99,English
,12.99,A Fast-Paced Yarn of a Dog And a Frisbee who must Conquer a Hunter in Nigeria,78,PG,WATCH TRACY,963,5,2006,0.99,English
,9.99,A Fateful Epistle of a Crocodile And a Moose who must Kill a Explorer in Nigeria,92,PG,OPPOSITE NECKLACE,639,7,2006,4.99,English
,25.99,A Amazing Display of a Composer And a Forensic Psychologist who must Discover a Car in The Canadian Rockies,89,NC-17,GLEAMING JAWBREAKER,361,5,2006,2.99,English
,25.99,A Stunning Story of a Explorer And a Forensic Psychologist who must Face a Crocodile in A Shark Tank,144,G,DANCING FEVER,206,6,2006,0.99,English
,15.99,A Thoughtful Display of a Woman And a Astronaut who must Battle a Robot in Berlin,74,G,ANGELS LIFE,25,3,2006,2.99,English
,10.99,A Stunning Saga of a Sumo Wrestler And a Student who must Outrace a Moose in The Sahara Desert,168,NC-17,HAROLD FRENCH,401,6,2006,0.99,English
,17.99,A Beautiful Epistle of a Secret Agent And a Pioneer who must Chase a Astronaut in Ancient China,69,PG-13,LEBOWSKI SOLDIERS,514,6,2006,2.99,English
,12.99,A Fateful Story of a Monkey And a Girl who must Overcome a Pastry Chef in Ancient India,148,G,EASY GLADIATOR,271,5,2006,4.99,English
,25.99,A Insightful Reflection of a Boat And a Secret Agent who must Vanquish a Astronaut in An Abandoned Mine Shaft,80,PG,PEAK FOREVER,668,7,2006,4.99,English
,20.99,A Epic Display of a Sumo Wrestler And a Forensic Psychologist who must Build a Woman in An Abandoned Amusement Park,84,PG-13,PACKER MADIGAN,651,3,2006,0.99,English
,20.99,A Lacklusture Drama of a Waitress And a Husband who must Fight a Husband in California,104,NC-17,MERMAID INSECTS,570,5,2006,4.99,English
,12.99,A Boring Tale of a Composer And a Mad Cow who must Defeat a Car in The Outback,119,PG-13,IDENTITY LOVER,449,4,2006,2.99,English
,10.99,A Awe-Inspiring Drama of a Secret Agent And a Hunter who must Fight a Moose in Nigeria,100,NC-17,WITCHES PANIC,979,6,2006,4.99,English
,29.99,A Awe-Inspiring Epistle of a Feminist And a Girl who must Sink a Girl in The Outback,135,G,JAPANESE RUN,475,6,2006,0.99,English
,21.99,A Intrepid Yarn of a Monkey And a Boy who must Fight a Composer in A Manhattan Penthouse,151,PG-13,SCHOOL JACKET,769,5,2006,4.99,English
,17.99,A Fast-Paced Display of a Squirrel And a Explorer who must Outgun a Mad Scientist in Nigeria,145,PG-13,ROCKY WAR,739,4,2006,4.99,English
,17.99,A Touching Drama of a Dog And a Sumo Wrestler who must Conquer a Mad Scientist in Berlin,167,G,EXORCIST STING,293,6,2006,2.99,English
,9.99,A Thrilling Display of a Husband And a Butler who must Reach a Pastry Chef in California,48,PG-13,VALENTINE VANISHING,931,7,2006,0.99,English
,21.99,A Emotional Documentary of a Student And a Girl who must Build a Boat in Nigeria,148,G,BLANKET BEVERLY,80,7,2006,2.99,English
,17.99,A Fateful Display of a Cat And a Pioneer who must Challenge a Pastry Chef in A Baloon Factory,161,PG,GABLES METROPOLIS,345,3,2006,0.99,English
,12.99,A Lacklusture Epistle of a Dentist And a Technical Writer who must Find a Dog in A Monastery,79,G,SPIKING ELEMENT,828,7,2006,2.99,English
,27.99,A Epic Story of a Pastry Chef And a Woman who must Chase a Feminist in An Abandoned Fun House,82,R,ANYTHING SAVANNAH,30,4,2006,2.99,English
,12.99,A Beautiful Character Study of a Sumo Wrestler And a Dentist who must Find a Dog in California,152,PG,CENTER DINOSAUR,131,5,2006,4.99,English
,10.99,A Thrilling Panorama of a Man And a Woman who must Reach a Woman in Australia,132,PG-13,PLATOON INSTINCT,685,6,2006,4.99,English
,12.99,A Touching Panorama of a Lumberjack And a Frisbee who must Build a Dog in Australia,111,R,SUIT WALLS,861,3,2006,4.99,English
,16.99,A Amazing Character Study of a Robot And a Student who must Chase a Robot in Australia,62,G,UNBREAKABLE KARATE,920,3,2006,0.99,English
,9.99,A Fanciful Drama of a Frisbee And a Dog who must Fight a Madman in A Jet Boat,93,NC-17,STING PERSONAL,846,3,2006,4.99,English
,11.99,A Lacklusture Reflection of a Girl And a Husband who must Find a Robot in The Canadian Rockies,163,PG-13,KISS GLORY,500,5,2006,4.99,English
,11.99,A Awe-Inspiring Drama of a Technical Writer And a Composer who must Reach a Pastry Chef in A U-Boat,118,G,FIDELITY DEVIL,313,5,2006,4.99,English
,11.99,A Astounding Story of a Dog And a Squirrel who must Defeat a Woman in An Abandoned Amusement Park,119,R,APOCALYPSE FLAMINGOS,32,6,2006,4.99,English
,13.99,A Amazing Reflection of a Lumberjack And a Cat who must Discover a Husband in A MySQL Convention,82,PG,FROST HEAD,341,5,2006,0.99,English
,21.99,A Action-Packed Display of a Man And a Waitress who must Build a Dog in A MySQL Convention,66,PG,CHARADE DUFFEL,137,3,2006,2.99,English
,25.99,A Intrepid Display of a Madman And a Feminist who must Pursue a Pioneer in The First Manned Space Station,150,R,GRINCH MASSAGE,381,7,2006,4.99,English
,16.99,A Intrepid Panorama of a Butler And a Composer who must Meet a Mad Cow in The Sahara Desert,154,R,DOUBTFIRE LABYRINTH,246,5,2006,4.99,English
,27.99,A Brilliant Panorama of a Dentist And a Moose who must Find a Student in The Gulf of Mexico,70,G,COLDBLOODED DARLING,165,7,2006,4.99,English
,11.99,A Emotional Yarn of a Teacher And a Girl who must Find a Teacher in A Baloon Factory,102,PG-13,SCARFACE BANG,768,3,2006,4.99,English
,16.99,A Touching Saga of a Crocodile And a Crocodile who must Discover a Technical Writer in Nigeria,109,PG-13,RUGRATS SHAKESPEARE,748,4,2006,0.99,English
,11.99,A Fanciful Character Study of a Student And a Explorer who must Succumb a Composer in An Abandoned Mine Shaft,161,R,KILLER INNOCENT,498,7,2006,2.99,English
,29.99,A Amazing Yarn of a Hunter And a Butler who must Defeat a Boy in A Jet Boat,171,NC-17,JERICHO MULAN,483,3,2006,2.99,English
,22.99,A Fast-Paced Reflection of a Waitress And a Hunter who must Defeat a Forensic Psychologist in A Baloon,74,NC-17,MAGUIRE APACHE,550,6,2006,2.99,English
,15.99,A Thrilling Documentary of a Forensic Psychologist And a Butler who must Defeat a Explorer in A Jet Boat,63,R,FORREST SONS,329,4,2006,2.99,English
,20.99,A Awe-Inspiring Story of a Monkey And a Pastry Chef who must Succumb a Womanizer in A MySQL Convention,63,PG-13,INTOLERABLE INTENTIONS,466,6,2006,4.99,English
,10.99,A Fanciful Character Study of a Feminist And a Madman who must Find a Explorer in A Baloon Factory,174,PG-13,EVOLUTION ALTER,291,5,2006,0.99,English
,15.99,A Epic Tale of a Moose And a Girl who must Confront a Monkey in Ancient India,54,R,AIRPORT POLLOCK,8,6,2006,4.99,English
,13.99,A Beautiful Tale of a Dentist And a Mad Cow who must Battle a Moose in The Sahara Desert,108,G,AUTUMN CROW,46,3,2006,4.99,English
,17.99,A Thoughtful Story of a Astronaut And a Composer who must Conquer a Dog in The Sahara Desert,148,PG-13,OUTLAW HANKY,648,7,2006,4.99,English
,16.99,A Epic Reflection of a Pastry Chef And a Explorer who must Reach a Dentist in The Sahara Desert,70,NC-17,GUNFIGHT MOON,388,5,2006,0.99,English
,26.99,A Astounding Drama of a Astronaut And a Cat who must Discover a Woman in The First Manned Space Station,142,NC-17,BIKINI BORROWERS,70,7,2006,4.99,English
,29.99,A Insightful Yarn of a Boy And a Sumo Wrestler who must Outgun a Car in The Outback,181,G,LAWLESS VISION,510,6,2006,4.99,English
,21.99,A Thoughtful Panorama of a Database Administrator And a Mad Scientist who must Outgun a Mad Scientist in A Jet Boat,114,PG-13,ALABAMA DEVIL,9,3,2006,2.99,English
,13.99,A Astounding Panorama of a Car And a Mad Scientist who must Battle a Lumberjack in A MySQL Convention,68,R,DOOM DANCING,242,4,2006,0.99,English
,19.99,A Insightful Panorama of a Teacher And a Teacher who must Overcome a Mad Cow in An Abandoned Fun House,135,PG,WALLS ARTIST,955,7,2006,4.99,English
,10.99,A Insightful Display of a A Shark And a Monkey who must Face a Database Administrator in Ancient India,166,PG-13,CONTACT ANONYMOUS,181,7,2006,2.99,English
,9.99,A Astounding Documentary of a Butler And a Cat who must Find a Frisbee in Ancient China,118,PG,PATHS CONTROL,662,3,2006,4.99,English
,10.99,A Intrepid Character Study of a Robot And a Monkey who must Reach a Secret Agent in An Abandoned Amusement Park,84,R,SLING LUKE,808,5,2006,0.99,English
,22.99,A Astounding Epistle of a Technical Writer And a Teacher who must Fight a Squirrel in The Sahara Desert,118,R,ORIENT CLOSER,643,3,2006,2.99,English
,14.99,A Taut Drama of a Mad Scientist And a Man who must Escape a Pioneer in An Abandoned Mine Shaft,173,G,CONQUERER NUTS,179,4,2006,4.99,English
,22.99,A Boring Saga of a Database Administrator And a Womanizer who must Battle a Waitress in Nigeria,148,R,ARMY FLINTSTONES,40,4,2006,0.99,English
,10.99,A Fast-Paced Tale of a Boat And a Teacher who must Succumb a Composer in An Abandoned Mine Shaft,99,G,ARMAGEDDON LOST,39,5,2006,0.99,English
,18.99,A Epic Reflection of a Womanizer And a Squirrel who must Discover a Husband in A Jet Boat,61,PG-13,DRIFTER COMMANDMENTS,253,5,2006,4.99,English
,16.99,A Action-Packed Yarn of a Womanizer And a Lumberjack who must Chase a Sumo Wrestler in A Monastery,169,NC-17,HEDWIG ALTER,413,7,2006,2.99,English
,16.99,A Fateful Display of a Womanizer And a Mad Scientist who must Outgun a A Shark in Soviet Georgia,122,G,BEACH HEARTBREAKERS,58,6,2006,2.99,English
