lingua_originale_id,costo_sostituzione,descrizione,durata,voto,titolo,film_id,durata_noleggio,data_rilascio,tariffa_noleggio,lingua
,11.99,A Emotional Story of a Squirrel And a Crocodile who must Succumb a Husband in The Sahara Desert,99,PG,SABRINA MIDNIGHT,755,5,2006,4.99,English
,21.99,A Unbelieveable Story of a Teacher And a Boat who must Confront a Moose in A Baloon,71,PG-13,KNOCK WARLOCK,502,4,2006,2.99,English
,29.99,A Emotional Yarn of a Composer And a Man who must Escape a Butler in The Gulf of Mexico,82,PG-13,REIGN GENTLEMEN,723,3,2006,2.99,English
,14.99,A Awe-Inspiring Character Study of a Boat And a Boy who must Kill a Pastry Chef in The Sahara Desert,103,G,FIREHOUSE VIETNAM,318,7,2006,0.99,English
,18.99,A Brilliant Reflection of a Feminist And a Dog who must Fight a Boy in A Baloon Factory,104,R,TITANIC BOONDOCK,892,3,2006,4.99,English
,16.99,A Amazing Drama of a Car And a Robot who must Pursue a Dentist in New Orleans,124,R,CLONES PINOCCHIO,158,6,2006,2.99,English
,19.99,A Intrepid Drama of a Frisbee And a Hunter who must Kill a Secret Agent in New Orleans,61,NC-17,CASSIDY WYOMING,125,5,2006,2.99,English
,27.99,A Fast-Paced Reflection of a Explorer And a Butler who must Battle a Madman in An Abandoned Amusement Park,112,R,CRUSADE HONEY,197,4,2006,2.99,English
,29.99,A Fateful Character Study of a Boat And a Cat who must Find a Database Administrator in A Jet Boat,153,PG-13,RIGHT CRANES,731,7,2006,4.99,English
,28.99,A Fast-Paced Display of a Composer And a Moose who must Sink a Robot in An Abandoned Mine Shaft,175,G,BEAUTY GREASE,61,5,2006,4.99,English
,10.99,A Emotional Character Study of a Dentist And a Crocodile who must Meet a Sumo Wrestler in California,85,G,AMISTAD MIDSUMMER,22,6,2006,2.99,English
,13.99,A Beautiful Panorama of a Pastry Chef And a A Shark who must Battle a Pioneer in Soviet Georgia,51,NC-17,HALL CASSIDY,392,5,2006,4.99,English
,21.99,A Amazing Display of a Car And a Monkey who must Fight a Teacher in Soviet Georgia,127,R,SUBMARINE BED,858,5,2006,4.99,English
,16.99,A Taut Yarn of a Hunter And a Astronaut who must Conquer a Database Administrator in The Sahara Desert,137,PG-13,PHILADELPHIA WIFE,676,7,2006,4.99,English
,21.99,A Taut Character Study of a Boy And a Robot who must Redeem a Mad Scientist in Ancient India,74,NC-17,LUKE MUMMY,541,5,2006,2.99,English
,19.99,A Touching Documentary of a Dentist And a Sumo Wrestler who must Overcome a Boy in The Gulf of Mexico,93,G,PANKY SUBMARINE,654,4,2006,4.99,English
,20.99,A Beautiful Tale of a Astronaut And a Mad Cow who must Challenge a Cat in A Baloon Factory,83,PG,MOON BUNCH,595,7,2006,0.99,English
,26.99,A Thrilling Character Study of a Robot And a Squirrel who must Face a Dog in Ancient India,71,R,TRAIN BUNCH,904,3,2006,4.99,English
,29.99,A Epic Display of a Hunter And a Feminist who must Sink a Car in A U-Boat,93,G,HILLS NEIGHBORS,417,5,2006,0.99,English
,18.99,A Unbelieveable Documentary of a Teacher And a Monkey who must Defeat a Explorer in A U-Boat,105,PG,WON DARES,983,7,2006,2.99,English
,17.99,A Intrepid Tale of a Madman And a Astronaut who must Challenge a Hunter in A Monastery,157,PG-13,PAST SUICIDES,661,5,2006,4.99,English
,29.99,A Intrepid Drama of a Teacher And a Butler who must Build a Pastry Chef in Berlin,60,G,SMILE EARRING,811,4,2006,2.99,English
,21.99,A Touching Reflection of a Man And a Man who must Sink a Robot in The Outback,146,R,HAMLET WISDOM,394,7,2006,2.99,English
,24.99,A Action-Packed Reflection of a Pastry Chef And a Composer who must Discover a Mad Scientist in The First Manned Space Station,147,PG-13,ARACHNOPHOBIA ROLLERCOASTER,35,4,2006,2.99,English
,9.99,A Awe-Inspiring Documentary of a A Shark And a Dentist who must Outrace a Pastry Chef in The Canadian Rockies,59,G,HEARTBREAKERS BRIGHT,409,3,2006,4.99,English
,27.99,A Thrilling Yarn of a Dog And a Moose who must Kill a Pastry Chef in A Manhattan Penthouse,144,G,PACIFIC AMISTAD,650,3,2006,0.99,English
,24.99,A Beautiful Panorama of a Lumberjack And a Forensic Psychologist who must Overcome a Frisbee in A Baloon,126,PG-13,ELEPHANT TROJAN,277,4,2006,4.99,English
,28.99,A Awe-Inspiring Reflection of a Astronaut And a A Shark who must Defeat a Forensic Psychologist in California,48,NC-17,SUNSET RACER,866,6,2006,0.99,English
,9.99,A Intrepid Epistle of a Woman And a Forensic Psychologist who must Succumb a Astronaut in A Manhattan Penthouse,112,PG-13,WAIT CIDER,953,3,2006,0.99,English
,17.99,A Awe-Inspiring Reflection of a Crocodile And a Sumo Wrestler who must Meet a Forensic Psychologist in An Abandoned Mine Shaft,50,PG,PILOT HOOSIERS,679,6,2006,2.99,English
,9.99,A Beautiful Display of a Mad Cow And a Dog who must Redeem a Waitress in An Abandoned Amusement Park,141,R,SUN CONFESSIONS,863,5,2006,0.99,English
,20.99,A Brilliant Documentary of a Astronaut And a Squirrel who must Succumb a Student in The Gulf of Mexico,165,PG-13,DARLING BREAKING,211,7,2006,4.99,English
,27.99,A Intrepid Documentary of a Forensic Psychologist And a Mad Scientist who must Face a Explorer in A U-Boat,141,PG-13,DYNAMITE TARZAN,266,4,2006,0.99,English
,12.99,A Emotional Character Study of a Frisbee And a Mad Scientist who must Build a Madman in California,135,NC-17,SIERRA DIVIDE,796,3,2006,0.99,English
,12.99,A Unbelieveable Yarn of a Database Administrator And a Woman who must Succumb a A Shark in A U-Boat,169,NC-17,OUTBREAK DIVINE,646,6,2006,0.99,English
,20.99,A Awe-Inspiring Story of a Butler And a Sumo Wrestler who must Redeem a Boy in New Orleans,74,PG,MODERN DORADO,589,3,2006,0.99,English
,24.99,A Brilliant Saga of a Boat And a Mad Scientist who must Meet a Moose in Ancient India,85,NC-17,WONKA SEA,986,6,2006,2.99,English
,24.99,A Boring Drama of a Man And a Forensic Psychologist who must Face a Frisbee in Ancient India,152,R,TUXEDO MILE,917,3,2006,2.99,English
,10.99,A Boring Reflection of a Lumberjack And a Feminist who must Discover a Woman in Nigeria,183,G,CATCH AMISTAD,128,7,2006,0.99,English
,13.99,A Action-Packed Reflection of a Composer And a Mad Scientist who must Face a Pioneer in A MySQL Convention,116,PG,WORDS HUNTER,987,3,2006,2.99,English
,14.99,A Touching Drama of a Teacher And a Cat who must Challenge a Technical Writer in A U-Boat,179,NC-17,YOUTH KICK,997,4,2006,0.99,English
,12.99,A Astounding Display of a Explorer And a Boat who must Vanquish a Car in The First Manned Space Station,176,G,HOOSIERS BIRDCAGE,431,3,2006,2.99,English
,19.99,A Beautiful Yarn of a Teacher And a Cat who must Build a Car in A U-Boat,76,PG-13,DESTINATION JERK,225,3,2006,0.99,English
,29.99,A Action-Packed Epistle of a Robot And a Car who must Chase a Boat in Ancient Japan,145,PG-13,FLOATS GARDEN,325,6,2006,2.99,English
,29.99,A Thrilling Character Study of a Squirrel And a Lumberjack who must Face a Hunter in A MySQL Convention,149,PG-13,RIVER OUTLAW,733,4,2006,0.99,English
,27.99,A Fast-Paced Documentary of a Mad Cow And a Boy who must Pursue a Dentist in A Baloon,46,PG,IRON MOON,469,7,2006,4.99,English
,21.99,A Astounding Yarn of a Womanizer And a Dog who must Reach a Waitress in A MySQL Convention,120,PG-13,KARATE MOON,494,4,2006,0.99,English
,22.99,A Emotional Panorama of a Dentist And a Crocodile who must Meet a Boy in Berlin,164,R,VIRGINIAN PLUTO,945,5,2006,0.99,English
,23.99,A Brilliant Yarn of a Cat And a Car who must Confront a Explorer in Ancient Japan,149,R,SPIRIT FLINTSTONES,830,7,2006,0.99,English
,29.99,A Intrepid Drama of a Butler And a Lumberjack who must Challenge a Database Administrator in A Manhattan Penthouse,159,G,WEST LION,969,4,2006,4.99,English
,26.99,A Fast-Paced Panorama of a Lumberjack And a Database Administrator who must Defeat a Madman in A MySQL Convention,60,PG-13,SHAKESPEARE SADDLE,782,6,2006,2.99,English
,20.99,A Emotional Panorama of a Secret Agent And a Waitress who must Escape a Composer in Soviet Georgia,135,G,GREASE YOUTH,377,7,2006,0.99,English
,27.99,A Brilliant Documentary of a Butler And a Frisbee who must Build a Astronaut in New Orleans,64,R,DESERT POSEIDON,222,4,2006,4.99,English
,16.99,A Intrepid Documentary of a Astronaut And a Forensic Psychologist who must Find a Frisbee in An Abandoned Fun House,112,R,CROWDS TELEMARK,195,3,2006,4.99,English
,29.99,A Fast-Paced Tale of a A Shark And a Student who must Meet a Crocodile in Ancient China,179,R,SLACKER LIAISONS,803,7,2006,4.99,English
,20.99,A Brilliant Documentary of a Monkey And a Car who must Conquer a Crocodile in A Shark Tank,51,G,EXCITEMENT EVE,292,3,2006,0.99,English
,18.99,A Fanciful Yarn of a Crocodile And a Forensic Psychologist who must Discover a Crocodile in The Outback,65,PG,LOVELY JINGLE,536,3,2006,2.99,English
,27.99,A Thoughtful Documentary of a Dentist And a Forensic Psychologist who must Defeat a Waitress in Berlin,57,PG,DAWN POND,215,4,2006,4.99,English
,11.99,A Fanciful Documentary of a Boy And a Woman who must Redeem a Womanizer in A Jet Boat,100,G,HYDE DOCTOR,445,5,2006,2.99,English
,21.99,A Action-Packed Drama of a Dentist And a Crocodile who must Battle a Feminist in The Canadian Rockies,150,PG,ALI FOREVER,13,4,2006,4.99,English
,26.99,A Boring Character Study of a Student And a Robot who must Meet a Woman in California,123,NC-17,MASK PEACH,561,6,2006,2.99,English
,22.99,A Fanciful Saga of a Hunter And a Pastry Chef who must Vanquish a Boy in Australia,136,PG,ALASKA PHANTOM,12,6,2006,0.99,English
,11.99,A Beautiful Panorama of a Boat And a Crocodile who must Outrace a Dog in Australia,175,NC-17,MODEL FISH,588,4,2006,4.99,English
,12.99,A Amazing Yarn of a Robot And a Womanizer who must Discover a Forensic Psychologist in Berlin,166,PG-13,MINE TITANS,580,3,2006,4.99,English
,26.99,A Action-Packed Tale of a Sumo Wrestler And a A Shark who must Meet a Frisbee in California,139,NC-17,DORADO NOTTING,244,5,2006,4.99,English
,23.99,A Emotional Drama of a Sumo Wrestler And a Dentist who must Confront a Sumo Wrestler in A Baloon,67,R,SILENCE KANE,797,7,2006,0.99,English
,20.99,A Awe-Inspiring Panorama of a Crocodile And a Moose who must Confront a Girl in A Baloon,60,R,BUBBLE GROSSE,102,4,2006,4.99,English
,13.99,A Fateful Reflection of a Dog And a Mad Scientist who must Meet a Mad Scientist in New Orleans,113,NC-17,LADYBUGS ARMAGEDDON,507,4,2006,0.99,English
,10.99,A Boring Epistle of a Crocodile And a Lumberjack who must Outgun a Moose in Ancient China,160,PG,STOCK GLASS,847,7,2006,2.99,English
,14.99,A Fateful Story of a A Shark And a Explorer who must Succumb a Technical Writer in A Jet Boat,185,G,DARN FORRESTER,212,7,2006,4.99,English
,21.99,A Fanciful Drama of a Moose And a Squirrel who must Conquer a Pioneer in The Canadian Rockies,125,NC-17,BULL SHAWSHANK,105,6,2006,0.99,English
,20.99,A Taut Story of a Waitress And a Man who must Face a Car in A Baloon Factory,138,PG-13,SPIRITED CASUALTIES,831,5,2006,0.99,English
,12.99,A Intrepid Yarn of a Pastry Chef And a Mad Scientist who must Challenge a Secret Agent in Ancient Japan,85,PG,BLACKOUT PRIVATE,78,7,2006,2.99,English
,17.99,A Epic Documentary of a Boy And a Monkey who must Pursue a Astronaut in Berlin,48,PG,PELICAN COMFORTS,670,4,2006,4.99,English
,27.99,A Fast-Paced Reflection of a Cat And a Mad Cow who must Fight a Car in The Sahara Desert,164,R,UNITED PILOT,925,3,2006,0.99,English
,28.99,A Intrepid Tale of a Boat And a Monkey who must Kill a Cat in California,168,PG,DYING MAKER,265,5,2006,4.99,English
,9.99,A Fateful Documentary of a Robot And a Student who must Battle a Cat in A Monastery,185,G,CONTROL ANTHEM,182,7,2006,4.99,English
,22.99,A Stunning Character Study of a Crocodile And a Pioneer who must Pursue a Teacher in New Orleans,179,R,FLIGHT LIES,323,7,2006,4.99,English
,23.99,A Fanciful Panorama of a Mad Scientist And a Woman who must Pursue a Astronaut in Ancient India,77,NC-17,ENEMY ODDS,284,5,2006,4.99,English
,21.99,A Fast-Paced Story of a Pioneer And a Astronaut who must Reach a Boat in A Baloon,110,G,SAMURAI LION,760,5,2006,2.99,English
,9.99,A Astounding Story of a Pastry Chef And a Database Administrator who must Fight a Man in The Outback,171,R,ROXANNE REBEL,747,5,2006,0.99,English
,28.99,A Taut Epistle of a Feminist And a Sumo Wrestler who must Battle a Crocodile in Australia,83,R,FUGITIVE MAGUIRE,342,7,2006,4.99,English
,22.99,A Insightful Reflection of a A Shark And a Dog who must Kill a Butler in An Abandoned Amusement Park,58,NC-17,DANCES NONE,205,3,2006,0.99,English
,15.99,A Intrepid Yarn of a Frisbee And a Dog who must Build a Astronaut in A Baloon Factory,138,NC-17,POCUS PULP,687,6,2006,0.99,English
,28.99,A Thoughtful Reflection of a Mad Scientist And a Moose who must Kill a Husband in A Baloon,150,G,SATURDAY LAMBS,764,3,2006,4.99,English
,19.99,A Fast-Paced Yarn of a Waitress And a Composer who must Outgun a Dentist in California,72,NC-17,BOWFINGER GABLES,92,7,2006,4.99,English
,20.99,A Action-Packed Display of a Feminist And a Pioneer who must Pursue a Dog in A Baloon Factory,88,R,HOLY TADPOLE,425,6,2006,0.99,English
,21.99,A Fast-Paced Panorama of a Technical Writer And a Mad Scientist who must Find a Feminist in An Abandoned Mine Shaft,113,PG-13,ATTACKS HATE,44,5,2006,4.99,English
,15.99,A Fateful Character Study of a Crocodile And a Monkey who must Meet a Dentist in Australia,160,NC-17,MUMMY CREATURES,606,3,2006,0.99,English
,22.99,A Thrilling Reflection of a Waitress And a Butler who must Battle a Butler in A Jet Boat,126,NC-17,MONTEZUMA COMMAND,594,6,2006,0.99,English
,20.99,A Boring Tale of a Squirrel And a Dog who must Challenge a Madman in The Gulf of Mexico,75,R,FIDDLER LOST,312,4,2006,4.99,English
,13.99,A Emotional Reflection of a Womanizer And a Pioneer who must Face a Squirrel in Berlin,128,R,GALAXY SWEETHEARTS,346,4,2006,4.99,English
,27.99,A Brilliant Display of a Composer And a Cat who must Succumb a A Shark in Ancient India,171,PG,TRAMP OTHERS,906,4,2006,0.99,English
,20.99,A Stunning Drama of a Woman And a Lumberjack who must Overcome a A Shark in The Canadian Rockies,100,PG,PIRATES ROXANNE,681,4,2006,0.99,English
,17.99,A Action-Packed Panorama of a Mad Scientist And a Robot who must Challenge a Student in Nigeria,53,PG,TEQUILA PAST,883,6,2006,4.99,English
,10.99,A Emotional Drama of a Monkey And a Robot who must Defeat a Monkey in New Orleans,179,PG-13,KICK SAVANNAH,496,3,2006,0.99,English
,22.99,A Thrilling Drama of a Frisbee And a Lumberjack who must Sink a Man in Nigeria,120,NC-17,CALENDAR GUNFIGHT,112,4,2006,4.99,English
,24.99,A Awe-Inspiring Saga of a Composer And a Frisbee who must Succumb a Pioneer in The Sahara Desert,46,PG-13,LABYRINTH LEAGUE,505,6,2006,2.99,English
,26.99,A Thrilling Documentary of a Technical Writer And a A Shark who must Face a Pioneer in A Shark Tank,51,NC-17,SIMON NORTH,799,3,2006,0.99,English
,18.99,A Astounding Saga of a Mad Cow And a Pastry Chef who must Discover a Husband in Ancient India,71,PG-13,MANNEQUIN WORST,558,3,2006,2.99,English
,15.99,A Emotional Epistle of a Boat And a Mad Scientist who must Outrace a Robot in An Abandoned Mine Shaft,122,R,ILLUSION AMELIE,452,4,2006,0.99,English
,12.99,A Lacklusture Character Study of a Mad Scientist And a Womanizer who must Outrace a Explorer in A Monastery,97,PG,INVASION CYCLONE,468,5,2006,2.99,English
,10.99,A Astounding Yarn of a Pioneer And a Crocodile who must Defeat a A Shark in The Outback,83,G,WARLOCK WEREWOLF,959,6,2006,2.99,English
,23.99,A Touching Documentary of a Husband And a Boat who must Meet a Pastry Chef in A Baloon Factory,77,G,PICKUP DRIVING,678,3,2006,2.99,English
,15.99,A Unbelieveable Character Study of a Dog And a Mad Cow who must Kill a Monkey in Berlin,127,R,SEVEN SWARM,781,4,2006,4.99,English
,19.99,A Thoughtful Panorama of a Car And a Crocodile who must Sink a Monkey in The Sahara Desert,149,G,COLOR PHILADELPHIA,166,6,2006,2.99,English
,26.99,A Action-Packed Yarn of a Secret Agent And a Technical Writer who must Battle a Sumo Wrestler in The First Manned Space Station,139,R,WORKER TARZAN,988,7,2006,2.99,English
,16.99,A Fast-Paced Documentary of a Pastry Chef And a Crocodile who must Chase a Squirrel in The Gulf of Mexico,126,R,FREAKY POCUS,333,7,2006,2.99,English
,28.99,A Thoughtful Yarn of a Womanizer And a Dog who must Challenge a Madman in The Gulf of Mexico,177,R,DOUBLE WRATH,245,4,2006,0.99,English
,28.99,A Touching Saga of a Hunter And a Butler who must Discover a Butler in A Jet Boat,62,PG-13,AIRPLANE SIERRA,7,6,2006,4.99,English
,26.99,A Unbelieveable Tale of a Woman And a Lumberjack who must Fight a Frisbee in A U-Boat,75,R,STAMPEDE DISTURBING,840,5,2006,0.99,English
,29.99,A Intrepid Yarn of a Explorer And a Pastry Chef who must Pursue a Mad Cow in A U-Boat,172,PG-13,UNCUT SUICIDES,921,7,2006,2.99,English
,11.99,A Brilliant Yarn of a Car And a Database Administrator who must Escape a Boy in A MySQL Convention,166,PG,MURDER ANTITRUST,608,6,2006,2.99,English
,11.99,A Awe-Inspiring Reflection of a Monkey And a Dentist who must Overcome a Pioneer in A U-Boat,147,R,MADISON TRAP,544,4,2006,2.99,English
,10.99,A Astounding Drama of a Boy And a Lumberjack who must Fight a Butler in A Baloon,146,PG,COWBOY DOOM,185,3,2006,2.99,English
,18.99,A Fateful Saga of a Womanizer And a Student who must Defeat a Butler in A Monastery,167,NC-17,INCH JET,456,6,2006,4.99,English
,23.99,A Emotional Drama of a A Shark And a Database Administrator who must Vanquish a Pioneer in Soviet Georgia,94,NC-17,ALICE FANTASIA,14,6,2006,0.99,English
,21.99,A Astounding Documentary of a Hunter And a Boy who must Confront a Boy in A MySQL Convention,141,PG-13,HOMICIDE PEACH,428,6,2006,2.99,English
,22.99,A Thrilling Documentary of a Composer And a Secret Agent who must Succumb a Cat in Berlin,175,PG,PATTON INTERVIEW,665,4,2006,2.99,English
,21.99,A Action-Packed Epistle of a Feminist And a Astronaut who must Conquer a Boat in A Manhattan Penthouse,150,NC-17,CHRISTMAS MOONSHINE,149,7,2006,0.99,English
,13.99,A Emotional Character Study of a Car And a Girl who must Face a Composer in A U-Boat,93,G,SUICIDES SILENCE,860,4,2006,4.99,English
,13.99,A Emotional Yarn of a Girl And a Dog who must Challenge a Composer in Ancient Japan,101,G,DWARFS ALTER,264,6,2006,2.99,English
,26.99,A Action-Packed Display of a Sumo Wrestler And a Car who must Overcome a Waitress in A Baloon Factory,108,R,GORGEOUS BINGO,370,4,2006,2.99,English
,24.99,A Astounding Character Study of a Monkey And a Moose who must Outgun a Cat in A U-Boat,174,G,ITALIAN AFRICAN,472,3,2006,4.99,English
,12.99,A Stunning Display of a Moose And a Database Administrator who must Pursue a Composer in A Jet Boat,136,PG-13,MAKER GABLES,553,4,2006,0.99,English
,15.99,A Touching Display of a Hunter And a Secret Agent who must Redeem a Husband in The Outback,54,G,KILL BROTHERHOOD,497,4,2006,0.99,English
,23.99,A Stunning Display of a Mad Scientist And a Technical Writer who must Succumb a Monkey in A Shark Tank,95,PG,HORN WORKING,433,4,2006,2.99,English
,12.99,A Fateful Yarn of a Lumberjack And a Feminist who must Conquer a Student in A Jet Boat,73,PG-13,BRIGHT ENCOUNTERS,98,4,2006,4.99,English
,29.99,A Boring Epistle of a Pioneer And a Mad Scientist who must Escape a Frisbee in The Gulf of Mexico,140,R,LOATHING LEGALLY,525,4,2006,0.99,English
,23.99,A Fast-Paced Saga of a Frisbee And a Astronaut who must Overcome a Feminist in Ancient India,103,NC-17,BIRDCAGE CASPER,76,4,2006,0.99,English
,22.99,A Touching Tale of a Girl And a Crocodile who must Discover a Waitress in Nigeria,150,PG-13,BINGO TALENTED,73,5,2006,2.99,English
,22.99,A Emotional Reflection of a Sumo Wrestler And a Monkey who must Conquer a Robot in The Sahara Desert,83,NC-17,HUSTLER PARTY,444,3,2006,4.99,English
,25.99,A Beautiful Yarn of a Pioneer And a Monkey who must Pursue a Explorer in The Sahara Desert,68,NC-17,ARK RIDGEMONT,38,6,2006,0.99,English
,20.99,A Boring Tale of a Husband And a Boy who must Fight a Squirrel in Ancient China,103,R,MOTHER OLEANDER,599,3,2006,0.99,English
,25.99,A Action-Packed Character Study of a Dog And a Lumberjack who must Outrace a Moose in The Gulf of Mexico,159,G,NEWSIES STORY,622,4,2006,0.99,English
,23.99,A Emotional Documentary of a Moose And a Car who must Redeem a Mad Cow in A Baloon Factory,154,PG,SANTA PARIS,761,7,2006,2.99,English
,23.99,A Fanciful Yarn of a Database Administrator And a Mad Cow who must Pursue a Womanizer in Berlin,175,NC-17,LAWRENCE LOVE,511,7,2006,0.99,English
,27.99,A Taut Tale of a Butler And a Mad Scientist who must Build a Crocodile in Ancient China,70,NC-17,CLUE GRAIL,161,6,2006,4.99,English
,18.99,A Thrilling Documentary of a Husband And a Feminist who must Face a Mad Scientist in Ancient China,184,R,SMOOCHY CONTROL,813,7,2006,0.99,English
,16.99,A Awe-Inspiring Reflection of a Dog And a Student who must Kill a Car in An Abandoned Fun House,166,PG,MOTIONS DETAILS,600,5,2006,0.99,English
,16.99,A Taut Tale of a Explorer And a Pastry Chef who must Conquer a Hunter in A MySQL Convention,179,R,CAUSE DATE,129,3,2006,2.99,English
,10.99,A Awe-Inspiring Documentary of a Womanizer And a Pastry Chef who must Kill a Lumberjack in Berlin,157,PG,TOOTSIE PILOT,896,3,2006,0.99,English
,22.99,A Fast-Paced Story of a Crocodile And a A Shark who must Sink a Pioneer in Berlin,67,PG-13,SHOOTIST SUPERFLY,790,6,2006,0.99,English
,16.99,A Insightful Yarn of a A Shark And a Pastry Chef who must Face a Boy in A Monastery,179,G,CASUALTIES ENCINO,126,3,2006,4.99,English
,22.99,A Thrilling Epistle of a Dog And a Feminist who must Kill a Madman in Berlin,99,PG,FRENCH HOLIDAY,336,5,2006,4.99,English
,22.99,A Awe-Inspiring Epistle of a Student And a Squirrel who must Defeat a Boy in Ancient China,89,R,BEAST HUNCHBACK,60,3,2006,4.99,English
,27.99,A Emotional Drama of a Husband And a Girl who must Outgun a Composer in The First Manned Space Station,157,PG-13,HOBBIT ALIEN,418,5,2006,0.99,English
,9.99,A Beautiful Yarn of a Composer And a Mad Cow who must Redeem a Mad Scientist in A Jet Boat,153,NC-17,EDGE KISSING,272,5,2006,4.99,English
,9.99,A Boring Display of a Pastry Chef And a Sumo Wrestler who must Discover a Frisbee in An Abandoned Amusement Park,88,R,PURPLE MOVIE,705,4,2006,2.99,English
,27.99,A Insightful Display of a Database Administrator And a Student who must Build a Hunter in Berlin,53,PG,MOVIE SHAKESPEARE,603,6,2006,4.99,English
,20.99,A Fanciful Reflection of a Crocodile And a Astronaut who must Outrace a Feminist in An Abandoned Amusement Park,161,R,NEIGHBORS CHARADE,619,3,2006,0.99,English
,15.99,A Insightful Tale of a Technical Writer And a Waitress who must Conquer a Monkey in Ancient India,110,R,REMEMBER DIARY,724,5,2006,2.99,English
,28.99,A Lacklusture Reflection of a Boat And a Forensic Psychologist who must Fight a Waitress in A Monastery,178,PG-13,FURY MURDER,344,3,2006,0.99,English
,15.99,A Emotional Tale of a Robot And a Sumo Wrestler who must Redeem a Pastry Chef in A Baloon Factory,98,PG,SENSIBILITY REAR,780,7,2006,4.99,English
,13.99,A Awe-Inspiring Drama of a Monkey And a Composer who must Escape a Feminist in A U-Boat,158,G,MONTEREY LABYRINTH,593,6,2006,0.99,English
,17.99,A Unbelieveable Documentary of a Dentist And a Technical Writer who must Build a Womanizer in Nigeria,61,G,WATERFRONT DELIVERANCE,964,4,2006,4.99,English
,18.99,A Fast-Paced Tale of a Pastry Chef And a Boat who must Face a Frisbee in The Canadian Rockies,100,PG,PUNK DIVORCE,703,6,2006,4.99,English
,22.99,A Amazing Panorama of a Pioneer And a Student who must Overcome a Mad Scientist in A Manhattan Penthouse,139,PG-13,VOICE PEACH,948,6,2006,0.99,English
,29.99,A Thoughtful Epistle of a Womanizer And a Monkey who must Vanquish a Dentist in A Monastery,159,PG-13,POSEIDON FOREVER,691,6,2006,4.99,English
,23.99,A Boring Drama of a Astronaut And a Boat who must Face a Boat in California,178,R,EXPRESS LONELY,296,5,2006,2.99,English
,9.99,A Lacklusture Reflection of a Dentist And a Hunter who must Meet a Teacher in A Baloon,77,NC-17,FELLOWSHIP AUTUMN,307,6,2006,4.99,English
,26.99,A Epic Display of a Pioneer And a Student who must Challenge a Butler in The Gulf of Mexico,151,PG-13,BEETHOVEN EXORCIST,64,6,2006,0.99,English
,13.99,A Taut Tale of a Car And a Pioneer who must Conquer a Sumo Wrestler in An Abandoned Fun House,95,R,CLUELESS BUCKET,162,4,2006,2.99,English
,11.99,A Lacklusture Character Study of a Husband And a Sumo Wrestler who must Succumb a Technical Writer in The Gulf of Mexico,121,R,BOOGIE AMELIE,86,6,2006,4.99,English
,10.99,A Thrilling Display of a Database Administrator And a Monkey who must Overcome a Dog in An Abandoned Fun House,112,G,JAWS HARRY,478,4,2006,2.99,English
,29.99,A Touching Reflection of a Database Administrator And a Madman who must Build a Lumberjack in Nigeria,142,G,TRACY CIDER,901,3,2006,0.99,English
,14.99,A Fateful Story of a Explorer And a Feminist who must Meet a Technical Writer in Soviet Georgia,122,NC-17,HOURS RAGE,436,4,2006,0.99,English
,14.99,A Emotional Story of a Madman And a Waitress who must Battle a Teacher in An Abandoned Fun House,183,PG-13,FRONTIER CABIN,340,6,2006,4.99,English
,27.99,A Amazing Epistle of a Moose And a Crocodile who must Outrace a Dog in Berlin,121,PG,BRANNIGAN SUNRISE,93,4,2006,4.99,English
,14.99,A Epic Story of a Mad Cow And a Astronaut who must Challenge a Car in California,54,PG-13,JUGGLER HARDLY,489,4,2006,0.99,English
,11.99,A Lacklusture Tale of a Butler And a Husband who must Face a Boy in Ancient China,52,NC-17,WESTWARD SEABISCUIT,970,7,2006,0.99,English
,14.99,A Thoughtful Drama of a Robot And a Womanizer who must Kill a Lumberjack in A Baloon,113,R,SHEPHERD MIDSUMMER,786,7,2006,0.99,English
,12.99,A Epic Yarn of a Robot And a Explorer who must Challenge a Girl in A MySQL Convention,117,PG,RESURRECTION SILVERADO,727,6,2006,0.99,English
,12.99,A Epic Tale of a Pioneer And a Hunter who must Escape a Girl in A U-Boat,65,PG-13,CLUB GRAFFITI,160,4,2006,0.99,English
,15.99,A Awe-Inspiring Drama of a Car And a Pastry Chef who must Chase a Crocodile in The First Manned Space Station,113,R,BANGER PINOCCHIO,54,5,2006,0.99,English
