film_id,category_id,name,title,description,release_year,language,original_language_id,rental_duration,rental_rate,length,replacement_cost,rating
246,9,Foreign,DOUBTFIRE LABYRINTH,A Intrepid Panorama of a Butler And a Composer who must Meet a Mad Cow in The Sahara Desert,2006,English,,5,4.99,154,16.99,R
128,9,Foreign,CATCH AMISTAD,A Boring Reflection of a Lumberjack And a Feminist who must Discover a Woman in Nigeria,2006,English,,7,0.99,183,10.99,G
584,9,Foreign,MIXED DOORS,A Taut Drama of a Womanizer And a Lumberjack who must Succumb a Pioneer in Ancient India,2006,English,,6,2.99,180,26.99,PG-13
380,9,Foreign,GREEK EVERYONE,A Stunning Display of a Butler And a Teacher who must Confront a A Shark in The First Manned Space Station,2006,English,,7,2.99,176,11.99,PG
908,9,Foreign,TRAP GUYS,A Unbelieveable Story of a Boy And a Mad Cow who must Challenge a Database Administrator in The Sahara Desert,2006,English,,3,4.99,110,11.99,G
500,9,Foreign,KISS GLORY,A Lacklusture Reflection of a Girl And a Husband who must Find a Robot in The Canadian Rockies,2006,English,,5,4.99,163,11.99,PG-13
531,9,Foreign,LOSE INCH,A Stunning Reflection of a Student And a Technical Writer who must Battle a Butler in The First Manned Space Station,2006,English,,3,0.99,137,18.99,R
567,9,Foreign,MEET CHOCOLATE,A Boring Documentary of a Dentist And a Butler who must Confront a Monkey in A MySQL Convention,2006,English,,3,2.99,80,26.99,G
290,9,Foreign,EVERYONE CRAFT,A Fateful Display of a Waitress And a Dentist who must Reach a Butler in Nigeria,2006,English,,4,0.99,163,29.99,PG
640,9,Foreign,OPUS ICE,A Fast-Paced Drama of a Hunter And a Boy who must Discover a Feminist in The Sahara Desert,2006,English,,5,4.99,102,21.99,R
399,9,Foreign,HAPPINESS UNITED,A Action-Packed Panorama of a Husband And a Feminist who must Meet a Forensic Psychologist in Ancient Japan,2006,English,,6,2.99,100,23.99,G
440,9,Foreign,HUNGER ROOF,A Unbelieveable Yarn of a Student And a Database Administrator who must Outgun a Husband in An Abandoned Mine Shaft,2006,English,,6,0.99,105,21.99,G
689,9,Foreign,POLLOCK DELIVERANCE,A Intrepid Story of a Madman And a Frisbee who must Outgun a Boat in The Sahara Desert,2006,English,,5,2.99,137,14.99,PG
414,9,Foreign,HELLFIGHTERS SIERRA,A Taut Reflection of a A Shark And a Dentist who must Battle a Boat in Soviet Georgia,2006,English,,3,2.99,75,23.99,PG
376,9,Foreign,GRAPES FURY,A Boring Yarn of a Mad Cow And a Sumo Wrestler who must Meet a Robot in Australia,2006,English,,4,0.99,155,20.99,G
452,9,Foreign,ILLUSION AMELIE,A Emotional Epistle of a Boat And a Mad Scientist who must Outrace a Robot in An Abandoned Mine Shaft,2006,English,,4,0.99,122,15.99,R
669,9,Foreign,PEARL DESTINY,A Lacklusture Yarn of a Astronaut And a Pastry Chef who must Sink a Dog in A U-Boat,2006,English,,3,2.99,74,10.99,NC-17
533,9,Foreign,LOST BIRD,A Emotional Character Study of a Robot And a A Shark who must Defeat a Technical Writer in A Manhattan Penthouse,2006,English,,4,2.99,98,21.99,PG-13
455,9,Foreign,IMPOSSIBLE PREJUDICE,A Awe-Inspiring Yarn of a Monkey And a Hunter who must Chase a Teacher in Ancient China,2006,English,,7,4.99,103,11.99,NC-17
971,9,Foreign,WHALE BIKINI,A Intrepid Story of a Pastry Chef And a Database Administrator who must Kill a Feminist in A MySQL Convention,2006,English,,4,4.99,109,11.99,PG-13
148,9,Foreign,CHOCOLATE DUCK,A Unbelieveable Story of a Mad Scientist And a Technical Writer who must Discover a Composer in Ancient China,2006,English,,3,2.99,132,13.99,R
879,12,Music,TELEGRAPH VOYAGE,A Fateful Yarn of a Husband And a Dog who must Battle a Waitress in A Jet Boat,2006,English,,3,4.99,148,20.99,PG
936,12,Music,VANISHING ROCKY,A Brilliant Reflection of a Man And a Woman who must Conquer a Pioneer in A MySQL Convention,2006,English,,3,2.99,123,21.99,NC-17
980,12,Music,WIZARD COLDBLOODED,A Lacklusture Display of a Robot And a Girl who must Defeat a Sumo Wrestler in A MySQL Convention,2006,English,,4,4.99,75,12.99,PG
384,12,Music,GROSSE WONDERFUL,A Epic Drama of a Cat And a Explorer who must Redeem a Moose in Australia,2006,English,,5,4.99,49,19.99,R
411,12,Music,HEAVENLY GUN,A Beautiful Yarn of a Forensic Psychologist And a Frisbee who must Battle a Moose in A Jet Boat,2006,English,,5,4.99,49,13.99,NC-17
378,12,Music,GREATEST NORTH,A Astounding Character Study of a Secret Agent And a Robot who must Build a A Shark in Berlin,2006,English,,5,2.99,93,24.99,NC-17
516,12,Music,LEGEND JEDI,A Awe-Inspiring Epistle of a Pioneer And a Student who must Outgun a Crocodile in The Outback,2006,English,,7,0.99,59,18.99,PG
51,12,Music,BALLOON HOMEWARD,A Insightful Panorama of a Forensic Psychologist And a Mad Cow who must Build a Mad Scientist in The First Manned Space Station,2006,English,,5,2.99,75,10.99,NC-17
17,12,Music,ALONE TRIP,A Fast-Paced Character Study of a Composer And a Dog who must Outgun a Boat in An Abandoned Fun House,2006,English,,3,0.99,82,14.99,R
255,12,Music,DRIVING POLISH,A Action-Packed Yarn of a Feminist And a Technical Writer who must Sink a Boat in An Abandoned Mine Shaft,2006,English,,6,4.99,175,21.99,NC-17
797,12,Music,SILENCE KANE,A Emotional Drama of a Sumo Wrestler And a Dentist who must Confront a Sumo Wrestler in A Baloon,2006,English,,7,0.99,67,23.99,R
475,11,Horror,JAPANESE RUN,A Awe-Inspiring Epistle of a Feminist And a Girl who must Sink a Girl in The Outback,2006,English,,6,0.99,135,29.99,G
800,11,Horror,SINNERS ATLANTIS,A Epic Display of a Dog And a Boat who must Succumb a Mad Scientist in An Abandoned Mine Shaft,2006,English,,7,2.99,126,19.99,PG-13
904,11,Horror,TRAIN BUNCH,A Thrilling Character Study of a Robot And a Squirrel who must Face a Dog in Ancient India,2006,English,,3,4.99,71,26.99,R
995,11,Horror,YENTL IDAHO,A Amazing Display of a Robot And a Astronaut who must Fight a Womanizer in Berlin,2006,English,,5,4.99,86,11.99,R
495,11,Horror,KENTUCKIAN GIANT,A Stunning Yarn of a Woman And a Frisbee who must Escape a Waitress in A U-Boat,2006,English,,5,2.99,169,10.99,PG
258,11,Horror,DRUMS DYNAMITE,A Epic Display of a Crocodile And a Crocodile who must Confront a Dog in An Abandoned Amusement Park,2006,English,,6,0.99,96,11.99,PG
804,11,Horror,SLEEPING SUSPECTS,A Stunning Reflection of a Sumo Wrestler And a Explorer who must Sink a Frisbee in A MySQL Convention,2006,English,,7,4.99,129,13.99,PG-13
30,11,Horror,ANYTHING SAVANNAH,A Epic Story of a Pastry Chef And a Woman who must Chase a Feminist in An Abandoned Fun House,2006,English,,4,2.99,82,27.99,R
24,11,Horror,ANALYZE HOOSIERS,A Thoughtful Display of a Explorer And a Pastry Chef who must Overcome a Feminist in The Sahara Desert,2006,English,,6,2.99,181,19.99,R
122,11,Horror,CARRIE BUNCH,A Amazing Epistle of a Student And a Astronaut who must Discover a Frisbee in The Canadian Rockies,2006,English,,7,0.99,114,11.99,PG
171,11,Horror,COMMANDMENTS EXPRESS,A Fanciful Saga of a Student And a Mad Scientist who must Battle a Hunter in An Abandoned Mine Shaft,2006,English,,6,4.99,59,13.99,R
653,11,Horror,PANIC CLUB,A Fanciful Display of a Teacher And a Crocodile who must Succumb a Girl in A Baloon,2006,English,,3,4.99,102,15.99,G
922,11,Horror,UNDEFEATED DALMATIONS,A Unbelieveable Display of a Crocodile And a Feminist who must Overcome a Moose in An Abandoned Amusement Park,2006,English,,7,4.99,107,22.99,PG-13
799,11,Horror,SIMON NORTH,A Thrilling Documentary of a Technical Writer And a A Shark who must Face a Pioneer in A Shark Tank,2006,English,,3,0.99,51,26.99,NC-17
665,11,Horror,PATTON INTERVIEW,A Thrilling Documentary of a Composer And a Secret Agent who must Succumb a Cat in Berlin,2006,English,,4,2.99,175,22.99,PG
313,11,Horror,FIDELITY DEVIL,A Awe-Inspiring Drama of a Technical Writer And a Composer who must Reach a Pastry Chef in A U-Boat,2006,English,,5,4.99,118,11.99,G
301,11,Horror,FAMILY SWEET,A Epic Documentary of a Teacher And a Boy who must Escape a Woman in Berlin,2006,English,,4,0.99,155,24.99,R
527,11,Horror,LOLA AGENT,A Astounding Tale of a Mad Scientist And a Husband who must Redeem a Database Administrator in Ancient Japan,2006,English,,4,4.99,85,24.99,PG
683,7,Drama,PITY BOUND,A Boring Panorama of a Feminist And a Moose who must Defeat a Database Administrator in Nigeria,2006,English,,5,4.99,60,19.99,NC-17
173,7,Drama,CONFESSIONS MAGUIRE,A Insightful Story of a Car And a Boy who must Battle a Technical Writer in A Baloon,2006,English,,7,4.99,65,25.99,PG-13
958,7,Drama,WARDROBE PHANTOM,A Action-Packed Display of a Mad Cow And a Astronaut who must Kill a Car in Ancient India,2006,English,,6,2.99,178,19.99,G
882,7,Drama,TENENBAUMS COMMAND,A Taut Display of a Pioneer And a Man who must Reach a Girl in The Gulf of Mexico,2006,English,,4,0.99,99,24.99,PG-13
923,7,Drama,UNFAITHFUL KILL,A Taut Documentary of a Waitress And a Mad Scientist who must Battle a Technical Writer in New Orleans,2006,English,,7,2.99,78,12.99,R
98,7,Drama,BRIGHT ENCOUNTERS,A Fateful Yarn of a Lumberjack And a Feminist who must Conquer a Student in A Jet Boat,2006,English,,4,4.99,73,12.99,PG-13
643,7,Drama,ORIENT CLOSER,A Astounding Epistle of a Technical Writer And a Teacher who must Fight a Squirrel in The Sahara Desert,2006,English,,3,2.99,118,22.99,R
942,7,Drama,VIETNAM SMOOCHY,A Lacklusture Display of a Butler And a Man who must Sink a Explorer in Soviet Georgia,2006,English,,7,0.99,174,27.99,PG-13
781,10,Games,SEVEN SWARM,A Unbelieveable Character Study of a Dog And a Mad Cow who must Kill a Monkey in Berlin,2006,English,,4,4.99,127,15.99,R
956,10,Games,WANDA CHAMBER,A Insightful Drama of a A Shark And a Pioneer who must Find a Womanizer in The Outback,2006,English,,7,4.99,107,23.99,PG-13
701,10,Games,PSYCHO SHRUNK,A Amazing Panorama of a Crocodile And a Explorer who must Fight a Husband in Nigeria,2006,English,,5,2.99,155,11.99,PG-13
215,10,Games,DAWN POND,A Thoughtful Documentary of a Dentist And a Forensic Psychologist who must Defeat a Waitress in Berlin,2006,English,,4,4.99,57,27.99,PG
406,10,Games,HAUNTING PIANIST,A Fast-Paced Story of a Database Administrator And a Composer who must Defeat a Squirrel in An Abandoned Amusement Park,2006,English,,5,0.99,181,22.99,R
106,10,Games,BULWORTH COMMANDMENTS,A Amazing Display of a Mad Cow And a Pioneer who must Redeem a Sumo Wrestler in The Outback,2006,English,,4,2.99,61,14.99,G
646,10,Games,OUTBREAK DIVINE,A Unbelieveable Yarn of a Database Administrator And a Woman who must Succumb a A Shark in A U-Boat,2006,English,,6,0.99,169,12.99,NC-17
447,10,Games,ICE CROSSING,A Fast-Paced Tale of a Butler And a Moose who must Overcome a Pioneer in A Manhattan Penthouse,2006,English,,5,2.99,131,28.99,R
281,10,Games,ENCINO ELF,A Astounding Drama of a Feminist And a Teacher who must Confront a Husband in A Baloon,2006,English,,6,0.99,143,9.99,G
264,10,Games,DWARFS ALTER,A Emotional Yarn of a Girl And a Dog who must Challenge a Composer in Ancient Japan,2006,English,,6,2.99,101,13.99,G
949,10,Games,VOLCANO TEXAS,A Awe-Inspiring Yarn of a Hunter And a Feminist who must Challenge a Dentist in The Outback,2006,English,,6,0.99,157,27.99,NC-17
211,10,Games,DARLING BREAKING,A Brilliant Documentary of a Astronaut And a Squirrel who must Succumb a Student in The Gulf of Mexico,2006,English,,7,4.99,165,20.99,PG-13
382,10,Games,GRIT CLOCKWORK,A Thoughtful Display of a Dentist And a Squirrel who must Confront a Lumberjack in A Shark Tank,2006,English,,3,0.99,137,21.99,PG
331,10,Games,FORWARD TEMPLE,A Astounding Display of a Forensic Psychologist And a Mad Scientist who must Challenge a Girl in New Orleans,2006,English,,6,2.99,90,25.99,NC-17
596,10,Games,MOONSHINE CABIN,A Thoughtful Display of a Astronaut And a Feminist who must Chase a Frisbee in A Jet Boat,2006,English,,4,4.99,171,25.99,PG-13
352,10,Games,GATHERING CALENDAR,A Intrepid Tale of a Pioneer And a Moose who must Conquer a Frisbee in A MySQL Convention,2006,English,,4,0.99,176,22.99,PG-13
839,14,Sci-Fi,STALLION SUNDANCE,A Fast-Paced Tale of a Car And a Dog who must Outgun a A Shark in Australia,2006,English,,5,0.99,130,23.99,PG-13
49,14,Sci-Fi,BADMAN DAWN,A Emotional Panorama of a Pioneer And a Composer who must Escape a Mad Scientist in A Jet Boat,2006,English,,6,2.99,162,22.99,R
367,14,Sci-Fi,GOLDMINE TYCOON,A Brilliant Epistle of a Composer And a Frisbee who must Conquer a Husband in The Outback,2006,English,,6,0.99,153,20.99,R
140,14,Sci-Fi,CHEAPER CLYDE,A Emotional Character Study of a Pioneer And a Girl who must Discover a Dog in Ancient Japan,2006,English,,6,0.99,87,23.99,G
967,14,Sci-Fi,WEEKEND PERSONAL,A Fast-Paced Documentary of a Car And a Butler who must Find a Frisbee in A Jet Boat,2006,English,,5,2.99,134,26.99,R
203,14,Sci-Fi,DAISY MENAGERIE,A Fast-Paced Saga of a Pastry Chef And a Monkey who must Sink a Composer in Ancient India,2006,English,,5,4.99,84,9.99,G
165,14,Sci-Fi,COLDBLOODED DARLING,A Brilliant Panorama of a Dentist And a Moose who must Find a Student in The Gulf of Mexico,2006,English,,7,4.99,70,27.99,G
114,14,Sci-Fi,CAMELOT VACATION,A Touching Character Study of a Woman And a Waitress who must Battle a Pastry Chef in A MySQL Convention,2006,English,,3,0.99,61,26.99,NC-17
972,14,Sci-Fi,WHISPERER GIANT,A Intrepid Story of a Dentist And a Hunter who must Confront a Monkey in Ancient Japan,2006,English,,4,4.99,59,24.99,PG-13
620,14,Sci-Fi,NEMO CAMPUS,A Lacklusture Reflection of a Monkey And a Squirrel who must Outrace a Womanizer in A Manhattan Penthouse,2006,English,,5,2.99,131,23.99,NC-17
44,14,Sci-Fi,ATTACKS HATE,A Fast-Paced Panorama of a Technical Writer And a Mad Scientist who must Find a Feminist in An Abandoned Mine Shaft,2006,English,,5,4.99,113,21.99,PG-13
153,14,Sci-Fi,CITIZEN SHREK,A Fanciful Character Study of a Technical Writer And a Husband who must Redeem a Robot in The Outback,2006,English,,7,0.99,165,18.99,G
930,14,Sci-Fi,VACATION BOONDOCK,A Fanciful Character Study of a Secret Agent And a Mad Scientist who must Reach a Teacher in Australia,2006,English,,4,2.99,145,23.99,R
520,14,Sci-Fi,LICENSE WEEKEND,A Insightful Story of a Man And a Husband who must Overcome a Madman in A Monastery,2006,English,,7,2.99,91,28.99,NC-17
240,14,Sci-Fi,DOLLS RAGE,A Thrilling Display of a Pioneer And a Frisbee who must Escape a Teacher in The Outback,2006,English,,7,2.99,120,10.99,PG-13
350,14,Sci-Fi,GARDEN ISLAND,A Unbelieveable Character Study of a Womanizer And a Madman who must Reach a Man in The Outback,2006,English,,3,4.99,80,21.99,G
177,14,Sci-Fi,CONNECTICUT TRAMP,A Unbelieveable Drama of a Crocodile And a Mad Cow who must Reach a Dentist in A Shark Tank,2006,English,,4,4.99,172,20.99,R
234,14,Sci-Fi,DISTURBING SCARFACE,A Lacklusture Display of a Crocodile And a Butler who must Overcome a Monkey in A U-Boat,2006,English,,6,2.99,94,27.99,R
149,3,Children,CHRISTMAS MOONSHINE,A Action-Packed Epistle of a Feminist And a Astronaut who must Conquer a Boat in A Manhattan Penthouse,2006,English,,7,0.99,150,21.99,NC-17
786,3,Children,SHEPHERD MIDSUMMER,A Thoughtful Drama of a Robot And a Womanizer who must Kill a Lumberjack in A Baloon,2006,English,,7,0.99,113,14.99,R
168,3,Children,COMANCHEROS ENEMY,A Boring Saga of a Lumberjack And a Monkey who must Find a Monkey in The Gulf of Mexico,2006,English,,5,0.99,67,23.99,R
626,3,Children,NOON PAPI,A Unbelieveable Character Study of a Mad Scientist And a Astronaut who must Find a Pioneer in A Manhattan Penthouse,2006,English,,5,2.99,57,12.99,G
918,3,Children,TWISTED PIRATES,A Touching Display of a Frisbee And a Boat who must Kill a Girl in A MySQL Convention,2006,English,,4,4.99,152,23.99,PG
485,3,Children,JERSEY SASSY,A Lacklusture Documentary of a Madman And a Mad Cow who must Find a Feminist in Ancient Japan,2006,English,,6,4.99,60,16.99,PG
152,3,Children,CIRCUS YOUTH,A Thoughtful Drama of a Pastry Chef And a Dentist who must Pursue a Girl in A Baloon,2006,English,,5,2.99,90,13.99,PG-13
573,3,Children,MICROCOSMOS PARADISE,A Touching Character Study of a Boat And a Student who must Sink a A Shark in Nigeria,2006,English,,6,2.99,105,22.99,PG-13
214,3,Children,DAUGHTER MADIGAN,A Beautiful Tale of a Hunter And a Mad Scientist who must Confront a Squirrel in The First Manned Space Station,2006,English,,3,4.99,59,13.99,PG-13
208,2,Animation,DARES PLUTO,A Fateful Story of a Robot And a Dentist who must Defeat a Astronaut in New Orleans,2006,English,,7,2.99,89,16.99,PG-13
564,2,Animation,MASSAGE IMAGE,A Fateful Drama of a Frisbee And a Crocodile who must Vanquish a Dog in The First Manned Space Station,2006,English,,4,2.99,161,11.99,PG
464,2,Animation,INTENTIONS EMPIRE,A Astounding Epistle of a Cat And a Cat who must Conquer a Mad Cow in A U-Boat,2006,English,,3,2.99,107,13.99,PG-13
118,2,Animation,CANYON STOCK,A Thoughtful Reflection of a Waitress And a Feminist who must Escape a Squirrel in A Manhattan Penthouse,2006,English,,7,0.99,85,26.99,R
649,2,Animation,OZ LIAISONS,A Epic Yarn of a Mad Scientist And a Cat who must Confront a Womanizer in A Baloon Factory,2006,English,,4,2.99,85,14.99,R
36,2,Animation,ARGONAUTS TOWN,A Emotional Epistle of a Forensic Psychologist And a Butler who must Challenge a Waitress in An Abandoned Mine Shaft,2006,English,,7,0.99,127,12.99,PG-13
70,2,Animation,BIKINI BORROWERS,A Astounding Drama of a Astronaut And a Cat who must Discover a Woman in The First Manned Space Station,2006,English,,7,4.99,142,26.99,NC-17
330,2,Animation,FORRESTER COMANCHEROS,A Fateful Tale of a Squirrel And a Forensic Psychologist who must Redeem a Man in Nigeria,2006,English,,7,4.99,112,22.99,NC-17
325,2,Animation,FLOATS GARDEN,A Action-Packed Epistle of a Robot And a Car who must Chase a Boat in Ancient Japan,2006,English,,6,2.99,145,29.99,PG-13
865,2,Animation,SUNRISE LEAGUE,A Beautiful Epistle of a Madman And a Butler who must Face a Crocodile in A Manhattan Penthouse,2006,English,,3,4.99,135,19.99,PG-13
134,2,Animation,CHAMPION FLATLINERS,A Amazing Story of a Mad Cow And a Dog who must Kill a Husband in A Monastery,2006,English,,4,4.99,51,21.99,PG
692,2,Animation,POTLUCK MIXED,A Beautiful Story of a Dog And a Technical Writer who must Outgun a Student in A Baloon,2006,English,,3,2.99,179,10.99,G
239,2,Animation,DOGMA FAMILY,A Brilliant Character Study of a Database Administrator And a Monkey who must Succumb a Astronaut in New Orleans,2006,English,,5,4.99,122,16.99,G
23,2,Animation,ANACONDA CONFESSIONS,A Lacklusture Display of a Dentist And a Dentist who must Fight a Girl in Australia,2006,English,,3,0.99,92,9.99,R
690,2,Animation,POND SEATTLE,A Stunning Drama of a Teacher And a Boat who must Battle a Feminist in Ancient China,2006,English,,7,2.99,185,25.99,PG-13
223,2,Animation,DESIRE ALIEN,A Fast-Paced Tale of a Dog And a Forensic Psychologist who must Meet a Astronaut in The First Manned Space Station,2006,English,,7,2.99,76,24.99,NC-17
300,2,Animation,FALCON VOLUME,A Fateful Saga of a Sumo Wrestler And a Hunter who must Redeem a A Shark in New Orleans,2006,English,,5,4.99,102,21.99,PG-13
518,16,Travel,LIAISONS SWEET,A Boring Drama of a A Shark And a Explorer who must Redeem a Waitress in The Canadian Rockies,2006,English,,5,4.99,140,15.99,PG
811,16,Travel,SMILE EARRING,A Intrepid Drama of a Teacher And a Butler who must Build a Pastry Chef in Berlin,2006,English,,4,2.99,60,29.99,G
87,16,Travel,BOONDOCK BALLROOM,A Fateful Panorama of a Crocodile And a Boy who must Defeat a Monkey in The Gulf of Mexico,2006,English,,7,0.99,76,14.99,NC-17
526,16,Travel,LOCK REAR,A Thoughtful Character Study of a Squirrel And a Technical Writer who must Outrace a Student in Ancient Japan,2006,English,,7,2.99,120,10.99,R
988,16,Travel,WORKER TARZAN,A Action-Packed Yarn of a Secret Agent And a Technical Writer who must Battle a Sumo Wrestler in The First Manned Space Station,2006,English,,7,2.99,139,26.99,R
288,16,Travel,ESCAPE METROPOLIS,A Taut Yarn of a Astronaut And a Technical Writer who must Outgun a Boat in New Orleans,2006,English,,7,2.99,167,20.99,R
787,16,Travel,SHINING ROSES,A Awe-Inspiring Character Study of a Astronaut And a Forensic Psychologist who must Challenge a Madman in Ancient India,2006,English,,4,0.99,125,12.99,G
642,16,Travel,ORDER BETRAYED,A Amazing Saga of a Dog And a A Shark who must Challenge a Cat in The Sahara Desert,2006,English,,7,2.99,120,13.99,PG-13
931,16,Travel,VALENTINE VANISHING,A Thrilling Display of a Husband And a Butler who must Reach a Pastry Chef in California,2006,English,,7,0.99,48,9.99,PG-13
609,16,Travel,MUSCLE BRIGHT,A Stunning Panorama of a Sumo Wrestler And a Husband who must Redeem a Madman in Ancient India,2006,English,,7,2.99,185,23.99,G
868,16,Travel,SUPERFLY TRIP,A Beautiful Saga of a Lumberjack And a Teacher who must Build a Technical Writer in An Abandoned Fun House,2006,English,,5,0.99,114,27.99,PG
88,16,Travel,BORN SPINAL,A Touching Epistle of a Frisbee And a Husband who must Pursue a Student in Nigeria,2006,English,,7,4.99,179,17.99,PG
543,16,Travel,MADIGAN DORADO,A Astounding Character Study of a A Shark And a A Shark who must Discover a Crocodile in The Outback,2006,English,,5,4.99,116,20.99,R
914,16,Travel,TROUBLE DATE,A Lacklusture Panorama of a Forensic Psychologist And a Woman who must Kill a Explorer in Ancient Japan,2006,English,,6,2.99,61,13.99,PG
339,16,Travel,FROGMEN BREAKING,A Unbelieveable Yarn of a Mad Scientist And a Cat who must Chase a Lumberjack in Australia,2006,English,,5,0.99,111,17.99,R
890,15,Sports,TIGHTS DAWN,A Thrilling Epistle of a Boat And a Secret Agent who must Face a Boy in A Baloon,2006,English,,5,0.99,172,14.99,R
488,15,Sports,JOON NORTHWEST,A Thrilling Panorama of a Technical Writer And a Car who must Discover a Forensic Psychologist in A Shark Tank,2006,English,,3,0.99,105,23.99,NC-17
263,15,Sports,DURHAM PANKY,A Brilliant Panorama of a Girl And a Boy who must Face a Mad Scientist in An Abandoned Mine Shaft,2006,English,,6,4.99,154,14.99,R
519,15,Sports,LIBERTY MAGNIFICENT,A Boring Drama of a Student And a Cat who must Sink a Technical Writer in A Baloon,2006,English,,3,2.99,138,27.99,G
517,15,Sports,LESSON CLEOPATRA,A Emotional Display of a Man And a Explorer who must Build a Boy in A Manhattan Penthouse,2006,English,,3,0.99,167,28.99,NC-17
763,15,Sports,SATISFACTION CONFIDENTIAL,A Lacklusture Yarn of a Dentist And a Butler who must Meet a Secret Agent in Ancient China,2006,English,,3,4.99,75,26.99,G
237,15,Sports,DIVORCE SHINING,A Unbelieveable Saga of a Crocodile And a Student who must Discover a Cat in Ancient India,2006,English,,3,2.99,47,21.99,G
851,15,Sports,STRAIGHT HOURS,A Boring Panorama of a Secret Agent And a Girl who must Sink a Waitress in The Outback,2006,English,,3,0.99,151,19.99,R
678,15,Sports,PICKUP DRIVING,A Touching Documentary of a Husband And a Boat who must Meet a Pastry Chef in A Baloon Factory,2006,English,,3,2.99,77,23.99,G
389,15,Sports,GUNFIGHTER MUSSOLINI,A Touching Saga of a Robot And a Boy who must Kill a Man in Ancient Japan,2006,English,,3,2.99,127,9.99,PG-13
420,15,Sports,HOLES BRANNIGAN,A Fast-Paced Reflection of a Technical Writer And a Student who must Fight a Boy in The Canadian Rockies,2006,English,,7,4.99,128,27.99,PG
668,15,Sports,PEAK FOREVER,A Insightful Reflection of a Boat And a Secret Agent who must Vanquish a Astronaut in An Abandoned Mine Shaft,2006,English,,7,4.99,80,25.99,PG
917,15,Sports,TUXEDO MILE,A Boring Drama of a Man And a Forensic Psychologist who must Face a Frisbee in Ancient India,2006,English,,3,2.99,152,24.99,R
279,15,Sports,ELIZABETH SHANE,A Lacklusture Display of a Womanizer And a Dog who must Face a Sumo Wrestler in Ancient Japan,2006,English,,7,4.99,152,11.99,NC-17
940,15,Sports,VICTORY ACADEMY,A Insightful Epistle of a Mad Scientist And a Explorer who must Challenge a Cat in The Sahara Desert,2006,English,,6,0.99,64,19.99,PG-13
681,15,Sports,PIRATES ROXANNE,A Stunning Drama of a Woman And a Lumberjack who must Overcome a A Shark in The Canadian Rockies,2006,English,,4,0.99,100,20.99,PG
764,15,Sports,SATURDAY LAMBS,A Thoughtful Reflection of a Mad Scientist And a Moose who must Kill a Husband in A Baloon,2006,English,,3,4.99,150,28.99,G
599,15,Sports,MOTHER OLEANDER,A Boring Tale of a Husband And a Boy who must Fight a Squirrel in Ancient China,2006,English,,3,0.99,103,20.99,R
453,15,Sports,IMAGE PRINCESS,A Lacklusture Panorama of a Secret Agent And a Crocodile who must Discover a Madman in The Canadian Rockies,2006,English,,3,2.99,178,17.99,PG-13
570,15,Sports,MERMAID INSECTS,A Lacklusture Drama of a Waitress And a Husband who must Fight a Husband in California,2006,English,,5,4.99,104,20.99,NC-17
568,5,Comedy,MEMENTO ZOOLANDER,A Touching Epistle of a Squirrel And a Explorer who must Redeem a Pastry Chef in The Sahara Desert,2006,English,,4,4.99,77,11.99,NC-17
906,5,Comedy,TRAMP OTHERS,A Brilliant Display of a Composer And a Cat who must Succumb a A Shark in Ancient India,2006,English,,4,0.99,171,27.99,PG
524,5,Comedy,LION UNCUT,A Intrepid Display of a Pastry Chef And a Cat who must Kill a A Shark in Ancient China,2006,English,,6,0.99,50,13.99,PG
308,5,Comedy,FERRIS MOTHER,A Touching Display of a Frisbee And a Frisbee who must Kill a Girl in The Gulf of Mexico,2006,English,,3,2.99,142,13.99,PG
858,5,Comedy,SUBMARINE BED,A Amazing Display of a Car And a Monkey who must Fight a Teacher in Soviet Georgia,2006,English,,5,4.99,127,21.99,R
774,5,Comedy,SEARCHERS WAIT,A Fast-Paced Tale of a Car And a Mad Scientist who must Kill a Womanizer in Ancient Japan,2006,English,,3,2.99,182,22.99,NC-17
754,5,Comedy,RUSHMORE MERMAID,A Boring Story of a Woman And a Moose who must Reach a Husband in A Shark Tank,2006,English,,6,2.99,150,17.99,PG-13
502,5,Comedy,KNOCK WARLOCK,A Unbelieveable Story of a Teacher And a Boat who must Confront a Moose in A Baloon,2006,English,,4,2.99,71,21.99,PG-13
202,5,Comedy,DADDY PITTSBURGH,A Epic Story of a A Shark And a Student who must Confront a Explorer in The Gulf of Mexico,2006,English,,5,4.99,161,26.99,G
837,5,Comedy,STAGE WORLD,A Lacklusture Panorama of a Woman And a Frisbee who must Chase a Crocodile in A Jet Boat,2006,English,,4,2.99,85,19.99,PG
