attore_id,film_id,titolo,descrizione,data_rilascio,lingua,lingua_originale_id,durata_noleggio,tariffa_noleggio,durata,costo_sostituzione,voto,nome,cognome
30,262,DUMBO LUST,A Touching Display of a Feminist And a Dentist who must Conquer a Husband in The Gulf of Mexico,2006,English,,5,0.99,119,17.99,NC-17,SANDRA,PECK
30,260,DUDE BLINDNESS,A Stunning Reflection of a Husband And a Lumberjack who must Face a Frisbee in An Abandoned Fun House,2006,English,,3,4.99,132,9.99,G,SANDRA,PECK
30,53,BANG KWAI,A Epic Drama of a Madman And a Cat who must Face a A Shark in An Abandoned Amusement Park,2006,English,,5,2.99,87,25.99,NC-17,SANDRA,PECK
30,69,BEVERLY OUTLAW,A Fanciful Documentary of a Womanizer And a Boat who must Defeat a Madman in The First Manned Space Station,2006,English,,3,2.99,85,21.99,R,SANDRA,PECK
30,87,BOONDOCK BALLROOM,A Fateful Panorama of a Crocodile And a Boy who must Defeat a Monkey in The Gulf of Mexico,2006,English,,7,0.99,76,14.99,NC-17,SANDRA,PECK
30,732,RINGS HEARTBREAKERS,A Amazing Yarn of a Sumo Wrestler And a Boat who must Conquer a Waitress in New Orleans,2006,English,,5,0.99,58,17.99,G,SANDRA,PECK
30,838,STAGECOACH ARMAGEDDON,A Touching Display of a Pioneer And a Butler who must Chase a Car in California,2006,English,,5,4.99,112,25.99,R,SANDRA,PECK
30,1,ACADEMY DINOSAUR,A Epic Drama of a Feminist And a Mad Scientist who must Battle a Teacher in The Canadian Rockies,2006,English,,6,0.99,86,20.99,PG,SANDRA,PECK
30,321,FLASH WARS,A Astounding Saga of a Moose And a Pastry Chef who must Chase a Student in The Gulf of Mexico,2006,English,,3,4.99,123,21.99,NC-17,SANDRA,PECK
30,945,VIRGINIAN PLUTO,A Emotional Panorama of a Dentist And a Crocodile who must Meet a Boy in Berlin,2006,English,,5,0.99,164,22.99,R,SANDRA,PECK
30,64,BEETHOVEN EXORCIST,A Epic Display of a Pioneer And a Student who must Challenge a Butler in The Gulf of Mexico,2006,English,,6,0.99,151,26.99,PG-13,SANDRA,PECK
30,565,MATRIX SNOWMAN,A Action-Packed Saga of a Womanizer And a Woman who must Overcome a Student in California,2006,English,,6,4.99,56,9.99,PG-13,SANDRA,PECK
30,292,EXCITEMENT EVE,A Brilliant Documentary of a Monkey And a Car who must Conquer a Crocodile in A Shark Tank,2006,English,,3,0.99,51,20.99,G,SANDRA,PECK
80,262,DUMBO LUST,A Touching Display of a Feminist And a Dentist who must Conquer a Husband in The Gulf of Mexico,2006,English,,5,0.99,119,17.99,NC-17,RALPH,CRUZ
80,260,DUDE BLINDNESS,A Stunning Reflection of a Husband And a Lumberjack who must Face a Frisbee in An Abandoned Fun House,2006,English,,3,4.99,132,9.99,G,RALPH,CRUZ
80,680,PINOCCHIO SIMON,A Action-Packed Reflection of a Mad Scientist And a A Shark who must Find a Feminist in California,2006,English,,4,4.99,103,21.99,PG,RALPH,CRUZ
80,342,FUGITIVE MAGUIRE,A Taut Epistle of a Feminist And a Sumo Wrestler who must Battle a Crocodile in Australia,2006,English,,7,4.99,83,28.99,R,RALPH,CRUZ
80,475,JAPANESE RUN,A Awe-Inspiring Epistle of a Feminist And a Girl who must Sink a Girl in The Outback,2006,English,,6,0.99,135,29.99,G,RALPH,CRUZ
80,362,GLORY TRACY,A Amazing Saga of a Woman And a Womanizer who must Discover a Cat in The First Manned Space Station,2006,English,,7,2.99,115,13.99,PG-13,RALPH,CRUZ
80,343,FULL FLATLINERS,A Beautiful Documentary of a Astronaut And a Moose who must Pursue a Monkey in A Shark Tank,2006,English,,6,2.99,94,14.99,PG,RALPH,CRUZ
80,175,CONFUSED CANDLES,A Stunning Epistle of a Cat And a Forensic Psychologist who must Confront a Pioneer in A Baloon,2006,English,,3,2.99,122,27.99,PG-13,RALPH,CRUZ
80,124,CASPER DRAGONFLY,A Intrepid Documentary of a Boat And a Crocodile who must Chase a Robot in The Sahara Desert,2006,English,,3,4.99,163,16.99,PG-13,RALPH,CRUZ
80,807,SLEUTH ORIENT,A Fateful Character Study of a Husband And a Dog who must Find a Feminist in Ancient India,2006,English,,4,0.99,87,25.99,NC-17,RALPH,CRUZ
80,688,POLISH BROOKLYN,A Boring Character Study of a Database Administrator And a Lumberjack who must Reach a Madman in The Outback,2006,English,,6,0.99,61,12.99,PG,RALPH,CRUZ
80,687,POCUS PULP,A Intrepid Yarn of a Frisbee And a Dog who must Build a Astronaut in A Baloon Factory,2006,English,,6,0.99,138,15.99,NC-17,RALPH,CRUZ
80,979,WITCHES PANIC,A Awe-Inspiring Drama of a Secret Agent And a Hunter who must Fight a Moose in Nigeria,2006,English,,6,4.99,100,10.99,NC-17,RALPH,CRUZ
80,888,THIN SAGEBRUSH,A Emotional Drama of a Husband And a Lumberjack who must Build a Cat in Ancient India,2006,English,,5,4.99,53,9.99,PG-13,RALPH,CRUZ
80,280,EMPIRE MALKOVICH,A Amazing Story of a Feminist And a Cat who must Face a Car in An Abandoned Fun House,2006,English,,7,0.99,177,26.99,G,RALPH,CRUZ
80,619,NEIGHBORS CHARADE,A Fanciful Reflection of a Crocodile And a Astronaut who must Outrace a Feminist in An Abandoned Amusement Park,2006,English,,3,0.99,161,20.99,R,RALPH,CRUZ
80,118,CANYON STOCK,A Thoughtful Reflection of a Waitress And a Feminist who must Escape a Squirrel in A Manhattan Penthouse,2006,English,,7,0.99,85,26.99,R,RALPH,CRUZ
79,262,DUMBO LUST,A Touching Display of a Feminist And a Dentist who must Conquer a Husband in The Gulf of Mexico,2006,English,,5,0.99,119,17.99,NC-17,MAE,HOFFMAN
79,750,RUN PACIFIC,A Touching Tale of a Cat And a Pastry Chef who must Conquer a Pastry Chef in A MySQL Convention,2006,English,,3,0.99,145,25.99,R,MAE,HOFFMAN
79,141,CHICAGO NORTH,A Fateful Yarn of a Mad Cow And a Waitress who must Battle a Student in California,2006,English,,6,4.99,185,11.99,PG-13,MAE,HOFFMAN
79,628,NORTHWEST POLISH,A Boring Character Study of a Boy And a A Shark who must Outrace a Womanizer in The Outback,2006,English,,5,2.99,172,24.99,PG,MAE,HOFFMAN
79,769,SCHOOL JACKET,A Intrepid Yarn of a Monkey And a Boy who must Fight a Composer in A Manhattan Penthouse,2006,English,,5,4.99,151,21.99,PG-13,MAE,HOFFMAN
79,473,JACKET FRISCO,A Insightful Reflection of a Womanizer And a Husband who must Conquer a Pastry Chef in A Baloon,2006,English,,5,2.99,181,16.99,PG-13,MAE,HOFFMAN
79,40,ARMY FLINTSTONES,A Boring Saga of a Database Administrator And a Womanizer who must Battle a Waitress in Nigeria,2006,English,,4,0.99,148,22.99,R,MAE,HOFFMAN
79,607,MUPPET MILE,A Lacklusture Story of a Madman And a Teacher who must Kill a Frisbee in The Gulf of Mexico,2006,English,,5,4.99,50,18.99,PG,MAE,HOFFMAN
79,299,FACTORY DRAGON,A Action-Packed Saga of a Teacher And a Frisbee who must Escape a Lumberjack in The Sahara Desert,2006,English,,4,0.99,144,9.99,PG-13,MAE,HOFFMAN
79,32,APOCALYPSE FLAMINGOS,A Astounding Story of a Dog And a Squirrel who must Defeat a Woman in An Abandoned Amusement Park,2006,English,,6,4.99,119,11.99,R,MAE,HOFFMAN
79,853,STRANGER STRANGERS,A Awe-Inspiring Yarn of a Womanizer And a Explorer who must Fight a Woman in The First Manned Space Station,2006,English,,3,4.99,139,12.99,G,MAE,HOFFMAN
79,33,APOLLO TEEN,A Action-Packed Reflection of a Crocodile And a Explorer who must Find a Sumo Wrestler in An Abandoned Mine Shaft,2006,English,,5,2.99,153,15.99,PG-13,MAE,HOFFMAN
79,242,DOOM DANCING,A Astounding Panorama of a Car And a Mad Scientist who must Battle a Lumberjack in A MySQL Convention,2006,English,,4,0.99,68,13.99,R,MAE,HOFFMAN
79,840,STAMPEDE DISTURBING,A Unbelieveable Tale of a Woman And a Lumberjack who must Fight a Frisbee in A U-Boat,2006,English,,5,0.99,75,26.99,R,MAE,HOFFMAN
79,753,RUSH GOODFELLAS,A Emotional Display of a Man And a Dentist who must Challenge a Squirrel in Australia,2006,English,,3,0.99,48,20.99,PG,MAE,HOFFMAN
79,230,DIARY PANIC,A Thoughtful Character Study of a Frisbee And a Mad Cow who must Outgun a Man in Ancient India,2006,English,,7,2.99,107,20.99,G,MAE,HOFFMAN
79,727,RESURRECTION SILVERADO,A Epic Yarn of a Robot And a Explorer who must Challenge a Girl in A MySQL Convention,2006,English,,6,0.99,117,12.99,PG,MAE,HOFFMAN
79,428,HOMICIDE PEACH,A Astounding Documentary of a Hunter And a Boy who must Confront a Boy in A MySQL Convention,2006,English,,6,2.99,141,21.99,PG-13,MAE,HOFFMAN
79,634,ODDS BOOGIE,A Thrilling Yarn of a Feminist And a Madman who must Battle a Hunter in Berlin,2006,English,,6,0.99,48,14.99,NC-17,MAE,HOFFMAN
79,269,EARRING INSTINCT,A Stunning Character Study of a Dentist And a Mad Cow who must Find a Teacher in Nigeria,2006,English,,3,0.99,98,22.99,R,MAE,HOFFMAN
79,430,HOOK CHARIOTS,A Insightful Story of a Boy And a Dog who must Redeem a Boy in Australia,2006,English,,7,0.99,49,23.99,G,MAE,HOFFMAN
198,262,DUMBO LUST,A Touching Display of a Feminist And a Dentist who must Conquer a Husband in The Gulf of Mexico,2006,English,,5,0.99,119,17.99,NC-17,MARY,KEITEL
198,628,NORTHWEST POLISH,A Boring Character Study of a Boy And a A Shark who must Outrace a Womanizer in The Outback,2006,English,,5,2.99,172,24.99,PG,MARY,KEITEL
198,311,FICTION CHRISTMAS,A Emotional Yarn of a A Shark And a Student who must Battle a Robot in An Abandoned Mine Shaft,2006,English,,4,0.99,72,14.99,PG,MARY,KEITEL
198,541,LUKE MUMMY,A Taut Character Study of a Boy And a Robot who must Redeem a Mad Scientist in Ancient India,2006,English,,5,2.99,74,21.99,NC-17,MARY,KEITEL
198,464,INTENTIONS EMPIRE,A Astounding Epistle of a Cat And a Cat who must Conquer a Mad Cow in A U-Boat,2006,English,,3,2.99,107,13.99,PG-13,MARY,KEITEL
198,758,SAINTS BRIDE,A Fateful Tale of a Technical Writer And a Composer who must Pursue a Explorer in The Gulf of Mexico,2006,English,,5,2.99,125,11.99,G,MARY,KEITEL
198,109,BUTTERFLY CHOCOLAT,A Fateful Story of a Girl And a Composer who must Conquer a Husband in A Shark Tank,2006,English,,3,0.99,89,17.99,G,MARY,KEITEL
198,379,GREEDY ROOTS,A Amazing Reflection of a A Shark And a Butler who must Chase a Hunter in The Canadian Rockies,2006,English,,7,0.99,166,14.99,R,MARY,KEITEL
198,568,MEMENTO ZOOLANDER,A Touching Epistle of a Squirrel And a Explorer who must Redeem a Pastry Chef in The Sahara Desert,2006,English,,4,4.99,77,11.99,NC-17,MARY,KEITEL
198,499,KING EVOLUTION,A Action-Packed Tale of a Boy And a Lumberjack who must Chase a Madman in A Baloon,2006,English,,3,4.99,184,24.99,NC-17,MARY,KEITEL
198,892,TITANIC BOONDOCK,A Brilliant Reflection of a Feminist And a Dog who must Fight a Boy in A Baloon Factory,2006,English,,3,4.99,104,18.99,R,MARY,KEITEL
198,406,HAUNTING PIANIST,A Fast-Paced Story of a Database Administrator And a Composer who must Defeat a Squirrel in An Abandoned Amusement Park,2006,English,,5,0.99,181,22.99,R,MARY,KEITEL
198,1,ACADEMY DINOSAUR,A Epic Drama of a Feminist And a Mad Scientist who must Battle a Teacher in The Canadian Rockies,2006,English,,6,0.99,86,20.99,PG,MARY,KEITEL
198,329,FORREST SONS,A Thrilling Documentary of a Forensic Psychologist And a Butler who must Defeat a Explorer in A Jet Boat,2006,English,,4,2.99,63,15.99,R,MARY,KEITEL
198,997,YOUTH KICK,A Touching Drama of a Teacher And a Cat who must Challenge a Technical Writer in A U-Boat,2006,English,,4,0.99,179,14.99,NC-17,MARY,KEITEL
198,588,MODEL FISH,A Beautiful Panorama of a Boat And a Crocodile who must Outrace a Dog in Australia,2006,English,,4,4.99,175,11.99,NC-17,MARY,KEITEL
198,482,JEOPARDY ENCINO,A Boring Panorama of a Man And a Mad Cow who must Face a Explorer in Ancient India,2006,English,,3,0.99,102,12.99,R,MARY,KEITEL
198,796,SIERRA DIVIDE,A Emotional Character Study of a Frisbee And a Mad Scientist who must Build a Madman in California,2006,English,,3,0.99,135,12.99,NC-17,MARY,KEITEL
198,395,HANDICAP BOONDOCK,A Beautiful Display of a Pioneer And a Squirrel who must Vanquish a Sumo Wrestler in Soviet Georgia,2006,English,,4,0.99,108,28.99,R,MARY,KEITEL
198,952,WAGON JAWS,A Intrepid Drama of a Moose And a Boat who must Kill a Explorer in A Manhattan Penthouse,2006,English,,7,2.99,152,17.99,PG,MARY,KEITEL
198,303,FANTASY TROOPERS,A Touching Saga of a Teacher And a Monkey who must Overcome a Secret Agent in A MySQL Convention,2006,English,,6,0.99,58,27.99,PG-13,MARY,KEITEL
198,597,MOONWALKER FOOL,A Epic Drama of a Feminist And a Pioneer who must Sink a Composer in New Orleans,2006,English,,5,4.99,184,12.99,G,MARY,KEITEL
198,347,GAMES BOWFINGER,A Astounding Documentary of a Butler And a Explorer who must Challenge a Butler in A Monastery,2006,English,,7,4.99,119,17.99,PG-13,MARY,KEITEL
198,745,ROSES TREASURE,A Astounding Panorama of a Monkey And a Secret Agent who must Defeat a Woman in The First Manned Space Station,2006,English,,5,4.99,162,23.99,PG-13,MARY,KEITEL
198,871,SWEDEN SHINING,A Taut Documentary of a Car And a Robot who must Conquer a Boy in The Canadian Rockies,2006,English,,6,4.99,176,19.99,PG,MARY,KEITEL
198,806,SLEEPY JAPANESE,A Emotional Epistle of a Moose And a Composer who must Fight a Technical Writer in The Outback,2006,English,,4,2.99,137,25.99,PG,MARY,KEITEL
198,817,SOLDIERS EVOLUTION,A Lacklusture Panorama of a A Shark And a Pioneer who must Confront a Student in The First Manned Space Station,2006,English,,7,4.99,185,27.99,R,MARY,KEITEL
198,536,LOVELY JINGLE,A Fanciful Yarn of a Crocodile And a Forensic Psychologist who must Discover a Crocodile in The Outback,2006,English,,3,2.99,65,18.99,PG,MARY,KEITEL
198,843,STEEL SANTA,A Fast-Paced Yarn of a Composer And a Frisbee who must Face a Moose in Nigeria,2006,English,,4,4.99,143,15.99,NC-17,MARY,KEITEL
198,886,THEORY MERMAID,A Fateful Yarn of a Composer And a Monkey who must Vanquish a Womanizer in The First Manned Space Station,2006,English,,5,0.99,184,9.99,PG-13,MARY,KEITEL
136,262,DUMBO LUST,A Touching Display of a Feminist And a Dentist who must Conquer a Husband in The Gulf of Mexico,2006,English,,5,0.99,119,17.99,NC-17,ED,MANSFIELD
136,649,OZ LIAISONS,A Epic Yarn of a Mad Scientist And a Cat who must Confront a Womanizer in A Baloon Factory,2006,English,,4,2.99,85,14.99,R,ED,MANSFIELD
136,193,CROSSROADS CASUALTIES,A Intrepid Documentary of a Sumo Wrestler And a Astronaut who must Battle a Composer in The Outback,2006,English,,5,2.99,153,20.99,G,ED,MANSFIELD
136,256,DROP WATERFRONT,A Fanciful Documentary of a Husband And a Explorer who must Reach a Madman in Ancient China,2006,English,,6,4.99,178,20.99,R,ED,MANSFIELD
136,620,NEMO CAMPUS,A Lacklusture Reflection of a Monkey And a Squirrel who must Outrace a Womanizer in A Manhattan Penthouse,2006,English,,5,2.99,131,23.99,NC-17,ED,MANSFIELD
136,474,JADE BUNCH,A Insightful Panorama of a Squirrel And a Mad Cow who must Confront a Student in The First Manned Space Station,2006,English,,6,2.99,174,21.99,NC-17,ED,MANSFIELD
136,414,HELLFIGHTERS SIERRA,A Taut Reflection of a A Shark And a Dentist who must Battle a Boat in Soviet Georgia,2006,English,,3,2.99,75,23.99,PG,ED,MANSFIELD
136,933,VAMPIRE WHALE,A Epic Story of a Lumberjack And a Monkey who must Confront a Pioneer in A MySQL Convention,2006,English,,4,4.99,126,11.99,NC-17,ED,MANSFIELD
136,686,PLUTO OLEANDER,A Action-Packed Reflection of a Car And a Moose who must Outgun a Car in A Shark Tank,2006,English,,5,4.99,84,9.99,R,ED,MANSFIELD
136,33,APOLLO TEEN,A Action-Packed Reflection of a Crocodile And a Explorer who must Find a Sumo Wrestler in An Abandoned Mine Shaft,2006,English,,5,2.99,153,15.99,PG-13,ED,MANSFIELD
136,485,JERSEY SASSY,A Lacklusture Documentary of a Madman And a Mad Cow who must Find a Feminist in Ancient Japan,2006,English,,6,4.99,60,16.99,PG,ED,MANSFIELD
136,420,HOLES BRANNIGAN,A Fast-Paced Reflection of a Technical Writer And a Student who must Fight a Boy in The Canadian Rockies,2006,English,,7,4.99,128,27.99,PG,ED,MANSFIELD
136,288,ESCAPE METROPOLIS,A Taut Yarn of a Astronaut And a Technical Writer who must Outgun a Boat in New Orleans,2006,English,,7,2.99,167,20.99,R,ED,MANSFIELD
136,229,DEVIL DESIRE,A Beautiful Reflection of a Monkey And a Dentist who must Face a Database Administrator in Ancient Japan,2006,English,,6,4.99,87,12.99,R,ED,MANSFIELD
136,552,MAJESTIC FLOATS,A Thrilling Character Study of a Moose And a Student who must Escape a Butler in The First Manned Space Station,2006,English,,5,0.99,130,15.99,PG,ED,MANSFIELD
136,61,BEAUTY GREASE,A Fast-Paced Display of a Composer And a Moose who must Sink a Robot in An Abandoned Mine Shaft,2006,English,,5,4.99,175,28.99,G,ED,MANSFIELD
136,300,FALCON VOLUME,A Fateful Saga of a Sumo Wrestler And a Hunter who must Redeem a A Shark in New Orleans,2006,English,,5,4.99,102,21.99,PG-13,ED,MANSFIELD
136,806,SLEEPY JAPANESE,A Emotional Epistle of a Moose And a Composer who must Fight a Technical Writer in The Outback,2006,English,,4,2.99,137,25.99,PG,ED,MANSFIELD
136,20,AMELIE HELLFIGHTERS,A Boring Drama of a Woman And a Squirrel who must Conquer a Student in A Baloon,2006,English,,4,4.99,79,23.99,R,ED,MANSFIELD
136,271,EASY GLADIATOR,A Fateful Story of a Monkey And a Girl who must Overcome a Pastry Chef in Ancient India,2006,English,,5,4.99,148,12.99,G,ED,MANSFIELD
136,842,STATE WASTELAND,A Beautiful Display of a Cat And a Pastry Chef who must Outrace a Mad Cow in A Jet Boat,2006,English,,4,2.99,113,13.99,NC-17,ED,MANSFIELD
136,214,DAUGHTER MADIGAN,A Beautiful Tale of a Hunter And a Mad Scientist who must Confront a Squirrel in The First Manned Space Station,2006,English,,3,4.99,59,13.99,PG-13,ED,MANSFIELD
136,808,SLING LUKE,A Intrepid Character Study of a Robot And a Monkey who must Reach a Secret Agent in An Abandoned Amusement Park,2006,English,,5,0.99,84,10.99,R,ED,MANSFIELD
136,818,SOMETHING DUCK,A Boring Character Study of a Car And a Husband who must Outgun a Frisbee in The First Manned Space Station,2006,English,,4,4.99,180,17.99,NC-17,ED,MANSFIELD
3,971,WHALE BIKINI,A Intrepid Story of a Pastry Chef And a Database Administrator who must Kill a Feminist in A MySQL Convention,2006,English,,4,4.99,109,11.99,PG-13,ED,CHASE
3,393,HALLOWEEN NUTS,A Amazing Panorama of a Forensic Psychologist And a Technical Writer who must Fight a Dentist in A U-Boat,2006,English,,6,2.99,47,19.99,PG-13,ED,CHASE
3,539,LUCK OPUS,A Boring Display of a Moose And a Squirrel who must Outrace a Teacher in A Shark Tank,2006,English,,7,2.99,152,21.99,NC-17,ED,CHASE
3,40,ARMY FLINTSTONES,A Boring Saga of a Database Administrator And a Womanizer who must Battle a Waitress in Nigeria,2006,English,,4,0.99,148,22.99,R,ED,CHASE
3,87,BOONDOCK BALLROOM,A Fateful Panorama of a Crocodile And a Boy who must Defeat a Monkey in The Gulf of Mexico,2006,English,,7,0.99,76,14.99,NC-17,ED,CHASE
3,336,FRENCH HOLIDAY,A Thrilling Epistle of a Dog And a Feminist who must Kill a Madman in Berlin,2006,English,,5,4.99,99,22.99,PG,ED,CHASE
3,996,YOUNG LANGUAGE,A Unbelieveable Yarn of a Boat And a Database Administrator who must Meet a Boy in The First Manned Space Station,2006,English,,6,0.99,183,9.99,G,ED,CHASE
3,453,IMAGE PRINCESS,A Lacklusture Panorama of a Secret Agent And a Crocodile who must Discover a Madman in The Canadian Rockies,2006,English,,3,2.99,178,17.99,PG-13,ED,CHASE
3,329,FORREST SONS,A Thrilling Documentary of a Forensic Psychologist And a Butler who must Defeat a Explorer in A Jet Boat,2006,English,,4,2.99,63,15.99,R,ED,CHASE
3,289,EVE RESURRECTION,A Awe-Inspiring Yarn of a Pastry Chef And a Database Administrator who must Challenge a Teacher in A Baloon,2006,English,,5,4.99,66,25.99,G,ED,CHASE
3,827,SPICE SORORITY,A Fateful Display of a Pioneer And a Hunter who must Defeat a Husband in An Abandoned Mine Shaft,2006,English,,5,4.99,141,22.99,NC-17,ED,CHASE
3,480,JEEPERS WEDDING,A Astounding Display of a Composer And a Dog who must Kill a Pastry Chef in Soviet Georgia,2006,English,,3,2.99,84,29.99,R,ED,CHASE
3,111,CADDYSHACK JEDI,A Awe-Inspiring Epistle of a Woman And a Madman who must Fight a Robot in Soviet Georgia,2006,English,,3,0.99,52,17.99,NC-17,ED,CHASE
3,441,HUNTER ALTER,A Emotional Drama of a Mad Cow And a Boat who must Redeem a Secret Agent in A Shark Tank,2006,English,,5,2.99,125,21.99,PG-13,ED,CHASE
3,17,ALONE TRIP,A Fast-Paced Character Study of a Composer And a Dog who must Outgun a Boat in An Abandoned Fun House,2006,English,,3,0.99,82,14.99,R,ED,CHASE
3,685,PLATOON INSTINCT,A Thrilling Panorama of a Man And a Woman who must Reach a Woman in Australia,2006,English,,6,4.99,132,10.99,PG-13,ED,CHASE
191,971,WHALE BIKINI,A Intrepid Story of a Pastry Chef And a Database Administrator who must Kill a Feminist in A MySQL Convention,2006,English,,4,4.99,109,11.99,PG-13,GREGORY,GOODING
191,544,MADISON TRAP,A Awe-Inspiring Reflection of a Monkey And a Dentist who must Overcome a Pioneer in A U-Boat,2006,English,,4,2.99,147,11.99,R,GREGORY,GOODING
191,830,SPIRIT FLINTSTONES,A Brilliant Yarn of a Cat And a Car who must Confront a Explorer in Ancient Japan,2006,English,,7,0.99,149,23.99,R,GREGORY,GOODING
191,296,EXPRESS LONELY,A Boring Drama of a Astronaut And a Boat who must Face a Boat in California,2006,English,,5,2.99,178,23.99,R,GREGORY,GOODING
191,958,WARDROBE PHANTOM,A Action-Packed Display of a Mad Cow And a Astronaut who must Kill a Car in Ancient India,2006,English,,6,2.99,178,19.99,G,GREGORY,GOODING
191,819,SONG HEDWIG,A Amazing Documentary of a Man And a Husband who must Confront a Squirrel in A MySQL Convention,2006,English,,3,0.99,165,29.99,PG-13,GREGORY,GOODING
191,801,SISTER FREDDY,A Stunning Saga of a Butler And a Woman who must Pursue a Explorer in Australia,2006,English,,5,4.99,152,19.99,PG-13,GREGORY,GOODING
191,668,PEAK FOREVER,A Insightful Reflection of a Boat And a Secret Agent who must Vanquish a Astronaut in An Abandoned Mine Shaft,2006,English,,7,4.99,80,25.99,PG,GREGORY,GOODING
191,638,OPERATION OPERATION,A Intrepid Character Study of a Man And a Frisbee who must Overcome a Madman in Ancient China,2006,English,,7,2.99,156,23.99,G,GREGORY,GOODING
191,914,TROUBLE DATE,A Lacklusture Panorama of a Forensic Psychologist And a Woman who must Kill a Explorer in Ancient Japan,2006,English,,6,2.99,61,13.99,PG,GREGORY,GOODING
191,16,ALLEY EVOLUTION,A Fast-Paced Drama of a Robot And a Composer who must Battle a Astronaut in New Orleans,2006,English,,6,2.99,180,23.99,NC-17,GREGORY,GOODING
191,775,SEATTLE EXPECATIONS,A Insightful Reflection of a Crocodile And a Sumo Wrestler who must Meet a Technical Writer in The Sahara Desert,2006,English,,4,4.99,110,18.99,PG-13,GREGORY,GOODING
191,827,SPICE SORORITY,A Fateful Display of a Pioneer And a Hunter who must Defeat a Husband in An Abandoned Mine Shaft,2006,English,,5,4.99,141,22.99,NC-17,GREGORY,GOODING
191,420,HOLES BRANNIGAN,A Fast-Paced Reflection of a Technical Writer And a Student who must Fight a Boy in The Canadian Rockies,2006,English,,7,4.99,128,27.99,PG,GREGORY,GOODING
191,39,ARMAGEDDON LOST,A Fast-Paced Tale of a Boat And a Teacher who must Succumb a Composer in An Abandoned Mine Shaft,2006,English,,5,0.99,99,10.99,G,GREGORY,GOODING
191,551,MAIDEN HOME,A Lacklusture Saga of a Moose And a Teacher who must Kill a Forensic Psychologist in A MySQL Convention,2006,English,,3,4.99,138,9.99,PG,GREGORY,GOODING
191,378,GREATEST NORTH,A Astounding Character Study of a Secret Agent And a Robot who must Build a A Shark in Berlin,2006,English,,5,2.99,93,24.99,NC-17,GREGORY,GOODING
191,692,POTLUCK MIXED,A Beautiful Story of a Dog And a Technical Writer who must Outgun a Student in A Baloon,2006,English,,3,2.99,179,10.99,G,GREGORY,GOODING
191,834,SPOILERS HELLFIGHTERS,A Fanciful Story of a Technical Writer And a Squirrel who must Defeat a Dog in The Gulf of Mexico,2006,English,,4,0.99,151,26.99,G,GREGORY,GOODING
191,461,INSECTS STONE,A Epic Display of a Butler And a Dog who must Vanquish a Crocodile in A Manhattan Penthouse,2006,English,,3,0.99,123,14.99,NC-17,GREGORY,GOODING
41,724,REMEMBER DIARY,A Insightful Tale of a Technical Writer And a Waitress who must Conquer a Monkey in Ancient India,2006,English,,5,2.99,110,15.99,R,JODIE,DEGENERES
41,249,DRACULA CRYSTAL,A Thrilling Reflection of a Feminist And a Cat who must Find a Frisbee in An Abandoned Fun House,2006,English,,7,0.99,176,26.99,G,JODIE,DEGENERES
41,784,SHANGHAI TYCOON,A Fast-Paced Character Study of a Crocodile And a Lumberjack who must Build a Husband in An Abandoned Fun House,2006,English,,7,2.99,47,20.99,PG,JODIE,DEGENERES
41,544,MADISON TRAP,A Awe-Inspiring Reflection of a Monkey And a Dentist who must Overcome a Pioneer in A U-Boat,2006,English,,4,2.99,147,11.99,R,JODIE,DEGENERES
41,678,PICKUP DRIVING,A Touching Documentary of a Husband And a Boat who must Meet a Pastry Chef in A Baloon Factory,2006,English,,3,2.99,77,23.99,G,JODIE,DEGENERES
41,69,BEVERLY OUTLAW,A Fanciful Documentary of a Womanizer And a Boat who must Defeat a Madman in The First Manned Space Station,2006,English,,3,2.99,85,21.99,R,JODIE,DEGENERES
41,4,AFFAIR PREJUDICE,A Fanciful Documentary of a Frisbee And a Lumberjack who must Chase a Monkey in A Shark Tank,2006,English,,5,2.99,117,26.99,G,JODIE,DEGENERES
41,203,DAISY MENAGERIE,A Fast-Paced Saga of a Pastry Chef And a Monkey who must Sink a Composer in Ancient India,2006,English,,5,4.99,84,9.99,G,JODIE,DEGENERES
41,305,FATAL HAUNTED,A Beautiful Drama of a Student And a Secret Agent who must Confront a Dentist in Ancient Japan,2006,English,,6,2.99,91,24.99,PG,JODIE,DEGENERES
41,894,TOMATOES HELLFIGHTERS,A Thoughtful Epistle of a Madman And a Astronaut who must Overcome a Monkey in A Shark Tank,2006,English,,6,0.99,68,23.99,PG,JODIE,DEGENERES
41,100,BROOKLYN DESERT,A Beautiful Drama of a Dentist And a Composer who must Battle a Sumo Wrestler in The First Manned Space Station,2006,English,,7,4.99,161,21.99,R,JODIE,DEGENERES
41,912,TROJAN TOMORROW,A Astounding Panorama of a Husband And a Sumo Wrestler who must Pursue a Boat in Ancient India,2006,English,,3,2.99,52,9.99,PG,JODIE,DEGENERES
41,721,REDS POCUS,A Lacklusture Yarn of a Sumo Wrestler And a Squirrel who must Redeem a Monkey in Soviet Georgia,2006,English,,7,4.99,182,23.99,PG-13,JODIE,DEGENERES
41,596,MOONSHINE CABIN,A Thoughtful Display of a Astronaut And a Feminist who must Chase a Frisbee in A Jet Boat,2006,English,,4,4.99,171,25.99,PG-13,JODIE,DEGENERES
41,230,DIARY PANIC,A Thoughtful Character Study of a Frisbee And a Mad Cow who must Outgun a Man in Ancient India,2006,English,,7,2.99,107,20.99,G,JODIE,DEGENERES
