attore_id,film_id,titolo,descrizione,data_rilascio,lingua,lingua_originale_id,durata_noleggio,tariffa_noleggio,durata,costo_sostituzione,voto,nome,cognome
86,905,TRAINSPOTTING STRANGERS,A Fast-Paced Drama of a Pioneer And a Mad Cow who must Challenge a Madman in Ancient Japan,2006,English,,7,4.99,132,10.99,PG-13,GREG,CHAPLIN
152,898,TOURIST PELICAN,A Boring Story of a Butler And a Astronaut who must Outrace a Pioneer in Australia,2006,English,,4,4.99,152,18.99,PG-13,BEN,HARRIS
152,680,PINOCCHIO SIMON,A Action-Packed Reflection of a Mad Scientist And a A Shark who must Find a Feminist in California,2006,English,,4,4.99,103,21.99,PG,BEN,HARRIS
152,153,CITIZEN SHREK,A Fanciful Character Study of a Technical Writer And a Husband who must Redeem a Robot in The Outback,2006,English,,7,0.99,165,18.99,G,BEN,HARRIS
152,475,JAPANESE RUN,A Awe-Inspiring Epistle of a Feminist And a Girl who must Sink a Girl in The Outback,2006,English,,6,0.99,135,29.99,G,BEN,HARRIS
152,607,MUPPET MILE,A Lacklusture Story of a Madman And a Teacher who must Kill a Frisbee in The Gulf of Mexico,2006,English,,5,4.99,50,18.99,PG,BEN,HARRIS
152,927,UPRISING UPTOWN,A Fanciful Reflection of a Boy And a Butler who must Pursue a Woman in Berlin,2006,English,,6,2.99,174,16.99,NC-17,BEN,HARRIS
152,964,WATERFRONT DELIVERANCE,A Unbelieveable Documentary of a Dentist And a Technical Writer who must Build a Womanizer in Nigeria,2006,English,,4,4.99,61,17.99,G,BEN,HARRIS
152,332,FRANKENSTEIN STRANGER,A Insightful Character Study of a Feminist And a Pioneer who must Pursue a Pastry Chef in Nigeria,2006,English,,7,0.99,159,16.99,NC-17,BEN,HARRIS
152,968,WEREWOLF LOLA,A Fanciful Story of a Man And a Sumo Wrestler who must Outrace a Student in A Monastery,2006,English,,6,4.99,79,19.99,G,BEN,HARRIS
152,248,DOZEN LION,A Taut Drama of a Cat And a Girl who must Defeat a Frisbee in The Canadian Rockies,2006,English,,6,4.99,177,20.99,NC-17,BEN,HARRIS
152,59,BEAR GRACELAND,A Astounding Saga of a Dog And a Boy who must Kill a Teacher in The First Manned Space Station,2006,English,,4,2.99,160,20.99,R,BEN,HARRIS
152,729,RIDER CADDYSHACK,A Taut Reflection of a Monkey And a Womanizer who must Chase a Moose in Nigeria,2006,English,,5,2.99,177,28.99,PG,BEN,HARRIS
152,615,NASH CHOCOLAT,A Epic Reflection of a Monkey And a Mad Cow who must Kill a Forensic Psychologist in An Abandoned Mine Shaft,2006,English,,6,2.99,180,21.99,PG-13,BEN,HARRIS
152,578,MILLION ACE,A Brilliant Documentary of a Womanizer And a Squirrel who must Find a Technical Writer in The Sahara Desert,2006,English,,4,4.99,142,16.99,PG-13,BEN,HARRIS
152,476,JASON TRAP,A Thoughtful Tale of a Woman And a A Shark who must Conquer a Dog in A Monastery,2006,English,,5,2.99,130,9.99,NC-17,BEN,HARRIS
152,217,DAZED PUNK,A Action-Packed Story of a Pioneer And a Technical Writer who must Discover a Forensic Psychologist in An Abandoned Amusement Park,2006,English,,6,4.99,120,20.99,G,BEN,HARRIS
152,821,SORORITY QUEEN,A Fast-Paced Display of a Squirrel And a Composer who must Fight a Forensic Psychologist in A Jet Boat,2006,English,,6,0.99,184,17.99,NC-17,BEN,HARRIS
152,891,TIMBERLAND SKY,A Boring Display of a Man And a Dog who must Redeem a Girl in A U-Boat,2006,English,,3,0.99,69,13.99,G,BEN,HARRIS
152,768,SCARFACE BANG,A Emotional Yarn of a Teacher And a Girl who must Find a Teacher in A Baloon Factory,2006,English,,3,4.99,102,11.99,PG-13,BEN,HARRIS
152,611,MUSKETEERS WAIT,A Touching Yarn of a Student And a Moose who must Fight a Mad Cow in Australia,2006,English,,7,4.99,73,17.99,PG,BEN,HARRIS
120,898,TOURIST PELICAN,A Boring Story of a Butler And a Astronaut who must Outrace a Pioneer in Australia,2006,English,,4,4.99,152,18.99,PG-13,PENELOPE,MONROE
120,682,PITTSBURGH HUNCHBACK,A Thrilling Epistle of a Boy And a Boat who must Find a Student in Soviet Georgia,2006,English,,4,4.99,134,17.99,PG-13,PENELOPE,MONROE
120,208,DARES PLUTO,A Fateful Story of a Robot And a Dentist who must Defeat a Astronaut in New Orleans,2006,English,,7,2.99,89,16.99,PG-13,PENELOPE,MONROE
120,911,TRIP NEWTON,A Fanciful Character Study of a Lumberjack And a Car who must Discover a Cat in An Abandoned Amusement Park,2006,English,,7,4.99,64,14.99,PG-13,PENELOPE,MONROE
120,590,MONEY HAROLD,A Touching Tale of a Explorer And a Boat who must Defeat a Robot in Australia,2006,English,,3,2.99,135,17.99,PG,PENELOPE,MONROE
120,830,SPIRIT FLINTSTONES,A Brilliant Yarn of a Cat And a Car who must Confront a Explorer in Ancient Japan,2006,English,,7,0.99,149,23.99,R,PENELOPE,MONROE
120,255,DRIVING POLISH,A Action-Packed Yarn of a Feminist And a Technical Writer who must Sink a Boat in An Abandoned Mine Shaft,2006,English,,6,4.99,175,21.99,NC-17,PENELOPE,MONROE
120,231,DINOSAUR SECRETARY,A Action-Packed Drama of a Feminist And a Girl who must Reach a Robot in The Canadian Rockies,2006,English,,7,2.99,63,27.99,R,PENELOPE,MONROE
120,513,LEATHERNECKS DWARFS,A Fateful Reflection of a Dog And a Mad Cow who must Outrace a Teacher in An Abandoned Mine Shaft,2006,English,,6,2.99,153,21.99,PG-13,PENELOPE,MONROE
120,414,HELLFIGHTERS SIERRA,A Taut Reflection of a A Shark And a Dentist who must Battle a Boat in Soviet Georgia,2006,English,,3,2.99,75,23.99,PG,PENELOPE,MONROE
120,894,TOMATOES HELLFIGHTERS,A Thoughtful Epistle of a Madman And a Astronaut who must Overcome a Monkey in A Shark Tank,2006,English,,6,0.99,68,23.99,PG,PENELOPE,MONROE
120,63,BEDAZZLED MARRIED,A Astounding Character Study of a Madman And a Robot who must Meet a Mad Scientist in An Abandoned Fun House,2006,English,,6,0.99,73,21.99,PG,PENELOPE,MONROE
120,489,JUGGLER HARDLY,A Epic Story of a Mad Cow And a Astronaut who must Challenge a Car in California,2006,English,,4,0.99,54,14.99,PG-13,PENELOPE,MONROE
120,994,WYOMING STORM,A Awe-Inspiring Panorama of a Robot And a Boat who must Overcome a Feminist in A U-Boat,2006,English,,6,4.99,100,29.99,PG-13,PENELOPE,MONROE
120,691,POSEIDON FOREVER,A Thoughtful Epistle of a Womanizer And a Monkey who must Vanquish a Dentist in A Monastery,2006,English,,6,4.99,159,29.99,PG-13,PENELOPE,MONROE
120,144,CHINATOWN GLADIATOR,A Brilliant Panorama of a Technical Writer And a Lumberjack who must Escape a Butler in Ancient India,2006,English,,7,4.99,61,24.99,PG,PENELOPE,MONROE
120,717,REAR TRADING,A Awe-Inspiring Reflection of a Forensic Psychologist And a Secret Agent who must Succumb a Pastry Chef in Soviet Georgia,2006,English,,6,0.99,97,23.99,NC-17,PENELOPE,MONROE
120,659,PARK CITIZEN,A Taut Epistle of a Sumo Wrestler And a Girl who must Face a Husband in Ancient Japan,2006,English,,3,4.99,109,14.99,PG-13,PENELOPE,MONROE
120,238,DOCTOR GRAIL,A Insightful Drama of a Womanizer And a Waitress who must Reach a Forensic Psychologist in The Outback,2006,English,,4,2.99,57,29.99,G,PENELOPE,MONROE
120,641,ORANGE GRAPES,A Astounding Documentary of a Butler And a Womanizer who must Face a Dog in A U-Boat,2006,English,,4,0.99,76,21.99,PG-13,PENELOPE,MONROE
120,57,BASIC EASY,A Stunning Epistle of a Man And a Husband who must Reach a Mad Scientist in A Jet Boat,2006,English,,4,2.99,90,18.99,PG-13,PENELOPE,MONROE
120,424,HOLOCAUST HIGHBALL,A Awe-Inspiring Yarn of a Composer And a Man who must Find a Robot in Soviet Georgia,2006,English,,6,0.99,149,12.99,R,PENELOPE,MONROE
120,722,REEF SALUTE,A Action-Packed Saga of a Teacher And a Lumberjack who must Battle a Dentist in A Baloon,2006,English,,5,0.99,123,26.99,NC-17,PENELOPE,MONROE
130,592,MONSTER SPARTACUS,A Fast-Paced Story of a Waitress And a Cat who must Fight a Girl in Australia,2006,English,,6,2.99,107,28.99,PG,GRETA,KEITEL
130,208,DARES PLUTO,A Fateful Story of a Robot And a Dentist who must Defeat a Astronaut in New Orleans,2006,English,,7,2.99,89,16.99,PG-13,GRETA,KEITEL
130,452,ILLUSION AMELIE,A Emotional Epistle of a Boat And a Mad Scientist who must Outrace a Robot in An Abandoned Mine Shaft,2006,English,,4,0.99,122,15.99,R,GRETA,KEITEL
130,43,ATLANTIS CAUSE,A Thrilling Yarn of a Feminist And a Hunter who must Fight a Technical Writer in A Shark Tank,2006,English,,6,2.99,170,15.99,G,GRETA,KEITEL
130,725,REQUIEM TYCOON,A Unbelieveable Character Study of a Cat And a Database Administrator who must Pursue a Teacher in A Monastery,2006,English,,6,4.99,167,25.99,R,GRETA,KEITEL
130,981,WOLVES DESIRE,A Fast-Paced Drama of a Squirrel And a Robot who must Succumb a Technical Writer in A Manhattan Penthouse,2006,English,,7,0.99,55,13.99,NC-17,GRETA,KEITEL
130,764,SATURDAY LAMBS,A Thoughtful Reflection of a Mad Scientist And a Moose who must Kill a Husband in A Baloon,2006,English,,3,4.99,150,28.99,G,GRETA,KEITEL
130,453,IMAGE PRINCESS,A Lacklusture Panorama of a Secret Agent And a Crocodile who must Discover a Madman in The Canadian Rockies,2006,English,,3,2.99,178,17.99,PG-13,GRETA,KEITEL
130,809,SLIPPER FIDELITY,A Taut Reflection of a Secret Agent And a Man who must Redeem a Explorer in A MySQL Convention,2006,English,,5,0.99,156,14.99,PG-13,GRETA,KEITEL
130,49,BADMAN DAWN,A Emotional Panorama of a Pioneer And a Composer who must Escape a Mad Scientist in A Jet Boat,2006,English,,6,2.99,162,22.99,R,GRETA,KEITEL
130,9,ALABAMA DEVIL,A Thoughtful Panorama of a Database Administrator And a Mad Scientist who must Outgun a Mad Scientist in A Jet Boat,2006,English,,3,2.99,114,21.99,PG-13,GRETA,KEITEL
130,375,GRAIL FRANKENSTEIN,A Unbelieveable Saga of a Teacher And a Monkey who must Fight a Girl in An Abandoned Mine Shaft,2006,English,,4,2.99,85,17.99,NC-17,GRETA,KEITEL
130,478,JAWS HARRY,A Thrilling Display of a Database Administrator And a Monkey who must Overcome a Dog in An Abandoned Fun House,2006,English,,4,2.99,112,10.99,G,GRETA,KEITEL
130,37,ARIZONA BANG,A Brilliant Panorama of a Mad Scientist And a Mad Cow who must Meet a Pioneer in A Monastery,2006,English,,3,2.99,121,28.99,PG,GRETA,KEITEL
130,549,MAGNOLIA FORRESTER,A Thoughtful Documentary of a Composer And a Explorer who must Conquer a Dentist in New Orleans,2006,English,,4,0.99,171,28.99,PG-13,GRETA,KEITEL
130,107,BUNCH MINDS,A Emotional Story of a Feminist And a Feminist who must Escape a Pastry Chef in A MySQL Convention,2006,English,,4,2.99,63,13.99,G,GRETA,KEITEL
130,507,LADYBUGS ARMAGEDDON,A Fateful Reflection of a Dog And a Mad Scientist who must Meet a Mad Scientist in New Orleans,2006,English,,4,0.99,113,13.99,NC-17,GRETA,KEITEL
130,525,LOATHING LEGALLY,A Boring Epistle of a Pioneer And a Mad Scientist who must Escape a Frisbee in The Gulf of Mexico,2006,English,,4,0.99,140,29.99,R,GRETA,KEITEL
130,57,BASIC EASY,A Stunning Epistle of a Man And a Husband who must Reach a Mad Scientist in A Jet Boat,2006,English,,4,2.99,90,18.99,PG-13,GRETA,KEITEL
130,26,ANNIE IDENTITY,A Amazing Panorama of a Pastry Chef And a Boat who must Escape a Woman in An Abandoned Amusement Park,2006,English,,3,0.99,86,15.99,G,GRETA,KEITEL
173,592,MONSTER SPARTACUS,A Fast-Paced Story of a Waitress And a Cat who must Fight a Girl in Australia,2006,English,,6,2.99,107,28.99,PG,ALAN,DREYFUSS
173,550,MAGUIRE APACHE,A Fast-Paced Reflection of a Waitress And a Hunter who must Defeat a Forensic Psychologist in A Baloon,2006,English,,6,2.99,74,22.99,NC-17,ALAN,DREYFUSS
173,852,STRANGELOVE DESIRE,A Awe-Inspiring Panorama of a Lumberjack And a Waitress who must Defeat a Crocodile in An Abandoned Amusement Park,2006,English,,4,0.99,103,27.99,NC-17,ALAN,DREYFUSS
173,921,UNCUT SUICIDES,A Intrepid Yarn of a Explorer And a Pastry Chef who must Pursue a Mad Cow in A U-Boat,2006,English,,7,2.99,172,29.99,PG-13,ALAN,DREYFUSS
173,379,GREEDY ROOTS,A Amazing Reflection of a A Shark And a Butler who must Chase a Hunter in The Canadian Rockies,2006,English,,7,0.99,166,14.99,R,ALAN,DREYFUSS
173,928,UPTOWN YOUNG,A Fateful Documentary of a Dog And a Hunter who must Pursue a Teacher in An Abandoned Amusement Park,2006,English,,5,2.99,84,16.99,PG,ALAN,DREYFUSS
173,529,LONELY ELEPHANT,A Intrepid Story of a Student And a Dog who must Challenge a Explorer in Soviet Georgia,2006,English,,3,2.99,67,12.99,G,ALAN,DREYFUSS
173,933,VAMPIRE WHALE,A Epic Story of a Lumberjack And a Monkey who must Confront a Pioneer in A MySQL Convention,2006,English,,4,4.99,126,11.99,NC-17,ALAN,DREYFUSS
173,688,POLISH BROOKLYN,A Boring Character Study of a Database Administrator And a Lumberjack who must Reach a Madman in The Outback,2006,English,,6,0.99,61,12.99,PG,ALAN,DREYFUSS
173,405,HAUNTED ANTITRUST,A Amazing Saga of a Man And a Dentist who must Reach a Technical Writer in Ancient India,2006,English,,6,4.99,76,13.99,NC-17,ALAN,DREYFUSS
173,74,BIRCH ANTITRUST,A Fanciful Panorama of a Husband And a Pioneer who must Outgun a Dog in A Baloon,2006,English,,4,4.99,162,18.99,PG,ALAN,DREYFUSS
173,564,MASSAGE IMAGE,A Fateful Drama of a Frisbee And a Crocodile who must Vanquish a Dog in The First Manned Space Station,2006,English,,4,2.99,161,11.99,PG,ALAN,DREYFUSS
173,162,CLUELESS BUCKET,A Taut Tale of a Car And a Pioneer who must Conquer a Sumo Wrestler in An Abandoned Fun House,2006,English,,4,2.99,95,13.99,R,ALAN,DREYFUSS
173,154,CLASH FREDDY,A Amazing Yarn of a Composer And a Squirrel who must Escape a Astronaut in Australia,2006,English,,6,2.99,81,12.99,G,ALAN,DREYFUSS
173,49,BADMAN DAWN,A Emotional Panorama of a Pioneer And a Composer who must Escape a Mad Scientist in A Jet Boat,2006,English,,6,2.99,162,22.99,R,ALAN,DREYFUSS
173,753,RUSH GOODFELLAS,A Emotional Display of a Man And a Dentist who must Challenge a Squirrel in Australia,2006,English,,3,0.99,48,20.99,PG,ALAN,DREYFUSS
173,496,KICK SAVANNAH,A Emotional Drama of a Monkey And a Robot who must Defeat a Monkey in New Orleans,2006,English,,3,0.99,179,10.99,PG-13,ALAN,DREYFUSS
173,80,BLANKET BEVERLY,A Emotional Documentary of a Student And a Girl who must Build a Boat in Nigeria,2006,English,,7,2.99,148,21.99,G,ALAN,DREYFUSS
173,571,METAL ARMAGEDDON,A Thrilling Display of a Lumberjack And a Crocodile who must Meet a Monkey in A Baloon Factory,2006,English,,6,2.99,161,26.99,PG-13,ALAN,DREYFUSS
173,857,STRICTLY SCARFACE,A Touching Reflection of a Crocodile And a Dog who must Chase a Hunter in An Abandoned Fun House,2006,English,,3,2.99,144,24.99,PG-13,ALAN,DREYFUSS
173,313,FIDELITY DEVIL,A Awe-Inspiring Drama of a Technical Writer And a Composer who must Reach a Pastry Chef in A U-Boat,2006,English,,5,4.99,118,11.99,G,ALAN,DREYFUSS
173,55,BARBARELLA STREETCAR,A Awe-Inspiring Story of a Feminist And a Cat who must Conquer a Dog in A Monastery,2006,English,,6,2.99,65,27.99,G,ALAN,DREYFUSS
173,106,BULWORTH COMMANDMENTS,A Amazing Display of a Mad Cow And a Pioneer who must Redeem a Sumo Wrestler in The Outback,2006,English,,4,2.99,61,14.99,G,ALAN,DREYFUSS
59,984,WONDERFUL DROP,A Boring Panorama of a Woman And a Madman who must Overcome a Butler in A U-Boat,2006,English,,3,2.99,126,20.99,NC-17,DUSTIN,TAUTOU
59,862,SUMMER SCARFACE,A Emotional Panorama of a Lumberjack And a Hunter who must Meet a Girl in A Shark Tank,2006,English,,5,0.99,53,25.99,G,DUSTIN,TAUTOU
59,5,AFRICAN EGG,A Fast-Paced Documentary of a Pastry Chef And a Dentist who must Pursue a Forensic Psychologist in The Gulf of Mexico,2006,English,,6,2.99,130,22.99,G,DUSTIN,TAUTOU
59,772,SEA VIRGIN,A Fast-Paced Documentary of a Technical Writer And a Pastry Chef who must Escape a Moose in A U-Boat,2006,English,,4,2.99,80,24.99,PG,DUSTIN,TAUTOU
59,121,CAROL TEXAS,A Astounding Character Study of a Composer And a Student who must Overcome a Composer in A Monastery,2006,English,,4,2.99,151,15.99,PG,DUSTIN,TAUTOU
59,749,RULES HUMAN,A Beautiful Epistle of a Astronaut And a Student who must Confront a Monkey in An Abandoned Fun House,2006,English,,6,4.99,153,19.99,R,DUSTIN,TAUTOU
59,853,STRANGER STRANGERS,A Awe-Inspiring Yarn of a Womanizer And a Explorer who must Fight a Woman in The First Manned Space Station,2006,English,,3,4.99,139,12.99,G,DUSTIN,TAUTOU
59,241,DONNIE ALLEY,A Awe-Inspiring Tale of a Butler And a Frisbee who must Vanquish a Teacher in Ancient Japan,2006,English,,4,0.99,125,20.99,NC-17,DUSTIN,TAUTOU
59,713,RAINBOW SHOCK,A Action-Packed Story of a Hunter And a Boy who must Discover a Lumberjack in Ancient India,2006,English,,3,4.99,74,14.99,PG,DUSTIN,TAUTOU
59,183,CONVERSATION DOWNHILL,A Taut Character Study of a Husband And a Waitress who must Sink a Squirrel in A MySQL Convention,2006,English,,4,4.99,112,14.99,R,DUSTIN,TAUTOU
59,46,AUTUMN CROW,A Beautiful Tale of a Dentist And a Mad Cow who must Battle a Moose in The Sahara Desert,2006,English,,3,4.99,108,13.99,G,DUSTIN,TAUTOU
59,295,EXPENDABLE STALLION,A Amazing Character Study of a Mad Cow And a Squirrel who must Discover a Hunter in A U-Boat,2006,English,,3,0.99,97,14.99,PG,DUSTIN,TAUTOU
59,650,PACIFIC AMISTAD,A Thrilling Yarn of a Dog And a Moose who must Kill a Pastry Chef in A Manhattan Penthouse,2006,English,,3,0.99,144,27.99,G,DUSTIN,TAUTOU
59,88,BORN SPINAL,A Touching Epistle of a Frisbee And a Husband who must Pursue a Student in Nigeria,2006,English,,7,4.99,179,17.99,PG,DUSTIN,TAUTOU
59,129,CAUSE DATE,A Taut Tale of a Explorer And a Pastry Chef who must Conquer a Hunter in A MySQL Convention,2006,English,,3,2.99,179,16.99,R,DUSTIN,TAUTOU
59,54,BANGER PINOCCHIO,A Awe-Inspiring Drama of a Car And a Pastry Chef who must Chase a Crocodile in The First Manned Space Station,2006,English,,5,0.99,113,15.99,R,DUSTIN,TAUTOU
59,946,VIRTUAL SPOILERS,A Fateful Tale of a Database Administrator And a Squirrel who must Discover a Student in Soviet Georgia,2006,English,,3,4.99,144,14.99,NC-17,DUSTIN,TAUTOU
59,72,BILL OTHERS,A Stunning Saga of a Mad Scientist And a Forensic Psychologist who must Challenge a Squirrel in A MySQL Convention,2006,English,,6,2.99,93,12.99,PG,DUSTIN,TAUTOU
59,418,HOBBIT ALIEN,A Emotional Drama of a Husband And a Girl who must Outgun a Composer in The First Manned Space Station,2006,English,,5,0.99,157,27.99,PG-13,DUSTIN,TAUTOU
183,495,KENTUCKIAN GIANT,A Stunning Yarn of a Woman And a Frisbee who must Escape a Waitress in A U-Boat,2006,English,,5,2.99,169,10.99,PG,RUSSELL,CLOSE
183,389,GUNFIGHTER MUSSOLINI,A Touching Saga of a Robot And a Boy who must Kill a Man in Ancient Japan,2006,English,,3,2.99,127,9.99,PG-13,RUSSELL,CLOSE
183,862,SUMMER SCARFACE,A Emotional Panorama of a Lumberjack And a Hunter who must Meet a Girl in A Shark Tank,2006,English,,5,0.99,53,25.99,G,RUSSELL,CLOSE
183,40,ARMY FLINTSTONES,A Boring Saga of a Database Administrator And a Womanizer who must Battle a Waitress in Nigeria,2006,English,,4,0.99,148,22.99,R,RUSSELL,CLOSE
183,32,APOCALYPSE FLAMINGOS,A Astounding Story of a Dog And a Squirrel who must Defeat a Woman in An Abandoned Amusement Park,2006,English,,6,4.99,119,11.99,R,RUSSELL,CLOSE
183,520,LICENSE WEEKEND,A Insightful Story of a Man And a Husband who must Overcome a Madman in A Monastery,2006,English,,7,2.99,91,28.99,NC-17,RUSSELL,CLOSE
183,914,TROUBLE DATE,A Lacklusture Panorama of a Forensic Psychologist And a Woman who must Kill a Explorer in Ancient Japan,2006,English,,6,2.99,61,13.99,PG,RUSSELL,CLOSE
183,850,STORY SIDE,A Lacklusture Saga of a Boy And a Cat who must Sink a Dentist in An Abandoned Mine Shaft,2006,English,,7,0.99,163,27.99,R,RUSSELL,CLOSE
183,983,WON DARES,A Unbelieveable Documentary of a Teacher And a Monkey who must Defeat a Explorer in A U-Boat,2006,English,,7,2.99,105,18.99,PG,RUSSELL,CLOSE
183,113,CALIFORNIA BIRDS,A Thrilling Yarn of a Database Administrator And a Robot who must Battle a Database Administrator in Ancient India,2006,English,,4,4.99,75,19.99,NC-17,RUSSELL,CLOSE
183,313,FIDELITY DEVIL,A Awe-Inspiring Drama of a Technical Writer And a Composer who must Reach a Pastry Chef in A U-Boat,2006,English,,5,4.99,118,11.99,G,RUSSELL,CLOSE
183,715,RANGE MOONWALKER,A Insightful Documentary of a Hunter And a Dentist who must Confront a Crocodile in A Baloon,2006,English,,3,4.99,147,25.99,PG,RUSSELL,CLOSE
183,388,GUNFIGHT MOON,A Epic Reflection of a Pastry Chef And a Explorer who must Reach a Dentist in The Sahara Desert,2006,English,,5,0.99,70,16.99,NC-17,RUSSELL,CLOSE
108,495,KENTUCKIAN GIANT,A Stunning Yarn of a Woman And a Frisbee who must Escape a Waitress in A U-Boat,2006,English,,5,2.99,169,10.99,PG,WARREN,NOLTE
108,517,LESSON CLEOPATRA,A Emotional Display of a Man And a Explorer who must Build a Boy in A Manhattan Penthouse,2006,English,,3,0.99,167,28.99,NC-17,WARREN,NOLTE
108,208,DARES PLUTO,A Fateful Story of a Robot And a Dentist who must Defeat a Astronaut in New Orleans,2006,English,,7,2.99,89,16.99,PG-13,WARREN,NOLTE
108,652,PAJAMA JAWBREAKER,A Emotional Drama of a Boy And a Technical Writer who must Redeem a Sumo Wrestler in California,2006,English,,3,0.99,126,14.99,R,WARREN,NOLTE
108,648,OUTLAW HANKY,A Thoughtful Story of a Astronaut And a Composer who must Conquer a Dog in The Sahara Desert,2006,English,,7,4.99,148,17.99,PG-13,WARREN,NOLTE
108,693,POTTER CONNECTICUT,A Thrilling Epistle of a Frisbee And a Cat who must Fight a Technical Writer in Berlin,2006,English,,5,2.99,115,16.99,PG,WARREN,NOLTE
108,379,GREEDY ROOTS,A Amazing Reflection of a A Shark And a Butler who must Chase a Hunter in The Canadian Rockies,2006,English,,7,0.99,166,14.99,R,WARREN,NOLTE
108,958,WARDROBE PHANTOM,A Action-Packed Display of a Mad Cow And a Astronaut who must Kill a Car in Ancient India,2006,English,,6,2.99,178,19.99,G,WARREN,NOLTE
108,6,AGENT TRUMAN,A Intrepid Panorama of a Robot And a Boy who must Escape a Sumo Wrestler in Ancient China,2006,English,,3,2.99,169,17.99,PG,WARREN,NOLTE
108,892,TITANIC BOONDOCK,A Brilliant Reflection of a Feminist And a Dog who must Fight a Boy in A Baloon Factory,2006,English,,3,4.99,104,18.99,R,WARREN,NOLTE
108,894,TOMATOES HELLFIGHTERS,A Thoughtful Epistle of a Madman And a Astronaut who must Overcome a Monkey in A Shark Tank,2006,English,,6,0.99,68,23.99,PG,WARREN,NOLTE
108,1,ACADEMY DINOSAUR,A Epic Drama of a Feminist And a Mad Scientist who must Battle a Teacher in The Canadian Rockies,2006,English,,6,0.99,86,20.99,PG,WARREN,NOLTE
108,920,UNBREAKABLE KARATE,A Amazing Character Study of a Robot And a Student who must Chase a Robot in Australia,2006,English,,3,0.99,62,16.99,G,WARREN,NOLTE
108,721,REDS POCUS,A Lacklusture Yarn of a Sumo Wrestler And a Squirrel who must Redeem a Monkey in Soviet Georgia,2006,English,,7,4.99,182,23.99,PG-13,WARREN,NOLTE
108,9,ALABAMA DEVIL,A Thoughtful Panorama of a Database Administrator And a Mad Scientist who must Outgun a Mad Scientist in A Jet Boat,2006,English,,3,2.99,114,21.99,PG-13,WARREN,NOLTE
108,378,GREATEST NORTH,A Astounding Character Study of a Secret Agent And a Robot who must Build a A Shark in Berlin,2006,English,,5,2.99,93,24.99,NC-17,WARREN,NOLTE
108,350,GARDEN ISLAND,A Unbelieveable Character Study of a Womanizer And a Madman who must Reach a Man in The Outback,2006,English,,3,4.99,80,21.99,G,WARREN,NOLTE
108,137,CHARADE DUFFEL,A Action-Packed Display of a Man And a Waitress who must Build a Dog in A MySQL Convention,2006,English,,3,2.99,66,21.99,PG,WARREN,NOLTE
108,733,RIVER OUTLAW,A Thrilling Character Study of a Squirrel And a Lumberjack who must Face a Hunter in A MySQL Convention,2006,English,,4,0.99,149,29.99,PG-13,WARREN,NOLTE
108,278,ELF MURDER,A Action-Packed Story of a Frisbee And a Woman who must Reach a Girl in An Abandoned Mine Shaft,2006,English,,4,4.99,155,19.99,NC-17,WARREN,NOLTE
108,507,LADYBUGS ARMAGEDDON,A Fateful Reflection of a Dog And a Mad Scientist who must Meet a Mad Scientist in New Orleans,2006,English,,4,0.99,113,13.99,NC-17,WARREN,NOLTE
108,561,MASK PEACH,A Boring Character Study of a Student And a Robot who must Meet a Woman in California,2006,English,,6,2.99,123,26.99,NC-17,WARREN,NOLTE
108,887,THIEF PELICAN,A Touching Documentary of a Madman And a Mad Scientist who must Outrace a Feminist in An Abandoned Mine Shaft,2006,English,,5,4.99,135,28.99,PG-13,WARREN,NOLTE
108,696,PRIDE ALAMO,A Thoughtful Drama of a A Shark And a Forensic Psychologist who must Vanquish a Student in Ancient India,2006,English,,6,0.99,114,20.99,NC-17,WARREN,NOLTE
108,741,ROMAN PUNK,A Thoughtful Panorama of a Mad Cow And a Student who must Battle a Forensic Psychologist in Berlin,2006,English,,7,0.99,81,28.99,NC-17,WARREN,NOLTE
22,495,KENTUCKIAN GIANT,A Stunning Yarn of a Woman And a Frisbee who must Escape a Waitress in A U-Boat,2006,English,,5,2.99,169,10.99,PG,ELVIS,MARX
22,648,OUTLAW HANKY,A Thoughtful Story of a Astronaut And a Composer who must Conquer a Dog in The Sahara Desert,2006,English,,7,4.99,148,17.99,PG-13,ELVIS,MARX
22,369,GOODFELLAS SALUTE,A Unbelieveable Tale of a Dog And a Explorer who must Sink a Mad Cow in A Baloon Factory,2006,English,,4,4.99,56,22.99,PG,ELVIS,MARX
22,964,WATERFRONT DELIVERANCE,A Unbelieveable Documentary of a Dentist And a Technical Writer who must Build a Womanizer in Nigeria,2006,English,,4,4.99,61,17.99,G,ELVIS,MARX
22,146,CHITTY LOCK,A Boring Epistle of a Boat And a Database Administrator who must Kill a Sumo Wrestler in The First Manned Space Station,2006,English,,6,2.99,107,24.99,G,ELVIS,MARX
22,731,RIGHT CRANES,A Fateful Character Study of a Boat And a Cat who must Find a Database Administrator in A Jet Boat,2006,English,,7,4.99,153,29.99,PG-13,ELVIS,MARX
22,291,EVOLUTION ALTER,A Fanciful Character Study of a Feminist And a Madman who must Find a Explorer in A Baloon Factory,2006,English,,5,0.99,174,10.99,PG-13,ELVIS,MARX
22,483,JERICHO MULAN,A Amazing Yarn of a Hunter And a Butler who must Defeat a Boy in A Jet Boat,2006,English,,3,2.99,171,29.99,NC-17,ELVIS,MARX
22,23,ANACONDA CONFESSIONS,A Lacklusture Display of a Dentist And a Dentist who must Fight a Girl in Australia,2006,English,,3,0.99,92,9.99,R,ELVIS,MARX
22,912,TROJAN TOMORROW,A Astounding Panorama of a Husband And a Sumo Wrestler who must Pursue a Boat in Ancient India,2006,English,,3,2.99,52,9.99,PG,ELVIS,MARX
22,802,SKY MIRACLE,A Epic Drama of a Mad Scientist And a Explorer who must Succumb a Waitress in An Abandoned Fun House,2006,English,,7,2.99,132,15.99,PG,ELVIS,MARX
22,775,SEATTLE EXPECATIONS,A Insightful Reflection of a Crocodile And a Sumo Wrestler who must Meet a Technical Writer in The Sahara Desert,2006,English,,4,4.99,110,18.99,PG-13,ELVIS,MARX
