attore_id,film_id,titolo,descrizione,data_rilascio,lingua,lingua_originale_id,durata_noleggio,tariffa_noleggio,durata,costo_sostituzione,voto,nome,cognome
110,961,WASH HEAVENLY,A Awe-Inspiring Reflection of a Cat And a Pioneer who must Escape a Hunter in Ancient China,2006,English,,7,4.99,161,22.99,R,SUSAN,DAVIS
110,292,EXCITEMENT EVE,A Brilliant Documentary of a Monkey And a Car who must Conquer a Crocodile in A Shark Tank,2006,English,,3,0.99,51,20.99,G,SUSAN,DAVIS
110,525,LOATHING LEGALLY,A Boring Epistle of a Pioneer And a Mad Scientist who must Escape a Frisbee in The Gulf of Mexico,2006,English,,4,0.99,140,29.99,R,SUSAN,DAVIS
132,987,WORDS HUNTER,A Action-Packed Reflection of a Composer And a Mad Scientist who must Face a Pioneer in A MySQL Convention,2006,English,,3,2.99,116,13.99,PG,ADAM,HOPPER
132,311,FICTION CHRISTMAS,A Emotional Yarn of a A Shark And a Student who must Battle a Robot in An Abandoned Mine Shaft,2006,English,,4,0.99,72,14.99,PG,ADAM,HOPPER
132,756,SADDLE ANTITRUST,A Stunning Epistle of a Feminist And a A Shark who must Battle a Woman in An Abandoned Fun House,2006,English,,7,2.99,80,10.99,PG-13,ADAM,HOPPER
132,904,TRAIN BUNCH,A Thrilling Character Study of a Robot And a Squirrel who must Face a Dog in Ancient India,2006,English,,3,4.99,71,26.99,R,ADAM,HOPPER
132,162,CLUELESS BUCKET,A Taut Tale of a Car And a Pioneer who must Conquer a Sumo Wrestler in An Abandoned Fun House,2006,English,,4,2.99,95,13.99,R,ADAM,HOPPER
132,81,BLINDNESS GUN,A Touching Drama of a Robot And a Dentist who must Meet a Hunter in A Jet Boat,2006,English,,6,4.99,103,29.99,PG-13,ADAM,HOPPER
132,377,GREASE YOUTH,A Emotional Panorama of a Secret Agent And a Waitress who must Escape a Composer in Soviet Georgia,2006,English,,7,0.99,135,20.99,G,ADAM,HOPPER
132,899,TOWERS HURRICANE,A Fateful Display of a Monkey And a Car who must Sink a Husband in A MySQL Convention,2006,English,,7,0.99,144,14.99,NC-17,ADAM,HOPPER
132,345,GABLES METROPOLIS,A Fateful Display of a Cat And a Pioneer who must Challenge a Pastry Chef in A Baloon Factory,2006,English,,3,0.99,161,17.99,PG,ADAM,HOPPER
132,538,LOVERBOY ATTACKS,A Boring Story of a Car And a Butler who must Build a Girl in Soviet Georgia,2006,English,,7,0.99,162,19.99,PG-13,ADAM,HOPPER
132,82,BLOOD ARGONAUTS,A Boring Drama of a Explorer And a Man who must Kill a Lumberjack in A Manhattan Penthouse,2006,English,,3,0.99,71,13.99,G,ADAM,HOPPER
132,698,PRINCESS GIANT,A Thrilling Yarn of a Pastry Chef And a Monkey who must Battle a Monkey in A Shark Tank,2006,English,,3,2.99,71,29.99,NC-17,ADAM,HOPPER
132,806,SLEEPY JAPANESE,A Emotional Epistle of a Moose And a Composer who must Fight a Technical Writer in The Outback,2006,English,,4,2.99,137,25.99,PG,ADAM,HOPPER
132,156,CLERKS ANGELS,A Thrilling Display of a Sumo Wrestler And a Girl who must Confront a Man in A Baloon,2006,English,,3,4.99,164,15.99,G,ADAM,HOPPER
132,562,MASKED BUBBLE,A Fanciful Documentary of a Pioneer And a Boat who must Pursue a Pioneer in An Abandoned Mine Shaft,2006,English,,6,0.99,151,12.99,PG-13,ADAM,HOPPER
132,897,TORQUE BOUND,A Emotional Display of a Crocodile And a Husband who must Reach a Man in Ancient Japan,2006,English,,3,4.99,179,27.99,G,ADAM,HOPPER
132,586,MOCKINGBIRD HOLLYWOOD,A Thoughtful Panorama of a Man And a Car who must Sink a Composer in Berlin,2006,English,,4,0.99,60,27.99,PG,ADAM,HOPPER
45,467,INTRIGUE WORST,A Fanciful Character Study of a Explorer And a Mad Scientist who must Vanquish a Squirrel in A Jet Boat,2006,English,,6,0.99,181,10.99,G,REESE,KILMER
45,680,PINOCCHIO SIMON,A Action-Packed Reflection of a Mad Scientist And a A Shark who must Find a Feminist in California,2006,English,,4,4.99,103,21.99,PG,REESE,KILMER
45,508,LAMBS CINCINATTI,A Insightful Story of a Man And a Feminist who must Fight a Composer in Australia,2006,English,,6,4.99,144,18.99,PG-13,REESE,KILMER
45,925,UNITED PILOT,A Fast-Paced Reflection of a Cat And a Mad Cow who must Fight a Car in The Sahara Desert,2006,English,,3,0.99,164,27.99,R,REESE,KILMER
45,484,JERK PAYCHECK,A Touching Character Study of a Pastry Chef And a Database Administrator who must Reach a A Shark in Ancient Japan,2006,English,,3,2.99,172,13.99,NC-17,REESE,KILMER
45,537,LOVER TRUMAN,A Emotional Yarn of a Robot And a Boy who must Outgun a Technical Writer in A U-Boat,2006,English,,3,2.99,75,29.99,G,REESE,KILMER
45,895,TOMORROW HUSTLER,A Thoughtful Story of a Moose And a Husband who must Face a Secret Agent in The Sahara Desert,2006,English,,3,2.99,142,21.99,R,REESE,KILMER
45,115,CAMPUS REMEMBER,A Astounding Drama of a Crocodile And a Mad Cow who must Build a Robot in A Jet Boat,2006,English,,5,2.99,167,27.99,R,REESE,KILMER
45,714,RANDOM GO,A Fateful Drama of a Frisbee And a Student who must Confront a Cat in A Shark Tank,2006,English,,6,2.99,73,29.99,NC-17,REESE,KILMER
45,164,COAST RAINBOW,A Astounding Documentary of a Mad Cow And a Pioneer who must Challenge a Butler in The Sahara Desert,2006,English,,4,0.99,55,20.99,PG,REESE,KILMER
45,330,FORRESTER COMANCHEROS,A Fateful Tale of a Squirrel And a Forensic Psychologist who must Redeem a Man in Nigeria,2006,English,,7,4.99,112,22.99,NC-17,REESE,KILMER
45,18,ALTER VICTORY,A Thoughtful Drama of a Composer And a Feminist who must Meet a Secret Agent in The Canadian Rockies,2006,English,,6,0.99,57,27.99,PG-13,REESE,KILMER
45,975,WILLOW TRACY,A Brilliant Panorama of a Boat And a Astronaut who must Challenge a Teacher in A Manhattan Penthouse,2006,English,,6,2.99,137,22.99,R,REESE,KILMER
45,767,SCALAWAG DUCK,A Fateful Reflection of a Car And a Teacher who must Confront a Waitress in A Monastery,2006,English,,6,4.99,183,13.99,NC-17,REESE,KILMER
45,503,KRAMER CHOCOLATE,A Amazing Yarn of a Robot And a Pastry Chef who must Redeem a Mad Scientist in The Outback,2006,English,,3,2.99,171,24.99,R,REESE,KILMER
45,117,CANDLES GRAPES,A Fanciful Character Study of a Monkey And a Explorer who must Build a Astronaut in An Abandoned Fun House,2006,English,,6,4.99,135,15.99,NC-17,REESE,KILMER
45,65,BEHAVIOR RUNAWAY,A Unbelieveable Drama of a Student And a Husband who must Outrace a Sumo Wrestler in Berlin,2006,English,,3,4.99,100,20.99,PG,REESE,KILMER
45,198,CRYSTAL BREAKING,A Fast-Paced Character Study of a Feminist And a Explorer who must Face a Pastry Chef in Ancient Japan,2006,English,,6,2.99,184,22.99,NC-17,REESE,KILMER
45,810,SLUMS DUCK,A Amazing Character Study of a Teacher And a Database Administrator who must Defeat a Waitress in A Jet Boat,2006,English,,5,0.99,147,21.99,PG,REESE,KILMER
133,868,SUPERFLY TRIP,A Beautiful Saga of a Lumberjack And a Teacher who must Build a Technical Writer in An Abandoned Fun House,2006,English,,5,0.99,114,27.99,PG,RICHARD,PENN
133,452,ILLUSION AMELIE,A Emotional Epistle of a Boat And a Mad Scientist who must Outrace a Robot in An Abandoned Mine Shaft,2006,English,,4,0.99,122,15.99,R,RICHARD,PENN
133,652,PAJAMA JAWBREAKER,A Emotional Drama of a Boy And a Technical Writer who must Redeem a Sumo Wrestler in California,2006,English,,3,0.99,126,14.99,R,RICHARD,PENN
133,342,FUGITIVE MAGUIRE,A Taut Epistle of a Feminist And a Sumo Wrestler who must Battle a Crocodile in Australia,2006,English,,7,4.99,83,28.99,R,RICHARD,PENN
133,368,GONE TROUBLE,A Insightful Character Study of a Mad Cow And a Forensic Psychologist who must Conquer a A Shark in A Manhattan Penthouse,2006,English,,7,2.99,84,20.99,R,RICHARD,PENN
133,594,MONTEZUMA COMMAND,A Thrilling Reflection of a Waitress And a Butler who must Battle a Butler in A Jet Boat,2006,English,,6,0.99,126,22.99,NC-17,RICHARD,PENN
133,514,LEBOWSKI SOLDIERS,A Beautiful Epistle of a Secret Agent And a Pioneer who must Chase a Astronaut in Ancient China,2006,English,,6,2.99,69,17.99,PG-13,RICHARD,PENN
133,7,AIRPLANE SIERRA,A Touching Saga of a Hunter And a Butler who must Discover a Butler in A Jet Boat,2006,English,,6,4.99,62,28.99,PG-13,RICHARD,PENN
133,933,VAMPIRE WHALE,A Epic Story of a Lumberjack And a Monkey who must Confront a Pioneer in A MySQL Convention,2006,English,,4,4.99,126,11.99,NC-17,RICHARD,PENN
133,894,TOMATOES HELLFIGHTERS,A Thoughtful Epistle of a Madman And a Astronaut who must Overcome a Monkey in A Shark Tank,2006,English,,6,0.99,68,23.99,PG,RICHARD,PENN
133,882,TENENBAUMS COMMAND,A Taut Display of a Pioneer And a Man who must Reach a Girl in The Gulf of Mexico,2006,English,,4,0.99,99,24.99,PG-13,RICHARD,PENN
133,588,MODEL FISH,A Beautiful Panorama of a Boat And a Crocodile who must Outrace a Dog in Australia,2006,English,,4,4.99,175,11.99,NC-17,RICHARD,PENN
133,51,BALLOON HOMEWARD,A Insightful Panorama of a Forensic Psychologist And a Mad Cow who must Build a Mad Scientist in The First Manned Space Station,2006,English,,5,2.99,75,10.99,NC-17,RICHARD,PENN
133,952,WAGON JAWS,A Intrepid Drama of a Moose And a Boat who must Kill a Explorer in A Manhattan Penthouse,2006,English,,7,2.99,152,17.99,PG,RICHARD,PENN
133,385,GROUNDHOG UNCUT,A Brilliant Panorama of a Astronaut And a Technical Writer who must Discover a Butler in A Manhattan Penthouse,2006,English,,6,4.99,139,26.99,PG-13,RICHARD,PENN
133,635,OKLAHOMA JUMANJI,A Thoughtful Drama of a Dentist And a Womanizer who must Meet a Husband in The Sahara Desert,2006,English,,7,0.99,58,15.99,PG,RICHARD,PENN
133,806,SLEEPY JAPANESE,A Emotional Epistle of a Moose And a Composer who must Fight a Technical Writer in The Outback,2006,English,,4,2.99,137,25.99,PG,RICHARD,PENN
133,727,RESURRECTION SILVERADO,A Epic Yarn of a Robot And a Explorer who must Challenge a Girl in A MySQL Convention,2006,English,,6,0.99,117,12.99,PG,RICHARD,PENN
133,397,HANKY OCTOBER,A Boring Epistle of a Database Administrator And a Explorer who must Pursue a Madman in Soviet Georgia,2006,English,,5,2.99,107,26.99,NC-17,RICHARD,PENN
133,280,EMPIRE MALKOVICH,A Amazing Story of a Feminist And a Cat who must Face a Car in An Abandoned Fun House,2006,English,,7,0.99,177,26.99,G,RICHARD,PENN
133,351,GASLIGHT CRUSADE,A Amazing Epistle of a Boy And a Astronaut who must Redeem a Man in The Gulf of Mexico,2006,English,,4,2.99,106,10.99,PG,RICHARD,PENN
196,833,SPLENDOR PATTON,A Taut Story of a Dog And a Explorer who must Find a Astronaut in Berlin,2006,English,,5,0.99,134,20.99,R,BELA,WALKEN
196,906,TRAMP OTHERS,A Brilliant Display of a Composer And a Cat who must Succumb a A Shark in Ancient India,2006,English,,4,0.99,171,27.99,PG,BELA,WALKEN
196,576,MIGHTY LUCK,A Astounding Epistle of a Mad Scientist And a Pioneer who must Escape a Database Administrator in A MySQL Convention,2006,English,,7,2.99,122,13.99,PG,BELA,WALKEN
196,473,JACKET FRISCO,A Insightful Reflection of a Womanizer And a Husband who must Conquer a Pastry Chef in A Baloon,2006,English,,5,2.99,181,16.99,PG-13,BELA,WALKEN
196,324,FLINTSTONES HAPPINESS,A Fateful Story of a Husband And a Moose who must Vanquish a Boy in California,2006,English,,3,4.99,148,11.99,PG-13,BELA,WALKEN
196,122,CARRIE BUNCH,A Amazing Epistle of a Student And a Astronaut who must Discover a Frisbee in The Canadian Rockies,2006,English,,7,0.99,114,11.99,PG,BELA,WALKEN
196,484,JERK PAYCHECK,A Touching Character Study of a Pastry Chef And a Database Administrator who must Reach a A Shark in Ancient Japan,2006,English,,3,2.99,172,13.99,NC-17,BELA,WALKEN
196,939,VERTIGO NORTHWEST,A Unbelieveable Display of a Mad Scientist And a Mad Scientist who must Outgun a Mad Cow in Ancient Japan,2006,English,,4,2.99,90,17.99,R,BELA,WALKEN
196,795,SIEGE MADRE,A Boring Tale of a Frisbee And a Crocodile who must Vanquish a Moose in An Abandoned Mine Shaft,2006,English,,7,0.99,111,23.99,R,BELA,WALKEN
196,815,SNATCHERS MONTEZUMA,A Boring Epistle of a Sumo Wrestler And a Woman who must Escape a Man in The Canadian Rockies,2006,English,,4,2.99,74,14.99,PG-13,BELA,WALKEN
196,587,MOD SECRETARY,A Boring Documentary of a Mad Cow And a Cat who must Build a Lumberjack in New Orleans,2006,English,,6,4.99,77,20.99,NC-17,BELA,WALKEN
196,515,LEGALLY SECRETARY,A Astounding Tale of a A Shark And a Moose who must Meet a Womanizer in The Sahara Desert,2006,English,,7,4.99,113,14.99,PG,BELA,WALKEN
196,64,BEETHOVEN EXORCIST,A Epic Display of a Pioneer And a Student who must Challenge a Butler in The Gulf of Mexico,2006,English,,6,0.99,151,26.99,PG-13,BELA,WALKEN
196,635,OKLAHOMA JUMANJI,A Thoughtful Drama of a Dentist And a Womanizer who must Meet a Husband in The Sahara Desert,2006,English,,7,0.99,58,15.99,PG,BELA,WALKEN
196,615,NASH CHOCOLAT,A Epic Reflection of a Monkey And a Mad Cow who must Kill a Forensic Psychologist in An Abandoned Mine Shaft,2006,English,,6,2.99,180,21.99,PG-13,BELA,WALKEN
196,908,TRAP GUYS,A Unbelieveable Story of a Boy And a Mad Cow who must Challenge a Database Administrator in The Sahara Desert,2006,English,,3,4.99,110,11.99,G,BELA,WALKEN
196,560,MARS ROMAN,A Boring Drama of a Car And a Dog who must Succumb a Madman in Soviet Georgia,2006,English,,6,0.99,62,21.99,NC-17,BELA,WALKEN
196,524,LION UNCUT,A Intrepid Display of a Pastry Chef And a Cat who must Kill a A Shark in Ancient China,2006,English,,6,0.99,50,13.99,PG,BELA,WALKEN
196,156,CLERKS ANGELS,A Thrilling Display of a Sumo Wrestler And a Girl who must Confront a Man in A Baloon,2006,English,,3,4.99,164,15.99,G,BELA,WALKEN
196,837,STAGE WORLD,A Lacklusture Panorama of a Woman And a Frisbee who must Chase a Crocodile in A Jet Boat,2006,English,,4,2.99,85,19.99,PG,BELA,WALKEN
196,276,ELEMENT FREDDY,A Awe-Inspiring Reflection of a Waitress And a Squirrel who must Kill a Mad Cow in A Jet Boat,2006,English,,6,4.99,115,28.99,NC-17,BELA,WALKEN
196,684,PIZZA JUMANJI,A Epic Saga of a Cat And a Squirrel who must Outgun a Robot in A U-Boat,2006,English,,4,2.99,173,11.99,NC-17,BELA,WALKEN
196,575,MIDSUMMER GROUNDHOG,A Fateful Panorama of a Moose And a Dog who must Chase a Crocodile in Ancient Japan,2006,English,,3,4.99,48,27.99,G,BELA,WALKEN
196,972,WHISPERER GIANT,A Intrepid Story of a Dentist And a Hunter who must Confront a Monkey in Ancient Japan,2006,English,,4,4.99,59,24.99,PG-13,BELA,WALKEN
71,833,SPLENDOR PATTON,A Taut Story of a Dog And a Explorer who must Find a Astronaut in Berlin,2006,English,,5,0.99,134,20.99,R,ADAM,GRANT
71,362,GLORY TRACY,A Amazing Saga of a Woman And a Womanizer who must Discover a Cat in The First Manned Space Station,2006,English,,7,2.99,115,13.99,PG-13,ADAM,GRANT
71,918,TWISTED PIRATES,A Touching Display of a Frisbee And a Boat who must Kill a Girl in A MySQL Convention,2006,English,,4,4.99,152,23.99,PG,ADAM,GRANT
71,638,OPERATION OPERATION,A Intrepid Character Study of a Man And a Frisbee who must Overcome a Madman in Ancient China,2006,English,,7,2.99,156,23.99,G,ADAM,GRANT
71,956,WANDA CHAMBER,A Insightful Drama of a A Shark And a Pioneer who must Find a Womanizer in The Outback,2006,English,,7,4.99,107,23.99,PG-13,ADAM,GRANT
71,399,HAPPINESS UNITED,A Action-Packed Panorama of a Husband And a Feminist who must Meet a Forensic Psychologist in Ancient Japan,2006,English,,6,2.99,100,23.99,G,ADAM,GRANT
71,385,GROUNDHOG UNCUT,A Brilliant Panorama of a Astronaut And a Technical Writer who must Discover a Butler in A Manhattan Penthouse,2006,English,,6,4.99,139,26.99,PG-13,ADAM,GRANT
71,560,MARS ROMAN,A Boring Drama of a Car And a Dog who must Succumb a Madman in Soviet Georgia,2006,English,,6,0.99,62,21.99,NC-17,ADAM,GRANT
71,359,GLADIATOR WESTWARD,A Astounding Reflection of a Squirrel And a Sumo Wrestler who must Sink a Dentist in Ancient Japan,2006,English,,6,4.99,173,20.99,PG,ADAM,GRANT
71,773,SEABISCUIT PUNK,A Insightful Saga of a Man And a Forensic Psychologist who must Discover a Mad Cow in A MySQL Convention,2006,English,,6,2.99,112,28.99,NC-17,ADAM,GRANT
71,26,ANNIE IDENTITY,A Amazing Panorama of a Pastry Chef And a Boat who must Escape a Woman in An Abandoned Amusement Park,2006,English,,3,0.99,86,15.99,G,ADAM,GRANT
89,833,SPLENDOR PATTON,A Taut Story of a Dog And a Explorer who must Find a Astronaut in Berlin,2006,English,,5,0.99,134,20.99,R,CHARLIZE,DENCH
89,342,FUGITIVE MAGUIRE,A Taut Epistle of a Feminist And a Sumo Wrestler who must Battle a Crocodile in Australia,2006,English,,7,4.99,83,28.99,R,CHARLIZE,DENCH
89,473,JACKET FRISCO,A Insightful Reflection of a Womanizer And a Husband who must Conquer a Pastry Chef in A Baloon,2006,English,,5,2.99,181,16.99,PG-13,CHARLIZE,DENCH
89,254,DRIVER ANNIE,A Lacklusture Character Study of a Butler And a Car who must Redeem a Boat in An Abandoned Fun House,2006,English,,4,2.99,159,11.99,PG-13,CHARLIZE,DENCH
89,446,HYSTERICAL GRAIL,A Amazing Saga of a Madman And a Dentist who must Build a Car in A Manhattan Penthouse,2006,English,,5,4.99,150,19.99,PG,CHARLIZE,DENCH
89,529,LONELY ELEPHANT,A Intrepid Story of a Student And a Dog who must Challenge a Explorer in Soviet Georgia,2006,English,,3,2.99,67,12.99,G,CHARLIZE,DENCH
89,103,BUCKET BROTHERHOOD,A Amazing Display of a Girl And a Womanizer who must Succumb a Lumberjack in A Baloon Factory,2006,English,,7,4.99,133,27.99,PG,CHARLIZE,DENCH
89,406,HAUNTING PIANIST,A Fast-Paced Story of a Database Administrator And a Composer who must Defeat a Squirrel in An Abandoned Amusement Park,2006,English,,5,0.99,181,22.99,R,CHARLIZE,DENCH
89,564,MASSAGE IMAGE,A Fateful Drama of a Frisbee And a Crocodile who must Vanquish a Dog in The First Manned Space Station,2006,English,,4,2.99,161,11.99,PG,CHARLIZE,DENCH
89,162,CLUELESS BUCKET,A Taut Tale of a Car And a Pioneer who must Conquer a Sumo Wrestler in An Abandoned Fun House,2006,English,,4,2.99,95,13.99,R,CHARLIZE,DENCH
89,970,WESTWARD SEABISCUIT,A Lacklusture Tale of a Butler And a Husband who must Face a Boy in Ancient China,2006,English,,7,0.99,52,11.99,NC-17,CHARLIZE,DENCH
89,182,CONTROL ANTHEM,A Fateful Documentary of a Robot And a Student who must Battle a Cat in A Monastery,2006,English,,7,4.99,185,9.99,G,CHARLIZE,DENCH
89,306,FEATHERS METAL,A Thoughtful Yarn of a Monkey And a Teacher who must Find a Dog in Australia,2006,English,,3,0.99,104,12.99,PG-13,CHARLIZE,DENCH
89,266,DYNAMITE TARZAN,A Intrepid Documentary of a Forensic Psychologist And a Mad Scientist who must Face a Explorer in A U-Boat,2006,English,,4,0.99,141,27.99,PG-13,CHARLIZE,DENCH
89,47,BABY HALL,A Boring Character Study of a A Shark And a Girl who must Outrace a Feminist in An Abandoned Mine Shaft,2006,English,,5,4.99,153,23.99,NC-17,CHARLIZE,DENCH
89,976,WIND PHANTOM,A Touching Saga of a Madman And a Forensic Psychologist who must Build a Sumo Wrestler in An Abandoned Mine Shaft,2006,English,,6,0.99,111,12.99,R,CHARLIZE,DENCH
89,117,CANDLES GRAPES,A Fanciful Character Study of a Monkey And a Explorer who must Build a Astronaut in An Abandoned Fun House,2006,English,,6,4.99,135,15.99,NC-17,CHARLIZE,DENCH
89,697,PRIMARY GLASS,A Fateful Documentary of a Pastry Chef And a Butler who must Build a Dog in The Canadian Rockies,2006,English,,7,0.99,53,16.99,G,CHARLIZE,DENCH
89,488,JOON NORTHWEST,A Thrilling Panorama of a Technical Writer And a Car who must Discover a Forensic Psychologist in A Shark Tank,2006,English,,3,0.99,105,23.99,NC-17,CHARLIZE,DENCH
125,62,BED HIGHBALL,A Astounding Panorama of a Lumberjack And a Dog who must Redeem a Woman in An Abandoned Fun House,2006,English,,5,2.99,106,23.99,NC-17,ALBERT,NOLTE
125,324,FLINTSTONES HAPPINESS,A Fateful Story of a Husband And a Moose who must Vanquish a Boy in California,2006,English,,3,4.99,148,11.99,PG-13,ALBERT,NOLTE
125,175,CONFUSED CANDLES,A Stunning Epistle of a Cat And a Forensic Psychologist who must Confront a Pioneer in A Baloon,2006,English,,3,2.99,122,27.99,PG-13,ALBERT,NOLTE
125,497,KILL BROTHERHOOD,A Touching Display of a Hunter And a Secret Agent who must Redeem a Husband in The Outback,2006,English,,4,0.99,54,15.99,G,ALBERT,NOLTE
125,568,MEMENTO ZOOLANDER,A Touching Epistle of a Squirrel And a Explorer who must Redeem a Pastry Chef in The Sahara Desert,2006,English,,4,4.99,77,11.99,NC-17,ALBERT,NOLTE
125,414,HELLFIGHTERS SIERRA,A Taut Reflection of a A Shark And a Dentist who must Battle a Boat in Soviet Georgia,2006,English,,3,2.99,75,23.99,PG,ALBERT,NOLTE
125,100,BROOKLYN DESERT,A Beautiful Drama of a Dentist And a Composer who must Battle a Sumo Wrestler in The First Manned Space Station,2006,English,,7,4.99,161,21.99,R,ALBERT,NOLTE
125,98,BRIGHT ENCOUNTERS,A Fateful Yarn of a Lumberjack And a Feminist who must Conquer a Student in A Jet Boat,2006,English,,4,4.99,73,12.99,PG-13,ALBERT,NOLTE
125,584,MIXED DOORS,A Taut Drama of a Womanizer And a Lumberjack who must Succumb a Pioneer in Ancient India,2006,English,,6,2.99,180,26.99,PG-13,ALBERT,NOLTE
125,683,PITY BOUND,A Boring Panorama of a Feminist And a Moose who must Defeat a Database Administrator in Nigeria,2006,English,,5,4.99,60,19.99,NC-17,ALBERT,NOLTE
125,361,GLEAMING JAWBREAKER,A Amazing Display of a Composer And a Forensic Psychologist who must Discover a Car in The Canadian Rockies,2006,English,,5,2.99,89,25.99,NC-17,ALBERT,NOLTE
125,395,HANDICAP BOONDOCK,A Beautiful Display of a Pioneer And a Squirrel who must Vanquish a Sumo Wrestler in Soviet Georgia,2006,English,,4,0.99,108,28.99,R,ALBERT,NOLTE
125,877,TAXI KICK,A Amazing Epistle of a Girl And a Woman who must Outrace a Waitress in Soviet Georgia,2006,English,,4,0.99,64,23.99,PG-13,ALBERT,NOLTE
125,204,DALMATIONS SWEDEN,A Emotional Epistle of a Moose And a Hunter who must Overcome a Robot in A Manhattan Penthouse,2006,English,,4,0.99,106,25.99,PG,ALBERT,NOLTE
125,908,TRAP GUYS,A Unbelieveable Story of a Boy And a Mad Cow who must Challenge a Database Administrator in The Sahara Desert,2006,English,,3,4.99,110,11.99,G,ALBERT,NOLTE
125,428,HOMICIDE PEACH,A Astounding Documentary of a Hunter And a Boy who must Confront a Boy in A MySQL Convention,2006,English,,6,2.99,141,21.99,PG-13,ALBERT,NOLTE
125,710,RAGE GAMES,A Fast-Paced Saga of a Astronaut And a Secret Agent who must Escape a Hunter in An Abandoned Amusement Park,2006,English,,4,4.99,120,18.99,R,ALBERT,NOLTE
125,949,VOLCANO TEXAS,A Awe-Inspiring Yarn of a Hunter And a Feminist who must Challenge a Dentist in The Outback,2006,English,,6,0.99,157,27.99,NC-17,ALBERT,NOLTE
125,664,PATRIOT ROMAN,A Taut Saga of a Robot And a Database Administrator who must Challenge a Astronaut in California,2006,English,,6,2.99,65,12.99,PG,ALBERT,NOLTE
125,114,CAMELOT VACATION,A Touching Character Study of a Woman And a Waitress who must Battle a Pastry Chef in A MySQL Convention,2006,English,,3,0.99,61,26.99,NC-17,ALBERT,NOLTE
4,62,BED HIGHBALL,A Astounding Panorama of a Lumberjack And a Dog who must Redeem a Woman in An Abandoned Fun House,2006,English,,5,2.99,106,23.99,NC-17,JENNIFER,DAVIS
4,490,JUMANJI BLADE,A Intrepid Yarn of a Husband And a Womanizer who must Pursue a Mad Scientist in New Orleans,2006,English,,4,2.99,121,13.99,G,JENNIFER,DAVIS
4,87,BOONDOCK BALLROOM,A Fateful Panorama of a Crocodile And a Boy who must Defeat a Monkey in The Gulf of Mexico,2006,English,,7,0.99,76,14.99,NC-17,JENNIFER,DAVIS
4,379,GREEDY ROOTS,A Amazing Reflection of a A Shark And a Butler who must Chase a Hunter in The Canadian Rockies,2006,English,,7,0.99,166,14.99,R,JENNIFER,DAVIS
4,23,ANACONDA CONFESSIONS,A Lacklusture Display of a Dentist And a Dentist who must Fight a Girl in Australia,2006,English,,3,0.99,92,9.99,R,JENNIFER,DAVIS
4,832,SPLASH GUMP,A Taut Saga of a Crocodile And a Boat who must Conquer a Hunter in A Shark Tank,2006,English,,5,0.99,175,16.99,PG,JENNIFER,DAVIS
4,909,TREASURE COMMAND,A Emotional Saga of a Car And a Madman who must Discover a Pioneer in California,2006,English,,3,0.99,102,28.99,PG-13,JENNIFER,DAVIS
4,721,REDS POCUS,A Lacklusture Yarn of a Sumo Wrestler And a Squirrel who must Redeem a Monkey in Soviet Georgia,2006,English,,7,4.99,182,23.99,PG-13,JENNIFER,DAVIS
4,714,RANDOM GO,A Fateful Drama of a Frisbee And a Student who must Confront a Cat in A Shark Tank,2006,English,,6,2.99,73,29.99,NC-17,JENNIFER,DAVIS
4,691,POSEIDON FOREVER,A Thoughtful Epistle of a Womanizer And a Monkey who must Vanquish a Dentist in A Monastery,2006,English,,6,4.99,159,29.99,PG-13,JENNIFER,DAVIS
4,398,HANOVER GALAXY,A Stunning Reflection of a Girl And a Secret Agent who must Succumb a Boy in A MySQL Convention,2006,English,,5,4.99,47,21.99,NC-17,JENNIFER,DAVIS
4,635,OKLAHOMA JUMANJI,A Thoughtful Drama of a Dentist And a Womanizer who must Meet a Husband in The Sahara Desert,2006,English,,7,0.99,58,15.99,PG,JENNIFER,DAVIS
4,712,RAIDERS ANTITRUST,A Amazing Drama of a Teacher And a Feminist who must Meet a Woman in The First Manned Space Station,2006,English,,4,0.99,82,11.99,PG-13,JENNIFER,DAVIS
187,548,MAGNIFICENT CHITTY,A Insightful Story of a Teacher And a Hunter who must Face a Mad Cow in California,2006,English,,3,2.99,53,27.99,R,RENEE,BALL
187,906,TRAMP OTHERS,A Brilliant Display of a Composer And a Cat who must Succumb a A Shark in Ancient India,2006,English,,4,0.99,171,27.99,PG,RENEE,BALL
187,110,CABIN FLASH,A Stunning Epistle of a Boat And a Man who must Challenge a A Shark in A Baloon Factory,2006,English,,4,0.99,53,25.99,NC-17,RENEE,BALL
187,923,UNFAITHFUL KILL,A Taut Documentary of a Waitress And a Mad Scientist who must Battle a Technical Writer in New Orleans,2006,English,,7,2.99,78,12.99,R,RENEE,BALL
187,76,BIRDCAGE CASPER,A Fast-Paced Saga of a Frisbee And a Astronaut who must Overcome a Feminist in Ancient India,2006,English,,4,0.99,103,23.99,NC-17,RENEE,BALL
187,168,COMANCHEROS ENEMY,A Boring Saga of a Lumberjack And a Monkey who must Find a Monkey in The Gulf of Mexico,2006,English,,5,0.99,67,23.99,R,RENEE,BALL
187,379,GREEDY ROOTS,A Amazing Reflection of a A Shark And a Butler who must Chase a Hunter in The Canadian Rockies,2006,English,,7,0.99,166,14.99,R,RENEE,BALL
187,29,ANTITRUST TOMATOES,A Fateful Yarn of a Womanizer And a Feminist who must Succumb a Database Administrator in Ancient India,2006,English,,5,2.99,168,11.99,NC-17,RENEE,BALL
187,499,KING EVOLUTION,A Action-Packed Tale of a Boy And a Lumberjack who must Chase a Madman in A Baloon,2006,English,,3,4.99,184,24.99,NC-17,RENEE,BALL
187,435,HOTEL HAPPINESS,A Thrilling Yarn of a Pastry Chef And a A Shark who must Challenge a Mad Scientist in The Outback,2006,English,,6,4.99,181,28.99,PG-13,RENEE,BALL
