attore_id,film_id,titolo,descrizione,data_rilascio,lingua,lingua_originale_id,durata_noleggio,tariffa_noleggio,durata,costo_sostituzione,voto,nome,cognome
36,426,HOME PITY,A Touching Panorama of a Man And a Secret Agent who must Challenge a Teacher in A MySQL Convention,2006,English,,7,4.99,185,15.99,R,BURT,DUKAKIS
36,569,MENAGERIE RUSHMORE,A Unbelieveable Panorama of a Composer And a Butler who must Overcome a Database Administrator in The First Manned Space Station,2006,English,,7,2.99,147,18.99,G,BURT,DUKAKIS
36,590,MONEY HAROLD,A Touching Tale of a Explorer And a Boat who must Defeat a Robot in Australia,2006,English,,3,2.99,135,17.99,PG,BURT,DUKAKIS
36,484,JERK PAYCHECK,A Touching Character Study of a Pastry Chef And a Database Administrator who must Reach a A Shark in Ancient Japan,2006,English,,3,2.99,172,13.99,NC-17,BURT,DUKAKIS
36,380,GREEK EVERYONE,A Stunning Display of a Butler And a Teacher who must Confront a A Shark in The First Manned Space Station,2006,English,,7,2.99,176,11.99,PG,BURT,DUKAKIS
36,427,HOMEWARD CIDER,A Taut Reflection of a Astronaut And a Squirrel who must Fight a Squirrel in A Manhattan Penthouse,2006,English,,5,0.99,103,19.99,R,BURT,DUKAKIS
36,499,KING EVOLUTION,A Action-Packed Tale of a Boy And a Lumberjack who must Chase a Madman in A Baloon,2006,English,,3,4.99,184,24.99,NC-17,BURT,DUKAKIS
36,731,RIGHT CRANES,A Fateful Character Study of a Boat And a Cat who must Find a Database Administrator in A Jet Boat,2006,English,,7,4.99,153,29.99,PG-13,BURT,DUKAKIS
36,453,IMAGE PRINCESS,A Lacklusture Panorama of a Secret Agent And a Crocodile who must Discover a Madman in The Canadian Rockies,2006,English,,3,2.99,178,17.99,PG-13,BURT,DUKAKIS
36,81,BLINDNESS GUN,A Touching Drama of a Robot And a Dentist who must Meet a Hunter in A Jet Boat,2006,English,,6,4.99,103,29.99,PG-13,BURT,DUKAKIS
36,387,GUN BONNIE,A Boring Display of a Sumo Wrestler And a Husband who must Build a Waitress in The Gulf of Mexico,2006,English,,7,0.99,100,27.99,G,BURT,DUKAKIS
36,716,REAP UNFAITHFUL,A Thrilling Epistle of a Composer And a Sumo Wrestler who must Challenge a Mad Cow in A MySQL Convention,2006,English,,6,2.99,136,26.99,PG-13,BURT,DUKAKIS
36,714,RANDOM GO,A Fateful Drama of a Frisbee And a Student who must Confront a Cat in A Shark Tank,2006,English,,6,2.99,73,29.99,NC-17,BURT,DUKAKIS
36,956,WANDA CHAMBER,A Insightful Drama of a A Shark And a Pioneer who must Find a Womanizer in The Outback,2006,English,,7,4.99,107,23.99,PG-13,BURT,DUKAKIS
36,245,DOUBLE WRATH,A Thoughtful Yarn of a Womanizer And a Dog who must Challenge a Madman in The Gulf of Mexico,2006,English,,4,0.99,177,28.99,R,BURT,DUKAKIS
36,15,ALIEN CENTER,A Brilliant Drama of a Cat And a Mad Scientist who must Battle a Feminist in A MySQL Convention,2006,English,,5,2.99,46,10.99,NC-17,BURT,DUKAKIS
36,381,GRINCH MASSAGE,A Intrepid Display of a Madman And a Feminist who must Pursue a Pioneer in The First Manned Space Station,2006,English,,7,4.99,150,25.99,R,BURT,DUKAKIS
36,600,MOTIONS DETAILS,A Awe-Inspiring Reflection of a Dog And a Student who must Kill a Car in An Abandoned Fun House,2006,English,,5,0.99,166,16.99,PG,BURT,DUKAKIS
36,931,VALENTINE VANISHING,A Thrilling Display of a Husband And a Butler who must Reach a Pastry Chef in California,2006,English,,7,0.99,48,9.99,PG-13,BURT,DUKAKIS
36,915,TRUMAN CRAZY,A Thrilling Epistle of a Moose And a Boy who must Meet a Database Administrator in A Monastery,2006,English,,7,4.99,92,9.99,G,BURT,DUKAKIS
58,426,HOME PITY,A Touching Panorama of a Man And a Secret Agent who must Challenge a Teacher in A MySQL Convention,2006,English,,7,4.99,185,15.99,R,CHRISTIAN,AKROYD
58,726,RESERVOIR ADAPTATION,A Intrepid Drama of a Teacher And a Moose who must Kill a Car in California,2006,English,,7,2.99,61,29.99,PG-13,CHRISTIAN,AKROYD
58,541,LUKE MUMMY,A Taut Character Study of a Boy And a Robot who must Redeem a Mad Scientist in Ancient India,2006,English,,5,2.99,74,21.99,NC-17,CHRISTIAN,AKROYD
58,119,CAPER MOTIONS,A Fateful Saga of a Moose And a Car who must Pursue a Woman in A MySQL Convention,2006,English,,6,0.99,176,22.99,G,CHRISTIAN,AKROYD
58,199,CUPBOARD SINNERS,A Emotional Reflection of a Frisbee And a Boat who must Reach a Pastry Chef in An Abandoned Amusement Park,2006,English,,4,2.99,56,29.99,R,CHRISTIAN,AKROYD
58,316,FIRE WOLVES,A Intrepid Documentary of a Frisbee And a Dog who must Outrace a Lumberjack in Nigeria,2006,English,,5,4.99,173,18.99,R,CHRISTIAN,AKROYD
58,254,DRIVER ANNIE,A Lacklusture Character Study of a Butler And a Car who must Redeem a Boat in An Abandoned Fun House,2006,English,,4,2.99,159,11.99,PG-13,CHRISTIAN,AKROYD
58,175,CONFUSED CANDLES,A Stunning Epistle of a Cat And a Forensic Psychologist who must Confront a Pioneer in A Baloon,2006,English,,3,2.99,122,27.99,PG-13,CHRISTIAN,AKROYD
58,460,INNOCENT USUAL,A Beautiful Drama of a Pioneer And a Crocodile who must Challenge a Student in The Outback,2006,English,,3,4.99,178,26.99,PG-13,CHRISTIAN,AKROYD
58,638,OPERATION OPERATION,A Intrepid Character Study of a Man And a Frisbee who must Overcome a Madman in Ancient China,2006,English,,7,2.99,156,23.99,G,CHRISTIAN,AKROYD
58,68,BETRAYED REAR,A Emotional Character Study of a Boat And a Pioneer who must Find a Explorer in A Shark Tank,2006,English,,5,4.99,122,26.99,NC-17,CHRISTIAN,AKROYD
58,242,DOOM DANCING,A Astounding Panorama of a Car And a Mad Scientist who must Battle a Lumberjack in A MySQL Convention,2006,English,,4,0.99,68,13.99,R,CHRISTIAN,AKROYD
58,632,NUTS TIES,A Thoughtful Drama of a Explorer And a Womanizer who must Meet a Teacher in California,2006,English,,5,4.99,145,10.99,NC-17,CHRISTIAN,AKROYD
58,48,BACKLASH UNDEFEATED,A Stunning Character Study of a Mad Scientist And a Mad Cow who must Kill a Car in A Monastery,2006,English,,3,4.99,118,24.99,PG-13,CHRISTIAN,AKROYD
58,306,FEATHERS METAL,A Thoughtful Yarn of a Monkey And a Teacher who must Find a Dog in Australia,2006,English,,3,0.99,104,12.99,PG-13,CHRISTIAN,AKROYD
58,800,SINNERS ATLANTIS,A Epic Display of a Dog And a Boat who must Succumb a Mad Scientist in An Abandoned Mine Shaft,2006,English,,7,2.99,126,19.99,PG-13,CHRISTIAN,AKROYD
58,235,DIVIDE MONSTER,A Intrepid Saga of a Man And a Forensic Psychologist who must Reach a Squirrel in A Monastery,2006,English,,6,2.99,68,13.99,PG-13,CHRISTIAN,AKROYD
58,135,CHANCE RESURRECTION,A Astounding Story of a Forensic Psychologist And a Forensic Psychologist who must Overcome a Moose in Ancient China,2006,English,,3,2.99,70,22.99,R,CHRISTIAN,AKROYD
58,551,MAIDEN HOME,A Lacklusture Saga of a Moose And a Teacher who must Kill a Forensic Psychologist in A MySQL Convention,2006,English,,3,4.99,138,9.99,PG,CHRISTIAN,AKROYD
58,549,MAGNOLIA FORRESTER,A Thoughtful Documentary of a Composer And a Explorer who must Conquer a Dentist in New Orleans,2006,English,,4,0.99,171,28.99,PG-13,CHRISTIAN,AKROYD
58,635,OKLAHOMA JUMANJI,A Thoughtful Drama of a Dentist And a Womanizer who must Meet a Husband in The Sahara Desert,2006,English,,7,0.99,58,15.99,PG,CHRISTIAN,AKROYD
58,698,PRINCESS GIANT,A Thrilling Yarn of a Pastry Chef And a Monkey who must Battle a Monkey in A Shark Tank,2006,English,,3,2.99,71,29.99,NC-17,CHRISTIAN,AKROYD
58,856,STREETCAR INTENTIONS,A Insightful Character Study of a Waitress And a Crocodile who must Sink a Waitress in The Gulf of Mexico,2006,English,,5,4.99,73,11.99,R,CHRISTIAN,AKROYD
58,578,MILLION ACE,A Brilliant Documentary of a Womanizer And a Squirrel who must Find a Technical Writer in The Sahara Desert,2006,English,,4,4.99,142,16.99,PG-13,CHRISTIAN,AKROYD
58,128,CATCH AMISTAD,A Boring Reflection of a Lumberjack And a Feminist who must Discover a Woman in Nigeria,2006,English,,7,0.99,183,10.99,G,CHRISTIAN,AKROYD
121,517,LESSON CLEOPATRA,A Emotional Display of a Man And a Explorer who must Build a Boy in A Manhattan Penthouse,2006,English,,3,0.99,167,28.99,NC-17,LIZA,BERGMAN
121,141,CHICAGO NORTH,A Fateful Yarn of a Mad Cow And a Waitress who must Battle a Student in California,2006,English,,6,4.99,185,11.99,PG-13,LIZA,BERGMAN
121,666,PAYCHECK WAIT,A Awe-Inspiring Reflection of a Boy And a Man who must Discover a Moose in The Sahara Desert,2006,English,,4,4.99,145,27.99,PG-13,LIZA,BERGMAN
121,170,COMMAND DARLING,A Awe-Inspiring Tale of a Forensic Psychologist And a Woman who must Challenge a Database Administrator in Ancient Japan,2006,English,,5,4.99,120,28.99,PG-13,LIZA,BERGMAN
121,161,CLUE GRAIL,A Taut Tale of a Butler And a Mad Scientist who must Build a Crocodile in Ancient China,2006,English,,6,4.99,70,27.99,NC-17,LIZA,BERGMAN
121,449,IDENTITY LOVER,A Boring Tale of a Composer And a Mad Cow who must Defeat a Car in The Outback,2006,English,,4,2.99,119,12.99,PG-13,LIZA,BERGMAN
121,654,PANKY SUBMARINE,A Touching Documentary of a Dentist And a Sumo Wrestler who must Overcome a Boy in The Gulf of Mexico,2006,English,,4,4.99,93,19.99,G,LIZA,BERGMAN
121,154,CLASH FREDDY,A Amazing Yarn of a Composer And a Squirrel who must Escape a Astronaut in Australia,2006,English,,6,2.99,81,12.99,G,LIZA,BERGMAN
121,353,GENTLEMEN STAGE,A Awe-Inspiring Reflection of a Monkey And a Student who must Overcome a Dentist in The First Manned Space Station,2006,English,,6,2.99,125,22.99,NC-17,LIZA,BERGMAN
121,847,STOCK GLASS,A Boring Epistle of a Crocodile And a Lumberjack who must Outgun a Moose in Ancient China,2006,English,,7,2.99,160,10.99,PG,LIZA,BERGMAN
121,885,TEXAS WATCH,A Awe-Inspiring Yarn of a Student And a Teacher who must Fight a Teacher in An Abandoned Amusement Park,2006,English,,7,0.99,179,22.99,NC-17,LIZA,BERGMAN
121,771,SCORPION APOLLO,A Awe-Inspiring Documentary of a Technical Writer And a Husband who must Meet a Monkey in An Abandoned Fun House,2006,English,,3,4.99,137,23.99,NC-17,LIZA,BERGMAN
121,297,EXTRAORDINARY CONQUERER,A Stunning Story of a Dog And a Feminist who must Face a Forensic Psychologist in Berlin,2006,English,,6,2.99,122,29.99,G,LIZA,BERGMAN
121,220,DEER VIRGINIAN,A Thoughtful Story of a Mad Cow And a Womanizer who must Overcome a Mad Scientist in Soviet Georgia,2006,English,,7,2.99,106,13.99,NC-17,LIZA,BERGMAN
121,198,CRYSTAL BREAKING,A Fast-Paced Character Study of a Feminist And a Explorer who must Face a Pastry Chef in Ancient Japan,2006,English,,6,2.99,184,22.99,NC-17,LIZA,BERGMAN
121,479,JEDI BENEATH,A Astounding Reflection of a Explorer And a Dentist who must Pursue a Student in Nigeria,2006,English,,7,0.99,128,12.99,PG,LIZA,BERGMAN
121,633,OCTOBER SUBMARINE,A Taut Epistle of a Monkey And a Boy who must Confront a Husband in A Jet Boat,2006,English,,6,4.99,54,10.99,PG-13,LIZA,BERGMAN
121,780,SENSIBILITY REAR,A Emotional Tale of a Robot And a Sumo Wrestler who must Redeem a Pastry Chef in A Baloon Factory,2006,English,,7,4.99,98,15.99,PG,LIZA,BERGMAN
121,658,PARIS WEEKEND,A Intrepid Story of a Squirrel And a Crocodile who must Defeat a Monkey in The Outback,2006,English,,7,2.99,121,19.99,PG-13,LIZA,BERGMAN
102,517,LESSON CLEOPATRA,A Emotional Display of a Man And a Explorer who must Build a Boy in A Manhattan Penthouse,2006,English,,3,0.99,167,28.99,NC-17,WALTER,TORN
102,34,ARABIA DOGMA,A Touching Epistle of a Madman And a Mad Cow who must Defeat a Student in Nigeria,2006,English,,6,0.99,62,29.99,NC-17,WALTER,TORN
102,544,MADISON TRAP,A Awe-Inspiring Reflection of a Monkey And a Dentist who must Overcome a Pioneer in A U-Boat,2006,English,,4,2.99,147,11.99,R,WALTER,TORN
102,508,LAMBS CINCINATTI,A Insightful Story of a Man And a Feminist who must Fight a Composer in Australia,2006,English,,6,4.99,144,18.99,PG-13,WALTER,TORN
102,852,STRANGELOVE DESIRE,A Awe-Inspiring Panorama of a Lumberjack And a Waitress who must Defeat a Crocodile in An Abandoned Amusement Park,2006,English,,4,0.99,103,27.99,NC-17,WALTER,TORN
102,446,HYSTERICAL GRAIL,A Amazing Saga of a Madman And a Dentist who must Build a Car in A Manhattan Penthouse,2006,English,,5,4.99,150,19.99,PG,WALTER,TORN
102,958,WARDROBE PHANTOM,A Action-Packed Display of a Mad Cow And a Astronaut who must Kill a Car in Ancient India,2006,English,,6,2.99,178,19.99,G,WALTER,TORN
102,124,CASPER DRAGONFLY,A Intrepid Documentary of a Boat And a Crocodile who must Chase a Robot in The Sahara Desert,2006,English,,3,4.99,163,16.99,PG-13,WALTER,TORN
102,529,LONELY ELEPHANT,A Intrepid Story of a Student And a Dog who must Challenge a Explorer in Soviet Georgia,2006,English,,3,2.99,67,12.99,G,WALTER,TORN
102,605,MULHOLLAND BEAST,A Awe-Inspiring Display of a Husband And a Squirrel who must Battle a Sumo Wrestler in A Jet Boat,2006,English,,7,2.99,157,13.99,PG,WALTER,TORN
102,205,DANCES NONE,A Insightful Reflection of a A Shark And a Dog who must Kill a Butler in An Abandoned Amusement Park,2006,English,,3,0.99,58,22.99,NC-17,WALTER,TORN
102,329,FORREST SONS,A Thrilling Documentary of a Forensic Psychologist And a Butler who must Defeat a Explorer in A Jet Boat,2006,English,,4,2.99,63,15.99,R,WALTER,TORN
102,802,SKY MIRACLE,A Epic Drama of a Mad Scientist And a Explorer who must Succumb a Waitress in An Abandoned Fun House,2006,English,,7,2.99,132,15.99,PG,WALTER,TORN
102,631,NOVOCAINE FLIGHT,A Fanciful Display of a Student And a Teacher who must Outgun a Crocodile in Nigeria,2006,English,,4,0.99,64,11.99,G,WALTER,TORN
102,485,JERSEY SASSY,A Lacklusture Documentary of a Madman And a Mad Cow who must Find a Feminist in Ancient Japan,2006,English,,6,4.99,60,16.99,PG,WALTER,TORN
102,980,WIZARD COLDBLOODED,A Lacklusture Display of a Robot And a Girl who must Defeat a Sumo Wrestler in A MySQL Convention,2006,English,,4,4.99,75,12.99,PG,WALTER,TORN
102,624,NIGHTMARE CHILL,A Brilliant Display of a Robot And a Butler who must Fight a Waitress in An Abandoned Mine Shaft,2006,English,,3,4.99,149,25.99,PG,WALTER,TORN
102,200,CURTAIN VIDEOTAPE,A Boring Reflection of a Dentist And a Mad Cow who must Chase a Secret Agent in A Shark Tank,2006,English,,7,0.99,133,27.99,PG-13,WALTER,TORN
102,20,AMELIE HELLFIGHTERS,A Boring Drama of a Woman And a Squirrel who must Conquer a Student in A Baloon,2006,English,,4,4.99,79,23.99,R,WALTER,TORN
102,600,MOTIONS DETAILS,A Awe-Inspiring Reflection of a Dog And a Student who must Kill a Car in An Abandoned Fun House,2006,English,,5,0.99,166,16.99,PG,WALTER,TORN
102,526,LOCK REAR,A Thoughtful Character Study of a Squirrel And a Technical Writer who must Outrace a Student in Ancient Japan,2006,English,,7,2.99,120,10.99,R,WALTER,TORN
102,810,SLUMS DUCK,A Amazing Character Study of a Teacher And a Database Administrator who must Defeat a Waitress in A Jet Boat,2006,English,,5,0.99,147,21.99,PG,WALTER,TORN
102,837,STAGE WORLD,A Lacklusture Panorama of a Woman And a Frisbee who must Chase a Crocodile in A Jet Boat,2006,English,,4,2.99,85,19.99,PG,WALTER,TORN
102,845,STEPMOM DREAM,A Touching Epistle of a Crocodile And a Teacher who must Build a Forensic Psychologist in A MySQL Convention,2006,English,,7,4.99,48,9.99,NC-17,WALTER,TORN
102,268,EARLY HOME,A Amazing Panorama of a Mad Scientist And a Husband who must Meet a Woman in The Outback,2006,English,,6,4.99,96,27.99,NC-17,WALTER,TORN
102,351,GASLIGHT CRUSADE,A Amazing Epistle of a Boy And a Astronaut who must Redeem a Man in The Gulf of Mexico,2006,English,,4,2.99,106,10.99,PG,WALTER,TORN
102,712,RAIDERS ANTITRUST,A Amazing Drama of a Teacher And a Feminist who must Meet a Woman in The First Manned Space Station,2006,English,,4,0.99,82,11.99,PG-13,WALTER,TORN
64,10,ALADDIN CALENDAR,A Action-Packed Tale of a Man And a Lumberjack who must Reach a Feminist in Ancient China,2006,English,,6,4.99,63,24.99,NC-17,RAY,JOHANSSON
64,569,MENAGERIE RUSHMORE,A Unbelieveable Panorama of a Composer And a Butler who must Overcome a Database Administrator in The First Manned Space Station,2006,English,,7,2.99,147,18.99,G,RAY,JOHANSSON
64,852,STRANGELOVE DESIRE,A Awe-Inspiring Panorama of a Lumberjack And a Waitress who must Defeat a Crocodile in An Abandoned Amusement Park,2006,English,,4,0.99,103,27.99,NC-17,RAY,JOHANSSON
64,87,BOONDOCK BALLROOM,A Fateful Panorama of a Crocodile And a Boy who must Defeat a Monkey in The Gulf of Mexico,2006,English,,7,0.99,76,14.99,NC-17,RAY,JOHANSSON
64,307,FELLOWSHIP AUTUMN,A Lacklusture Reflection of a Dentist And a Hunter who must Meet a Teacher in A Baloon,2006,English,,6,4.99,77,9.99,NC-17,RAY,JOHANSSON
64,921,UNCUT SUICIDES,A Intrepid Yarn of a Explorer And a Pastry Chef who must Pursue a Mad Cow in A U-Boat,2006,English,,7,2.99,172,29.99,PG-13,RAY,JOHANSSON
64,925,UNITED PILOT,A Fast-Paced Reflection of a Cat And a Mad Cow who must Fight a Car in The Sahara Desert,2006,English,,3,0.99,164,27.99,R,RAY,JOHANSSON
64,124,CASPER DRAGONFLY,A Intrepid Documentary of a Boat And a Crocodile who must Chase a Robot in The Sahara Desert,2006,English,,3,4.99,163,16.99,PG-13,RAY,JOHANSSON
64,291,EVOLUTION ALTER,A Fanciful Character Study of a Feminist And a Madman who must Find a Explorer in A Baloon Factory,2006,English,,5,0.99,174,10.99,PG-13,RAY,JOHANSSON
64,832,SPLASH GUMP,A Taut Saga of a Crocodile And a Boat who must Conquer a Hunter in A Shark Tank,2006,English,,5,0.99,175,16.99,PG,RAY,JOHANSSON
64,469,IRON MOON,A Fast-Paced Documentary of a Mad Cow And a Boy who must Pursue a Dentist in A Baloon,2006,English,,7,4.99,46,27.99,PG,RAY,JOHANSSON
64,88,BORN SPINAL,A Touching Epistle of a Frisbee And a Husband who must Pursue a Student in Nigeria,2006,English,,7,4.99,179,17.99,PG,RAY,JOHANSSON
64,335,FREEDOM CLEOPATRA,A Emotional Reflection of a Dentist And a Mad Cow who must Face a Squirrel in A Baloon,2006,English,,5,0.99,133,23.99,PG-13,RAY,JOHANSSON
64,980,WIZARD COLDBLOODED,A Lacklusture Display of a Robot And a Girl who must Defeat a Sumo Wrestler in A MySQL Convention,2006,English,,4,4.99,75,12.99,PG,RAY,JOHANSSON
64,37,ARIZONA BANG,A Brilliant Panorama of a Mad Scientist And a Mad Cow who must Meet a Pioneer in A Monastery,2006,English,,3,2.99,121,28.99,PG,RAY,JOHANSSON
64,572,METROPOLIS COMA,A Emotional Saga of a Database Administrator And a Pastry Chef who must Confront a Teacher in A Baloon Factory,2006,English,,4,2.99,64,9.99,PG-13,RAY,JOHANSSON
64,345,GABLES METROPOLIS,A Fateful Display of a Cat And a Pioneer who must Challenge a Pastry Chef in A Baloon Factory,2006,English,,3,0.99,161,17.99,PG,RAY,JOHANSSON
64,506,LADY STAGE,A Beautiful Character Study of a Woman And a Man who must Pursue a Explorer in A U-Boat,2006,English,,4,4.99,67,14.99,PG,RAY,JOHANSSON
64,597,MOONWALKER FOOL,A Epic Drama of a Feminist And a Pioneer who must Sink a Composer in New Orleans,2006,English,,5,4.99,184,12.99,G,RAY,JOHANSSON
64,646,OUTBREAK DIVINE,A Unbelieveable Yarn of a Database Administrator And a Woman who must Succumb a A Shark in A U-Boat,2006,English,,6,0.99,169,12.99,NC-17,RAY,JOHANSSON
64,448,IDAHO LOVE,A Fast-Paced Drama of a Student And a Crocodile who must Meet a Database Administrator in The Outback,2006,English,,3,2.99,172,25.99,PG-13,RAY,JOHANSSON
64,471,ISLAND EXORCIST,A Fanciful Panorama of a Technical Writer And a Boy who must Find a Dentist in An Abandoned Fun House,2006,English,,7,2.99,84,23.99,NC-17,RAY,JOHANSSON
64,280,EMPIRE MALKOVICH,A Amazing Story of a Feminist And a Cat who must Face a Car in An Abandoned Fun House,2006,English,,7,0.99,177,26.99,G,RAY,JOHANSSON
64,3,ADAPTATION HOLES,A Astounding Reflection of a Lumberjack And a Car who must Sink a Lumberjack in A Baloon Factory,2006,English,,7,2.99,50,18.99,NC-17,RAY,JOHANSSON
64,543,MADIGAN DORADO,A Astounding Character Study of a A Shark And a A Shark who must Discover a Crocodile in The Outback,2006,English,,5,4.99,116,20.99,R,RAY,JOHANSSON
37,10,ALADDIN CALENDAR,A Action-Packed Tale of a Man And a Lumberjack who must Reach a Feminist in Ancient China,2006,English,,6,4.99,63,24.99,NC-17,VAL,BOLGER
37,467,INTRIGUE WORST,A Fanciful Character Study of a Explorer And a Mad Scientist who must Vanquish a Squirrel in A Jet Boat,2006,English,,6,0.99,181,10.99,G,VAL,BOLGER
37,785,SHAWSHANK BUBBLE,A Lacklusture Story of a Moose And a Monkey who must Confront a Butler in An Abandoned Amusement Park,2006,English,,6,4.99,80,20.99,PG,VAL,BOLGER
37,260,DUDE BLINDNESS,A Stunning Reflection of a Husband And a Lumberjack who must Face a Frisbee in An Abandoned Fun House,2006,English,,3,4.99,132,9.99,G,VAL,BOLGER
37,508,LAMBS CINCINATTI,A Insightful Story of a Man And a Feminist who must Fight a Composer in Australia,2006,English,,6,4.99,144,18.99,PG-13,VAL,BOLGER
37,119,CAPER MOTIONS,A Fateful Saga of a Moose And a Car who must Pursue a Woman in A MySQL Convention,2006,English,,6,0.99,176,22.99,G,VAL,BOLGER
37,253,DRIFTER COMMANDMENTS,A Epic Reflection of a Womanizer And a Squirrel who must Discover a Husband in A Jet Boat,2006,English,,5,4.99,61,18.99,PG-13,VAL,BOLGER
37,662,PATHS CONTROL,A Astounding Documentary of a Butler And a Cat who must Find a Frisbee in Ancient China,2006,English,,3,4.99,118,9.99,PG,VAL,BOLGER
37,122,CARRIE BUNCH,A Amazing Epistle of a Student And a Astronaut who must Discover a Frisbee in The Canadian Rockies,2006,English,,7,0.99,114,11.99,PG,VAL,BOLGER
37,925,UNITED PILOT,A Fast-Paced Reflection of a Cat And a Mad Cow who must Fight a Car in The Sahara Desert,2006,English,,3,0.99,164,27.99,R,VAL,BOLGER
37,146,CHITTY LOCK,A Boring Epistle of a Boat And a Database Administrator who must Kill a Sumo Wrestler in The First Manned Space Station,2006,English,,6,2.99,107,24.99,G,VAL,BOLGER
37,277,ELEPHANT TROJAN,A Beautiful Panorama of a Lumberjack And a Forensic Psychologist who must Overcome a Frisbee in A Baloon,2006,English,,4,4.99,126,24.99,PG-13,VAL,BOLGER
37,529,LONELY ELEPHANT,A Intrepid Story of a Student And a Dog who must Challenge a Explorer in Soviet Georgia,2006,English,,3,2.99,67,12.99,G,VAL,BOLGER
37,12,ALASKA PHANTOM,A Fanciful Saga of a Hunter And a Pastry Chef who must Vanquish a Boy in Australia,2006,English,,6,0.99,136,22.99,PG,VAL,BOLGER
37,853,STRANGER STRANGERS,A Awe-Inspiring Yarn of a Womanizer And a Explorer who must Fight a Woman in The First Manned Space Station,2006,English,,3,4.99,139,12.99,G,VAL,BOLGER
37,19,AMADEUS HOLY,A Emotional Display of a Pioneer And a Technical Writer who must Battle a Man in A Baloon,2006,English,,6,0.99,113,20.99,PG,VAL,BOLGER
37,989,WORKING MICROCOSMOS,A Stunning Epistle of a Dentist And a Dog who must Kill a Madman in Ancient China,2006,English,,4,4.99,74,22.99,R,VAL,BOLGER
37,997,YOUTH KICK,A Touching Drama of a Teacher And a Cat who must Challenge a Technical Writer in A U-Boat,2006,English,,4,0.99,179,14.99,NC-17,VAL,BOLGER
37,485,JERSEY SASSY,A Lacklusture Documentary of a Madman And a Mad Cow who must Find a Feminist in Ancient Japan,2006,English,,6,4.99,60,16.99,PG,VAL,BOLGER
37,588,MODEL FISH,A Beautiful Panorama of a Boat And a Crocodile who must Outrace a Dog in Australia,2006,English,,4,4.99,175,11.99,NC-17,VAL,BOLGER
37,840,STAMPEDE DISTURBING,A Unbelieveable Tale of a Woman And a Lumberjack who must Fight a Frisbee in A U-Boat,2006,English,,5,0.99,75,26.99,R,VAL,BOLGER
37,572,METROPOLIS COMA,A Emotional Saga of a Database Administrator And a Pastry Chef who must Confront a Teacher in A Baloon Factory,2006,English,,4,2.99,64,9.99,PG-13,VAL,BOLGER
37,204,DALMATIONS SWEDEN,A Emotional Epistle of a Moose And a Hunter who must Overcome a Robot in A Manhattan Penthouse,2006,English,,4,0.99,106,25.99,PG,VAL,BOLGER
37,697,PRIMARY GLASS,A Fateful Documentary of a Pastry Chef And a Butler who must Build a Dog in The Canadian Rockies,2006,English,,7,0.99,53,16.99,G,VAL,BOLGER
37,963,WATCH TRACY,A Fast-Paced Yarn of a Dog And a Frisbee who must Conquer a Hunter in Nigeria,2006,English,,5,0.99,78,12.99,PG,VAL,BOLGER
37,317,FIREBALL PHILADELPHIA,A Amazing Yarn of a Dentist And a A Shark who must Vanquish a Madman in An Abandoned Mine Shaft,2006,English,,4,0.99,148,25.99,PG,VAL,BOLGER
37,663,PATIENT SISTER,A Emotional Epistle of a Squirrel And a Robot who must Confront a Lumberjack in Soviet Georgia,2006,English,,7,0.99,99,29.99,NC-17,VAL,BOLGER
112,34,ARABIA DOGMA,A Touching Epistle of a Madman And a Mad Cow who must Defeat a Student in Nigeria,2006,English,,6,0.99,62,29.99,NC-17,RUSSELL,BACALL
112,666,PAYCHECK WAIT,A Awe-Inspiring Reflection of a Boy And a Man who must Discover a Moose in The Sahara Desert,2006,English,,4,4.99,145,27.99,PG-13,RUSSELL,BACALL
112,603,MOVIE SHAKESPEARE,A Insightful Display of a Database Administrator And a Student who must Build a Hunter in Berlin,2006,English,,6,4.99,53,27.99,PG,RUSSELL,BACALL
112,772,SEA VIRGIN,A Fast-Paced Documentary of a Technical Writer And a Pastry Chef who must Escape a Moose in A U-Boat,2006,English,,4,2.99,80,24.99,PG,RUSSELL,BACALL
112,231,DINOSAUR SECRETARY,A Action-Packed Drama of a Feminist And a Girl who must Reach a Robot in The Canadian Rockies,2006,English,,7,2.99,63,27.99,R,RUSSELL,BACALL
112,654,PANKY SUBMARINE,A Touching Documentary of a Dentist And a Sumo Wrestler who must Overcome a Boy in The Gulf of Mexico,2006,English,,4,4.99,93,19.99,G,RUSSELL,BACALL
112,443,HURRICANE AFFAIR,A Lacklusture Epistle of a Database Administrator And a Woman who must Meet a Hunter in An Abandoned Mine Shaft,2006,English,,6,2.99,49,11.99,PG,RUSSELL,BACALL
112,796,SIERRA DIVIDE,A Emotional Character Study of a Frisbee And a Mad Scientist who must Build a Madman in California,2006,English,,3,0.99,135,12.99,NC-17,RUSSELL,BACALL
112,37,ARIZONA BANG,A Brilliant Panorama of a Mad Scientist And a Mad Cow who must Meet a Pioneer in A Monastery,2006,English,,3,2.99,121,28.99,PG,RUSSELL,BACALL
112,700,PRIX UNDEFEATED,A Stunning Saga of a Mad Scientist And a Boat who must Overcome a Dentist in Ancient China,2006,English,,4,2.99,115,13.99,R,RUSSELL,BACALL
112,565,MATRIX SNOWMAN,A Action-Packed Saga of a Womanizer And a Woman who must Overcome a Student in California,2006,English,,6,4.99,56,9.99,PG-13,RUSSELL,BACALL
112,856,STREETCAR INTENTIONS,A Insightful Character Study of a Waitress And a Crocodile who must Sink a Waitress in The Gulf of Mexico,2006,English,,5,4.99,73,11.99,R,RUSSELL,BACALL
