lingua,film_id,durata_noleggio,voto,descrizione,titolo,costo_sostituzione,data_rilascio,lingua_originale_id,durata,tariffa_noleggio
English,210,3,NC-17,A Stunning Reflection of a Frisbee And a Husband who must Redeem a Dog in New Orleans,DARKO DORADO,13.99,2006,,130,4.99
English,949,6,NC-17,A Awe-Inspiring Yarn of a Hunter And a Feminist who must Challenge a Dentist in The Outback,VOLCANO TEXAS,27.99,2006,,157,0.99
English,127,5,G,A Fast-Paced Panorama of a Girl And a A Shark who must Confront a Boy in Ancient India,CAT CONEHEADS,14.99,2006,,112,4.99
English,947,5,PG-13,A Thoughtful Documentary of a Dog And a Man who must Sink a Man in A Shark Tank,VISION TORQUE,16.99,2006,,59,0.99
English,928,5,PG,A Fateful Documentary of a Dog And a Hunter who must Pursue a Teacher in An Abandoned Amusement Park,UPTOWN YOUNG,16.99,2006,,84,2.99
English,818,4,NC-17,A Boring Character Study of a Car And a Husband who must Outgun a Frisbee in The First Manned Space Station,SOMETHING DUCK,17.99,2006,,180,4.99
English,746,3,NC-17,A Awe-Inspiring Drama of a Astronaut And a Frisbee who must Conquer a Mad Scientist in Australia,ROUGE SQUAD,10.99,2006,,118,0.99
English,736,4,R,A Taut Reflection of a Robot And a Squirrel who must Fight a Boat in Ancient Japan,ROBBERY BRIGHT,21.99,2006,,134,0.99
English,636,5,PG,A Boring Story of a Teacher And a Monkey who must Succumb a Forensic Psychologist in A Jet Boat,OLEANDER CLUE,12.99,2006,,161,0.99
English,943,4,PG-13,A Boring Yarn of a Pioneer And a Feminist who must Redeem a Cat in An Abandoned Amusement Park,VILLAIN DESPERATE,27.99,2006,,76,4.99
English,800,7,PG-13,A Epic Display of a Dog And a Boat who must Succumb a Mad Scientist in An Abandoned Mine Shaft,SINNERS ATLANTIS,19.99,2006,,126,2.99
English,198,6,NC-17,A Fast-Paced Character Study of a Feminist And a Explorer who must Face a Pastry Chef in Ancient Japan,CRYSTAL BREAKING,22.99,2006,,184,2.99
English,155,6,PG-13,A Fanciful Documentary of a Crocodile And a Technical Writer who must Fight a A Shark in A Baloon,CLEOPATRA DEVIL,26.99,2006,,150,0.99
English,874,6,PG,A Beautiful Tale of a Frisbee And a Moose who must Vanquish a Dog in An Abandoned Amusement Park,TADPOLE PARK,13.99,2006,,155,2.99
English,426,7,R,A Touching Panorama of a Man And a Secret Agent who must Challenge a Teacher in A MySQL Convention,HOME PITY,15.99,2006,,185,4.99
English,281,6,G,A Astounding Drama of a Feminist And a Teacher who must Confront a Husband in A Baloon,ENCINO ELF,9.99,2006,,143,0.99
English,460,3,PG-13,A Beautiful Drama of a Pioneer And a Crocodile who must Challenge a Student in The Outback,INNOCENT USUAL,26.99,2006,,178,4.99
English,491,4,NC-17,A Touching Epistle of a Monkey And a Feminist who must Discover a Boat in Berlin,JUMPING WRATH,18.99,2006,,74,0.99
English,187,5,NC-17,A Fanciful Documentary of a Teacher And a Dog who must Outgun a Forensic Psychologist in A Baloon Factory,CRANES RESERVOIR,12.99,2006,,57,2.99
English,368,7,R,A Insightful Character Study of a Mad Cow And a Forensic Psychologist who must Conquer a A Shark in A Manhattan Penthouse,GONE TROUBLE,20.99,2006,,84,2.99
English,188,7,PG,A Fanciful Panorama of a Boy And a Woman who must Vanquish a Database Administrator in The Outback,CRAZY HOME,24.99,2006,,136,2.99
English,837,4,PG,A Lacklusture Panorama of a Woman And a Frisbee who must Chase a Crocodile in A Jet Boat,STAGE WORLD,19.99,2006,,85,2.99
English,79,5,PG-13,A Thoughtful Character Study of a Frisbee And a Pastry Chef who must Fight a Dentist in The First Manned Space Station,BLADE POLISH,10.99,2006,,114,0.99
English,335,5,PG-13,A Emotional Reflection of a Dentist And a Mad Cow who must Face a Squirrel in A Baloon,FREEDOM CLEOPATRA,23.99,2006,,133,0.99
English,563,6,R,A Fateful Reflection of a Waitress And a Crocodile who must Challenge a Forensic Psychologist in California,MASSACRE USUAL,16.99,2006,,165,4.99
English,142,3,PG,A Emotional Drama of a Dog And a Explorer who must Outrace a Technical Writer in Australia,CHICKEN HELLFIGHTERS,24.99,2006,,122,0.99
English,19,6,PG,A Emotional Display of a Pioneer And a Technical Writer who must Battle a Man in A Baloon,AMADEUS HOLY,20.99,2006,,113,0.99
English,738,3,PG-13,A Awe-Inspiring Character Study of a Robot And a Sumo Wrestler who must Discover a Womanizer in A Shark Tank,ROCKETEER MOTHER,27.99,2006,,178,0.99
English,521,7,NC-17,A Fast-Paced Character Study of a Dentist And a Moose who must Defeat a Composer in The First Manned Space Station,LIES TREATMENT,28.99,2006,,147,4.99
English,321,3,NC-17,A Astounding Saga of a Moose And a Pastry Chef who must Chase a Student in The Gulf of Mexico,FLASH WARS,21.99,2006,,123,4.99
English,784,7,PG,A Fast-Paced Character Study of a Crocodile And a Lumberjack who must Build a Husband in An Abandoned Fun House,SHANGHAI TYCOON,20.99,2006,,47,2.99
English,772,4,PG,A Fast-Paced Documentary of a Technical Writer And a Pastry Chef who must Escape a Moose in A U-Boat,SEA VIRGIN,24.99,2006,,80,2.99
English,633,6,PG-13,A Taut Epistle of a Monkey And a Boy who must Confront a Husband in A Jet Boat,OCTOBER SUBMARINE,10.99,2006,,54,4.99
English,884,5,R,A Touching Story of a Crocodile And a Girl who must Sink a Man in The Gulf of Mexico,TERMINATOR CLUB,11.99,2006,,88,4.99
English,351,4,PG,A Amazing Epistle of a Boy And a Astronaut who must Redeem a Man in The Gulf of Mexico,GASLIGHT CRUSADE,10.99,2006,,106,2.99
English,455,7,NC-17,A Awe-Inspiring Yarn of a Monkey And a Hunter who must Chase a Teacher in Ancient China,IMPOSSIBLE PREJUDICE,11.99,2006,,103,4.99
English,816,3,G,A Fateful Display of a Lumberjack And a Girl who must Succumb a Mad Cow in A Manhattan Penthouse,SNOWMAN ROLLERCOASTER,27.99,2006,,62,0.99
English,698,3,NC-17,A Thrilling Yarn of a Pastry Chef And a Monkey who must Battle a Monkey in A Shark Tank,PRINCESS GIANT,29.99,2006,,71,2.99
English,537,3,G,A Emotional Yarn of a Robot And a Boy who must Outgun a Technical Writer in A U-Boat,LOVER TRUMAN,29.99,2006,,75,2.99
English,121,4,PG,A Astounding Character Study of a Composer And a Student who must Overcome a Composer in A Monastery,CAROL TEXAS,15.99,2006,,151,2.99
English,220,7,NC-17,A Thoughtful Story of a Mad Cow And a Womanizer who must Overcome a Mad Scientist in Soviet Georgia,DEER VIRGINIAN,13.99,2006,,106,2.99
English,690,7,PG-13,A Stunning Drama of a Teacher And a Boat who must Battle a Feminist in Ancient China,POND SEATTLE,25.99,2006,,185,2.99
English,742,7,R,A Lacklusture Reflection of a Car And a Explorer who must Find a Monkey in A Baloon,ROOF CHAMPION,25.99,2006,,101,0.99
English,6,3,PG,A Intrepid Panorama of a Robot And a Boy who must Escape a Sumo Wrestler in Ancient China,AGENT TRUMAN,17.99,2006,,169,2.99
English,823,4,R,A Amazing Documentary of a Car And a Robot who must Escape a Lumberjack in An Abandoned Amusement Park,SOUTH WAIT,21.99,2006,,143,2.99
English,85,4,G,A Fast-Paced Story of a Crocodile And a Robot who must Find a Moose in Ancient Japan,BONNIE HOLOCAUST,29.99,2006,,63,0.99
English,819,3,PG-13,A Amazing Documentary of a Man And a Husband who must Confront a Squirrel in A MySQL Convention,SONG HEDWIG,29.99,2006,,165,0.99
English,852,4,NC-17,A Awe-Inspiring Panorama of a Lumberjack And a Waitress who must Defeat a Crocodile in An Abandoned Amusement Park,STRANGELOVE DESIRE,27.99,2006,,103,0.99
English,923,7,R,A Taut Documentary of a Waitress And a Mad Scientist who must Battle a Technical Writer in New Orleans,UNFAITHFUL KILL,12.99,2006,,78,2.99
English,528,4,NC-17,A Thrilling Drama of a Girl And a Robot who must Redeem a Waitress in An Abandoned Mine Shaft,LOLITA WORLD,25.99,2006,,155,2.99
English,604,4,G,A Emotional Saga of a Womanizer And a Pioneer who must Overcome a Dentist in A Baloon,MULAN MOON,10.99,2006,,160,0.99
English,143,6,PG,A Lacklusture Epistle of a Boat And a Technical Writer who must Fight a A Shark in The Canadian Rockies,CHILL LUCK,17.99,2006,,142,0.99
English,697,7,G,A Fateful Documentary of a Pastry Chef And a Butler who must Build a Dog in The Canadian Rockies,PRIMARY GLASS,16.99,2006,,53,0.99
English,675,6,NC-17,A Beautiful Documentary of a Astronaut And a Crocodile who must Discover a Madman in A Monastery,PHANTOM GLORY,17.99,2006,,60,2.99
English,148,3,R,A Unbelieveable Story of a Mad Scientist And a Technical Writer who must Discover a Composer in Ancient China,CHOCOLATE DUCK,13.99,2006,,132,2.99
English,2,3,G,A Astounding Epistle of a Database Administrator And a Explorer who must Find a Car in Ancient China,ACE GOLDFINGER,12.99,2006,,48,4.99
English,440,6,G,A Unbelieveable Yarn of a Student And a Database Administrator who must Outgun a Husband in An Abandoned Mine Shaft,HUNGER ROOF,21.99,2006,,105,0.99
English,415,3,R,A Fateful Saga of a Waitress And a Hunter who must Outrace a Sumo Wrestler in Australia,HIGH ENCINO,23.99,2006,,84,2.99
English,865,3,PG-13,A Beautiful Epistle of a Madman And a Butler who must Face a Crocodile in A Manhattan Penthouse,SUNRISE LEAGUE,19.99,2006,,135,4.99
English,725,6,R,A Unbelieveable Character Study of a Cat And a Database Administrator who must Pursue a Teacher in A Monastery,REQUIEM TYCOON,25.99,2006,,167,4.99
English,659,3,PG-13,A Taut Epistle of a Sumo Wrestler And a Girl who must Face a Husband in Ancient Japan,PARK CITIZEN,14.99,2006,,109,4.99
English,508,6,PG-13,A Insightful Story of a Man And a Feminist who must Fight a Composer in Australia,LAMBS CINCINATTI,18.99,2006,,144,4.99
English,615,6,PG-13,A Epic Reflection of a Monkey And a Mad Cow who must Kill a Forensic Psychologist in An Abandoned Mine Shaft,NASH CHOCOLAT,21.99,2006,,180,2.99
English,702,4,G,A Unbelieveable Display of a Dog And a Crocodile who must Outrace a Man in Nigeria,PULP BEVERLY,12.99,2006,,89,2.99
English,107,4,G,A Emotional Story of a Feminist And a Feminist who must Escape a Pastry Chef in A MySQL Convention,BUNCH MINDS,13.99,2006,,63,2.99
English,743,7,PG,A Awe-Inspiring Panorama of a Composer And a Secret Agent who must Sink a Composer in A Shark Tank,ROOM ROMAN,27.99,2006,,60,0.99
English,286,7,NC-17,A Astounding Character Study of a Boat And a Secret Agent who must Find a Mad Cow in The Sahara Desert,ENOUGH RAGING,16.99,2006,,158,2.99
English,672,7,PG-13,A Thrilling Yarn of a Dog And a Dog who must Build a Husband in A Baloon,PERFECT GROOVE,17.99,2006,,82,2.99
English,522,4,NC-17,A Thrilling Reflection of a Teacher And a Composer who must Find a Man in The First Manned Space Station,LIFE TWISTED,9.99,2006,,137,2.99
English,532,5,PG,A Stunning Drama of a Robot And a Feminist who must Outgun a Butler in Nigeria,LOSER HUSTLER,28.99,2006,,80,4.99
English,474,6,NC-17,A Insightful Panorama of a Squirrel And a Mad Cow who must Confront a Student in The First Manned Space Station,JADE BUNCH,21.99,2006,,174,2.99
English,759,4,R,A Awe-Inspiring Character Study of a Boy And a Feminist who must Sink a Crocodile in Ancient China,SALUTE APOLLO,29.99,2006,,73,2.99
English,530,5,PG-13,A Action-Packed Display of a Frisbee And a Pastry Chef who must Pursue a Crocodile in A Jet Boat,LORD ARIZONA,27.99,2006,,108,2.99
English,737,4,G,A Astounding Character Study of a Robot And a Moose who must Overcome a Astronaut in Ancient India,ROCK INSTINCT,28.99,2006,,102,0.99
English,91,5,PG,A Thrilling Panorama of a Database Administrator And a Astronaut who must Challenge a Lumberjack in A Baloon,BOUND CHEAPER,17.99,2006,,98,0.99
English,591,6,PG,A Astounding Tale of a Crocodile And a Car who must Outrace a Squirrel in A U-Boat,MONSOON CAUSE,20.99,2006,,182,4.99
English,216,3,G,A Stunning Documentary of a Composer And a Mad Scientist who must Find a Technical Writer in A U-Boat,DAY UNFAITHFUL,16.99,2006,,113,4.99
English,37,3,PG,A Brilliant Panorama of a Mad Scientist And a Mad Cow who must Meet a Pioneer in A Monastery,ARIZONA BANG,28.99,2006,,121,2.99
English,154,6,G,A Amazing Yarn of a Composer And a Squirrel who must Escape a Astronaut in Australia,CLASH FREDDY,12.99,2006,,81,2.99
English,895,3,R,A Thoughtful Story of a Moose And a Husband who must Face a Secret Agent in The Sahara Desert,TOMORROW HUSTLER,21.99,2006,,142,2.99
English,946,3,NC-17,A Fateful Tale of a Database Administrator And a Squirrel who must Discover a Student in Soviet Georgia,VIRTUAL SPOILERS,14.99,2006,,144,4.99
English,400,7,R,A Emotional Character Study of a Hunter And a Car who must Kill a Woman in Berlin,HARDLY ROBBERS,15.99,2006,,72,2.99
English,900,6,R,A Awe-Inspiring Documentary of a Moose And a Madman who must Meet a Dog in An Abandoned Mine Shaft,TOWN ARK,17.99,2006,,136,2.99
English,887,5,PG-13,A Touching Documentary of a Madman And a Mad Scientist who must Outrace a Feminist in An Abandoned Mine Shaft,THIEF PELICAN,28.99,2006,,135,4.99
English,981,7,NC-17,A Fast-Paced Drama of a Squirrel And a Robot who must Succumb a Technical Writer in A Manhattan Penthouse,WOLVES DESIRE,13.99,2006,,55,0.99
English,309,6,R,A Brilliant Reflection of a Database Administrator And a Mad Cow who must Chase a Woman in The Canadian Rockies,FEUD FROGMEN,29.99,2006,,98,0.99
English,560,6,NC-17,A Boring Drama of a Car And a Dog who must Succumb a Madman in Soviet Georgia,MARS ROMAN,21.99,2006,,62,0.99
English,684,4,NC-17,A Epic Saga of a Cat And a Squirrel who must Outgun a Robot in A U-Boat,PIZZA JUMANJI,11.99,2006,,173,2.99
English,910,3,PG,A Boring Story of a Teacher And a Student who must Outgun a Cat in An Abandoned Mine Shaft,TREATMENT JEKYLL,19.99,2006,,87,0.99
English,270,7,NC-17,A Stunning Drama of a Butler And a Madman who must Outrace a Womanizer in Ancient India,EARTH VISION,29.99,2006,,85,0.99
English,501,3,R,A Insightful Reflection of a Pioneer And a Teacher who must Build a Composer in The First Manned Space Station,KISSING DOLLS,9.99,2006,,141,4.99
English,461,3,NC-17,A Epic Display of a Butler And a Dog who must Vanquish a Crocodile in A Manhattan Penthouse,INSECTS STONE,14.99,2006,,123,0.99
English,596,4,PG-13,A Thoughtful Display of a Astronaut And a Feminist who must Chase a Frisbee in A Jet Boat,MOONSHINE CABIN,25.99,2006,,171,4.99
English,524,6,PG,A Intrepid Display of a Pastry Chef And a Cat who must Kill a A Shark in Ancient China,LION UNCUT,13.99,2006,,50,0.99
English,568,4,NC-17,A Touching Epistle of a Squirrel And a Explorer who must Redeem a Pastry Chef in The Sahara Desert,MEMENTO ZOOLANDER,11.99,2006,,77,4.99
English,412,6,G,A Unbelieveable Story of a Composer And a Dog who must Overcome a Womanizer in An Abandoned Amusement Park,HEAVYWEIGHTS BEAST,25.99,2006,,102,4.99
English,488,3,NC-17,A Thrilling Panorama of a Technical Writer And a Car who must Discover a Forensic Psychologist in A Shark Tank,JOON NORTHWEST,23.99,2006,,105,0.99
English,463,4,PG,A Touching Documentary of a Mad Cow And a Explorer who must Confront a Butler in A Manhattan Penthouse,INSTINCT AIRPORT,21.99,2006,,116,2.99
English,193,5,G,A Intrepid Documentary of a Sumo Wrestler And a Astronaut who must Battle a Composer in The Outback,CROSSROADS CASUALTIES,20.99,2006,,153,2.99
English,972,4,PG-13,A Intrepid Story of a Dentist And a Hunter who must Confront a Monkey in Ancient Japan,WHISPERER GIANT,24.99,2006,,59,4.99
English,938,3,R,A Lacklusture Tale of a Pastry Chef And a Technical Writer who must Confront a Crocodile in An Abandoned Amusement Park,VELVET TERMINATOR,14.99,2006,,173,4.99
English,671,7,NC-17,A Fast-Paced Story of a Car And a Cat who must Outgun a Hunter in Berlin,PERDITION FARGO,27.99,2006,,99,4.99
English,285,3,PG-13,A Intrepid Epistle of a Pastry Chef And a Pastry Chef who must Pursue a Crocodile in Ancient China,ENGLISH BULWORTH,18.99,2006,,51,0.99
English,101,3,R,A Fateful Character Study of a Butler And a Technical Writer who must Sink a Astronaut in Ancient Japan,BROTHERHOOD BLANKET,26.99,2006,,73,0.99
English,298,4,PG-13,A Thrilling Story of a Cat And a Waitress who must Fight a Explorer in The Outback,EYES DRIVING,13.99,2006,,172,2.99
English,99,7,PG,A Fateful Saga of a A Shark And a Technical Writer who must Find a Woman in A Jet Boat,BRINGING HYSTERICAL,14.99,2006,,136,2.99
English,20,4,R,A Boring Drama of a Woman And a Squirrel who must Conquer a Student in A Baloon,AMELIE HELLFIGHTERS,23.99,2006,,79,4.99
English,334,6,NC-17,A Intrepid Saga of a Man And a Lumberjack who must Vanquish a Husband in The Outback,FREDDY STORM,21.99,2006,,65,4.99
English,585,4,G,A Unbelieveable Documentary of a Frisbee And a Boat who must Meet a Boy in The Canadian Rockies,MOB DUFFEL,25.99,2006,,105,0.99
English,531,3,R,A Stunning Reflection of a Student And a Technical Writer who must Battle a Butler in The First Manned Space Station,LOSE INCH,18.99,2006,,137,0.99
English,65,3,PG,A Unbelieveable Drama of a Student And a Husband who must Outrace a Sumo Wrestler in Berlin,BEHAVIOR RUNAWAY,20.99,2006,,100,4.99
English,120,3,NC-17,A Fanciful Tale of a Pioneer And a Technical Writer who must Outgun a Pioneer in A Shark Tank,CARIBBEAN LIBERTY,16.99,2006,,92,4.99
English,926,5,NC-17,A Amazing Documentary of a Woman And a Astronaut who must Outrace a Teacher in An Abandoned Fun House,UNTOUCHABLES SUNRISE,11.99,2006,,120,2.99
English,391,6,PG-13,A Epic Epistle of a Database Administrator And a Crocodile who must Face a Madman in A Jet Boat,HALF OUTFIELD,25.99,2006,,146,2.99
English,437,7,R,A Taut Story of a Pioneer And a Squirrel who must Battle a Student in Soviet Georgia,HOUSE DYNAMITE,13.99,2006,,109,2.99
English,919,3,G,A Emotional Display of a Husband And a A Shark who must Succumb a Madman in A Manhattan Penthouse,TYCOON GATHERING,17.99,2006,,82,4.99
English,26,3,G,A Amazing Panorama of a Pastry Chef And a Boat who must Escape a Woman in An Abandoned Amusement Park,ANNIE IDENTITY,15.99,2006,,86,0.99
English,467,6,G,A Fanciful Character Study of a Explorer And a Mad Scientist who must Vanquish a Squirrel in A Jet Boat,INTRIGUE WORST,10.99,2006,,181,0.99
English,688,6,PG,A Boring Character Study of a Database Administrator And a Lumberjack who must Reach a Madman in The Outback,POLISH BROOKLYN,12.99,2006,,61,0.99
English,273,6,PG,A Beautiful Display of a Pastry Chef And a Pastry Chef who must Outgun a Forensic Psychologist in A Manhattan Penthouse,EFFECT GLADIATOR,14.99,2006,,107,0.99
English,473,5,PG-13,A Insightful Reflection of a Womanizer And a Husband who must Conquer a Pastry Chef in A Baloon,JACKET FRISCO,16.99,2006,,181,2.99
English,927,6,NC-17,A Fanciful Reflection of a Boy And a Butler who must Pursue a Woman in Berlin,UPRISING UPTOWN,16.99,2006,,174,2.99
English,789,7,PG-13,A Fateful Tale of a Mad Cow And a Crocodile who must Meet a Husband in New Orleans,SHOCK CABIN,15.99,2006,,79,2.99
English,677,6,NC-17,A Intrepid Story of a Boy And a Technical Writer who must Pursue a Lumberjack in A Monastery,PIANIST OUTFIELD,25.99,2006,,136,0.99
English,845,7,NC-17,A Touching Epistle of a Crocodile And a Teacher who must Build a Forensic Psychologist in A MySQL Convention,STEPMOM DREAM,9.99,2006,,48,4.99
English,453,3,PG-13,A Lacklusture Panorama of a Secret Agent And a Crocodile who must Discover a Madman in The Canadian Rockies,IMAGE PRINCESS,17.99,2006,,178,2.99
English,176,6,PG-13,A Touching Documentary of a Cat And a Pastry Chef who must Find a Lumberjack in A Baloon,CONGENIALITY QUEST,21.99,2006,,87,0.99
English,49,6,R,A Emotional Panorama of a Pioneer And a Composer who must Escape a Mad Scientist in A Jet Boat,BADMAN DAWN,22.99,2006,,162,2.99
English,645,7,PG,A Lacklusture Documentary of a Mad Cow And a Madman who must Sink a Moose in The Gulf of Mexico,OTHERS SOUP,18.99,2006,,118,2.99
English,944,6,PG-13,A Awe-Inspiring Documentary of a Robot And a Mad Scientist who must Reach a Database Administrator in A Shark Tank,VIRGIN DAISY,29.99,2006,,179,4.99
English,423,7,PG,A Fast-Paced Epistle of a Boy And a Explorer who must Escape a Dog in A U-Boat,HOLLYWOOD ANONYMOUS,29.99,2006,,69,0.99
English,300,5,PG-13,A Fateful Saga of a Sumo Wrestler And a Hunter who must Redeem a A Shark in New Orleans,FALCON VOLUME,21.99,2006,,102,4.99
English,462,5,NC-17,A Astounding Saga of a Mad Scientist And a Hunter who must Pursue a Robot in A Baloon Factory,INSIDER ARIZONA,17.99,2006,,78,2.99
English,787,4,G,A Awe-Inspiring Character Study of a Astronaut And a Forensic Psychologist who must Challenge a Madman in Ancient India,SHINING ROSES,12.99,2006,,125,0.99
English,442,6,NC-17,A Thrilling Reflection of a Pioneer And a Dentist who must Outrace a Womanizer in An Abandoned Mine Shaft,HUNTING MUSKETEERS,24.99,2006,,65,2.99
English,57,4,PG-13,A Stunning Epistle of a Man And a Husband who must Reach a Mad Scientist in A Jet Boat,BASIC EASY,18.99,2006,,90,2.99
English,680,4,PG,A Action-Packed Reflection of a Mad Scientist And a A Shark who must Find a Feminist in California,PINOCCHIO SIMON,21.99,2006,,103,4.99
English,689,5,PG,A Intrepid Story of a Madman And a Frisbee who must Outgun a Boat in The Sahara Desert,POLLOCK DELIVERANCE,14.99,2006,,137,2.99
English,263,6,R,A Brilliant Panorama of a Girl And a Boy who must Face a Mad Scientist in An Abandoned Mine Shaft,DURHAM PANKY,14.99,2006,,154,4.99
English,454,6,PG-13,A Epic Character Study of a Frisbee And a Moose who must Outgun a Technical Writer in A Shark Tank,IMPACT ALADDIN,20.99,2006,,180,0.99
English,295,3,PG,A Amazing Character Study of a Mad Cow And a Squirrel who must Discover a Hunter in A U-Boat,EXPENDABLE STALLION,14.99,2006,,97,0.99
English,555,4,PG,A Thrilling Yarn of a Waitress And a Dentist who must Find a Hunter in A Monastery,MALLRATS UNITED,25.99,2006,,133,0.99
English,43,6,G,A Thrilling Yarn of a Feminist And a Hunter who must Fight a Technical Writer in A Shark Tank,ATLANTIS CAUSE,15.99,2006,,170,2.99
English,239,5,G,A Brilliant Character Study of a Database Administrator And a Monkey who must Succumb a Astronaut in New Orleans,DOGMA FAMILY,16.99,2006,,122,4.99
English,577,4,PG,A Lacklusture Epistle of a Cat And a Husband who must Confront a Boy in A MySQL Convention,MILE MULAN,10.99,2006,,64,0.99
English,53,5,NC-17,A Epic Drama of a Madman And a Cat who must Face a A Shark in An Abandoned Amusement Park,BANG KWAI,25.99,2006,,87,2.99
English,513,6,PG-13,A Fateful Reflection of a Dog And a Mad Cow who must Outrace a Teacher in An Abandoned Mine Shaft,LEATHERNECKS DWARFS,21.99,2006,,153,2.99
English,833,5,R,A Taut Story of a Dog And a Explorer who must Find a Astronaut in Berlin,SPLENDOR PATTON,20.99,2006,,134,0.99
English,695,6,PG,A Fateful Panorama of a Technical Writer And a Moose who must Battle a Robot in Soviet Georgia,PRESIDENT BANG,12.99,2006,,144,4.99
English,638,7,G,A Intrepid Character Study of a Man And a Frisbee who must Overcome a Madman in Ancient China,OPERATION OPERATION,23.99,2006,,156,2.99
English,930,4,R,A Fanciful Character Study of a Secret Agent And a Mad Scientist who must Reach a Teacher in Australia,VACATION BOONDOCK,23.99,2006,,145,2.99
English,516,7,PG,A Awe-Inspiring Epistle of a Pioneer And a Student who must Outgun a Crocodile in The Outback,LEGEND JEDI,18.99,2006,,59,0.99
English,5,6,G,A Fast-Paced Documentary of a Pastry Chef And a Dentist who must Pursue a Forensic Psychologist in The Gulf of Mexico,AFRICAN EGG,22.99,2006,,130,2.99
English,429,3,R,A Taut Story of a Waitress And a Crocodile who must Outrace a Lumberjack in A Shark Tank,HONEY TIES,29.99,2006,,84,0.99
English,939,4,R,A Unbelieveable Display of a Mad Scientist And a Mad Scientist who must Outgun a Mad Cow in Ancient Japan,VERTIGO NORTHWEST,17.99,2006,,90,2.99
English,566,6,R,A Beautiful Documentary of a Forensic Psychologist And a Cat who must Reach a Astronaut in Nigeria,MAUDE MOD,20.99,2006,,72,0.99
English,924,7,PG,A Taut Epistle of a Monkey And a Sumo Wrestler who must Vanquish a A Shark in A Baloon Factory,UNFORGIVEN ZOOLANDER,15.99,2006,,129,0.99
English,821,6,NC-17,A Fast-Paced Display of a Squirrel And a Composer who must Fight a Forensic Psychologist in A Jet Boat,SORORITY QUEEN,17.99,2006,,184,0.99
English,873,3,G,A Brilliant Character Study of a Frisbee And a Sumo Wrestler who must Confront a Woman in The Gulf of Mexico,SWEETHEARTS SUSPECTS,13.99,2006,,108,0.99
English,139,7,PG,A Astounding Saga of a Technical Writer And a Butler who must Battle a Butler in A Shark Tank,CHASING FIGHT,21.99,2006,,114,4.99
English,778,3,G,A Fateful Saga of a Cat And a Frisbee who must Kill a Girl in A Manhattan Penthouse,SECRETS PARADISE,24.99,2006,,109,4.99
English,326,6,NC-17,A Thrilling Display of a Mad Cow And a Dog who must Challenge a Frisbee in Nigeria,FLYING HOOK,18.99,2006,,69,2.99
English,317,4,PG,A Amazing Yarn of a Dentist And a A Shark who must Vanquish a Madman in An Abandoned Mine Shaft,FIREBALL PHILADELPHIA,25.99,2006,,148,0.99
English,71,3,PG-13,A Emotional Reflection of a Teacher And a Man who must Meet a Cat in The First Manned Space Station,BILKO ANONYMOUS,25.99,2006,,100,4.99
English,411,5,NC-17,A Beautiful Yarn of a Forensic Psychologist And a Frisbee who must Battle a Moose in A Jet Boat,HEAVENLY GUN,13.99,2006,,49,4.99
English,235,6,PG-13,A Intrepid Saga of a Man And a Forensic Psychologist who must Reach a Squirrel in A Monastery,DIVIDE MONSTER,13.99,2006,,68,2.99
English,916,3,G,A Stunning Tale of a Man And a Monkey who must Chase a Student in New Orleans,TURN STAR,10.99,2006,,80,2.99
English,506,4,PG,A Beautiful Character Study of a Woman And a Man who must Pursue a Explorer in A U-Boat,LADY STAGE,14.99,2006,,67,4.99
English,857,3,PG-13,A Touching Reflection of a Crocodile And a Dog who must Chase a Hunter in An Abandoned Fun House,STRICTLY SCARFACE,24.99,2006,,144,2.99
English,218,7,NC-17,A Taut Story of a Moose And a Squirrel who must Build a Husband in Ancient India,DECEIVER BETRAYED,22.99,2006,,122,0.99
English,180,4,PG-13,A Awe-Inspiring Story of a Student And a Frisbee who must Conquer a Crocodile in An Abandoned Mine Shaft,CONSPIRACY SPIRIT,27.99,2006,,184,2.99
English,269,3,R,A Stunning Character Study of a Dentist And a Mad Cow who must Find a Teacher in Nigeria,EARRING INSTINCT,22.99,2006,,98,0.99
English,420,7,PG,A Fast-Paced Reflection of a Technical Writer And a Student who must Fight a Boy in The Canadian Rockies,HOLES BRANNIGAN,27.99,2006,,128,4.99
