lingua,film_id,durata_noleggio,voto,descrizione,titolo,costo_sostituzione,data_rilascio,lingua_originale_id,durata,tariffa_noleggio
English,72,6,PG,A Stunning Saga of a Mad Scientist And a Forensic Psychologist who must Challenge a Squirrel in A MySQL Convention,BILL OTHERS,12.99,2006,,93,2.99
English,656,3,PG,A Fanciful Display of a Car And a Monkey who must Escape a Squirrel in Ancient Japan,PAPI NECKLACE,9.99,2006,,128,0.99
English,885,7,NC-17,A Awe-Inspiring Yarn of a Student And a Teacher who must Fight a Teacher in An Abandoned Amusement Park,TEXAS WATCH,22.99,2006,,179,0.99
English,911,7,PG-13,A Fanciful Character Study of a Lumberjack And a Car who must Discover a Cat in An Abandoned Amusement Park,TRIP NEWTON,14.99,2006,,64,4.99
English,814,6,PG,A Insightful Panorama of a Woman And a Feminist who must Defeat a Forensic Psychologist in Berlin,SNATCH SLIPPER,15.99,2006,,110,4.99
English,958,6,G,A Action-Packed Display of a Mad Cow And a Astronaut who must Kill a Car in Ancient India,WARDROBE PHANTOM,19.99,2006,,178,2.99
English,294,5,PG-13,A Amazing Drama of a Butler And a Husband who must Reach a A Shark in A U-Boat,EXPECATIONS NATURAL,26.99,2006,,138,4.99
English,177,4,R,A Unbelieveable Drama of a Crocodile And a Mad Cow who must Reach a Dentist in A Shark Tank,CONNECTICUT TRAMP,20.99,2006,,172,4.99
English,287,5,R,A Thoughtful Panorama of a Hunter And a Teacher who must Reach a Mad Cow in A U-Boat,ENTRAPMENT SATISFACTION,19.99,2006,,176,0.99
English,414,3,PG,A Taut Reflection of a A Shark And a Dentist who must Battle a Boat in Soviet Georgia,HELLFIGHTERS SIERRA,23.99,2006,,75,2.99
English,815,4,PG-13,A Boring Epistle of a Sumo Wrestler And a Woman who must Escape a Man in The Canadian Rockies,SNATCHERS MONTEZUMA,14.99,2006,,74,2.99
English,533,4,PG-13,A Emotional Character Study of a Robot And a A Shark who must Defeat a Technical Writer in A Manhattan Penthouse,LOST BIRD,21.99,2006,,98,2.99
English,52,6,G,A Thrilling Documentary of a Composer And a Monkey who must Find a Feminist in California,BALLROOM MOCKINGBIRD,29.99,2006,,173,0.99
English,573,6,PG-13,A Touching Character Study of a Boat And a Student who must Sink a A Shark in Nigeria,MICROCOSMOS PARADISE,22.99,2006,,105,2.99
English,262,5,NC-17,A Touching Display of a Feminist And a Dentist who must Conquer a Husband in The Gulf of Mexico,DUMBO LUST,17.99,2006,,119,0.99
English,795,7,R,A Boring Tale of a Frisbee And a Crocodile who must Vanquish a Moose in An Abandoned Mine Shaft,SIEGE MADRE,23.99,2006,,111,0.99
English,673,3,PG-13,A Epic Saga of a Hunter And a Technical Writer who must Conquer a Cat in Ancient Japan,PERSONAL LADYBUGS,19.99,2006,,118,0.99
English,89,7,G,A Brilliant Epistle of a Teacher And a Sumo Wrestler who must Defeat a Man in An Abandoned Fun House,BORROWERS BEDAZZLED,22.99,2006,,63,0.99
English,968,6,G,A Fanciful Story of a Man And a Sumo Wrestler who must Outrace a Student in A Monastery,WEREWOLF LOLA,19.99,2006,,79,4.99
English,586,4,PG,A Thoughtful Panorama of a Man And a Car who must Sink a Composer in Berlin,MOCKINGBIRD HOLLYWOOD,27.99,2006,,60,0.99
English,644,7,PG,A Insightful Tale of a Database Administrator And a Dog who must Face a Madman in Soviet Georgia,OSCAR GOLD,29.99,2006,,115,2.99
English,150,7,PG,A Stunning Character Study of a Composer And a Mad Cow who must Succumb a Cat in Soviet Georgia,CIDER DESIRE,9.99,2006,,101,2.99
English,937,7,NC-17,A Action-Packed Character Study of a Astronaut And a Explorer who must Reach a Monkey in A MySQL Convention,VARSITY TRIP,14.99,2006,,85,2.99
English,152,5,PG-13,A Thoughtful Drama of a Pastry Chef And a Dentist who must Pursue a Girl in A Baloon,CIRCUS YOUTH,13.99,2006,,90,2.99
English,749,6,R,A Beautiful Epistle of a Astronaut And a Student who must Confront a Monkey in An Abandoned Fun House,RULES HUMAN,19.99,2006,,153,4.99
English,626,5,G,A Unbelieveable Character Study of a Mad Scientist And a Astronaut who must Find a Pioneer in A Manhattan Penthouse,NOON PAPI,12.99,2006,,57,2.99
English,897,3,G,A Emotional Display of a Crocodile And a Husband who must Reach a Man in Ancient Japan,TORQUE BOUND,27.99,2006,,179,4.99
English,204,4,PG,A Emotional Epistle of a Moose And a Hunter who must Overcome a Robot in A Manhattan Penthouse,DALMATIONS SWEDEN,25.99,2006,,106,0.99
English,387,7,G,A Boring Display of a Sumo Wrestler And a Husband who must Build a Waitress in The Gulf of Mexico,GUN BONNIE,27.99,2006,,100,0.99
English,183,4,R,A Taut Character Study of a Husband And a Waitress who must Sink a Squirrel in A MySQL Convention,CONVERSATION DOWNHILL,14.99,2006,,112,4.99
English,153,7,G,A Fanciful Character Study of a Technical Writer And a Husband who must Redeem a Robot in The Outback,CITIZEN SHREK,18.99,2006,,165,0.99
English,42,5,NC-17,A Stunning Reflection of a Robot And a Moose who must Challenge a Woman in California,ARTIST COLDBLOODED,10.99,2006,,170,2.99
English,306,3,PG-13,A Thoughtful Yarn of a Monkey And a Teacher who must Find a Dog in Australia,FEATHERS METAL,12.99,2006,,104,0.99
English,740,5,PG-13,A Beautiful Drama of a Robot And a Lumberjack who must Discover a Technical Writer in A Shark Tank,ROLLERCOASTER BRINGING,13.99,2006,,153,2.99
English,985,4,PG,A Awe-Inspiring Character Study of a Waitress And a Car who must Pursue a Mad Scientist in The First Manned Space Station,WONDERLAND CHRISTMAS,19.99,2006,,111,4.99
English,693,5,PG,A Thrilling Epistle of a Frisbee And a Cat who must Fight a Technical Writer in Berlin,POTTER CONNECTICUT,16.99,2006,,115,2.99
English,23,3,R,A Lacklusture Display of a Dentist And a Dentist who must Fight a Girl in Australia,ANACONDA CONFESSIONS,9.99,2006,,92,0.99
English,827,5,NC-17,A Fateful Display of a Pioneer And a Hunter who must Defeat a Husband in An Abandoned Mine Shaft,SPICE SORORITY,22.99,2006,,141,4.99
English,328,7,NC-17,A Unbelieveable Panorama of a Technical Writer And a Man who must Pursue a Frisbee in A U-Boat,FOREVER CANDIDATE,28.99,2006,,131,2.99
English,311,4,PG,A Emotional Yarn of a A Shark And a Student who must Battle a Robot in An Abandoned Mine Shaft,FICTION CHRISTMAS,14.99,2006,,72,0.99
English,751,6,NC-17,A Thoughtful Documentary of a Boat And a Man who must Meet a Boat in An Abandoned Fun House,RUNAWAY TENENBAUMS,17.99,2006,,181,0.99
English,552,5,PG,A Thrilling Character Study of a Moose And a Student who must Escape a Butler in The First Manned Space Station,MAJESTIC FLOATS,15.99,2006,,130,0.99
English,477,5,PG,A Stunning Reflection of a Boat And a Pastry Chef who must Succumb a A Shark in A Jet Boat,JAWBREAKER BROOKLYN,15.99,2006,,118,0.99
English,613,5,NC-17,A Epic Yarn of a Teacher And a Hunter who must Outgun a Explorer in Soviet Georgia,MYSTIC TRUMAN,19.99,2006,,92,0.99
English,871,6,PG,A Taut Documentary of a Car And a Robot who must Conquer a Boy in The Canadian Rockies,SWEDEN SHINING,19.99,2006,,176,4.99
English,457,5,NC-17,A Thrilling Tale of a Technical Writer And a Boy who must Face a Pioneer in A Monastery,INDEPENDENCE HOTEL,21.99,2006,,157,0.99
English,868,5,PG,A Beautiful Saga of a Lumberjack And a Teacher who must Build a Technical Writer in An Abandoned Fun House,SUPERFLY TRIP,27.99,2006,,114,0.99
English,912,3,PG,A Astounding Panorama of a Husband And a Sumo Wrestler who must Pursue a Boat in Ancient India,TROJAN TOMORROW,9.99,2006,,52,2.99
English,163,4,PG-13,A Beautiful Yarn of a Astronaut And a Frisbee who must Overcome a Explorer in A Jet Boat,CLYDE THEORY,29.99,2006,,139,0.99
English,200,7,PG-13,A Boring Reflection of a Dentist And a Mad Cow who must Chase a Secret Agent in A Shark Tank,CURTAIN VIDEOTAPE,27.99,2006,,133,0.99
English,829,7,PG-13,A Lacklusture Epistle of a Sumo Wrestler And a Squirrel who must Defeat a Explorer in California,SPINAL ROCKY,12.99,2006,,138,2.99
English,319,4,R,A Touching Display of a Feminist And a Girl who must Confront a Astronaut in Australia,FISH OPUS,22.99,2006,,125,2.99
English,15,5,NC-17,A Brilliant Drama of a Cat And a Mad Scientist who must Battle a Feminist in A MySQL Convention,ALIEN CENTER,10.99,2006,,46,2.99
English,989,4,R,A Stunning Epistle of a Dentist And a Dog who must Kill a Madman in Ancient China,WORKING MICROCOSMOS,22.99,2006,,74,4.99
English,707,5,R,A Fateful Drama of a Husband And a Sumo Wrestler who must Battle a Pastry Chef in A Baloon Factory,QUEST MUSSOLINI,29.99,2006,,177,2.99
English,237,3,G,A Unbelieveable Saga of a Crocodile And a Student who must Discover a Cat in Ancient India,DIVORCE SHINING,21.99,2006,,47,2.99
English,173,7,PG-13,A Insightful Story of a Car And a Boy who must Battle a Technical Writer in A Baloon,CONFESSIONS MAGUIRE,25.99,2006,,65,4.99
English,421,7,PG-13,A Insightful Reflection of a Waitress And a Madman who must Pursue a Boy in Ancient Japan,HOLIDAY GAMES,10.99,2006,,78,4.99
English,762,6,G,A Fast-Paced Documentary of a Dog And a Teacher who must Find a Moose in A Manhattan Penthouse,SASSY PACKER,29.99,2006,,154,0.99
English,422,7,NC-17,A Beautiful Character Study of a Robot And a Astronaut who must Overcome a Boat in A Monastery,HOLLOW JEOPARDY,25.99,2006,,136,4.99
English,146,6,G,A Boring Epistle of a Boat And a Database Administrator who must Kill a Sumo Wrestler in The First Manned Space Station,CHITTY LOCK,24.99,2006,,107,2.99
English,301,4,R,A Epic Documentary of a Teacher And a Boy who must Escape a Woman in Berlin,FAMILY SWEET,24.99,2006,,155,0.99
English,189,3,NC-17,A Emotional Drama of a Womanizer And a Squirrel who must Vanquish a Crocodile in Ancient India,CREATURES SHAKESPEARE,23.99,2006,,139,0.99
English,243,3,NC-17,A Awe-Inspiring Display of a Squirrel And a Woman who must Overcome a Boy in The Gulf of Mexico,DOORS PRESIDENT,22.99,2006,,49,4.99
English,81,6,PG-13,A Touching Drama of a Robot And a Dentist who must Meet a Hunter in A Jet Boat,BLINDNESS GUN,29.99,2006,,103,4.99
English,851,3,R,A Boring Panorama of a Secret Agent And a Girl who must Sink a Waitress in The Outback,STRAIGHT HOURS,19.99,2006,,151,0.99
English,517,3,NC-17,A Emotional Display of a Man And a Explorer who must Build a Boy in A Manhattan Penthouse,LESSON CLEOPATRA,28.99,2006,,167,0.99
English,88,7,PG,A Touching Epistle of a Frisbee And a Husband who must Pursue a Student in Nigeria,BORN SPINAL,17.99,2006,,179,4.99
English,241,4,NC-17,A Awe-Inspiring Tale of a Butler And a Frisbee who must Vanquish a Teacher in Ancient Japan,DONNIE ALLEY,20.99,2006,,125,0.99
English,620,5,NC-17,A Lacklusture Reflection of a Monkey And a Squirrel who must Outrace a Womanizer in A Manhattan Penthouse,NEMO CAMPUS,23.99,2006,,131,2.99
English,11,6,G,A Boring Epistle of a Butler And a Cat who must Fight a Pastry Chef in A MySQL Convention,ALAMO VIDEOTAPE,16.99,2006,,126,0.99
English,348,7,PG-13,A Thoughtful Display of a Mad Scientist And a Secret Agent who must Chase a Boat in Berlin,GANDHI KWAI,9.99,2006,,86,0.99
English,114,3,NC-17,A Touching Character Study of a Woman And a Waitress who must Battle a Pastry Chef in A MySQL Convention,CAMELOT VACATION,26.99,2006,,61,0.99
English,170,5,PG-13,A Awe-Inspiring Tale of a Forensic Psychologist And a Woman who must Challenge a Database Administrator in Ancient Japan,COMMAND DARLING,28.99,2006,,120,4.99
English,859,3,PG,A Touching Story of a Dentist And a Database Administrator who must Conquer a Astronaut in An Abandoned Amusement Park,SUGAR WONKA,20.99,2006,,114,4.99
English,905,7,PG-13,A Fast-Paced Drama of a Pioneer And a Mad Cow who must Challenge a Madman in Ancient Japan,TRAINSPOTTING STRANGERS,10.99,2006,,132,4.99
English,485,6,PG,A Lacklusture Documentary of a Madman And a Mad Cow who must Find a Feminist in Ancient Japan,JERSEY SASSY,16.99,2006,,60,4.99
English,699,7,PG,A Stunning Story of a Technical Writer And a Hunter who must Succumb a Secret Agent in A Baloon,PRIVATE DROP,26.99,2006,,106,4.99
English,67,5,PG-13,A Taut Saga of a Crocodile And a Boy who must Overcome a Technical Writer in Ancient China,BERETS AGENT,24.99,2006,,77,2.99
English,652,3,R,A Emotional Drama of a Boy And a Technical Writer who must Redeem a Sumo Wrestler in California,PAJAMA JAWBREAKER,14.99,2006,,126,0.99
English,962,7,PG,A Fanciful Story of a Database Administrator And a Womanizer who must Fight a Database Administrator in Ancient China,WASTELAND DIVINE,18.99,2006,,85,2.99
English,842,4,NC-17,A Beautiful Display of a Cat And a Pastry Chef who must Outrace a Mad Cow in A Jet Boat,STATE WASTELAND,13.99,2006,,113,2.99
English,853,3,G,A Awe-Inspiring Yarn of a Womanizer And a Explorer who must Fight a Woman in The First Manned Space Station,STRANGER STRANGERS,12.99,2006,,139,4.99
English,848,3,G,A Intrepid Drama of a Astronaut And a Crocodile who must Find a Boat in Soviet Georgia,STONE FIRE,19.99,2006,,94,0.99
English,667,3,PG-13,A Action-Packed Drama of a Monkey And a Dentist who must Chase a Butler in Berlin,PEACH INNOCENT,20.99,2006,,160,2.99
English,618,3,PG,A Astounding Epistle of a Database Administrator And a Mad Scientist who must Pursue a Cat in California,NECKLACE OUTBREAK,21.99,2006,,132,0.99
English,196,7,G,A Brilliant Tale of a Car And a Moose who must Battle a Dentist in Nigeria,CRUELTY UNFORGIVEN,29.99,2006,,69,0.99
English,587,6,NC-17,A Boring Documentary of a Mad Cow And a Cat who must Build a Lumberjack in New Orleans,MOD SECRETARY,20.99,2006,,77,4.99
English,767,6,NC-17,A Fateful Reflection of a Car And a Teacher who must Confront a Waitress in A Monastery,SCALAWAG DUCK,13.99,2006,,183,4.99
English,812,7,PG-13,A Lacklusture Saga of a Mad Cow And a Mad Scientist who must Sink a Cat in A MySQL Convention,SMOKING BARBARELLA,13.99,2006,,50,0.99
English,490,4,G,A Intrepid Yarn of a Husband And a Womanizer who must Pursue a Mad Scientist in New Orleans,JUMANJI BLADE,13.99,2006,,121,2.99
English,168,5,R,A Boring Saga of a Lumberjack And a Monkey who must Find a Monkey in The Gulf of Mexico,COMANCHEROS ENEMY,23.99,2006,,67,0.99
English,915,7,G,A Thrilling Epistle of a Moose And a Boy who must Meet a Database Administrator in A Monastery,TRUMAN CRAZY,9.99,2006,,92,4.99
English,140,6,G,A Emotional Character Study of a Pioneer And a Girl who must Discover a Dog in Ancient Japan,CHEAPER CLYDE,23.99,2006,,87,0.99
English,554,6,G,A Intrepid Reflection of a Waitress And a A Shark who must Kill a Squirrel in The Outback,MALKOVICH PET,22.99,2006,,159,2.99
English,119,6,G,A Fateful Saga of a Moose And a Car who must Pursue a Woman in A MySQL Convention,CAPER MOTIONS,22.99,2006,,176,0.99
English,765,7,R,A Fateful Epistle of a Butler And a Boy who must Redeem a Teacher in Berlin,SATURN NAME,18.99,2006,,182,4.99
English,914,6,PG,A Lacklusture Panorama of a Forensic Psychologist And a Woman who must Kill a Explorer in Ancient Japan,TROUBLE DATE,13.99,2006,,61,2.99
English,338,6,PG,A Beautiful Documentary of a Woman And a Pioneer who must Pursue a Mad Scientist in A Shark Tank,FRISCO FORREST,23.99,2006,,51,4.99
English,642,7,PG-13,A Amazing Saga of a Dog And a A Shark who must Challenge a Cat in The Sahara Desert,ORDER BETRAYED,13.99,2006,,120,2.99
English,68,5,NC-17,A Emotional Character Study of a Boat And a Pioneer who must Find a Explorer in A Shark Tank,BETRAYED REAR,26.99,2006,,122,4.99
English,729,5,PG,A Taut Reflection of a Monkey And a Womanizer who must Chase a Moose in Nigeria,RIDER CADDYSHACK,28.99,2006,,177,2.99
English,316,5,R,A Intrepid Documentary of a Frisbee And a Dog who must Outrace a Lumberjack in Nigeria,FIRE WOLVES,18.99,2006,,173,4.99
English,519,3,G,A Boring Drama of a Student And a Cat who must Sink a Technical Writer in A Baloon,LIBERTY MAGNIFICENT,27.99,2006,,138,2.99
English,495,5,PG,A Stunning Yarn of a Woman And a Frisbee who must Escape a Waitress in A U-Boat,KENTUCKIAN GIANT,10.99,2006,,169,2.99
English,756,7,PG-13,A Stunning Epistle of a Feminist And a A Shark who must Battle a Woman in An Abandoned Fun House,SADDLE ANTITRUST,10.99,2006,,80,2.99
English,432,4,NC-17,A Amazing Documentary of a Student And a Sumo Wrestler who must Outgun a A Shark in A Shark Tank,HOPE TOOTSIE,22.99,2006,,139,2.99
English,549,4,PG-13,A Thoughtful Documentary of a Composer And a Explorer who must Conquer a Dentist in New Orleans,MAGNOLIA FORRESTER,28.99,2006,,171,0.99
English,856,5,R,A Insightful Character Study of a Waitress And a Crocodile who must Sink a Waitress in The Gulf of Mexico,STREETCAR INTENTIONS,11.99,2006,,73,4.99
English,960,5,G,A Taut Reflection of a Teacher And a Database Administrator who must Chase a Madman in The Sahara Desert,WARS PLUTO,15.99,2006,,128,2.99
English,775,4,PG-13,A Insightful Reflection of a Crocodile And a Sumo Wrestler who must Meet a Technical Writer in The Sahara Desert,SEATTLE EXPECATIONS,18.99,2006,,110,4.99
English,850,7,R,A Lacklusture Saga of a Boy And a Cat who must Sink a Dentist in An Abandoned Mine Shaft,STORY SIDE,27.99,2006,,163,0.99
English,278,4,NC-17,A Action-Packed Story of a Frisbee And a Woman who must Reach a Girl in An Abandoned Mine Shaft,ELF MURDER,19.99,2006,,155,4.99
English,315,4,R,A Fateful Tale of a Database Administrator And a Girl who must Battle a Squirrel in New Orleans,FINDING ANACONDA,10.99,2006,,156,0.99
English,890,5,R,A Thrilling Epistle of a Boat And a Secret Agent who must Face a Boy in A Baloon,TIGHTS DAWN,14.99,2006,,172,0.99
English,612,6,G,A Thrilling Display of a Boat And a Monkey who must Meet a Composer in Ancient China,MUSSOLINI SPOILERS,10.99,2006,,180,2.99
English,324,3,PG-13,A Fateful Story of a Husband And a Moose who must Vanquish a Boy in California,FLINTSTONES HAPPINESS,11.99,2006,,148,4.99
English,715,3,PG,A Insightful Documentary of a Hunter And a Dentist who must Confront a Crocodile in A Baloon,RANGE MOONWALKER,25.99,2006,,147,4.99
English,249,7,G,A Thrilling Reflection of a Feminist And a Cat who must Find a Frisbee in An Abandoned Fun House,DRACULA CRYSTAL,26.99,2006,,176,0.99
English,855,7,PG-13,A Astounding Character Study of a Hunter And a Waitress who must Sink a Man in New Orleans,STREAK RIDGEMONT,28.99,2006,,132,0.99
English,248,6,NC-17,A Taut Drama of a Cat And a Girl who must Defeat a Frisbee in The Canadian Rockies,DOZEN LION,20.99,2006,,177,4.99
English,464,3,PG-13,A Astounding Epistle of a Cat And a Cat who must Conquer a Mad Cow in A U-Boat,INTENTIONS EMPIRE,13.99,2006,,107,2.99
English,745,5,PG-13,A Astounding Panorama of a Monkey And a Secret Agent who must Defeat a Woman in The First Manned Space Station,ROSES TREASURE,23.99,2006,,162,4.99
English,822,6,R,A Fast-Paced Display of a Robot And a Butler who must Defeat a Butler in A MySQL Convention,SOUP WISDOM,12.99,2006,,169,0.99
English,118,7,R,A Thoughtful Reflection of a Waitress And a Feminist who must Escape a Squirrel in A Manhattan Penthouse,CANYON STOCK,26.99,2006,,85,0.99
English,447,5,R,A Fast-Paced Tale of a Butler And a Moose who must Overcome a Pioneer in A Manhattan Penthouse,ICE CROSSING,28.99,2006,,131,2.99
English,627,4,NC-17,A Beautiful Character Study of a Mad Cow And a Robot who must Reach a Womanizer in New Orleans,NORTH TEQUILA,9.99,2006,,67,4.99
English,363,3,R,A Fast-Paced Display of a Car And a Database Administrator who must Battle a Woman in A Baloon,GO PURPLE,12.99,2006,,54,0.99
English,362,7,PG-13,A Amazing Saga of a Woman And a Womanizer who must Discover a Cat in The First Manned Space Station,GLORY TRACY,13.99,2006,,115,2.99
English,876,3,PG-13,A Fast-Paced Display of a Lumberjack And a Mad Scientist who must Succumb a Sumo Wrestler in The Sahara Desert,TARZAN VIDEOTAPE,11.99,2006,,91,2.99
English,219,6,PG-13,A Amazing Tale of a Crocodile And a Squirrel who must Discover a Composer in Australia,DEEP CRUSADE,20.99,2006,,51,4.99
English,625,3,NC-17,A Boring Reflection of a Secret Agent And a Astronaut who must Face a Composer in A Manhattan Penthouse,NONE SPIKING,18.99,2006,,83,0.99
English,546,7,PG-13,A Intrepid Panorama of a Sumo Wrestler And a Forensic Psychologist who must Discover a Moose in The First Manned Space Station,MADRE GABLES,27.99,2006,,98,2.99
English,902,6,PG,A Emotional Character Study of a Student And a Explorer who must Discover a Frisbee in The First Manned Space Station,TRADING PINOCCHIO,22.99,2006,,170,4.99
English,898,4,PG-13,A Boring Story of a Butler And a Astronaut who must Outrace a Pioneer in Australia,TOURIST PELICAN,18.99,2006,,152,4.99
English,567,3,G,A Boring Documentary of a Dentist And a Butler who must Confront a Monkey in A MySQL Convention,MEET CHOCOLATE,26.99,2006,,80,2.99
English,891,3,G,A Boring Display of a Man And a Dog who must Redeem a Girl in A U-Boat,TIMBERLAND SKY,13.99,2006,,69,0.99
English,209,6,NC-17,A Touching Documentary of a Husband And a Hunter who must Escape a Boy in The Sahara Desert,DARKNESS WAR,24.99,2006,,99,2.99
English,538,7,PG-13,A Boring Story of a Car And a Butler who must Build a Girl in Soviet Georgia,LOVERBOY ATTACKS,19.99,2006,,162,0.99
English,331,6,NC-17,A Astounding Display of a Forensic Psychologist And a Mad Scientist who must Challenge a Girl in New Orleans,FORWARD TEMPLE,25.99,2006,,90,2.99
English,366,3,G,A Insightful Drama of a Mad Scientist And a Hunter who must Defeat a Pastry Chef in New Orleans,GOLDFINGER SENSIBILITY,29.99,2006,,93,0.99
English,547,3,PG,A Touching Documentary of a Pastry Chef And a Pastry Chef who must Build a Mad Scientist in California,MAGIC MALLRATS,19.99,2006,,117,0.99
English,201,7,PG,A Lacklusture Drama of a Student And a Monkey who must Sink a Womanizer in A MySQL Convention,CYCLONE FAMILY,18.99,2006,,176,2.99
English,880,6,PG-13,A Action-Packed Panorama of a Technical Writer And a Man who must Build a Forensic Psychologist in A Manhattan Penthouse,TELEMARK HEARTBREAKERS,9.99,2006,,152,2.99
English,343,6,PG,A Beautiful Documentary of a Astronaut And a Moose who must Pursue a Monkey in A Shark Tank,FULL FLATLINERS,14.99,2006,,94,2.99
English,954,7,G,A Beautiful Saga of a Feminist And a Composer who must Challenge a Moose in Berlin,WAKE JAWS,18.99,2006,,73,4.99
English,712,4,PG-13,A Amazing Drama of a Teacher And a Feminist who must Meet a Woman in The First Manned Space Station,RAIDERS ANTITRUST,11.99,2006,,82,0.99
English,804,7,PG-13,A Stunning Reflection of a Sumo Wrestler And a Explorer who must Sink a Frisbee in A MySQL Convention,SLEEPING SUSPECTS,13.99,2006,,129,4.99
English,578,4,PG-13,A Brilliant Documentary of a Womanizer And a Squirrel who must Find a Technical Writer in The Sahara Desert,MILLION ACE,16.99,2006,,142,4.99
English,171,6,R,A Fanciful Saga of a Student And a Mad Scientist who must Battle a Hunter in An Abandoned Mine Shaft,COMMANDMENTS EXPRESS,13.99,2006,,59,4.99
English,835,6,PG-13,A Thrilling Documentary of a Feminist And a Feminist who must Confront a Feminist in A Baloon,SPY MILE,13.99,2006,,112,2.99
English,330,7,NC-17,A Fateful Tale of a Squirrel And a Forensic Psychologist who must Redeem a Man in Nigeria,FORRESTER COMANCHEROS,22.99,2006,,112,4.99
English,658,7,PG-13,A Intrepid Story of a Squirrel And a Crocodile who must Defeat a Monkey in The Outback,PARIS WEEKEND,19.99,2006,,121,2.99
English,708,4,R,A Thoughtful Story of a Pioneer And a Woman who must Reach a Moose in Australia,QUILLS BULL,19.99,2006,,112,4.99
English,174,6,NC-17,A Stunning Reflection of a Cat And a Woman who must Find a Astronaut in Ancient Japan,CONFIDENTIAL INTERVIEW,13.99,2006,,180,4.99
English,151,5,NC-17,A Brilliant Saga of a Pastry Chef And a Hunter who must Confront a Butler in Berlin,CINCINATTI WHISPERER,26.99,2006,,143,4.99
English,339,5,R,A Unbelieveable Yarn of a Mad Scientist And a Cat who must Chase a Lumberjack in Australia,FROGMEN BREAKING,17.99,2006,,111,0.99
English,199,4,R,A Emotional Reflection of a Frisbee And a Boat who must Reach a Pastry Chef in An Abandoned Amusement Park,CUPBOARD SINNERS,29.99,2006,,56,2.99
English,635,7,PG,A Thoughtful Drama of a Dentist And a Womanizer who must Meet a Husband in The Sahara Desert,OKLAHOMA JUMANJI,15.99,2006,,58,0.99
English,115,5,R,A Astounding Drama of a Crocodile And a Mad Cow who must Build a Robot in A Jet Boat,CAMPUS REMEMBER,27.99,2006,,167,2.99
English,164,4,PG,A Astounding Documentary of a Mad Cow And a Pioneer who must Challenge a Butler in The Sahara Desert,COAST RAINBOW,20.99,2006,,55,0.99
English,439,4,PG-13,A Touching Yarn of a Frisbee And a Dentist who must Fight a Composer in Ancient Japan,HUNCHBACK IMPOSSIBLE,28.99,2006,,151,4.99
English,304,3,G,A Thrilling Reflection of a Pastry Chef And a Crocodile who must Reach a Teacher in The Outback,FARGO GANDHI,28.99,2006,,130,2.99
English,349,4,PG-13,A Taut Character Study of a Woman And a A Shark who must Confront a Frisbee in Berlin,GANGS PRIDE,27.99,2006,,185,2.99
English,48,3,PG-13,A Stunning Character Study of a Mad Scientist And a Mad Cow who must Kill a Car in A Monastery,BACKLASH UNDEFEATED,24.99,2006,,118,4.99
English,28,5,PG-13,A Touching Panorama of a Waitress And a Woman who must Outrace a Dog in An Abandoned Amusement Park,ANTHEM LUKE,16.99,2006,,91,4.99
English,84,7,PG,A Awe-Inspiring Story of a Waitress And a Dog who must Discover a Dentist in Ancient Japan,BOILED DARES,13.99,2006,,102,4.99
English,486,7,R,A Amazing Display of a Lumberjack And a Teacher who must Outrace a Woman in A U-Boat,JET NEIGHBORS,14.99,2006,,59,4.99
English,609,7,G,A Stunning Panorama of a Sumo Wrestler And a Husband who must Redeem a Madman in Ancient India,MUSCLE BRIGHT,23.99,2006,,185,2.99
English,542,3,G,A Fanciful Panorama of a Hunter And a Dentist who must Meet a Secret Agent in The Sahara Desert,LUST LOCK,28.99,2006,,52,2.99
English,843,4,NC-17,A Fast-Paced Yarn of a Composer And a Frisbee who must Face a Moose in Nigeria,STEEL SANTA,15.99,2006,,143,4.99
English,509,5,NC-17,A Epic Yarn of a Cat And a Madman who must Vanquish a Dentist in An Abandoned Amusement Park,LANGUAGE COWBOY,26.99,2006,,78,0.99
English,540,7,PG-13,A Lacklusture Character Study of a A Shark And a Man who must Find a Forensic Psychologist in A U-Boat,LUCKY FLYING,10.99,2006,,97,2.99
English,534,5,PG-13,A Lacklusture Drama of a Girl And a Technical Writer who must Redeem a Monkey in A Shark Tank,LOUISIANA HARRY,18.99,2006,,70,0.99
