lingua,film_id,durata_noleggio,voto,descrizione,titolo,costo_sostituzione,data_rilascio,lingua_originale_id,durata,tariffa_noleggio
English,755,5,PG,A Emotional Story of a Squirrel And a Crocodile who must Succumb a Husband in The Sahara Desert,SABRINA MIDNIGHT,11.99,2006,,99,4.99
English,502,4,PG-13,A Unbelieveable Story of a Teacher And a Boat who must Confront a Moose in A Baloon,KNOCK WARLOCK,21.99,2006,,71,2.99
English,723,3,PG-13,A Emotional Yarn of a Composer And a Man who must Escape a Butler in The Gulf of Mexico,REIGN GENTLEMEN,29.99,2006,,82,2.99
English,318,7,G,A Awe-Inspiring Character Study of a Boat And a Boy who must Kill a Pastry Chef in The Sahara Desert,FIREHOUSE VIETNAM,14.99,2006,,103,0.99
English,892,3,R,A Brilliant Reflection of a Feminist And a Dog who must Fight a Boy in A Baloon Factory,TITANIC BOONDOCK,18.99,2006,,104,4.99
English,158,6,R,A Amazing Drama of a Car And a Robot who must Pursue a Dentist in New Orleans,CLONES PINOCCHIO,16.99,2006,,124,2.99
English,125,5,NC-17,A Intrepid Drama of a Frisbee And a Hunter who must Kill a Secret Agent in New Orleans,CASSIDY WYOMING,19.99,2006,,61,2.99
English,197,4,R,A Fast-Paced Reflection of a Explorer And a Butler who must Battle a Madman in An Abandoned Amusement Park,CRUSADE HONEY,27.99,2006,,112,2.99
English,731,7,PG-13,A Fateful Character Study of a Boat And a Cat who must Find a Database Administrator in A Jet Boat,RIGHT CRANES,29.99,2006,,153,4.99
English,61,5,G,A Fast-Paced Display of a Composer And a Moose who must Sink a Robot in An Abandoned Mine Shaft,BEAUTY GREASE,28.99,2006,,175,4.99
English,22,6,G,A Emotional Character Study of a Dentist And a Crocodile who must Meet a Sumo Wrestler in California,AMISTAD MIDSUMMER,10.99,2006,,85,2.99
English,392,5,NC-17,A Beautiful Panorama of a Pastry Chef And a A Shark who must Battle a Pioneer in Soviet Georgia,HALL CASSIDY,13.99,2006,,51,4.99
English,858,5,R,A Amazing Display of a Car And a Monkey who must Fight a Teacher in Soviet Georgia,SUBMARINE BED,21.99,2006,,127,4.99
English,676,7,PG-13,A Taut Yarn of a Hunter And a Astronaut who must Conquer a Database Administrator in The Sahara Desert,PHILADELPHIA WIFE,16.99,2006,,137,4.99
English,541,5,NC-17,A Taut Character Study of a Boy And a Robot who must Redeem a Mad Scientist in Ancient India,LUKE MUMMY,21.99,2006,,74,2.99
English,654,4,G,A Touching Documentary of a Dentist And a Sumo Wrestler who must Overcome a Boy in The Gulf of Mexico,PANKY SUBMARINE,19.99,2006,,93,4.99
English,595,7,PG,A Beautiful Tale of a Astronaut And a Mad Cow who must Challenge a Cat in A Baloon Factory,MOON BUNCH,20.99,2006,,83,0.99
English,904,3,R,A Thrilling Character Study of a Robot And a Squirrel who must Face a Dog in Ancient India,TRAIN BUNCH,26.99,2006,,71,4.99
English,417,5,G,A Epic Display of a Hunter And a Feminist who must Sink a Car in A U-Boat,HILLS NEIGHBORS,29.99,2006,,93,0.99
English,983,7,PG,A Unbelieveable Documentary of a Teacher And a Monkey who must Defeat a Explorer in A U-Boat,WON DARES,18.99,2006,,105,2.99
English,661,5,PG-13,A Intrepid Tale of a Madman And a Astronaut who must Challenge a Hunter in A Monastery,PAST SUICIDES,17.99,2006,,157,4.99
English,811,4,G,A Intrepid Drama of a Teacher And a Butler who must Build a Pastry Chef in Berlin,SMILE EARRING,29.99,2006,,60,2.99
English,394,7,R,A Touching Reflection of a Man And a Man who must Sink a Robot in The Outback,HAMLET WISDOM,21.99,2006,,146,2.99
English,35,4,PG-13,A Action-Packed Reflection of a Pastry Chef And a Composer who must Discover a Mad Scientist in The First Manned Space Station,ARACHNOPHOBIA ROLLERCOASTER,24.99,2006,,147,2.99
English,409,3,G,A Awe-Inspiring Documentary of a A Shark And a Dentist who must Outrace a Pastry Chef in The Canadian Rockies,HEARTBREAKERS BRIGHT,9.99,2006,,59,4.99
English,650,3,G,A Thrilling Yarn of a Dog And a Moose who must Kill a Pastry Chef in A Manhattan Penthouse,PACIFIC AMISTAD,27.99,2006,,144,0.99
English,277,4,PG-13,A Beautiful Panorama of a Lumberjack And a Forensic Psychologist who must Overcome a Frisbee in A Baloon,ELEPHANT TROJAN,24.99,2006,,126,4.99
English,866,6,NC-17,A Awe-Inspiring Reflection of a Astronaut And a A Shark who must Defeat a Forensic Psychologist in California,SUNSET RACER,28.99,2006,,48,0.99
English,953,3,PG-13,A Intrepid Epistle of a Woman And a Forensic Psychologist who must Succumb a Astronaut in A Manhattan Penthouse,WAIT CIDER,9.99,2006,,112,0.99
English,679,6,PG,A Awe-Inspiring Reflection of a Crocodile And a Sumo Wrestler who must Meet a Forensic Psychologist in An Abandoned Mine Shaft,PILOT HOOSIERS,17.99,2006,,50,2.99
English,863,5,R,A Beautiful Display of a Mad Cow And a Dog who must Redeem a Waitress in An Abandoned Amusement Park,SUN CONFESSIONS,9.99,2006,,141,0.99
English,211,7,PG-13,A Brilliant Documentary of a Astronaut And a Squirrel who must Succumb a Student in The Gulf of Mexico,DARLING BREAKING,20.99,2006,,165,4.99
English,266,4,PG-13,A Intrepid Documentary of a Forensic Psychologist And a Mad Scientist who must Face a Explorer in A U-Boat,DYNAMITE TARZAN,27.99,2006,,141,0.99
English,796,3,NC-17,A Emotional Character Study of a Frisbee And a Mad Scientist who must Build a Madman in California,SIERRA DIVIDE,12.99,2006,,135,0.99
English,646,6,NC-17,A Unbelieveable Yarn of a Database Administrator And a Woman who must Succumb a A Shark in A U-Boat,OUTBREAK DIVINE,12.99,2006,,169,0.99
English,589,3,PG,A Awe-Inspiring Story of a Butler And a Sumo Wrestler who must Redeem a Boy in New Orleans,MODERN DORADO,20.99,2006,,74,0.99
English,986,6,NC-17,A Brilliant Saga of a Boat And a Mad Scientist who must Meet a Moose in Ancient India,WONKA SEA,24.99,2006,,85,2.99
English,917,3,R,A Boring Drama of a Man And a Forensic Psychologist who must Face a Frisbee in Ancient India,TUXEDO MILE,24.99,2006,,152,2.99
English,128,7,G,A Boring Reflection of a Lumberjack And a Feminist who must Discover a Woman in Nigeria,CATCH AMISTAD,10.99,2006,,183,0.99
English,987,3,PG,A Action-Packed Reflection of a Composer And a Mad Scientist who must Face a Pioneer in A MySQL Convention,WORDS HUNTER,13.99,2006,,116,2.99
English,997,4,NC-17,A Touching Drama of a Teacher And a Cat who must Challenge a Technical Writer in A U-Boat,YOUTH KICK,14.99,2006,,179,0.99
English,431,3,G,A Astounding Display of a Explorer And a Boat who must Vanquish a Car in The First Manned Space Station,HOOSIERS BIRDCAGE,12.99,2006,,176,2.99
English,225,3,PG-13,A Beautiful Yarn of a Teacher And a Cat who must Build a Car in A U-Boat,DESTINATION JERK,19.99,2006,,76,0.99
English,325,6,PG-13,A Action-Packed Epistle of a Robot And a Car who must Chase a Boat in Ancient Japan,FLOATS GARDEN,29.99,2006,,145,2.99
English,733,4,PG-13,A Thrilling Character Study of a Squirrel And a Lumberjack who must Face a Hunter in A MySQL Convention,RIVER OUTLAW,29.99,2006,,149,0.99
English,469,7,PG,A Fast-Paced Documentary of a Mad Cow And a Boy who must Pursue a Dentist in A Baloon,IRON MOON,27.99,2006,,46,4.99
English,494,4,PG-13,A Astounding Yarn of a Womanizer And a Dog who must Reach a Waitress in A MySQL Convention,KARATE MOON,21.99,2006,,120,0.99
English,945,5,R,A Emotional Panorama of a Dentist And a Crocodile who must Meet a Boy in Berlin,VIRGINIAN PLUTO,22.99,2006,,164,0.99
English,830,7,R,A Brilliant Yarn of a Cat And a Car who must Confront a Explorer in Ancient Japan,SPIRIT FLINTSTONES,23.99,2006,,149,0.99
English,969,4,G,A Intrepid Drama of a Butler And a Lumberjack who must Challenge a Database Administrator in A Manhattan Penthouse,WEST LION,29.99,2006,,159,4.99
English,782,6,PG-13,A Fast-Paced Panorama of a Lumberjack And a Database Administrator who must Defeat a Madman in A MySQL Convention,SHAKESPEARE SADDLE,26.99,2006,,60,2.99
English,377,7,G,A Emotional Panorama of a Secret Agent And a Waitress who must Escape a Composer in Soviet Georgia,GREASE YOUTH,20.99,2006,,135,0.99
English,222,4,R,A Brilliant Documentary of a Butler And a Frisbee who must Build a Astronaut in New Orleans,DESERT POSEIDON,27.99,2006,,64,4.99
English,195,3,R,A Intrepid Documentary of a Astronaut And a Forensic Psychologist who must Find a Frisbee in An Abandoned Fun House,CROWDS TELEMARK,16.99,2006,,112,4.99
English,803,7,R,A Fast-Paced Tale of a A Shark And a Student who must Meet a Crocodile in Ancient China,SLACKER LIAISONS,29.99,2006,,179,4.99
English,292,3,G,A Brilliant Documentary of a Monkey And a Car who must Conquer a Crocodile in A Shark Tank,EXCITEMENT EVE,20.99,2006,,51,0.99
English,536,3,PG,A Fanciful Yarn of a Crocodile And a Forensic Psychologist who must Discover a Crocodile in The Outback,LOVELY JINGLE,18.99,2006,,65,2.99
English,215,4,PG,A Thoughtful Documentary of a Dentist And a Forensic Psychologist who must Defeat a Waitress in Berlin,DAWN POND,27.99,2006,,57,4.99
English,445,5,G,A Fanciful Documentary of a Boy And a Woman who must Redeem a Womanizer in A Jet Boat,HYDE DOCTOR,11.99,2006,,100,2.99
English,13,4,PG,A Action-Packed Drama of a Dentist And a Crocodile who must Battle a Feminist in The Canadian Rockies,ALI FOREVER,21.99,2006,,150,4.99
English,561,6,NC-17,A Boring Character Study of a Student And a Robot who must Meet a Woman in California,MASK PEACH,26.99,2006,,123,2.99
English,12,6,PG,A Fanciful Saga of a Hunter And a Pastry Chef who must Vanquish a Boy in Australia,ALASKA PHANTOM,22.99,2006,,136,0.99
English,588,4,NC-17,A Beautiful Panorama of a Boat And a Crocodile who must Outrace a Dog in Australia,MODEL FISH,11.99,2006,,175,4.99
English,580,3,PG-13,A Amazing Yarn of a Robot And a Womanizer who must Discover a Forensic Psychologist in Berlin,MINE TITANS,12.99,2006,,166,4.99
English,244,5,NC-17,A Action-Packed Tale of a Sumo Wrestler And a A Shark who must Meet a Frisbee in California,DORADO NOTTING,26.99,2006,,139,4.99
English,797,7,R,A Emotional Drama of a Sumo Wrestler And a Dentist who must Confront a Sumo Wrestler in A Baloon,SILENCE KANE,23.99,2006,,67,0.99
English,102,4,R,A Awe-Inspiring Panorama of a Crocodile And a Moose who must Confront a Girl in A Baloon,BUBBLE GROSSE,20.99,2006,,60,4.99
English,507,4,NC-17,A Fateful Reflection of a Dog And a Mad Scientist who must Meet a Mad Scientist in New Orleans,LADYBUGS ARMAGEDDON,13.99,2006,,113,0.99
English,847,7,PG,A Boring Epistle of a Crocodile And a Lumberjack who must Outgun a Moose in Ancient China,STOCK GLASS,10.99,2006,,160,2.99
English,212,7,G,A Fateful Story of a A Shark And a Explorer who must Succumb a Technical Writer in A Jet Boat,DARN FORRESTER,14.99,2006,,185,4.99
English,105,6,NC-17,A Fanciful Drama of a Moose And a Squirrel who must Conquer a Pioneer in The Canadian Rockies,BULL SHAWSHANK,21.99,2006,,125,0.99
English,831,5,PG-13,A Taut Story of a Waitress And a Man who must Face a Car in A Baloon Factory,SPIRITED CASUALTIES,20.99,2006,,138,0.99
English,78,7,PG,A Intrepid Yarn of a Pastry Chef And a Mad Scientist who must Challenge a Secret Agent in Ancient Japan,BLACKOUT PRIVATE,12.99,2006,,85,2.99
English,670,4,PG,A Epic Documentary of a Boy And a Monkey who must Pursue a Astronaut in Berlin,PELICAN COMFORTS,17.99,2006,,48,4.99
English,925,3,R,A Fast-Paced Reflection of a Cat And a Mad Cow who must Fight a Car in The Sahara Desert,UNITED PILOT,27.99,2006,,164,0.99
English,265,5,PG,A Intrepid Tale of a Boat And a Monkey who must Kill a Cat in California,DYING MAKER,28.99,2006,,168,4.99
English,182,7,G,A Fateful Documentary of a Robot And a Student who must Battle a Cat in A Monastery,CONTROL ANTHEM,9.99,2006,,185,4.99
English,323,7,R,A Stunning Character Study of a Crocodile And a Pioneer who must Pursue a Teacher in New Orleans,FLIGHT LIES,22.99,2006,,179,4.99
English,284,5,NC-17,A Fanciful Panorama of a Mad Scientist And a Woman who must Pursue a Astronaut in Ancient India,ENEMY ODDS,23.99,2006,,77,4.99
English,760,5,G,A Fast-Paced Story of a Pioneer And a Astronaut who must Reach a Boat in A Baloon,SAMURAI LION,21.99,2006,,110,2.99
English,747,5,R,A Astounding Story of a Pastry Chef And a Database Administrator who must Fight a Man in The Outback,ROXANNE REBEL,9.99,2006,,171,0.99
English,342,7,R,A Taut Epistle of a Feminist And a Sumo Wrestler who must Battle a Crocodile in Australia,FUGITIVE MAGUIRE,28.99,2006,,83,4.99
English,205,3,NC-17,A Insightful Reflection of a A Shark And a Dog who must Kill a Butler in An Abandoned Amusement Park,DANCES NONE,22.99,2006,,58,0.99
English,687,6,NC-17,A Intrepid Yarn of a Frisbee And a Dog who must Build a Astronaut in A Baloon Factory,POCUS PULP,15.99,2006,,138,0.99
English,764,3,G,A Thoughtful Reflection of a Mad Scientist And a Moose who must Kill a Husband in A Baloon,SATURDAY LAMBS,28.99,2006,,150,4.99
English,92,7,NC-17,A Fast-Paced Yarn of a Waitress And a Composer who must Outgun a Dentist in California,BOWFINGER GABLES,19.99,2006,,72,4.99
English,425,6,R,A Action-Packed Display of a Feminist And a Pioneer who must Pursue a Dog in A Baloon Factory,HOLY TADPOLE,20.99,2006,,88,0.99
English,44,5,PG-13,A Fast-Paced Panorama of a Technical Writer And a Mad Scientist who must Find a Feminist in An Abandoned Mine Shaft,ATTACKS HATE,21.99,2006,,113,4.99
English,606,3,NC-17,A Fateful Character Study of a Crocodile And a Monkey who must Meet a Dentist in Australia,MUMMY CREATURES,15.99,2006,,160,0.99
English,594,6,NC-17,A Thrilling Reflection of a Waitress And a Butler who must Battle a Butler in A Jet Boat,MONTEZUMA COMMAND,22.99,2006,,126,0.99
English,312,4,R,A Boring Tale of a Squirrel And a Dog who must Challenge a Madman in The Gulf of Mexico,FIDDLER LOST,20.99,2006,,75,4.99
English,346,4,R,A Emotional Reflection of a Womanizer And a Pioneer who must Face a Squirrel in Berlin,GALAXY SWEETHEARTS,13.99,2006,,128,4.99
English,906,4,PG,A Brilliant Display of a Composer And a Cat who must Succumb a A Shark in Ancient India,TRAMP OTHERS,27.99,2006,,171,0.99
English,681,4,PG,A Stunning Drama of a Woman And a Lumberjack who must Overcome a A Shark in The Canadian Rockies,PIRATES ROXANNE,20.99,2006,,100,0.99
English,883,6,PG,A Action-Packed Panorama of a Mad Scientist And a Robot who must Challenge a Student in Nigeria,TEQUILA PAST,17.99,2006,,53,4.99
English,496,3,PG-13,A Emotional Drama of a Monkey And a Robot who must Defeat a Monkey in New Orleans,KICK SAVANNAH,10.99,2006,,179,0.99
English,112,4,NC-17,A Thrilling Drama of a Frisbee And a Lumberjack who must Sink a Man in Nigeria,CALENDAR GUNFIGHT,22.99,2006,,120,4.99
English,505,6,PG-13,A Awe-Inspiring Saga of a Composer And a Frisbee who must Succumb a Pioneer in The Sahara Desert,LABYRINTH LEAGUE,24.99,2006,,46,2.99
English,799,3,NC-17,A Thrilling Documentary of a Technical Writer And a A Shark who must Face a Pioneer in A Shark Tank,SIMON NORTH,26.99,2006,,51,0.99
English,558,3,PG-13,A Astounding Saga of a Mad Cow And a Pastry Chef who must Discover a Husband in Ancient India,MANNEQUIN WORST,18.99,2006,,71,2.99
English,452,4,R,A Emotional Epistle of a Boat And a Mad Scientist who must Outrace a Robot in An Abandoned Mine Shaft,ILLUSION AMELIE,15.99,2006,,122,0.99
English,468,5,PG,A Lacklusture Character Study of a Mad Scientist And a Womanizer who must Outrace a Explorer in A Monastery,INVASION CYCLONE,12.99,2006,,97,2.99
English,959,6,G,A Astounding Yarn of a Pioneer And a Crocodile who must Defeat a A Shark in The Outback,WARLOCK WEREWOLF,10.99,2006,,83,2.99
English,678,3,G,A Touching Documentary of a Husband And a Boat who must Meet a Pastry Chef in A Baloon Factory,PICKUP DRIVING,23.99,2006,,77,2.99
English,781,4,R,A Unbelieveable Character Study of a Dog And a Mad Cow who must Kill a Monkey in Berlin,SEVEN SWARM,15.99,2006,,127,4.99
English,166,6,G,A Thoughtful Panorama of a Car And a Crocodile who must Sink a Monkey in The Sahara Desert,COLOR PHILADELPHIA,19.99,2006,,149,2.99
English,988,7,R,A Action-Packed Yarn of a Secret Agent And a Technical Writer who must Battle a Sumo Wrestler in The First Manned Space Station,WORKER TARZAN,26.99,2006,,139,2.99
English,333,7,R,A Fast-Paced Documentary of a Pastry Chef And a Crocodile who must Chase a Squirrel in The Gulf of Mexico,FREAKY POCUS,16.99,2006,,126,2.99
English,245,4,R,A Thoughtful Yarn of a Womanizer And a Dog who must Challenge a Madman in The Gulf of Mexico,DOUBLE WRATH,28.99,2006,,177,0.99
English,7,6,PG-13,A Touching Saga of a Hunter And a Butler who must Discover a Butler in A Jet Boat,AIRPLANE SIERRA,28.99,2006,,62,4.99
English,840,5,R,A Unbelieveable Tale of a Woman And a Lumberjack who must Fight a Frisbee in A U-Boat,STAMPEDE DISTURBING,26.99,2006,,75,0.99
English,921,7,PG-13,A Intrepid Yarn of a Explorer And a Pastry Chef who must Pursue a Mad Cow in A U-Boat,UNCUT SUICIDES,29.99,2006,,172,2.99
English,608,6,PG,A Brilliant Yarn of a Car And a Database Administrator who must Escape a Boy in A MySQL Convention,MURDER ANTITRUST,11.99,2006,,166,2.99
English,544,4,R,A Awe-Inspiring Reflection of a Monkey And a Dentist who must Overcome a Pioneer in A U-Boat,MADISON TRAP,11.99,2006,,147,2.99
English,185,3,PG,A Astounding Drama of a Boy And a Lumberjack who must Fight a Butler in A Baloon,COWBOY DOOM,10.99,2006,,146,2.99
English,456,6,NC-17,A Fateful Saga of a Womanizer And a Student who must Defeat a Butler in A Monastery,INCH JET,18.99,2006,,167,4.99
English,14,6,NC-17,A Emotional Drama of a A Shark And a Database Administrator who must Vanquish a Pioneer in Soviet Georgia,ALICE FANTASIA,23.99,2006,,94,0.99
English,428,6,PG-13,A Astounding Documentary of a Hunter And a Boy who must Confront a Boy in A MySQL Convention,HOMICIDE PEACH,21.99,2006,,141,2.99
English,665,4,PG,A Thrilling Documentary of a Composer And a Secret Agent who must Succumb a Cat in Berlin,PATTON INTERVIEW,22.99,2006,,175,2.99
English,149,7,NC-17,A Action-Packed Epistle of a Feminist And a Astronaut who must Conquer a Boat in A Manhattan Penthouse,CHRISTMAS MOONSHINE,21.99,2006,,150,0.99
English,860,4,G,A Emotional Character Study of a Car And a Girl who must Face a Composer in A U-Boat,SUICIDES SILENCE,13.99,2006,,93,4.99
English,264,6,G,A Emotional Yarn of a Girl And a Dog who must Challenge a Composer in Ancient Japan,DWARFS ALTER,13.99,2006,,101,2.99
English,370,4,R,A Action-Packed Display of a Sumo Wrestler And a Car who must Overcome a Waitress in A Baloon Factory,GORGEOUS BINGO,26.99,2006,,108,2.99
English,472,3,G,A Astounding Character Study of a Monkey And a Moose who must Outgun a Cat in A U-Boat,ITALIAN AFRICAN,24.99,2006,,174,4.99
English,553,4,PG-13,A Stunning Display of a Moose And a Database Administrator who must Pursue a Composer in A Jet Boat,MAKER GABLES,12.99,2006,,136,0.99
English,497,4,G,A Touching Display of a Hunter And a Secret Agent who must Redeem a Husband in The Outback,KILL BROTHERHOOD,15.99,2006,,54,0.99
English,433,4,PG,A Stunning Display of a Mad Scientist And a Technical Writer who must Succumb a Monkey in A Shark Tank,HORN WORKING,23.99,2006,,95,2.99
English,98,4,PG-13,A Fateful Yarn of a Lumberjack And a Feminist who must Conquer a Student in A Jet Boat,BRIGHT ENCOUNTERS,12.99,2006,,73,4.99
English,525,4,R,A Boring Epistle of a Pioneer And a Mad Scientist who must Escape a Frisbee in The Gulf of Mexico,LOATHING LEGALLY,29.99,2006,,140,0.99
English,76,4,NC-17,A Fast-Paced Saga of a Frisbee And a Astronaut who must Overcome a Feminist in Ancient India,BIRDCAGE CASPER,23.99,2006,,103,0.99
English,73,5,PG-13,A Touching Tale of a Girl And a Crocodile who must Discover a Waitress in Nigeria,BINGO TALENTED,22.99,2006,,150,2.99
English,444,3,NC-17,A Emotional Reflection of a Sumo Wrestler And a Monkey who must Conquer a Robot in The Sahara Desert,HUSTLER PARTY,22.99,2006,,83,4.99
English,38,6,NC-17,A Beautiful Yarn of a Pioneer And a Monkey who must Pursue a Explorer in The Sahara Desert,ARK RIDGEMONT,25.99,2006,,68,0.99
English,599,3,R,A Boring Tale of a Husband And a Boy who must Fight a Squirrel in Ancient China,MOTHER OLEANDER,20.99,2006,,103,0.99
English,622,4,G,A Action-Packed Character Study of a Dog And a Lumberjack who must Outrace a Moose in The Gulf of Mexico,NEWSIES STORY,25.99,2006,,159,0.99
English,761,7,PG,A Emotional Documentary of a Moose And a Car who must Redeem a Mad Cow in A Baloon Factory,SANTA PARIS,23.99,2006,,154,2.99
English,511,7,NC-17,A Fanciful Yarn of a Database Administrator And a Mad Cow who must Pursue a Womanizer in Berlin,LAWRENCE LOVE,23.99,2006,,175,0.99
English,161,6,NC-17,A Taut Tale of a Butler And a Mad Scientist who must Build a Crocodile in Ancient China,CLUE GRAIL,27.99,2006,,70,4.99
English,813,7,R,A Thrilling Documentary of a Husband And a Feminist who must Face a Mad Scientist in Ancient China,SMOOCHY CONTROL,18.99,2006,,184,0.99
English,600,5,PG,A Awe-Inspiring Reflection of a Dog And a Student who must Kill a Car in An Abandoned Fun House,MOTIONS DETAILS,16.99,2006,,166,0.99
English,129,3,R,A Taut Tale of a Explorer And a Pastry Chef who must Conquer a Hunter in A MySQL Convention,CAUSE DATE,16.99,2006,,179,2.99
English,896,3,PG,A Awe-Inspiring Documentary of a Womanizer And a Pastry Chef who must Kill a Lumberjack in Berlin,TOOTSIE PILOT,10.99,2006,,157,0.99
English,790,6,PG-13,A Fast-Paced Story of a Crocodile And a A Shark who must Sink a Pioneer in Berlin,SHOOTIST SUPERFLY,22.99,2006,,67,0.99
English,126,3,G,A Insightful Yarn of a A Shark And a Pastry Chef who must Face a Boy in A Monastery,CASUALTIES ENCINO,16.99,2006,,179,4.99
English,336,5,PG,A Thrilling Epistle of a Dog And a Feminist who must Kill a Madman in Berlin,FRENCH HOLIDAY,22.99,2006,,99,4.99
English,60,3,R,A Awe-Inspiring Epistle of a Student And a Squirrel who must Defeat a Boy in Ancient China,BEAST HUNCHBACK,22.99,2006,,89,4.99
English,418,5,PG-13,A Emotional Drama of a Husband And a Girl who must Outgun a Composer in The First Manned Space Station,HOBBIT ALIEN,27.99,2006,,157,0.99
English,272,5,NC-17,A Beautiful Yarn of a Composer And a Mad Cow who must Redeem a Mad Scientist in A Jet Boat,EDGE KISSING,9.99,2006,,153,4.99
English,705,4,R,A Boring Display of a Pastry Chef And a Sumo Wrestler who must Discover a Frisbee in An Abandoned Amusement Park,PURPLE MOVIE,9.99,2006,,88,2.99
English,603,6,PG,A Insightful Display of a Database Administrator And a Student who must Build a Hunter in Berlin,MOVIE SHAKESPEARE,27.99,2006,,53,4.99
English,619,3,R,A Fanciful Reflection of a Crocodile And a Astronaut who must Outrace a Feminist in An Abandoned Amusement Park,NEIGHBORS CHARADE,20.99,2006,,161,0.99
English,724,5,R,A Insightful Tale of a Technical Writer And a Waitress who must Conquer a Monkey in Ancient India,REMEMBER DIARY,15.99,2006,,110,2.99
English,344,3,PG-13,A Lacklusture Reflection of a Boat And a Forensic Psychologist who must Fight a Waitress in A Monastery,FURY MURDER,28.99,2006,,178,0.99
English,780,7,PG,A Emotional Tale of a Robot And a Sumo Wrestler who must Redeem a Pastry Chef in A Baloon Factory,SENSIBILITY REAR,15.99,2006,,98,4.99
English,593,6,G,A Awe-Inspiring Drama of a Monkey And a Composer who must Escape a Feminist in A U-Boat,MONTEREY LABYRINTH,13.99,2006,,158,0.99
English,964,4,G,A Unbelieveable Documentary of a Dentist And a Technical Writer who must Build a Womanizer in Nigeria,WATERFRONT DELIVERANCE,17.99,2006,,61,4.99
English,703,6,PG,A Fast-Paced Tale of a Pastry Chef And a Boat who must Face a Frisbee in The Canadian Rockies,PUNK DIVORCE,18.99,2006,,100,4.99
English,948,6,PG-13,A Amazing Panorama of a Pioneer And a Student who must Overcome a Mad Scientist in A Manhattan Penthouse,VOICE PEACH,22.99,2006,,139,0.99
English,691,6,PG-13,A Thoughtful Epistle of a Womanizer And a Monkey who must Vanquish a Dentist in A Monastery,POSEIDON FOREVER,29.99,2006,,159,4.99
English,296,5,R,A Boring Drama of a Astronaut And a Boat who must Face a Boat in California,EXPRESS LONELY,23.99,2006,,178,2.99
English,307,6,NC-17,A Lacklusture Reflection of a Dentist And a Hunter who must Meet a Teacher in A Baloon,FELLOWSHIP AUTUMN,9.99,2006,,77,4.99
English,64,6,PG-13,A Epic Display of a Pioneer And a Student who must Challenge a Butler in The Gulf of Mexico,BEETHOVEN EXORCIST,26.99,2006,,151,0.99
English,162,4,R,A Taut Tale of a Car And a Pioneer who must Conquer a Sumo Wrestler in An Abandoned Fun House,CLUELESS BUCKET,13.99,2006,,95,2.99
English,86,6,R,A Lacklusture Character Study of a Husband And a Sumo Wrestler who must Succumb a Technical Writer in The Gulf of Mexico,BOOGIE AMELIE,11.99,2006,,121,4.99
English,478,4,G,A Thrilling Display of a Database Administrator And a Monkey who must Overcome a Dog in An Abandoned Fun House,JAWS HARRY,10.99,2006,,112,2.99
English,901,3,G,A Touching Reflection of a Database Administrator And a Madman who must Build a Lumberjack in Nigeria,TRACY CIDER,29.99,2006,,142,0.99
English,436,4,NC-17,A Fateful Story of a Explorer And a Feminist who must Meet a Technical Writer in Soviet Georgia,HOURS RAGE,14.99,2006,,122,0.99
English,340,6,PG-13,A Emotional Story of a Madman And a Waitress who must Battle a Teacher in An Abandoned Fun House,FRONTIER CABIN,14.99,2006,,183,4.99
English,93,4,PG,A Amazing Epistle of a Moose And a Crocodile who must Outrace a Dog in Berlin,BRANNIGAN SUNRISE,27.99,2006,,121,4.99
English,489,4,PG-13,A Epic Story of a Mad Cow And a Astronaut who must Challenge a Car in California,JUGGLER HARDLY,14.99,2006,,54,0.99
English,970,7,NC-17,A Lacklusture Tale of a Butler And a Husband who must Face a Boy in Ancient China,WESTWARD SEABISCUIT,11.99,2006,,52,0.99
English,786,7,R,A Thoughtful Drama of a Robot And a Womanizer who must Kill a Lumberjack in A Baloon,SHEPHERD MIDSUMMER,14.99,2006,,113,0.99
English,727,6,PG,A Epic Yarn of a Robot And a Explorer who must Challenge a Girl in A MySQL Convention,RESURRECTION SILVERADO,12.99,2006,,117,0.99
English,160,4,PG-13,A Epic Tale of a Pioneer And a Hunter who must Escape a Girl in A U-Boat,CLUB GRAFFITI,12.99,2006,,65,0.99
English,54,5,R,A Awe-Inspiring Drama of a Car And a Pastry Chef who must Chase a Crocodile in The First Manned Space Station,BANGER PINOCCHIO,15.99,2006,,113,0.99
