lingua,film_id,durata_noleggio,voto,descrizione,titolo,costo_sostituzione,data_rilascio,lingua_originale_id,durata,tariffa_noleggio
English,706,5,PG,A Astounding Story of a Girl And a Boy who must Challenge a Composer in New Orleans,QUEEN LUKE,22.99,2006,,163,4.99
English,994,6,PG-13,A Awe-Inspiring Panorama of a Robot And a Boat who must Overcome a Feminist in A U-Boat,WYOMING STORM,29.99,2006,,100,4.99
English,598,6,G,A Thoughtful Character Study of a Waitress And a Feminist who must Build a Teacher in Ancient Japan,MOSQUITO ARMAGEDDON,22.99,2006,,57,0.99
English,402,3,G,A Awe-Inspiring Reflection of a Woman And a Cat who must Confront a Feminist in The Sahara Desert,HARPER DYING,15.99,2006,,52,0.99
English,375,4,NC-17,A Unbelieveable Saga of a Teacher And a Monkey who must Fight a Girl in An Abandoned Mine Shaft,GRAIL FRANKENSTEIN,17.99,2006,,85,2.99
English,82,3,G,A Boring Drama of a Explorer And a Man who must Kill a Lumberjack in A Manhattan Penthouse,BLOOD ARGONAUTS,13.99,2006,,71,0.99
English,172,7,NC-17,A Touching Story of a Womanizer And a Composer who must Pursue a Husband in Nigeria,CONEHEADS SMOOCHY,12.99,2006,,112,4.99
English,34,6,NC-17,A Touching Epistle of a Madman And a Mad Cow who must Defeat a Student in Nigeria,ARABIA DOGMA,29.99,2006,,62,0.99
English,907,4,PG-13,A Touching Reflection of a Man And a Monkey who must Pursue a Womanizer in A MySQL Convention,TRANSLATION SUMMER,10.99,2006,,168,0.99
English,252,6,PG,A Epic Display of a Car And a Composer who must Overcome a Forensic Psychologist in The Gulf of Mexico,DREAM PICKUP,18.99,2006,,135,2.99
English,214,3,PG-13,A Beautiful Tale of a Hunter And a Mad Scientist who must Confront a Squirrel in The First Manned Space Station,DAUGHTER MADIGAN,13.99,2006,,59,4.99
English,4,5,G,A Fanciful Documentary of a Frisbee And a Lumberjack who must Chase a Monkey in A Shark Tank,AFFAIR PREJUDICE,26.99,2006,,117,2.99
English,385,6,PG-13,A Brilliant Panorama of a Astronaut And a Technical Writer who must Discover a Butler in A Manhattan Penthouse,GROUNDHOG UNCUT,26.99,2006,,139,4.99
English,258,6,PG,A Epic Display of a Crocodile And a Crocodile who must Confront a Dog in An Abandoned Amusement Park,DRUMS DYNAMITE,11.99,2006,,96,0.99
English,754,6,PG-13,A Boring Story of a Woman And a Moose who must Reach a Husband in A Shark Tank,RUSHMORE MERMAID,17.99,2006,,150,2.99
English,251,6,NC-17,A Boring Documentary of a Pioneer And a Man who must Vanquish a Man in Nigeria,DRAGONFLY STRANGERS,19.99,2006,,133,4.99
English,386,3,NC-17,A Intrepid Yarn of a Explorer And a Student who must Kill a Husband in An Abandoned Mine Shaft,GUMP DATE,12.99,2006,,53,4.99
English,888,5,PG-13,A Emotional Drama of a Husband And a Lumberjack who must Build a Cat in Ancient India,THIN SAGEBRUSH,9.99,2006,,53,4.99
English,410,7,PG,A Intrepid Story of a Butler And a Car who must Vanquish a Man in New Orleans,HEAVEN FREEDOM,19.99,2006,,48,2.99
English,539,7,NC-17,A Boring Display of a Moose And a Squirrel who must Outrace a Teacher in A Shark Tank,LUCK OPUS,21.99,2006,,152,2.99
English,254,4,PG-13,A Lacklusture Character Study of a Butler And a Car who must Redeem a Boat in An Abandoned Fun House,DRIVER ANNIE,11.99,2006,,159,2.99
English,27,7,NC-17,A Amazing Reflection of a Database Administrator And a Astronaut who must Outrace a Database Administrator in A Shark Tank,ANONYMOUS HUMAN,12.99,2006,,179,0.99
English,862,5,G,A Emotional Panorama of a Lumberjack And a Hunter who must Meet a Girl in A Shark Tank,SUMMER SCARFACE,25.99,2006,,53,0.99
English,669,3,NC-17,A Lacklusture Yarn of a Astronaut And a Pastry Chef who must Sink a Dog in A U-Boat,PEARL DESTINY,10.99,2006,,74,2.99
English,147,5,NC-17,A Action-Packed Epistle of a Dentist And a Moose who must Meet a Mad Cow in Ancient Japan,CHOCOLAT HARRY,16.99,2006,,101,0.99
English,327,3,PG,A Lacklusture Tale of a Crocodile And a Composer who must Defeat a Madman in A U-Boat,FOOL MOCKINGBIRD,24.99,2006,,158,4.99
English,290,4,PG,A Fateful Display of a Waitress And a Dentist who must Reach a Butler in Nigeria,EVERYONE CRAFT,29.99,2006,,163,0.99
English,694,6,PG-13,A Epic Saga of a Boy And a Dentist who must Outrace a Madman in A U-Boat,PREJUDICE OLEANDER,15.99,2006,,98,4.99
English,991,4,PG,A Thrilling Drama of a Madman And a Dentist who must Conquer a Boy in The Outback,WORST BANGER,26.99,2006,,185,2.99
English,826,7,PG-13,A Brilliant Display of a Frisbee And a Mad Scientist who must Succumb a Robot in Ancient China,SPEED SUIT,19.99,2006,,124,4.99
English,686,5,R,A Action-Packed Reflection of a Car And a Moose who must Outgun a Car in A Shark Tank,PLUTO OLEANDER,9.99,2006,,84,4.99
English,504,5,PG-13,A Amazing Drama of a Car And a Squirrel who must Pursue a Car in Soviet Georgia,KWAI HOMEWARD,25.99,2006,,46,0.99
English,136,7,NC-17,A Boring Drama of a Dog And a Forensic Psychologist who must Outrace a Explorer in Ancient India,CHAPLIN LICENSE,26.99,2006,,146,2.99
English,156,3,G,A Thrilling Display of a Sumo Wrestler And a Girl who must Confront a Man in A Baloon,CLERKS ANGELS,15.99,2006,,164,4.99
English,380,7,PG,A Stunning Display of a Butler And a Teacher who must Confront a A Shark in The First Manned Space Station,GREEK EVERYONE,11.99,2006,,176,2.99
English,279,7,NC-17,A Lacklusture Display of a Womanizer And a Dog who must Face a Sumo Wrestler in Ancient Japan,ELIZABETH SHANE,11.99,2006,,152,4.99
English,202,5,G,A Epic Story of a A Shark And a Student who must Confront a Explorer in The Gulf of Mexico,DADDY PITTSBURGH,26.99,2006,,161,4.99
English,801,5,PG-13,A Stunning Saga of a Butler And a Woman who must Pursue a Explorer in Australia,SISTER FREDDY,19.99,2006,,152,4.99
English,995,5,R,A Amazing Display of a Robot And a Astronaut who must Fight a Womanizer in Berlin,YENTL IDAHO,11.99,2006,,86,4.99
English,872,3,R,A Unbelieveable Epistle of a Sumo Wrestler And a Hunter who must Chase a Forensic Psychologist in A Baloon,SWEET BROTHERHOOD,27.99,2006,,185,2.99
English,628,5,PG,A Boring Character Study of a Boy And a A Shark who must Outrace a Womanizer in The Outback,NORTHWEST POLISH,24.99,2006,,172,2.99
English,492,6,NC-17,A Boring Character Study of a Boy And a Woman who must Battle a Astronaut in Australia,JUNGLE CLOSER,11.99,2006,,134,0.99
English,825,6,PG-13,A Lacklusture Drama of a Forensic Psychologist And a Car who must Redeem a Man in A Manhattan Penthouse,SPEAKEASY DATE,22.99,2006,,165,2.99
English,993,6,PG-13,A Emotional Saga of a Crocodile And a Sumo Wrestler who must Discover a Mad Cow in New Orleans,WRONG BEHAVIOR,10.99,2006,,178,2.99
English,238,4,G,A Insightful Drama of a Womanizer And a Waitress who must Reach a Forensic Psychologist in The Outback,DOCTOR GRAIL,29.99,2006,,57,2.99
English,664,6,PG,A Taut Saga of a Robot And a Database Administrator who must Challenge a Astronaut in California,PATRIOT ROMAN,12.99,2006,,65,2.99
English,714,6,NC-17,A Fateful Drama of a Frisbee And a Student who must Confront a Cat in A Shark Tank,RANDOM GO,29.99,2006,,73,2.99
English,732,5,G,A Amazing Yarn of a Sumo Wrestler And a Boat who must Conquer a Waitress in New Orleans,RINGS HEARTBREAKERS,17.99,2006,,58,0.99
English,441,5,PG-13,A Emotional Drama of a Mad Cow And a Boat who must Redeem a Secret Agent in A Shark Tank,HUNTER ALTER,21.99,2006,,125,2.99
English,832,5,PG,A Taut Saga of a Crocodile And a Boat who must Conquer a Hunter in A Shark Tank,SPLASH GUMP,16.99,2006,,175,0.99
English,791,3,PG-13,A Fanciful Saga of a Student And a Girl who must Find a Butler in Ancient Japan,SHOW LORD,24.99,2006,,167,4.99
English,259,4,NC-17,A Lacklusture Yarn of a Teacher And a Squirrel who must Overcome a Dog in A Shark Tank,DUCK RACER,15.99,2006,,116,2.99
English,957,7,G,A Boring Drama of a Teacher And a Sumo Wrestler who must Challenge a Secret Agent in The Canadian Rockies,WAR NOTTING,26.99,2006,,80,4.99
English,207,7,PG,A Unbelieveable Story of a Mad Scientist And a Woman who must Overcome a Dog in California,DANGEROUS UPTOWN,26.99,2006,,121,4.99
English,122,7,PG,A Amazing Epistle of a Student And a Astronaut who must Discover a Frisbee in The Canadian Rockies,CARRIE BUNCH,11.99,2006,,114,0.99
English,116,4,R,A Brilliant Epistle of a Composer And a Database Administrator who must Vanquish a Mad Scientist in The First Manned Space Station,CANDIDATE PERDITION,10.99,2006,,70,2.99
English,752,6,NC-17,A Thoughtful Documentary of a Crocodile And a Robot who must Outrace a Womanizer in The Outback,RUNNER MADIGAN,27.99,2006,,101,0.99
English,208,7,PG-13,A Fateful Story of a Robot And a Dentist who must Defeat a Astronaut in New Orleans,DARES PLUTO,16.99,2006,,89,2.99
English,95,5,G,A Beautiful Reflection of a Student And a Student who must Fight a Moose in Berlin,BREAKFAST GOLDFINGER,18.99,2006,,123,4.99
English,257,3,G,A Insightful Panorama of a Monkey And a Sumo Wrestler who must Outrace a Mad Scientist in The Canadian Rockies,DRUMLINE CYCLONE,14.99,2006,,110,0.99
English,610,7,R,A Thrilling Tale of a Butler And a Astronaut who must Battle a Explorer in The First Manned Space Station,MUSIC BOONDOCK,17.99,2006,,129,0.99
English,159,5,R,A Unbelieveable Panorama of a Frisbee And a Hunter who must Vanquish a Monkey in Ancient India,CLOSER BANG,12.99,2006,,58,4.99
English,135,3,R,A Astounding Story of a Forensic Psychologist And a Forensic Psychologist who must Overcome a Moose in Ancient China,CHANCE RESURRECTION,22.99,2006,,70,2.99
English,59,4,R,A Astounding Saga of a Dog And a Boy who must Kill a Teacher in The First Manned Space Station,BEAR GRACELAND,20.99,2006,,160,2.99
English,899,7,NC-17,A Fateful Display of a Monkey And a Car who must Sink a Husband in A MySQL Convention,TOWERS HURRICANE,14.99,2006,,144,0.99
English,427,5,R,A Taut Reflection of a Astronaut And a Squirrel who must Fight a Squirrel in A Manhattan Penthouse,HOMEWARD CIDER,19.99,2006,,103,0.99
English,299,4,PG-13,A Action-Packed Saga of a Teacher And a Frisbee who must Escape a Lumberjack in The Sahara Desert,FACTORY DRAGON,9.99,2006,,144,0.99
English,956,7,PG-13,A Insightful Drama of a A Shark And a Pioneer who must Find a Womanizer in The Outback,WANDA CHAMBER,23.99,2006,,107,4.99
English,350,3,G,A Unbelieveable Character Study of a Womanizer And a Madman who must Reach a Man in The Outback,GARDEN ISLAND,21.99,2006,,80,4.99
English,870,4,PG-13,A Insightful Panorama of a Crocodile And a Boat who must Conquer a Sumo Wrestler in A MySQL Convention,SWARM GOLD,12.99,2006,,123,0.99
English,757,4,G,A Insightful Story of a Lumberjack And a Hunter who must Kill a Boy in Ancient Japan,SAGEBRUSH CLUELESS,28.99,2006,,106,2.99
English,221,4,R,A Astounding Saga of a Monkey And a Moose who must Conquer a Butler in A Shark Tank,DELIVERANCE MULHOLLAND,9.99,2006,,100,0.99
English,660,7,PG,A Fateful Display of a Technical Writer And a Butler who must Battle a Sumo Wrestler in An Abandoned Mine Shaft,PARTY KNOCK,11.99,2006,,107,2.99
English,297,6,G,A Stunning Story of a Dog And a Feminist who must Face a Forensic Psychologist in Berlin,EXTRAORDINARY CONQUERER,29.99,2006,,122,2.99
English,365,4,R,A Taut Documentary of a Database Administrator And a Waitress who must Reach a Mad Scientist in A Baloon Factory,GOLD RIVER,21.99,2006,,154,4.99
English,526,7,R,A Thoughtful Character Study of a Squirrel And a Technical Writer who must Outrace a Student in Ancient Japan,LOCK REAR,10.99,2006,,120,2.99
English,499,3,NC-17,A Action-Packed Tale of a Boy And a Lumberjack who must Chase a Madman in A Baloon,KING EVOLUTION,24.99,2006,,184,4.99
English,776,6,PG,A Astounding Story of a Cat And a Database Administrator who must Build a Technical Writer in New Orleans,SECRET GROUNDHOG,11.99,2006,,90,4.99
English,231,7,R,A Action-Packed Drama of a Feminist And a Girl who must Reach a Robot in The Canadian Rockies,DINOSAUR SECRETARY,27.99,2006,,63,2.99
English,476,5,NC-17,A Thoughtful Tale of a Woman And a A Shark who must Conquer a Dog in A Monastery,JASON TRAP,9.99,2006,,130,2.99
English,794,5,G,A Stunning Panorama of a Crocodile And a Womanizer who must Meet a Feminist in The Canadian Rockies,SIDE ARK,28.99,2006,,52,0.99
English,653,3,G,A Fanciful Display of a Teacher And a Crocodile who must Succumb a Girl in A Baloon,PANIC CLUB,15.99,2006,,102,4.99
English,798,4,PG,A Stunning Epistle of a Sumo Wrestler And a Man who must Challenge a Waitress in Ancient India,SILVERADO GOLDFINGER,11.99,2006,,74,4.99
English,605,7,PG,A Awe-Inspiring Display of a Husband And a Squirrel who must Battle a Sumo Wrestler in A Jet Boat,MULHOLLAND BEAST,13.99,2006,,157,2.99
English,175,3,PG-13,A Stunning Epistle of a Cat And a Forensic Psychologist who must Confront a Pioneer in A Baloon,CONFUSED CANDLES,27.99,2006,,122,2.99
English,487,6,PG-13,A Epic Character Study of a Feminist And a Student who must Meet a Woman in A Baloon,JINGLE SAGEBRUSH,29.99,2006,,124,4.99
English,967,5,R,A Fast-Paced Documentary of a Car And a Butler who must Find a Frisbee in A Jet Boat,WEEKEND PERSONAL,26.99,2006,,134,2.99
English,879,3,PG,A Fateful Yarn of a Husband And a Dog who must Battle a Waitress in A Jet Boat,TELEGRAPH VOYAGE,20.99,2006,,148,4.99
English,730,3,PG-13,A Unbelieveable Drama of a Waitress And a Composer who must Sink a Mad Cow in Ancient Japan,RIDGEMONT SUBMARINE,28.99,2006,,46,0.99
English,395,4,R,A Beautiful Display of a Pioneer And a Squirrel who must Vanquish a Sumo Wrestler in Soviet Georgia,HANDICAP BOONDOCK,28.99,2006,,108,0.99
English,982,4,R,A Insightful Documentary of a Waitress And a Butler who must Vanquish a Composer in Australia,WOMEN DORADO,23.99,2006,,126,0.99
English,805,5,G,A Amazing Saga of a Moose And a Pastry Chef who must Escape a Butler in Australia,SLEEPLESS MONSOON,12.99,2006,,64,4.99
English,353,6,NC-17,A Awe-Inspiring Reflection of a Monkey And a Student who must Overcome a Dentist in The First Manned Space Station,GENTLEMEN STAGE,22.99,2006,,125,2.99
English,719,7,PG,A Amazing Drama of a Mad Scientist And a Composer who must Build a Husband in The Outback,RECORDS ZORRO,11.99,2006,,182,4.99
English,551,3,PG,A Lacklusture Saga of a Moose And a Teacher who must Kill a Forensic Psychologist in A MySQL Convention,MAIDEN HOME,9.99,2006,,138,4.99
English,844,6,PG,A Stunning Character Study of a Car And a Girl who must Succumb a Car in A MySQL Convention,STEERS ARMAGEDDON,16.99,2006,,140,4.99
English,434,3,R,A Touching Documentary of a A Shark And a Car who must Build a Husband in Nigeria,HORROR REIGN,25.99,2006,,139,0.99
English,709,7,NC-17,A Emotional Display of a Monkey And a Waitress who must Reach a Secret Agent in California,RACER EGG,19.99,2006,,147,2.99
English,655,5,NC-17,A Brilliant Panorama of a Moose And a Man who must Reach a Teacher in The Gulf of Mexico,PANTHER REDS,22.99,2006,,109,4.99
English,314,3,R,A Intrepid Panorama of a Womanizer And a Girl who must Escape a Girl in A Manhattan Penthouse,FIGHT JAWBREAKER,13.99,2006,,91,0.99
English,601,4,PG-13,A Astounding Story of a Forensic Psychologist And a Cat who must Battle a Teacher in An Abandoned Mine Shaft,MOULIN WAKE,20.99,2006,,79,0.99
English,213,4,R,A Touching Saga of a Composer And a Moose who must Discover a Dentist in A MySQL Convention,DATE SPEED,19.99,2006,,104,0.99
English,178,6,G,A Fateful Documentary of a Crocodile And a Husband who must Face a Husband in The First Manned Space Station,CONNECTION MICROCOSMOS,25.99,2006,,115,0.99
English,726,7,PG-13,A Intrepid Drama of a Teacher And a Moose who must Kill a Car in California,RESERVOIR ADAPTATION,29.99,2006,,61,2.99
English,398,5,NC-17,A Stunning Reflection of a Girl And a Secret Agent who must Succumb a Boy in A MySQL Convention,HANOVER GALAXY,21.99,2006,,47,4.99
English,824,4,NC-17,A Thrilling Panorama of a Pastry Chef And a Secret Agent who must Overcome a Student in A Manhattan Penthouse,SPARTACUS CHEAPER,19.99,2006,,52,4.99
English,247,3,G,A Emotional Tale of a Pastry Chef And a Forensic Psychologist who must Succumb a Monkey in The Sahara Desert,DOWNHILL ENOUGH,19.99,2006,,47,0.99
English,869,4,PG,A Emotional Epistle of a Pioneer And a Crocodile who must Battle a Man in A Manhattan Penthouse,SUSPECTS QUILLS,22.99,2006,,47,2.99
English,194,6,PG,A Awe-Inspiring Documentary of a Woman And a Husband who must Sink a Database Administrator in The First Manned Space Station,CROW GREASE,22.99,2006,,104,0.99
English,396,5,G,A Action-Packed Yarn of a Boat And a Crocodile who must Build a Monkey in Berlin,HANGING DEEP,18.99,2006,,62,4.99
English,984,3,NC-17,A Boring Panorama of a Woman And a Madman who must Overcome a Butler in A U-Boat,WONDERFUL DROP,20.99,2006,,126,2.99
English,404,4,PG,A Intrepid Reflection of a Mad Scientist And a Pioneer who must Overcome a Hunter in The First Manned Space Station,HATE HANDICAP,26.99,2006,,107,0.99
English,55,6,G,A Awe-Inspiring Story of a Feminist And a Cat who must Conquer a Dog in A Monastery,BARBARELLA STREETCAR,27.99,2006,,65,2.99
English,963,5,PG,A Fast-Paced Yarn of a Dog And a Frisbee who must Conquer a Hunter in Nigeria,WATCH TRACY,12.99,2006,,78,0.99
English,639,7,PG,A Fateful Epistle of a Crocodile And a Moose who must Kill a Explorer in Nigeria,OPPOSITE NECKLACE,9.99,2006,,92,4.99
English,361,5,NC-17,A Amazing Display of a Composer And a Forensic Psychologist who must Discover a Car in The Canadian Rockies,GLEAMING JAWBREAKER,25.99,2006,,89,2.99
English,206,6,G,A Stunning Story of a Explorer And a Forensic Psychologist who must Face a Crocodile in A Shark Tank,DANCING FEVER,25.99,2006,,144,0.99
English,25,3,G,A Thoughtful Display of a Woman And a Astronaut who must Battle a Robot in Berlin,ANGELS LIFE,15.99,2006,,74,2.99
English,401,6,NC-17,A Stunning Saga of a Sumo Wrestler And a Student who must Outrace a Moose in The Sahara Desert,HAROLD FRENCH,10.99,2006,,168,0.99
English,514,6,PG-13,A Beautiful Epistle of a Secret Agent And a Pioneer who must Chase a Astronaut in Ancient China,LEBOWSKI SOLDIERS,17.99,2006,,69,2.99
English,271,5,G,A Fateful Story of a Monkey And a Girl who must Overcome a Pastry Chef in Ancient India,EASY GLADIATOR,12.99,2006,,148,4.99
English,668,7,PG,A Insightful Reflection of a Boat And a Secret Agent who must Vanquish a Astronaut in An Abandoned Mine Shaft,PEAK FOREVER,25.99,2006,,80,4.99
English,651,3,PG-13,A Epic Display of a Sumo Wrestler And a Forensic Psychologist who must Build a Woman in An Abandoned Amusement Park,PACKER MADIGAN,20.99,2006,,84,0.99
English,570,5,NC-17,A Lacklusture Drama of a Waitress And a Husband who must Fight a Husband in California,MERMAID INSECTS,20.99,2006,,104,4.99
English,449,4,PG-13,A Boring Tale of a Composer And a Mad Cow who must Defeat a Car in The Outback,IDENTITY LOVER,12.99,2006,,119,2.99
English,979,6,NC-17,A Awe-Inspiring Drama of a Secret Agent And a Hunter who must Fight a Moose in Nigeria,WITCHES PANIC,10.99,2006,,100,4.99
English,475,6,G,A Awe-Inspiring Epistle of a Feminist And a Girl who must Sink a Girl in The Outback,JAPANESE RUN,29.99,2006,,135,0.99
English,769,5,PG-13,A Intrepid Yarn of a Monkey And a Boy who must Fight a Composer in A Manhattan Penthouse,SCHOOL JACKET,21.99,2006,,151,4.99
English,739,4,PG-13,A Fast-Paced Display of a Squirrel And a Explorer who must Outgun a Mad Scientist in Nigeria,ROCKY WAR,17.99,2006,,145,4.99
English,293,6,G,A Touching Drama of a Dog And a Sumo Wrestler who must Conquer a Mad Scientist in Berlin,EXORCIST STING,17.99,2006,,167,2.99
English,931,7,PG-13,A Thrilling Display of a Husband And a Butler who must Reach a Pastry Chef in California,VALENTINE VANISHING,9.99,2006,,48,0.99
English,80,7,G,A Emotional Documentary of a Student And a Girl who must Build a Boat in Nigeria,BLANKET BEVERLY,21.99,2006,,148,2.99
English,345,3,PG,A Fateful Display of a Cat And a Pioneer who must Challenge a Pastry Chef in A Baloon Factory,GABLES METROPOLIS,17.99,2006,,161,0.99
English,828,7,G,A Lacklusture Epistle of a Dentist And a Technical Writer who must Find a Dog in A Monastery,SPIKING ELEMENT,12.99,2006,,79,2.99
English,30,4,R,A Epic Story of a Pastry Chef And a Woman who must Chase a Feminist in An Abandoned Fun House,ANYTHING SAVANNAH,27.99,2006,,82,2.99
English,131,5,PG,A Beautiful Character Study of a Sumo Wrestler And a Dentist who must Find a Dog in California,CENTER DINOSAUR,12.99,2006,,152,4.99
English,685,6,PG-13,A Thrilling Panorama of a Man And a Woman who must Reach a Woman in Australia,PLATOON INSTINCT,10.99,2006,,132,4.99
English,861,3,R,A Touching Panorama of a Lumberjack And a Frisbee who must Build a Dog in Australia,SUIT WALLS,12.99,2006,,111,4.99
English,920,3,G,A Amazing Character Study of a Robot And a Student who must Chase a Robot in Australia,UNBREAKABLE KARATE,16.99,2006,,62,0.99
English,846,3,NC-17,A Fanciful Drama of a Frisbee And a Dog who must Fight a Madman in A Jet Boat,STING PERSONAL,9.99,2006,,93,4.99
English,500,5,PG-13,A Lacklusture Reflection of a Girl And a Husband who must Find a Robot in The Canadian Rockies,KISS GLORY,11.99,2006,,163,4.99
English,313,5,G,A Awe-Inspiring Drama of a Technical Writer And a Composer who must Reach a Pastry Chef in A U-Boat,FIDELITY DEVIL,11.99,2006,,118,4.99
English,32,6,R,A Astounding Story of a Dog And a Squirrel who must Defeat a Woman in An Abandoned Amusement Park,APOCALYPSE FLAMINGOS,11.99,2006,,119,4.99
English,341,5,PG,A Amazing Reflection of a Lumberjack And a Cat who must Discover a Husband in A MySQL Convention,FROST HEAD,13.99,2006,,82,0.99
English,137,3,PG,A Action-Packed Display of a Man And a Waitress who must Build a Dog in A MySQL Convention,CHARADE DUFFEL,21.99,2006,,66,2.99
English,381,7,R,A Intrepid Display of a Madman And a Feminist who must Pursue a Pioneer in The First Manned Space Station,GRINCH MASSAGE,25.99,2006,,150,4.99
English,246,5,R,A Intrepid Panorama of a Butler And a Composer who must Meet a Mad Cow in The Sahara Desert,DOUBTFIRE LABYRINTH,16.99,2006,,154,4.99
English,165,7,G,A Brilliant Panorama of a Dentist And a Moose who must Find a Student in The Gulf of Mexico,COLDBLOODED DARLING,27.99,2006,,70,4.99
English,768,3,PG-13,A Emotional Yarn of a Teacher And a Girl who must Find a Teacher in A Baloon Factory,SCARFACE BANG,11.99,2006,,102,4.99
English,748,4,PG-13,A Touching Saga of a Crocodile And a Crocodile who must Discover a Technical Writer in Nigeria,RUGRATS SHAKESPEARE,16.99,2006,,109,0.99
English,498,7,R,A Fanciful Character Study of a Student And a Explorer who must Succumb a Composer in An Abandoned Mine Shaft,KILLER INNOCENT,11.99,2006,,161,2.99
English,483,3,NC-17,A Amazing Yarn of a Hunter And a Butler who must Defeat a Boy in A Jet Boat,JERICHO MULAN,29.99,2006,,171,2.99
English,550,6,NC-17,A Fast-Paced Reflection of a Waitress And a Hunter who must Defeat a Forensic Psychologist in A Baloon,MAGUIRE APACHE,22.99,2006,,74,2.99
English,329,4,R,A Thrilling Documentary of a Forensic Psychologist And a Butler who must Defeat a Explorer in A Jet Boat,FORREST SONS,15.99,2006,,63,2.99
English,466,6,PG-13,A Awe-Inspiring Story of a Monkey And a Pastry Chef who must Succumb a Womanizer in A MySQL Convention,INTOLERABLE INTENTIONS,20.99,2006,,63,4.99
English,291,5,PG-13,A Fanciful Character Study of a Feminist And a Madman who must Find a Explorer in A Baloon Factory,EVOLUTION ALTER,10.99,2006,,174,0.99
English,8,6,R,A Epic Tale of a Moose And a Girl who must Confront a Monkey in Ancient India,AIRPORT POLLOCK,15.99,2006,,54,4.99
English,46,3,G,A Beautiful Tale of a Dentist And a Mad Cow who must Battle a Moose in The Sahara Desert,AUTUMN CROW,13.99,2006,,108,4.99
English,648,7,PG-13,A Thoughtful Story of a Astronaut And a Composer who must Conquer a Dog in The Sahara Desert,OUTLAW HANKY,17.99,2006,,148,4.99
English,388,5,NC-17,A Epic Reflection of a Pastry Chef And a Explorer who must Reach a Dentist in The Sahara Desert,GUNFIGHT MOON,16.99,2006,,70,0.99
English,70,7,NC-17,A Astounding Drama of a Astronaut And a Cat who must Discover a Woman in The First Manned Space Station,BIKINI BORROWERS,26.99,2006,,142,4.99
English,510,6,G,A Insightful Yarn of a Boy And a Sumo Wrestler who must Outgun a Car in The Outback,LAWLESS VISION,29.99,2006,,181,4.99
English,9,3,PG-13,A Thoughtful Panorama of a Database Administrator And a Mad Scientist who must Outgun a Mad Scientist in A Jet Boat,ALABAMA DEVIL,21.99,2006,,114,2.99
English,242,4,R,A Astounding Panorama of a Car And a Mad Scientist who must Battle a Lumberjack in A MySQL Convention,DOOM DANCING,13.99,2006,,68,0.99
English,955,7,PG,A Insightful Panorama of a Teacher And a Teacher who must Overcome a Mad Cow in An Abandoned Fun House,WALLS ARTIST,19.99,2006,,135,4.99
English,181,7,PG-13,A Insightful Display of a A Shark And a Monkey who must Face a Database Administrator in Ancient India,CONTACT ANONYMOUS,10.99,2006,,166,2.99
English,662,3,PG,A Astounding Documentary of a Butler And a Cat who must Find a Frisbee in Ancient China,PATHS CONTROL,9.99,2006,,118,4.99
English,808,5,R,A Intrepid Character Study of a Robot And a Monkey who must Reach a Secret Agent in An Abandoned Amusement Park,SLING LUKE,10.99,2006,,84,0.99
English,643,3,R,A Astounding Epistle of a Technical Writer And a Teacher who must Fight a Squirrel in The Sahara Desert,ORIENT CLOSER,22.99,2006,,118,2.99
English,179,4,G,A Taut Drama of a Mad Scientist And a Man who must Escape a Pioneer in An Abandoned Mine Shaft,CONQUERER NUTS,14.99,2006,,173,4.99
English,40,4,R,A Boring Saga of a Database Administrator And a Womanizer who must Battle a Waitress in Nigeria,ARMY FLINTSTONES,22.99,2006,,148,0.99
English,39,5,G,A Fast-Paced Tale of a Boat And a Teacher who must Succumb a Composer in An Abandoned Mine Shaft,ARMAGEDDON LOST,10.99,2006,,99,0.99
English,253,5,PG-13,A Epic Reflection of a Womanizer And a Squirrel who must Discover a Husband in A Jet Boat,DRIFTER COMMANDMENTS,18.99,2006,,61,4.99
English,413,7,NC-17,A Action-Packed Yarn of a Womanizer And a Lumberjack who must Chase a Sumo Wrestler in A Monastery,HEDWIG ALTER,16.99,2006,,169,2.99
English,58,6,G,A Fateful Display of a Womanizer And a Mad Scientist who must Outgun a A Shark in Soviet Georgia,BEACH HEARTBREAKERS,16.99,2006,,122,2.99
